01:05:12.986177 ARP, Request who-has L1-anjo5726.cloud tell S1-anjo5726.cloud, length 28
01:05:12.986226 ARP, Reply L1-anjo5726.cloud is-at 02:00:ac:10:00:10 (oui Unknown), length 28
01:05:12.989771 IP S1-anjo5726.cloud.47614 > L1-anjo5726.cloud.pop3s: Flags [S], seq 1986449925, win 1024, options [mss 1460], length 0
01:05:12.989771 IP S1-anjo5726.cloud.47614 > L1-anjo5726.cloud.ms-wbt-server: Flags [S], seq 1986449925, win 1024, options [mss 1460], length 0
01:05:12.989771 IP S1-anjo5726.cloud.47614 > L1-anjo5726.cloud.smtp: Flags [S], seq 1986449925, win 1024, options [mss 1460], length 0
01:05:12.989771 IP S1-anjo5726.cloud.47614 > L1-anjo5726.cloud.submission: Flags [S], seq 1986449925, win 1024, options [mss 1460], length 0
01:05:12.989771 IP S1-anjo5726.cloud.47614 > L1-anjo5726.cloud.1723: Flags [S], seq 1986449925, win 1024, options [mss 1460], length 0
01:05:12.989843 IP L1-anjo5726.cloud.pop3s > S1-anjo5726.cloud.47614: Flags [R.], seq 0, ack 1986449926, win 0, length 0
01:05:12.989865 IP L1-anjo5726.cloud.ms-wbt-server > S1-anjo5726.cloud.47614: Flags [R.], seq 0, ack 1986449926, win 0, length 0
01:05:12.989892 IP L1-anjo5726.cloud.smtp > S1-anjo5726.cloud.47614: Flags [S.], seq 1245539431, ack 1986449926, win 64240, options [mss 1460], length 0
01:05:12.989900 IP L1-anjo5726.cloud.submission > S1-anjo5726.cloud.47614: Flags [R.], seq 0, ack 1986449926, win 0, length 0
01:05:12.989906 IP L1-anjo5726.cloud.1723 > S1-anjo5726.cloud.47614: Flags [R.], seq 0, ack 1986449926, win 0, length 0
01:05:12.989934 IP S1-anjo5726.cloud.47614 > L1-anjo5726.cloud.1720: Flags [S], seq 1986449925, win 1024, options [mss 1460], length 0
01:05:12.989934 IP S1-anjo5726.cloud.47614 > L1-anjo5726.cloud.8888: Flags [S], seq 1986449925, win 1024, options [mss 1460], length 0
01:05:12.989934 IP S1-anjo5726.cloud.47614 > L1-anjo5726.cloud.ftp: Flags [S], seq 1986449925, win 1024, options [mss 1460], length 0
01:05:12.989934 IP S1-anjo5726.cloud.47614 > L1-anjo5726.cloud.https: Flags [S], seq 1986449925, win 1024, options [mss 1460], length 0
01:05:12.989943 IP L1-anjo5726.cloud.1720 > S1-anjo5726.cloud.47614: Flags [R.], seq 0, ack 1986449926, win 0, length 0
01:05:12.989948 IP L1-anjo5726.cloud.8888 > S1-anjo5726.cloud.47614: Flags [R.], seq 0, ack 1986449926, win 0, length 0
01:05:12.989958 IP L1-anjo5726.cloud.ftp > S1-anjo5726.cloud.47614: Flags [S.], seq 3847179877, ack 1986449926, win 64240, options [mss 1460], length 0
01:05:12.989963 IP L1-anjo5726.cloud.https > S1-anjo5726.cloud.47614: Flags [R.], seq 0, ack 1986449926, win 0, length 0
01:05:12.990014 IP S1-anjo5726.cloud.47614 > L1-anjo5726.cloud.microsoft-ds: Flags [S], seq 1986449925, win 1024, options [mss 1460], length 0
01:05:12.990023 IP L1-anjo5726.cloud.microsoft-ds > S1-anjo5726.cloud.47614: Flags [R.], seq 0, ack 1986449926, win 0, length 0
01:05:12.990163 IP S1-anjo5726.cloud.47614 > L1-anjo5726.cloud.smtp: Flags [R], seq 1986449926, win 0, length 0
01:05:12.990163 IP S1-anjo5726.cloud.47614 > L1-anjo5726.cloud.ftp: Flags [R], seq 1986449926, win 0, length 0
01:05:12.990360 IP S1-anjo5726.cloud.47614 > L1-anjo5726.cloud.netbios-ssn: Flags [S], seq 1986449925, win 1024, options [mss 1460], length 0
01:05:12.990360 IP S1-anjo5726.cloud.47614 > L1-anjo5726.cloud.1025: Flags [S], seq 1986449925, win 1024, options [mss 1460], length 0
01:05:12.990360 IP S1-anjo5726.cloud.47614 > L1-anjo5726.cloud.256: Flags [S], seq 1986449925, win 1024, options [mss 1460], length 0
01:05:12.990387 IP L1-anjo5726.cloud.netbios-ssn > S1-anjo5726.cloud.47614: Flags [R.], seq 0, ack 1986449926, win 0, length 0
01:05:12.990402 IP L1-anjo5726.cloud.1025 > S1-anjo5726.cloud.47614: Flags [R.], seq 0, ack 1986449926, win 0, length 0
01:05:12.990406 IP L1-anjo5726.cloud.256 > S1-anjo5726.cloud.47614: Flags [R.], seq 0, ack 1986449926, win 0, length 0
01:05:12.990412 IP S1-anjo5726.cloud.47614 > L1-anjo5726.cloud.mysql: Flags [S], seq 1986449925, win 1024, options [mss 1460], length 0
01:05:12.990412 IP S1-anjo5726.cloud.47614 > L1-anjo5726.cloud.rtsp: Flags [S], seq 1986449925, win 1024, options [mss 1460], length 0
01:05:12.990418 IP L1-anjo5726.cloud.mysql > S1-anjo5726.cloud.47614: Flags [R.], seq 0, ack 1986449926, win 0, length 0
01:05:12.990422 IP L1-anjo5726.cloud.rtsp > S1-anjo5726.cloud.47614: Flags [R.], seq 0, ack 1986449926, win 0, length 0
01:05:12.990452 IP S1-anjo5726.cloud.47614 > L1-anjo5726.cloud.imaps: Flags [S], seq 1986449925, win 1024, options [mss 1460], length 0
01:05:12.990452 IP S1-anjo5726.cloud.47614 > L1-anjo5726.cloud.sunrpc: Flags [S], seq 1986449925, win 1024, options [mss 1460], length 0
01:05:12.990458 IP L1-anjo5726.cloud.imaps > S1-anjo5726.cloud.47614: Flags [R.], seq 0, ack 1986449926, win 0, length 0
01:05:12.990489 IP L1-anjo5726.cloud.sunrpc > S1-anjo5726.cloud.47614: Flags [S.], seq 2875123676, ack 1986449926, win 64240, options [mss 1460], length 0
01:05:12.990503 IP S1-anjo5726.cloud.47614 > L1-anjo5726.cloud.auth: Flags [S], seq 1986449925, win 1024, options [mss 1460], length 0
01:05:12.990503 IP S1-anjo5726.cloud.47614 > L1-anjo5726.cloud.http: Flags [S], seq 1986449925, win 1024, options [mss 1460], length 0
01:05:12.990509 IP L1-anjo5726.cloud.auth > S1-anjo5726.cloud.47614: Flags [R.], seq 0, ack 1986449926, win 0, length 0
01:05:12.990563 IP L1-anjo5726.cloud.http > S1-anjo5726.cloud.47614: Flags [S.], seq 350036061, ack 1986449926, win 64240, options [mss 1460], length 0
01:05:12.990580 IP S1-anjo5726.cloud.47614 > L1-anjo5726.cloud.smux: Flags [S], seq 1986449925, win 1024, options [mss 1460], length 0
01:05:12.990580 IP S1-anjo5726.cloud.47614 > L1-anjo5726.cloud.ssh: Flags [S], seq 1986449925, win 1024, options [mss 1460], length 0
01:05:12.990580 IP S1-anjo5726.cloud.47614 > L1-anjo5726.cloud.telnet: Flags [S], seq 1986449925, win 1024, options [mss 1460], length 0
01:05:12.990606 IP L1-anjo5726.cloud.smux > S1-anjo5726.cloud.47614: Flags [R.], seq 0, ack 1986449926, win 0, length 0
01:05:12.990625 IP L1-anjo5726.cloud.ssh > S1-anjo5726.cloud.47614: Flags [S.], seq 3028738310, ack 1986449926, win 64240, options [mss 1460], length 0
01:05:12.990644 IP L1-anjo5726.cloud.telnet > S1-anjo5726.cloud.47614: Flags [R.], seq 0, ack 1986449926, win 0, length 0
01:05:12.990661 IP S1-anjo5726.cloud.47614 > L1-anjo5726.cloud.5900: Flags [S], seq 1986449925, win 1024, options [mss 1460], length 0
01:05:12.990661 IP S1-anjo5726.cloud.47614 > L1-anjo5726.cloud.domain: Flags [S], seq 1986449925, win 1024, options [mss 1460], length 0
01:05:12.990661 IP S1-anjo5726.cloud.47614 > L1-anjo5726.cloud.http-alt: Flags [S], seq 1986449925, win 1024, options [mss 1460], length 0
01:05:12.990661 IP S1-anjo5726.cloud.47614 > L1-anjo5726.cloud.epmap: Flags [S], seq 1986449925, win 1024, options [mss 1460], length 0
01:05:12.990688 IP L1-anjo5726.cloud.5900 > S1-anjo5726.cloud.47614: Flags [R.], seq 0, ack 1986449926, win 0, length 0
01:05:12.990723 IP L1-anjo5726.cloud.domain > S1-anjo5726.cloud.47614: Flags [S.], seq 372462949, ack 1986449926, win 64240, options [mss 1460], length 0
01:05:12.990739 IP L1-anjo5726.cloud.http-alt > S1-anjo5726.cloud.47614: Flags [R.], seq 0, ack 1986449926, win 0, length 0
01:05:12.990745 IP L1-anjo5726.cloud.epmap > S1-anjo5726.cloud.47614: Flags [R.], seq 0, ack 1986449926, win 0, length 0
01:05:12.990802 IP S1-anjo5726.cloud.47614 > L1-anjo5726.cloud.imap2: Flags [S], seq 1986449925, win 1024, options [mss 1460], length 0
01:05:12.990802 IP S1-anjo5726.cloud.47614 > L1-anjo5726.cloud.pop3: Flags [S], seq 1986449925, win 1024, options [mss 1460], length 0
01:05:12.990803 IP S1-anjo5726.cloud.47614 > L1-anjo5726.cloud.32769: Flags [S], seq 1986449925, win 1024, options [mss 1460], length 0
01:05:12.990803 IP S1-anjo5726.cloud.47614 > L1-anjo5726.cloud.1121: Flags [S], seq 1986449925, win 1024, options [mss 1460], length 0
01:05:12.990812 IP L1-anjo5726.cloud.imap2 > S1-anjo5726.cloud.47614: Flags [R.], seq 0, ack 1986449926, win 0, length 0
01:05:12.990825 IP L1-anjo5726.cloud.pop3 > S1-anjo5726.cloud.47614: Flags [R.], seq 0, ack 1986449926, win 0, length 0
01:05:12.990829 IP L1-anjo5726.cloud.32769 > S1-anjo5726.cloud.47614: Flags [R.], seq 0, ack 1986449926, win 0, length 0
01:05:12.990833 IP L1-anjo5726.cloud.1121 > S1-anjo5726.cloud.47614: Flags [R.], seq 0, ack 1986449926, win 0, length 0
01:05:12.991001 IP S1-anjo5726.cloud.47614 > L1-anjo5726.cloud.sunrpc: Flags [R], seq 1986449926, win 0, length 0
01:05:12.991001 IP S1-anjo5726.cloud.47614 > L1-anjo5726.cloud.http: Flags [R], seq 1986449926, win 0, length 0
01:05:12.991027 IP S1-anjo5726.cloud.47614 > L1-anjo5726.cloud.ssh: Flags [R], seq 1986449926, win 0, length 0
01:05:12.991027 IP S1-anjo5726.cloud.47614 > L1-anjo5726.cloud.domain: Flags [R], seq 1986449926, win 0, length 0
01:05:12.991313 IP S1-anjo5726.cloud.47614 > L1-anjo5726.cloud.9090: Flags [S], seq 1986449925, win 1024, options [mss 1460], length 0
01:05:12.991314 IP S1-anjo5726.cloud.47614 > L1-anjo5726.cloud.1062: Flags [S], seq 1986449925, win 1024, options [mss 1460], length 0
01:05:12.991314 IP S1-anjo5726.cloud.47614 > L1-anjo5726.cloud.7004: Flags [S], seq 1986449925, win 1024, options [mss 1460], length 0
01:05:12.991332 IP L1-anjo5726.cloud.9090 > S1-anjo5726.cloud.47614: Flags [R.], seq 0, ack 1986449926, win 0, length 0
01:05:12.991350 IP L1-anjo5726.cloud.1062 > S1-anjo5726.cloud.47614: Flags [R.], seq 0, ack 1986449926, win 0, length 0
01:05:12.991354 IP L1-anjo5726.cloud.7004 > S1-anjo5726.cloud.47614: Flags [R.], seq 0, ack 1986449926, win 0, length 0
01:05:12.991428 IP S1-anjo5726.cloud.47614 > L1-anjo5726.cloud.5633: Flags [S], seq 1986449925, win 1024, options [mss 1460], length 0
01:05:12.991437 IP L1-anjo5726.cloud.5633 > S1-anjo5726.cloud.47614: Flags [R.], seq 0, ack 1986449926, win 0, length 0
01:05:12.991506 IP S1-anjo5726.cloud.47614 > L1-anjo5726.cloud.49158: Flags [S], seq 1986449925, win 1024, options [mss 1460], length 0
01:05:12.991513 IP L1-anjo5726.cloud.49158 > S1-anjo5726.cloud.47614: Flags [R.], seq 0, ack 1986449926, win 0, length 0
01:05:12.991530 IP S1-anjo5726.cloud.47614 > L1-anjo5726.cloud.5800: Flags [S], seq 1986449925, win 1024, options [mss 1460], length 0
01:05:12.991536 IP L1-anjo5726.cloud.5800 > S1-anjo5726.cloud.47614: Flags [R.], seq 0, ack 1986449926, win 0, length 0
01:05:12.991561 IP S1-anjo5726.cloud.47614 > L1-anjo5726.cloud.9968: Flags [S], seq 1986449925, win 1024, options [mss 1460], length 0
01:05:12.991561 IP S1-anjo5726.cloud.47614 > L1-anjo5726.cloud.19801: Flags [S], seq 1986449925, win 1024, options [mss 1460], length 0
01:05:12.991568 IP L1-anjo5726.cloud.9968 > S1-anjo5726.cloud.47614: Flags [R.], seq 0, ack 1986449926, win 0, length 0
01:05:12.991578 IP L1-anjo5726.cloud.19801 > S1-anjo5726.cloud.47614: Flags [R.], seq 0, ack 1986449926, win 0, length 0
01:05:12.991606 IP S1-anjo5726.cloud.47614 > L1-anjo5726.cloud.1039: Flags [S], seq 1986449925, win 1024, options [mss 1460], length 0
01:05:12.991606 IP S1-anjo5726.cloud.47614 > L1-anjo5726.cloud.280: Flags [S], seq 1986449925, win 1024, options [mss 1460], length 0
01:05:12.991612 IP L1-anjo5726.cloud.1039 > S1-anjo5726.cloud.47614: Flags [R.], seq 0, ack 1986449926, win 0, length 0
01:05:12.991628 IP L1-anjo5726.cloud.280 > S1-anjo5726.cloud.47614: Flags [R.], seq 0, ack 1986449926, win 0, length 0
01:05:12.991644 IP S1-anjo5726.cloud.47614 > L1-anjo5726.cloud.8192: Flags [S], seq 1986449925, win 1024, options [mss 1460], length 0
01:05:12.991645 IP S1-anjo5726.cloud.47614 > L1-anjo5726.cloud.1028: Flags [S], seq 1986449925, win 1024, options [mss 1460], length 0
01:05:12.991656 IP L1-anjo5726.cloud.8192 > S1-anjo5726.cloud.47614: Flags [R.], seq 0, ack 1986449926, win 0, length 0
01:05:12.991673 IP L1-anjo5726.cloud.1028 > S1-anjo5726.cloud.47614: Flags [R.], seq 0, ack 1986449926, win 0, length 0
01:05:12.991693 IP S1-anjo5726.cloud.47614 > L1-anjo5726.cloud.9929: Flags [S], seq 1986449925, win 1024, options [mss 1460], length 0
01:05:12.991693 IP S1-anjo5726.cloud.47614 > L1-anjo5726.cloud.3325: Flags [S], seq 1986449925, win 1024, options [mss 1460], length 0
01:05:12.991699 IP L1-anjo5726.cloud.9929 > S1-anjo5726.cloud.47614: Flags [R.], seq 0, ack 1986449926, win 0, length 0
01:05:12.991722 IP L1-anjo5726.cloud.3325 > S1-anjo5726.cloud.47614: Flags [R.], seq 0, ack 1986449926, win 0, length 0
01:05:12.991727 IP S1-anjo5726.cloud.47614 > L1-anjo5726.cloud.55600: Flags [S], seq 1986449925, win 1024, options [mss 1460], length 0
01:05:12.991746 IP L1-anjo5726.cloud.55600 > S1-anjo5726.cloud.47614: Flags [R.], seq 0, ack 1986449926, win 0, length 0
01:05:12.991757 IP S1-anjo5726.cloud.47614 > L1-anjo5726.cloud.144: Flags [S], seq 1986449925, win 1024, options [mss 1460], length 0
01:05:12.991762 IP L1-anjo5726.cloud.144 > S1-anjo5726.cloud.47614: Flags [R.], seq 0, ack 1986449926, win 0, length 0
01:05:12.991785 IP S1-anjo5726.cloud.47614 > L1-anjo5726.cloud.1065: Flags [S], seq 1986449925, win 1024, options [mss 1460], length 0
01:05:12.991786 IP S1-anjo5726.cloud.47614 > L1-anjo5726.cloud.6009: Flags [S], seq 1986449925, win 1024, options [mss 1460], length 0
01:05:12.991791 IP L1-anjo5726.cloud.1065 > S1-anjo5726.cloud.47614: Flags [R.], seq 0, ack 1986449926, win 0, length 0
01:05:12.991807 IP L1-anjo5726.cloud.6009 > S1-anjo5726.cloud.47614: Flags [R.], seq 0, ack 1986449926, win 0, length 0
01:05:12.991822 IP S1-anjo5726.cloud.47614 > L1-anjo5726.cloud.9111: Flags [S], seq 1986449925, win 1024, options [mss 1460], length 0
01:05:12.991827 IP L1-anjo5726.cloud.9111 > S1-anjo5726.cloud.47614: Flags [R.], seq 0, ack 1986449926, win 0, length 0
01:05:12.991850 IP S1-anjo5726.cloud.47614 > L1-anjo5726.cloud.3880: Flags [S], seq 1986449925, win 1024, options [mss 1460], length 0
01:05:12.991850 IP S1-anjo5726.cloud.47614 > L1-anjo5726.cloud.9877: Flags [S], seq 1986449925, win 1024, options [mss 1460], length 0
01:05:12.991856 IP L1-anjo5726.cloud.3880 > S1-anjo5726.cloud.47614: Flags [R.], seq 0, ack 1986449926, win 0, length 0
01:05:12.991871 IP L1-anjo5726.cloud.9877 > S1-anjo5726.cloud.47614: Flags [R.], seq 0, ack 1986449926, win 0, length 0
01:05:12.991876 IP S1-anjo5726.cloud.47614 > L1-anjo5726.cloud.2013: Flags [S], seq 1986449925, win 1024, options [mss 1460], length 0
01:05:12.991887 IP L1-anjo5726.cloud.2013 > S1-anjo5726.cloud.47614: Flags [R.], seq 0, ack 1986449926, win 0, length 0
01:05:12.991898 IP S1-anjo5726.cloud.47614 > L1-anjo5726.cloud.5544: Flags [S], seq 1986449925, win 1024, options [mss 1460], length 0
01:05:12.991910 IP L1-anjo5726.cloud.5544 > S1-anjo5726.cloud.47614: Flags [R.], seq 0, ack 1986449926, win 0, length 0
01:05:12.991937 IP S1-anjo5726.cloud.47614 > L1-anjo5726.cloud.1201: Flags [S], seq 1986449925, win 1024, options [mss 1460], length 0
01:05:12.991949 IP L1-anjo5726.cloud.1201 > S1-anjo5726.cloud.47614: Flags [R.], seq 0, ack 1986449926, win 0, length 0
01:05:12.991977 IP S1-anjo5726.cloud.47614 > L1-anjo5726.cloud.2001: Flags [S], seq 1986449925, win 1024, options [mss 1460], length 0
01:05:12.991977 IP S1-anjo5726.cloud.47614 > L1-anjo5726.cloud.6100: Flags [S], seq 1986449925, win 1024, options [mss 1460], length 0
01:05:12.991994 IP L1-anjo5726.cloud.2001 > S1-anjo5726.cloud.47614: Flags [R.], seq 0, ack 1986449926, win 0, length 0
01:05:12.992016 IP L1-anjo5726.cloud.6100 > S1-anjo5726.cloud.47614: Flags [R.], seq 0, ack 1986449926, win 0, length 0
01:05:12.992022 IP S1-anjo5726.cloud.47614 > L1-anjo5726.cloud.616: Flags [S], seq 1986449925, win 1024, options [mss 1460], length 0
01:05:12.992028 IP L1-anjo5726.cloud.616 > S1-anjo5726.cloud.47614: Flags [R.], seq 0, ack 1986449926, win 0, length 0
01:05:12.992084 IP S1-anjo5726.cloud.47614 > L1-anjo5726.cloud.9898: Flags [S], seq 1986449925, win 1024, options [mss 1460], length 0
01:05:12.992085 IP S1-anjo5726.cloud.47614 > L1-anjo5726.cloud.65000: Flags [S], seq 1986449925, win 1024, options [mss 1460], length 0
01:05:12.992085 IP S1-anjo5726.cloud.47614 > L1-anjo5726.cloud.1148: Flags [S], seq 1986449925, win 1024, options [mss 1460], length 0
01:05:12.992094 IP L1-anjo5726.cloud.9898 > S1-anjo5726.cloud.47614: Flags [R.], seq 0, ack 1986449926, win 0, length 0
01:05:12.992110 IP L1-anjo5726.cloud.65000 > S1-anjo5726.cloud.47614: Flags [R.], seq 0, ack 1986449926, win 0, length 0
01:05:12.992116 IP L1-anjo5726.cloud.1148 > S1-anjo5726.cloud.47614: Flags [R.], seq 0, ack 1986449926, win 0, length 0
01:05:12.992123 IP S1-anjo5726.cloud.47614 > L1-anjo5726.cloud.1049: Flags [S], seq 1986449925, win 1024, options [mss 1460], length 0
01:05:12.992123 IP S1-anjo5726.cloud.47614 > L1-anjo5726.cloud.12174: Flags [S], seq 1986449925, win 1024, options [mss 1460], length 0
01:05:12.992149 IP L1-anjo5726.cloud.1049 > S1-anjo5726.cloud.47614: Flags [R.], seq 0, ack 1986449926, win 0, length 0
01:05:12.992165 IP L1-anjo5726.cloud.12174 > S1-anjo5726.cloud.47614: Flags [R.], seq 0, ack 1986449926, win 0, length 0
01:05:12.992172 IP S1-anjo5726.cloud.47614 > L1-anjo5726.cloud.2161: Flags [S], seq 1986449925, win 1024, options [mss 1460], length 0
01:05:12.992172 IP S1-anjo5726.cloud.47614 > L1-anjo5726.cloud.5950: Flags [S], seq 1986449925, win 1024, options [mss 1460], length 0
01:05:12.992196 IP L1-anjo5726.cloud.2161 > S1-anjo5726.cloud.47614: Flags [R.], seq 0, ack 1986449926, win 0, length 0
01:05:12.992211 IP L1-anjo5726.cloud.5950 > S1-anjo5726.cloud.47614: Flags [R.], seq 0, ack 1986449926, win 0, length 0
01:05:12.992218 IP S1-anjo5726.cloud.47614 > L1-anjo5726.cloud.telnets: Flags [S], seq 1986449925, win 1024, options [mss 1460], length 0
01:05:12.992218 IP S1-anjo5726.cloud.47614 > L1-anjo5726.cloud.1102: Flags [S], seq 1986449925, win 1024, options [mss 1460], length 0
01:05:12.992242 IP L1-anjo5726.cloud.telnets > S1-anjo5726.cloud.47614: Flags [R.], seq 0, ack 1986449926, win 0, length 0
01:05:12.992256 IP L1-anjo5726.cloud.1102 > S1-anjo5726.cloud.47614: Flags [R.], seq 0, ack 1986449926, win 0, length 0
01:05:12.992263 IP S1-anjo5726.cloud.47614 > L1-anjo5726.cloud.9100: Flags [S], seq 1986449925, win 1024, options [mss 1460], length 0
01:05:12.992263 IP S1-anjo5726.cloud.47614 > L1-anjo5726.cloud.8899: Flags [S], seq 1986449925, win 1024, options [mss 1460], length 0
01:05:12.992270 IP L1-anjo5726.cloud.9100 > S1-anjo5726.cloud.47614: Flags [R.], seq 0, ack 1986449926, win 0, length 0
01:05:12.992301 IP L1-anjo5726.cloud.8899 > S1-anjo5726.cloud.47614: Flags [R.], seq 0, ack 1986449926, win 0, length 0
01:05:12.992308 IP S1-anjo5726.cloud.47614 > L1-anjo5726.cloud.32783: Flags [S], seq 1986449925, win 1024, options [mss 1460], length 0
01:05:12.992308 IP S1-anjo5726.cloud.47614 > L1-anjo5726.cloud.8045: Flags [S], seq 1986449925, win 1024, options [mss 1460], length 0
01:05:12.992323 IP L1-anjo5726.cloud.32783 > S1-anjo5726.cloud.47614: Flags [R.], seq 0, ack 1986449926, win 0, length 0
01:05:12.992338 IP L1-anjo5726.cloud.8045 > S1-anjo5726.cloud.47614: Flags [R.], seq 0, ack 1986449926, win 0, length 0
01:05:12.992983 IP S1-anjo5726.cloud.47614 > L1-anjo5726.cloud.524: Flags [S], seq 1986449925, win 1024, options [mss 1460], length 0
01:05:12.992983 IP S1-anjo5726.cloud.47614 > L1-anjo5726.cloud.5902: Flags [S], seq 1986449925, win 1024, options [mss 1460], length 0
01:05:12.992983 IP S1-anjo5726.cloud.47614 > L1-anjo5726.cloud.1067: Flags [S], seq 1986449925, win 1024, options [mss 1460], length 0
01:05:12.993011 IP L1-anjo5726.cloud.524 > S1-anjo5726.cloud.47614: Flags [R.], seq 0, ack 1986449926, win 0, length 0
01:05:12.993047 IP L1-anjo5726.cloud.5902 > S1-anjo5726.cloud.47614: Flags [R.], seq 0, ack 1986449926, win 0, length 0
01:05:12.993051 IP L1-anjo5726.cloud.1067 > S1-anjo5726.cloud.47614: Flags [R.], seq 0, ack 1986449926, win 0, length 0
01:05:12.993057 IP S1-anjo5726.cloud.47614 > L1-anjo5726.cloud.31337: Flags [S], seq 1986449925, win 1024, options [mss 1460], length 0
01:05:12.993057 IP S1-anjo5726.cloud.47614 > L1-anjo5726.cloud.49163: Flags [S], seq 1986449925, win 1024, options [mss 1460], length 0
01:05:12.993063 IP L1-anjo5726.cloud.31337 > S1-anjo5726.cloud.47614: Flags [R.], seq 0, ack 1986449926, win 0, length 0
01:05:12.993068 IP L1-anjo5726.cloud.49163 > S1-anjo5726.cloud.47614: Flags [R.], seq 0, ack 1986449926, win 0, length 0
01:05:12.993181 IP S1-anjo5726.cloud.47614 > L1-anjo5726.cloud.5298: Flags [S], seq 1986449925, win 1024, options [mss 1460], length 0
01:05:12.993181 IP S1-anjo5726.cloud.47614 > L1-anjo5726.cloud.2179: Flags [S], seq 1986449925, win 1024, options [mss 1460], length 0
01:05:12.993181 IP S1-anjo5726.cloud.47614 > L1-anjo5726.cloud.5120: Flags [S], seq 1986449925, win 1024, options [mss 1460], length 0
01:05:12.993181 IP S1-anjo5726.cloud.47614 > L1-anjo5726.cloud.2107: Flags [S], seq 1986449925, win 1024, options [mss 1460], length 0
01:05:12.993181 IP S1-anjo5726.cloud.47614 > L1-anjo5726.cloud.5080: Flags [S], seq 1986449925, win 1024, options [mss 1460], length 0
01:05:12.993181 IP S1-anjo5726.cloud.47614 > L1-anjo5726.cloud.9000: Flags [S], seq 1986449925, win 1024, options [mss 1460], length 0
01:05:12.993208 IP L1-anjo5726.cloud.5298 > S1-anjo5726.cloud.47614: Flags [R.], seq 0, ack 1986449926, win 0, length 0
01:05:12.993224 IP L1-anjo5726.cloud.2179 > S1-anjo5726.cloud.47614: Flags [R.], seq 0, ack 1986449926, win 0, length 0
01:05:12.993228 IP L1-anjo5726.cloud.5120 > S1-anjo5726.cloud.47614: Flags [R.], seq 0, ack 1986449926, win 0, length 0
01:05:12.993233 IP L1-anjo5726.cloud.2107 > S1-anjo5726.cloud.47614: Flags [R.], seq 0, ack 1986449926, win 0, length 0
01:05:12.993236 IP L1-anjo5726.cloud.5080 > S1-anjo5726.cloud.47614: Flags [R.], seq 0, ack 1986449926, win 0, length 0
01:05:12.993241 IP L1-anjo5726.cloud.9000 > S1-anjo5726.cloud.47614: Flags [R.], seq 0, ack 1986449926, win 0, length 0
01:05:12.993247 IP S1-anjo5726.cloud.47614 > L1-anjo5726.cloud.89: Flags [S], seq 1986449925, win 1024, options [mss 1460], length 0
01:05:12.993247 IP S1-anjo5726.cloud.47614 > L1-anjo5726.cloud.1783: Flags [S], seq 1986449925, win 1024, options [mss 1460], length 0
01:05:12.993253 IP L1-anjo5726.cloud.89 > S1-anjo5726.cloud.47614: Flags [R.], seq 0, ack 1986449926, win 0, length 0
01:05:12.993257 IP L1-anjo5726.cloud.1783 > S1-anjo5726.cloud.47614: Flags [R.], seq 0, ack 1986449926, win 0, length 0
01:05:12.993292 IP S1-anjo5726.cloud.47614 > L1-anjo5726.cloud.54328: Flags [S], seq 1986449925, win 1024, options [mss 1460], length 0
01:05:12.993292 IP S1-anjo5726.cloud.47614 > L1-anjo5726.cloud.1501: Flags [S], seq 1986449925, win 1024, options [mss 1460], length 0
01:05:12.993292 IP S1-anjo5726.cloud.47614 > L1-anjo5726.cloud.9917: Flags [S], seq 1986449925, win 1024, options [mss 1460], length 0
01:05:12.993292 IP S1-anjo5726.cloud.47614 > L1-anjo5726.cloud.8000: Flags [S], seq 1986449925, win 1024, options [mss 1460], length 0
01:05:12.993300 IP L1-anjo5726.cloud.54328 > S1-anjo5726.cloud.47614: Flags [R.], seq 0, ack 1986449926, win 0, length 0
01:05:12.993312 IP L1-anjo5726.cloud.1501 > S1-anjo5726.cloud.47614: Flags [R.], seq 0, ack 1986449926, win 0, length 0
01:05:12.993316 IP L1-anjo5726.cloud.9917 > S1-anjo5726.cloud.47614: Flags [R.], seq 0, ack 1986449926, win 0, length 0
01:05:12.993321 IP L1-anjo5726.cloud.8000 > S1-anjo5726.cloud.47614: Flags [R.], seq 0, ack 1986449926, win 0, length 0
01:05:12.993372 IP S1-anjo5726.cloud.47614 > L1-anjo5726.cloud.gopher: Flags [S], seq 1986449925, win 1024, options [mss 1460], length 0
01:05:12.993372 IP S1-anjo5726.cloud.47614 > L1-anjo5726.cloud.1074: Flags [S], seq 1986449925, win 1024, options [mss 1460], length 0
01:05:12.993372 IP S1-anjo5726.cloud.47614 > L1-anjo5726.cloud.8400: Flags [S], seq 1986449925, win 1024, options [mss 1460], length 0
01:05:12.993372 IP S1-anjo5726.cloud.47614 > L1-anjo5726.cloud.ircd: Flags [S], seq 1986449925, win 1024, options [mss 1460], length 0
01:05:12.993382 IP L1-anjo5726.cloud.gopher > S1-anjo5726.cloud.47614: Flags [R.], seq 0, ack 1986449926, win 0, length 0
01:05:12.993398 IP L1-anjo5726.cloud.1074 > S1-anjo5726.cloud.47614: Flags [R.], seq 0, ack 1986449926, win 0, length 0
01:05:12.993404 IP L1-anjo5726.cloud.8400 > S1-anjo5726.cloud.47614: Flags [R.], seq 0, ack 1986449926, win 0, length 0
01:05:12.993408 IP L1-anjo5726.cloud.ircd > S1-anjo5726.cloud.47614: Flags [R.], seq 0, ack 1986449926, win 0, length 0
01:05:12.993413 IP S1-anjo5726.cloud.47614 > L1-anjo5726.cloud.1027: Flags [S], seq 1986449925, win 1024, options [mss 1460], length 0
01:05:12.993418 IP L1-anjo5726.cloud.1027 > S1-anjo5726.cloud.47614: Flags [R.], seq 0, ack 1986449926, win 0, length 0
01:05:12.993469 IP S1-anjo5726.cloud.47614 > L1-anjo5726.cloud.9290: Flags [S], seq 1986449925, win 1024, options [mss 1460], length 0
01:05:12.993469 IP S1-anjo5726.cloud.47614 > L1-anjo5726.cloud.9502: Flags [S], seq 1986449925, win 1024, options [mss 1460], length 0
01:05:12.993476 IP L1-anjo5726.cloud.9290 > S1-anjo5726.cloud.47614: Flags [R.], seq 0, ack 1986449926, win 0, length 0
01:05:12.993487 IP L1-anjo5726.cloud.9502 > S1-anjo5726.cloud.47614: Flags [R.], seq 0, ack 1986449926, win 0, length 0
01:05:12.993493 IP S1-anjo5726.cloud.47614 > L1-anjo5726.cloud.8090: Flags [S], seq 1986449925, win 1024, options [mss 1460], length 0
01:05:12.993493 IP S1-anjo5726.cloud.47614 > L1-anjo5726.cloud.648: Flags [S], seq 1986449925, win 1024, options [mss 1460], length 0
01:05:12.993498 IP L1-anjo5726.cloud.8090 > S1-anjo5726.cloud.47614: Flags [R.], seq 0, ack 1986449926, win 0, length 0
01:05:12.993502 IP L1-anjo5726.cloud.648 > S1-anjo5726.cloud.47614: Flags [R.], seq 0, ack 1986449926, win 0, length 0
01:05:12.993528 IP S1-anjo5726.cloud.47614 > L1-anjo5726.cloud.bacula-dir: Flags [S], seq 1986449925, win 1024, options [mss 1460], length 0
01:05:12.993529 IP S1-anjo5726.cloud.47614 > L1-anjo5726.cloud.1011: Flags [S], seq 1986449925, win 1024, options [mss 1460], length 0
01:05:12.993556 IP L1-anjo5726.cloud.bacula-dir > S1-anjo5726.cloud.47614: Flags [R.], seq 0, ack 1986449926, win 0, length 0
01:05:12.993572 IP L1-anjo5726.cloud.1011 > S1-anjo5726.cloud.47614: Flags [R.], seq 0, ack 1986449926, win 0, length 0
01:05:12.993579 IP S1-anjo5726.cloud.47614 > L1-anjo5726.cloud.49153: Flags [S], seq 1986449925, win 1024, options [mss 1460], length 0
01:05:12.993579 IP S1-anjo5726.cloud.47614 > L1-anjo5726.cloud.isisd: Flags [S], seq 1986449925, win 1024, options [mss 1460], length 0
01:05:12.993603 IP L1-anjo5726.cloud.49153 > S1-anjo5726.cloud.47614: Flags [R.], seq 0, ack 1986449926, win 0, length 0
01:05:12.993616 IP L1-anjo5726.cloud.isisd > S1-anjo5726.cloud.47614: Flags [R.], seq 0, ack 1986449926, win 0, length 0
01:05:12.993623 IP S1-anjo5726.cloud.47614 > L1-anjo5726.cloud.zebra: Flags [S], seq 1986449925, win 1024, options [mss 1460], length 0
01:05:12.993623 IP S1-anjo5726.cloud.47614 > L1-anjo5726.cloud.3370: Flags [S], seq 1986449925, win 1024, options [mss 1460], length 0
01:05:12.993651 IP L1-anjo5726.cloud.zebra > S1-anjo5726.cloud.47614: Flags [R.], seq 0, ack 1986449926, win 0, length 0
01:05:12.993666 IP L1-anjo5726.cloud.3370 > S1-anjo5726.cloud.47614: Flags [R.], seq 0, ack 1986449926, win 0, length 0
01:05:12.993672 IP S1-anjo5726.cloud.47614 > L1-anjo5726.cloud.13783: Flags [S], seq 1986449925, win 1024, options [mss 1460], length 0
01:05:12.993672 IP S1-anjo5726.cloud.47614 > L1-anjo5726.cloud.3945: Flags [S], seq 1986449925, win 1024, options [mss 1460], length 0
01:05:12.993679 IP L1-anjo5726.cloud.13783 > S1-anjo5726.cloud.47614: Flags [R.], seq 0, ack 1986449926, win 0, length 0
01:05:12.993710 IP L1-anjo5726.cloud.3945 > S1-anjo5726.cloud.47614: Flags [R.], seq 0, ack 1986449926, win 0, length 0
01:05:12.993717 IP S1-anjo5726.cloud.47614 > L1-anjo5726.cloud.8654: Flags [S], seq 1986449925, win 1024, options [mss 1460], length 0
01:05:12.993717 IP S1-anjo5726.cloud.47614 > L1-anjo5726.cloud.2920: Flags [S], seq 1986449925, win 1024, options [mss 1460], length 0
01:05:12.993740 IP L1-anjo5726.cloud.8654 > S1-anjo5726.cloud.47614: Flags [R.], seq 0, ack 1986449926, win 0, length 0
01:05:12.993755 IP L1-anjo5726.cloud.2920 > S1-anjo5726.cloud.47614: Flags [R.], seq 0, ack 1986449926, win 0, length 0
01:05:12.993763 IP S1-anjo5726.cloud.47614 > L1-anjo5726.cloud.8031: Flags [S], seq 1986449925, win 1024, options [mss 1460], length 0
01:05:12.993763 IP S1-anjo5726.cloud.47614 > L1-anjo5726.cloud.40193: Flags [S], seq 1986449925, win 1024, options [mss 1460], length 0
01:05:12.993786 IP L1-anjo5726.cloud.8031 > S1-anjo5726.cloud.47614: Flags [R.], seq 0, ack 1986449926, win 0, length 0
01:05:12.993801 IP L1-anjo5726.cloud.40193 > S1-anjo5726.cloud.47614: Flags [R.], seq 0, ack 1986449926, win 0, length 0
01:05:12.993807 IP S1-anjo5726.cloud.47614 > L1-anjo5726.cloud.echo: Flags [S], seq 1986449925, win 1024, options [mss 1460], length 0
01:05:12.993808 IP S1-anjo5726.cloud.47614 > L1-anjo5726.cloud.32773: Flags [S], seq 1986449925, win 1024, options [mss 1460], length 0
01:05:12.993830 IP L1-anjo5726.cloud.echo > S1-anjo5726.cloud.47614: Flags [R.], seq 0, ack 1986449926, win 0, length 0
01:05:12.993845 IP L1-anjo5726.cloud.32773 > S1-anjo5726.cloud.47614: Flags [R.], seq 0, ack 1986449926, win 0, length 0
01:05:12.993852 IP S1-anjo5726.cloud.47614 > L1-anjo5726.cloud.ldap: Flags [S], seq 1986449925, win 1024, options [mss 1460], length 0
01:05:12.993852 IP S1-anjo5726.cloud.47614 > L1-anjo5726.cloud.6646: Flags [S], seq 1986449925, win 1024, options [mss 1460], length 0
01:05:12.993875 IP L1-anjo5726.cloud.ldap > S1-anjo5726.cloud.47614: Flags [R.], seq 0, ack 1986449926, win 0, length 0
01:05:12.993889 IP L1-anjo5726.cloud.6646 > S1-anjo5726.cloud.47614: Flags [R.], seq 0, ack 1986449926, win 0, length 0
01:05:12.993896 IP S1-anjo5726.cloud.47614 > L1-anjo5726.cloud.2718: Flags [S], seq 1986449925, win 1024, options [mss 1460], length 0
01:05:12.993896 IP S1-anjo5726.cloud.47614 > L1-anjo5726.cloud.7741: Flags [S], seq 1986449925, win 1024, options [mss 1460], length 0
01:05:12.993919 IP L1-anjo5726.cloud.2718 > S1-anjo5726.cloud.47614: Flags [R.], seq 0, ack 1986449926, win 0, length 0
01:05:12.993933 IP L1-anjo5726.cloud.7741 > S1-anjo5726.cloud.47614: Flags [R.], seq 0, ack 1986449926, win 0, length 0
01:05:12.993991 IP S1-anjo5726.cloud.47614 > L1-anjo5726.cloud.1123: Flags [S], seq 1986449925, win 1024, options [mss 1460], length 0
01:05:12.993991 IP S1-anjo5726.cloud.47614 > L1-anjo5726.cloud.2106: Flags [S], seq 1986449925, win 1024, options [mss 1460], length 0
01:05:12.993991 IP S1-anjo5726.cloud.47614 > L1-anjo5726.cloud.1042: Flags [S], seq 1986449925, win 1024, options [mss 1460], length 0
01:05:12.993991 IP S1-anjo5726.cloud.47614 > L1-anjo5726.cloud.49156: Flags [S], seq 1986449925, win 1024, options [mss 1460], length 0
01:05:12.993992 IP S1-anjo5726.cloud.47614 > L1-anjo5726.cloud.2008: Flags [S], seq 1986449925, win 1024, options [mss 1460], length 0
01:05:12.994003 IP L1-anjo5726.cloud.1123 > S1-anjo5726.cloud.47614: Flags [R.], seq 0, ack 1986449926, win 0, length 0
01:05:12.994024 IP L1-anjo5726.cloud.2106 > S1-anjo5726.cloud.47614: Flags [R.], seq 0, ack 1986449926, win 0, length 0
01:05:12.994043 IP L1-anjo5726.cloud.1042 > S1-anjo5726.cloud.47614: Flags [R.], seq 0, ack 1986449926, win 0, length 0
01:05:12.994077 IP L1-anjo5726.cloud.49156 > S1-anjo5726.cloud.47614: Flags [R.], seq 0, ack 1986449926, win 0, length 0
01:05:12.994088 IP L1-anjo5726.cloud.2008 > S1-anjo5726.cloud.47614: Flags [R.], seq 0, ack 1986449926, win 0, length 0
01:05:12.994093 IP S1-anjo5726.cloud.47614 > L1-anjo5726.cloud.6: Flags [S], seq 1986449925, win 1024, options [mss 1460], length 0
01:05:12.994098 IP L1-anjo5726.cloud.6 > S1-anjo5726.cloud.47614: Flags [R.], seq 0, ack 1986449926, win 0, length 0
01:05:12.994838 IP S1-anjo5726.cloud.47614 > L1-anjo5726.cloud.3372: Flags [S], seq 1986449925, win 1024, options [mss 1460], length 0
01:05:12.994838 IP S1-anjo5726.cloud.47614 > L1-anjo5726.cloud.8002: Flags [S], seq 1986449925, win 1024, options [mss 1460], length 0
01:05:12.994838 IP S1-anjo5726.cloud.47614 > L1-anjo5726.cloud.1009: Flags [S], seq 1986449925, win 1024, options [mss 1460], length 0
01:05:12.994865 IP L1-anjo5726.cloud.3372 > S1-anjo5726.cloud.47614: Flags [R.], seq 0, ack 1986449926, win 0, length 0
01:05:12.994879 IP L1-anjo5726.cloud.8002 > S1-anjo5726.cloud.47614: Flags [R.], seq 0, ack 1986449926, win 0, length 0
01:05:12.994883 IP L1-anjo5726.cloud.1009 > S1-anjo5726.cloud.47614: Flags [R.], seq 0, ack 1986449926, win 0, length 0
01:05:12.994889 IP S1-anjo5726.cloud.47614 > L1-anjo5726.cloud.10012: Flags [S], seq 1986449925, win 1024, options [mss 1460], length 0
01:05:12.994889 IP S1-anjo5726.cloud.47614 > L1-anjo5726.cloud.1029: Flags [S], seq 1986449925, win 1024, options [mss 1460], length 0
01:05:12.994895 IP L1-anjo5726.cloud.10012 > S1-anjo5726.cloud.47614: Flags [R.], seq 0, ack 1986449926, win 0, length 0
01:05:12.994919 IP L1-anjo5726.cloud.1029 > S1-anjo5726.cloud.47614: Flags [R.], seq 0, ack 1986449926, win 0, length 0
01:05:12.994960 IP S1-anjo5726.cloud.47614 > L1-anjo5726.cloud.nntps: Flags [S], seq 1986449925, win 1024, options [mss 1460], length 0
01:05:12.994961 IP S1-anjo5726.cloud.47614 > L1-anjo5726.cloud.2725: Flags [S], seq 1986449925, win 1024, options [mss 1460], length 0
01:05:12.994967 IP L1-anjo5726.cloud.nntps > S1-anjo5726.cloud.47614: Flags [R.], seq 0, ack 1986449926, win 0, length 0
01:05:12.994979 IP L1-anjo5726.cloud.2725 > S1-anjo5726.cloud.47614: Flags [R.], seq 0, ack 1986449926, win 0, length 0
01:05:12.994987 IP S1-anjo5726.cloud.47614 > L1-anjo5726.cloud.32782: Flags [S], seq 1986449925, win 1024, options [mss 1460], length 0
01:05:12.994987 IP S1-anjo5726.cloud.47614 > L1-anjo5726.cloud.1137: Flags [S], seq 1986449925, win 1024, options [mss 1460], length 0
01:05:12.994992 IP L1-anjo5726.cloud.32782 > S1-anjo5726.cloud.47614: Flags [R.], seq 0, ack 1986449926, win 0, length 0
01:05:12.995020 IP L1-anjo5726.cloud.1137 > S1-anjo5726.cloud.47614: Flags [R.], seq 0, ack 1986449926, win 0, length 0
01:05:12.995025 IP S1-anjo5726.cloud.47614 > L1-anjo5726.cloud.20031: Flags [S], seq 1986449925, win 1024, options [mss 1460], length 0
01:05:12.995025 IP S1-anjo5726.cloud.47614 > L1-anjo5726.cloud.1947: Flags [S], seq 1986449925, win 1024, options [mss 1460], length 0
01:05:12.995030 IP L1-anjo5726.cloud.20031 > S1-anjo5726.cloud.47614: Flags [R.], seq 0, ack 1986449926, win 0, length 0
01:05:12.995052 IP L1-anjo5726.cloud.1947 > S1-anjo5726.cloud.47614: Flags [R.], seq 0, ack 1986449926, win 0, length 0
01:05:12.995063 IP S1-anjo5726.cloud.47614 > L1-anjo5726.cloud.ftps: Flags [S], seq 1986449925, win 1024, options [mss 1460], length 0
01:05:12.995063 IP S1-anjo5726.cloud.47614 > L1-anjo5726.cloud.8701: Flags [S], seq 1986449925, win 1024, options [mss 1460], length 0
01:05:12.995069 IP L1-anjo5726.cloud.ftps > S1-anjo5726.cloud.47614: Flags [R.], seq 0, ack 1986449926, win 0, length 0
01:05:12.995091 IP L1-anjo5726.cloud.8701 > S1-anjo5726.cloud.47614: Flags [R.], seq 0, ack 1986449926, win 0, length 0
01:05:12.995101 IP S1-anjo5726.cloud.47614 > L1-anjo5726.cloud.3784: Flags [S], seq 1986449925, win 1024, options [mss 1460], length 0
01:05:12.995101 IP S1-anjo5726.cloud.47614 > L1-anjo5726.cloud.3517: Flags [S], seq 1986449925, win 1024, options [mss 1460], length 0
01:05:12.995107 IP L1-anjo5726.cloud.3784 > S1-anjo5726.cloud.47614: Flags [R.], seq 0, ack 1986449926, win 0, length 0
01:05:12.995128 IP L1-anjo5726.cloud.3517 > S1-anjo5726.cloud.47614: Flags [R.], seq 0, ack 1986449926, win 0, length 0
01:05:12.995144 IP S1-anjo5726.cloud.47614 > L1-anjo5726.cloud.8500: Flags [S], seq 1986449925, win 1024, options [mss 1460], length 0
01:05:12.995144 IP S1-anjo5726.cloud.47614 > L1-anjo5726.cloud.3371: Flags [S], seq 1986449925, win 1024, options [mss 1460], length 0
01:05:12.995150 IP L1-anjo5726.cloud.8500 > S1-anjo5726.cloud.47614: Flags [R.], seq 0, ack 1986449926, win 0, length 0
01:05:12.995174 IP L1-anjo5726.cloud.3371 > S1-anjo5726.cloud.47614: Flags [R.], seq 0, ack 1986449926, win 0, length 0
01:05:12.995190 IP S1-anjo5726.cloud.47614 > L1-anjo5726.cloud.1248: Flags [S], seq 1986449925, win 1024, options [mss 1460], length 0
01:05:12.995195 IP L1-anjo5726.cloud.1248 > S1-anjo5726.cloud.47614: Flags [R.], seq 0, ack 1986449926, win 0, length 0
01:05:12.995219 IP S1-anjo5726.cloud.47614 > L1-anjo5726.cloud.16000: Flags [S], seq 1986449925, win 1024, options [mss 1460], length 0
01:05:12.995219 IP S1-anjo5726.cloud.47614 > L1-anjo5726.cloud.1040: Flags [S], seq 1986449925, win 1024, options [mss 1460], length 0
01:05:12.995225 IP L1-anjo5726.cloud.16000 > S1-anjo5726.cloud.47614: Flags [R.], seq 0, ack 1986449926, win 0, length 0
01:05:12.995249 IP L1-anjo5726.cloud.1040 > S1-anjo5726.cloud.47614: Flags [R.], seq 0, ack 1986449926, win 0, length 0
01:05:12.995279 IP S1-anjo5726.cloud.47614 > L1-anjo5726.cloud.55055: Flags [S], seq 1986449925, win 1024, options [mss 1460], length 0
01:05:12.995279 IP S1-anjo5726.cloud.47614 > L1-anjo5726.cloud.212: Flags [S], seq 1986449925, win 1024, options [mss 1460], length 0
01:05:12.995279 IP S1-anjo5726.cloud.47614 > L1-anjo5726.cloud.7106: Flags [S], seq 1986449925, win 1024, options [mss 1460], length 0
01:05:12.995286 IP L1-anjo5726.cloud.55055 > S1-anjo5726.cloud.47614: Flags [R.], seq 0, ack 1986449926, win 0, length 0
01:05:12.995302 IP L1-anjo5726.cloud.212 > S1-anjo5726.cloud.47614: Flags [R.], seq 0, ack 1986449926, win 0, length 0
01:05:12.995307 IP L1-anjo5726.cloud.7106 > S1-anjo5726.cloud.47614: Flags [R.], seq 0, ack 1986449926, win 0, length 0
01:05:12.995311 IP S1-anjo5726.cloud.47614 > L1-anjo5726.cloud.1271: Flags [S], seq 1986449925, win 1024, options [mss 1460], length 0
01:05:12.995316 IP L1-anjo5726.cloud.1271 > S1-anjo5726.cloud.47614: Flags [R.], seq 0, ack 1986449926, win 0, length 0
01:05:12.995338 IP S1-anjo5726.cloud.47614 > L1-anjo5726.cloud.5405: Flags [S], seq 1986449925, win 1024, options [mss 1460], length 0
01:05:12.995338 IP S1-anjo5726.cloud.47614 > L1-anjo5726.cloud.32785: Flags [S], seq 1986449925, win 1024, options [mss 1460], length 0
01:05:12.995344 IP L1-anjo5726.cloud.5405 > S1-anjo5726.cloud.47614: Flags [R.], seq 0, ack 1986449926, win 0, length 0
01:05:12.995353 IP L1-anjo5726.cloud.32785 > S1-anjo5726.cloud.47614: Flags [R.], seq 0, ack 1986449926, win 0, length 0
01:05:12.995363 IP S1-anjo5726.cloud.47614 > L1-anjo5726.cloud.55056: Flags [S], seq 1986449925, win 1024, options [mss 1460], length 0
01:05:12.995381 IP L1-anjo5726.cloud.55056 > S1-anjo5726.cloud.47614: Flags [R.], seq 0, ack 1986449926, win 0, length 0
01:05:12.995391 IP S1-anjo5726.cloud.47614 > L1-anjo5726.cloud.32772: Flags [S], seq 1986449925, win 1024, options [mss 1460], length 0
01:05:12.995397 IP L1-anjo5726.cloud.32772 > S1-anjo5726.cloud.47614: Flags [R.], seq 0, ack 1986449926, win 0, length 0
01:05:12.995438 IP S1-anjo5726.cloud.47614 > L1-anjo5726.cloud.2288: Flags [S], seq 1986449925, win 1024, options [mss 1460], length 0
01:05:12.995438 IP S1-anjo5726.cloud.47614 > L1-anjo5726.cloud.52673: Flags [S], seq 1986449925, win 1024, options [mss 1460], length 0
01:05:12.995438 IP S1-anjo5726.cloud.47614 > L1-anjo5726.cloud.6510: Flags [S], seq 1986449925, win 1024, options [mss 1460], length 0
01:05:12.995446 IP L1-anjo5726.cloud.2288 > S1-anjo5726.cloud.47614: Flags [R.], seq 0, ack 1986449926, win 0, length 0
01:05:12.995488 IP L1-anjo5726.cloud.52673 > S1-anjo5726.cloud.47614: Flags [R.], seq 0, ack 1986449926, win 0, length 0
01:05:12.995503 IP L1-anjo5726.cloud.6510 > S1-anjo5726.cloud.47614: Flags [R.], seq 0, ack 1986449926, win 0, length 0
01:05:12.995511 IP S1-anjo5726.cloud.47614 > L1-anjo5726.cloud.5988: Flags [S], seq 1986449925, win 1024, options [mss 1460], length 0
01:05:12.995511 IP S1-anjo5726.cloud.47614 > L1-anjo5726.cloud.1213: Flags [S], seq 1986449925, win 1024, options [mss 1460], length 0
