01:05:12.452874 ARP, Request who-has L1-anjo5726.cloud tell S1-anjo5726.cloud, length 28
01:05:12.453527 ARP, Reply L1-anjo5726.cloud is-at 02:00:ac:10:00:10 (oui Unknown), length 28
01:05:12.454494 IP S1-anjo5726.cloud.57833 > router1.cloud.domain: 32170+ PTR? 16.0.16.172.in-addr.arpa. (42)
01:05:12.455723 IP router1.cloud.domain > S1-anjo5726.cloud.57833: 32170* 1/0/0 PTR L1-anjo5726.cloud. (73)
01:05:12.456601 IP S1-anjo5726.cloud.47614 > L1-anjo5726.cloud.pop3s: Flags [S], seq 1986449925, win 1024, options [mss 1460], length 0
01:05:12.456625 IP S1-anjo5726.cloud.47614 > L1-anjo5726.cloud.ms-wbt-server: Flags [S], seq 1986449925, win 1024, options [mss 1460], length 0
01:05:12.456635 IP S1-anjo5726.cloud.47614 > L1-anjo5726.cloud.smtp: Flags [S], seq 1986449925, win 1024, options [mss 1460], length 0
01:05:12.456646 IP S1-anjo5726.cloud.47614 > L1-anjo5726.cloud.submission: Flags [S], seq 1986449925, win 1024, options [mss 1460], length 0
01:05:12.456656 IP S1-anjo5726.cloud.47614 > L1-anjo5726.cloud.1723: Flags [S], seq 1986449925, win 1024, options [mss 1460], length 0
01:05:12.456674 IP S1-anjo5726.cloud.47614 > L1-anjo5726.cloud.1720: Flags [S], seq 1986449925, win 1024, options [mss 1460], length 0
01:05:12.456687 IP S1-anjo5726.cloud.47614 > L1-anjo5726.cloud.8888: Flags [S], seq 1986449925, win 1024, options [mss 1460], length 0
01:05:12.456697 IP S1-anjo5726.cloud.47614 > L1-anjo5726.cloud.ftp: Flags [S], seq 1986449925, win 1024, options [mss 1460], length 0
01:05:12.456708 IP S1-anjo5726.cloud.47614 > L1-anjo5726.cloud.https: Flags [S], seq 1986449925, win 1024, options [mss 1460], length 0
01:05:12.456718 IP S1-anjo5726.cloud.47614 > L1-anjo5726.cloud.microsoft-ds: Flags [S], seq 1986449925, win 1024, options [mss 1460], length 0
01:05:12.457040 IP L1-anjo5726.cloud.pop3s > S1-anjo5726.cloud.47614: Flags [R.], seq 0, ack 1986449926, win 0, length 0
01:05:12.457046 IP L1-anjo5726.cloud.ms-wbt-server > S1-anjo5726.cloud.47614: Flags [R.], seq 0, ack 1986449926, win 0, length 0
01:05:12.457048 IP L1-anjo5726.cloud.smtp > S1-anjo5726.cloud.47614: Flags [S.], seq 1245539431, ack 1986449926, win 64240, options [mss 1460], length 0
01:05:12.457049 IP L1-anjo5726.cloud.submission > S1-anjo5726.cloud.47614: Flags [R.], seq 0, ack 1986449926, win 0, length 0
01:05:12.457050 IP L1-anjo5726.cloud.1723 > S1-anjo5726.cloud.47614: Flags [R.], seq 0, ack 1986449926, win 0, length 0
01:05:12.457051 IP L1-anjo5726.cloud.1720 > S1-anjo5726.cloud.47614: Flags [R.], seq 0, ack 1986449926, win 0, length 0
01:05:12.457052 IP L1-anjo5726.cloud.8888 > S1-anjo5726.cloud.47614: Flags [R.], seq 0, ack 1986449926, win 0, length 0
01:05:12.457053 IP L1-anjo5726.cloud.ftp > S1-anjo5726.cloud.47614: Flags [S.], seq 3847179877, ack 1986449926, win 64240, options [mss 1460], length 0
01:05:12.457095 IP S1-anjo5726.cloud.47614 > L1-anjo5726.cloud.smtp: Flags [R], seq 1986449926, win 0, length 0
01:05:12.457110 IP S1-anjo5726.cloud.47614 > L1-anjo5726.cloud.ftp: Flags [R], seq 1986449926, win 0, length 0
01:05:12.457120 IP L1-anjo5726.cloud.https > S1-anjo5726.cloud.47614: Flags [R.], seq 0, ack 1986449926, win 0, length 0
01:05:12.457183 IP L1-anjo5726.cloud.microsoft-ds > S1-anjo5726.cloud.47614: Flags [R.], seq 0, ack 1986449926, win 0, length 0
01:05:12.457279 IP S1-anjo5726.cloud.47614 > L1-anjo5726.cloud.netbios-ssn: Flags [S], seq 1986449925, win 1024, options [mss 1460], length 0
01:05:12.457300 IP S1-anjo5726.cloud.47614 > L1-anjo5726.cloud.1025: Flags [S], seq 1986449925, win 1024, options [mss 1460], length 0
01:05:12.457311 IP S1-anjo5726.cloud.47614 > L1-anjo5726.cloud.256: Flags [S], seq 1986449925, win 1024, options [mss 1460], length 0
01:05:12.457321 IP S1-anjo5726.cloud.47614 > L1-anjo5726.cloud.mysql: Flags [S], seq 1986449925, win 1024, options [mss 1460], length 0
01:05:12.457332 IP S1-anjo5726.cloud.47614 > L1-anjo5726.cloud.rtsp: Flags [S], seq 1986449925, win 1024, options [mss 1460], length 0
01:05:12.457342 IP S1-anjo5726.cloud.47614 > L1-anjo5726.cloud.imaps: Flags [S], seq 1986449925, win 1024, options [mss 1460], length 0
01:05:12.457353 IP S1-anjo5726.cloud.47614 > L1-anjo5726.cloud.sunrpc: Flags [S], seq 1986449925, win 1024, options [mss 1460], length 0
01:05:12.457371 IP S1-anjo5726.cloud.47614 > L1-anjo5726.cloud.auth: Flags [S], seq 1986449925, win 1024, options [mss 1460], length 0
01:05:12.457383 IP S1-anjo5726.cloud.47614 > L1-anjo5726.cloud.http: Flags [S], seq 1986449925, win 1024, options [mss 1460], length 0
01:05:12.457393 IP S1-anjo5726.cloud.47614 > L1-anjo5726.cloud.smux: Flags [S], seq 1986449925, win 1024, options [mss 1460], length 0
01:05:12.457403 IP S1-anjo5726.cloud.47614 > L1-anjo5726.cloud.ssh: Flags [S], seq 1986449925, win 1024, options [mss 1460], length 0
01:05:12.457423 IP S1-anjo5726.cloud.47614 > L1-anjo5726.cloud.telnet: Flags [S], seq 1986449925, win 1024, options [mss 1460], length 0
01:05:12.457435 IP S1-anjo5726.cloud.47614 > L1-anjo5726.cloud.5900: Flags [S], seq 1986449925, win 1024, options [mss 1460], length 0
01:05:12.457446 IP S1-anjo5726.cloud.47614 > L1-anjo5726.cloud.domain: Flags [S], seq 1986449925, win 1024, options [mss 1460], length 0
01:05:12.457456 IP S1-anjo5726.cloud.47614 > L1-anjo5726.cloud.http-alt: Flags [S], seq 1986449925, win 1024, options [mss 1460], length 0
01:05:12.457472 IP S1-anjo5726.cloud.47614 > L1-anjo5726.cloud.epmap: Flags [S], seq 1986449925, win 1024, options [mss 1460], length 0
01:05:12.457483 IP S1-anjo5726.cloud.47614 > L1-anjo5726.cloud.imap2: Flags [S], seq 1986449925, win 1024, options [mss 1460], length 0
01:05:12.457493 IP S1-anjo5726.cloud.47614 > L1-anjo5726.cloud.pop3: Flags [S], seq 1986449925, win 1024, options [mss 1460], length 0
01:05:12.457504 IP S1-anjo5726.cloud.47614 > L1-anjo5726.cloud.32769: Flags [S], seq 1986449925, win 1024, options [mss 1460], length 0
01:05:12.457519 IP S1-anjo5726.cloud.47614 > L1-anjo5726.cloud.1121: Flags [S], seq 1986449925, win 1024, options [mss 1460], length 0
01:05:12.457906 IP L1-anjo5726.cloud.netbios-ssn > S1-anjo5726.cloud.47614: Flags [R.], seq 0, ack 1986449926, win 0, length 0
01:05:12.457908 IP L1-anjo5726.cloud.1025 > S1-anjo5726.cloud.47614: Flags [R.], seq 0, ack 1986449926, win 0, length 0
01:05:12.457909 IP L1-anjo5726.cloud.256 > S1-anjo5726.cloud.47614: Flags [R.], seq 0, ack 1986449926, win 0, length 0
01:05:12.457910 IP L1-anjo5726.cloud.mysql > S1-anjo5726.cloud.47614: Flags [R.], seq 0, ack 1986449926, win 0, length 0
01:05:12.457911 IP L1-anjo5726.cloud.rtsp > S1-anjo5726.cloud.47614: Flags [R.], seq 0, ack 1986449926, win 0, length 0
01:05:12.457912 IP L1-anjo5726.cloud.imaps > S1-anjo5726.cloud.47614: Flags [R.], seq 0, ack 1986449926, win 0, length 0
01:05:12.457913 IP L1-anjo5726.cloud.sunrpc > S1-anjo5726.cloud.47614: Flags [S.], seq 2875123676, ack 1986449926, win 64240, options [mss 1460], length 0
01:05:12.457919 IP L1-anjo5726.cloud.auth > S1-anjo5726.cloud.47614: Flags [R.], seq 0, ack 1986449926, win 0, length 0
01:05:12.457938 IP S1-anjo5726.cloud.47614 > L1-anjo5726.cloud.sunrpc: Flags [R], seq 1986449926, win 0, length 0
01:05:12.457972 IP L1-anjo5726.cloud.http > S1-anjo5726.cloud.47614: Flags [S.], seq 350036061, ack 1986449926, win 64240, options [mss 1460], length 0
01:05:12.457973 IP L1-anjo5726.cloud.smux > S1-anjo5726.cloud.47614: Flags [R.], seq 0, ack 1986449926, win 0, length 0
01:05:12.457974 IP L1-anjo5726.cloud.ssh > S1-anjo5726.cloud.47614: Flags [S.], seq 3028738310, ack 1986449926, win 64240, options [mss 1460], length 0
01:05:12.457976 IP L1-anjo5726.cloud.telnet > S1-anjo5726.cloud.47614: Flags [R.], seq 0, ack 1986449926, win 0, length 0
01:05:12.457977 IP L1-anjo5726.cloud.5900 > S1-anjo5726.cloud.47614: Flags [R.], seq 0, ack 1986449926, win 0, length 0
01:05:12.457978 IP L1-anjo5726.cloud.domain > S1-anjo5726.cloud.47614: Flags [S.], seq 372462949, ack 1986449926, win 64240, options [mss 1460], length 0
01:05:12.457979 IP L1-anjo5726.cloud.http-alt > S1-anjo5726.cloud.47614: Flags [R.], seq 0, ack 1986449926, win 0, length 0
01:05:12.457980 IP L1-anjo5726.cloud.epmap > S1-anjo5726.cloud.47614: Flags [R.], seq 0, ack 1986449926, win 0, length 0
01:05:12.457996 IP S1-anjo5726.cloud.47614 > L1-anjo5726.cloud.http: Flags [R], seq 1986449926, win 0, length 0
01:05:12.458009 IP S1-anjo5726.cloud.47614 > L1-anjo5726.cloud.ssh: Flags [R], seq 1986449926, win 0, length 0
01:05:12.458020 IP S1-anjo5726.cloud.47614 > L1-anjo5726.cloud.domain: Flags [R], seq 1986449926, win 0, length 0
01:05:12.458055 IP L1-anjo5726.cloud.imap2 > S1-anjo5726.cloud.47614: Flags [R.], seq 0, ack 1986449926, win 0, length 0
01:05:12.458056 IP L1-anjo5726.cloud.pop3 > S1-anjo5726.cloud.47614: Flags [R.], seq 0, ack 1986449926, win 0, length 0
01:05:12.458057 IP L1-anjo5726.cloud.32769 > S1-anjo5726.cloud.47614: Flags [R.], seq 0, ack 1986449926, win 0, length 0
01:05:12.458058 IP L1-anjo5726.cloud.1121 > S1-anjo5726.cloud.47614: Flags [R.], seq 0, ack 1986449926, win 0, length 0
01:05:12.458232 IP S1-anjo5726.cloud.47614 > L1-anjo5726.cloud.9090: Flags [S], seq 1986449925, win 1024, options [mss 1460], length 0
01:05:12.458256 IP S1-anjo5726.cloud.47614 > L1-anjo5726.cloud.1062: Flags [S], seq 1986449925, win 1024, options [mss 1460], length 0
01:05:12.458268 IP S1-anjo5726.cloud.47614 > L1-anjo5726.cloud.7004: Flags [S], seq 1986449925, win 1024, options [mss 1460], length 0
01:05:12.458403 IP S1-anjo5726.cloud.47614 > L1-anjo5726.cloud.5633: Flags [S], seq 1986449925, win 1024, options [mss 1460], length 0
01:05:12.458432 IP L1-anjo5726.cloud.9090 > S1-anjo5726.cloud.47614: Flags [R.], seq 0, ack 1986449926, win 0, length 0
01:05:12.458433 IP L1-anjo5726.cloud.1062 > S1-anjo5726.cloud.47614: Flags [R.], seq 0, ack 1986449926, win 0, length 0
01:05:12.458471 IP L1-anjo5726.cloud.7004 > S1-anjo5726.cloud.47614: Flags [R.], seq 0, ack 1986449926, win 0, length 0
01:05:12.458480 IP S1-anjo5726.cloud.47614 > L1-anjo5726.cloud.49158: Flags [S], seq 1986449925, win 1024, options [mss 1460], length 0
01:05:12.458500 IP S1-anjo5726.cloud.47614 > L1-anjo5726.cloud.5800: Flags [S], seq 1986449925, win 1024, options [mss 1460], length 0
01:05:12.458511 IP S1-anjo5726.cloud.47614 > L1-anjo5726.cloud.9968: Flags [S], seq 1986449925, win 1024, options [mss 1460], length 0
01:05:12.458522 IP S1-anjo5726.cloud.47614 > L1-anjo5726.cloud.19801: Flags [S], seq 1986449925, win 1024, options [mss 1460], length 0
01:05:12.458540 IP S1-anjo5726.cloud.47614 > L1-anjo5726.cloud.1039: Flags [S], seq 1986449925, win 1024, options [mss 1460], length 0
01:05:12.458557 IP S1-anjo5726.cloud.47614 > L1-anjo5726.cloud.280: Flags [S], seq 1986449925, win 1024, options [mss 1460], length 0
01:05:12.458569 IP S1-anjo5726.cloud.47614 > L1-anjo5726.cloud.8192: Flags [S], seq 1986449925, win 1024, options [mss 1460], length 0
01:05:12.458580 IP S1-anjo5726.cloud.47614 > L1-anjo5726.cloud.1028: Flags [S], seq 1986449925, win 1024, options [mss 1460], length 0
01:05:12.458596 IP S1-anjo5726.cloud.47614 > L1-anjo5726.cloud.9929: Flags [S], seq 1986449925, win 1024, options [mss 1460], length 0
01:05:12.458608 IP S1-anjo5726.cloud.47614 > L1-anjo5726.cloud.3325: Flags [S], seq 1986449925, win 1024, options [mss 1460], length 0
01:05:12.458618 IP S1-anjo5726.cloud.47614 > L1-anjo5726.cloud.55600: Flags [S], seq 1986449925, win 1024, options [mss 1460], length 0
01:05:12.458629 IP S1-anjo5726.cloud.47614 > L1-anjo5726.cloud.144: Flags [S], seq 1986449925, win 1024, options [mss 1460], length 0
01:05:12.458645 IP S1-anjo5726.cloud.47614 > L1-anjo5726.cloud.1065: Flags [S], seq 1986449925, win 1024, options [mss 1460], length 0
01:05:12.458662 IP S1-anjo5726.cloud.47614 > L1-anjo5726.cloud.6009: Flags [S], seq 1986449925, win 1024, options [mss 1460], length 0
01:05:12.458674 IP S1-anjo5726.cloud.47614 > L1-anjo5726.cloud.9111: Flags [S], seq 1986449925, win 1024, options [mss 1460], length 0
01:05:12.458684 IP S1-anjo5726.cloud.47614 > L1-anjo5726.cloud.3880: Flags [S], seq 1986449925, win 1024, options [mss 1460], length 0
01:05:12.458695 IP S1-anjo5726.cloud.47614 > L1-anjo5726.cloud.9877: Flags [S], seq 1986449925, win 1024, options [mss 1460], length 0
01:05:12.458705 IP S1-anjo5726.cloud.47614 > L1-anjo5726.cloud.2013: Flags [S], seq 1986449925, win 1024, options [mss 1460], length 0
01:05:12.458715 IP S1-anjo5726.cloud.47614 > L1-anjo5726.cloud.5544: Flags [S], seq 1986449925, win 1024, options [mss 1460], length 0
01:05:12.458725 IP S1-anjo5726.cloud.47614 > L1-anjo5726.cloud.1201: Flags [S], seq 1986449925, win 1024, options [mss 1460], length 0
01:05:12.458735 IP S1-anjo5726.cloud.47614 > L1-anjo5726.cloud.2001: Flags [S], seq 1986449925, win 1024, options [mss 1460], length 0
01:05:12.458751 IP S1-anjo5726.cloud.47614 > L1-anjo5726.cloud.6100: Flags [S], seq 1986449925, win 1024, options [mss 1460], length 0
01:05:12.458763 IP S1-anjo5726.cloud.47614 > L1-anjo5726.cloud.616: Flags [S], seq 1986449925, win 1024, options [mss 1460], length 0
01:05:12.458774 IP S1-anjo5726.cloud.47614 > L1-anjo5726.cloud.9898: Flags [S], seq 1986449925, win 1024, options [mss 1460], length 0
01:05:12.458784 IP S1-anjo5726.cloud.47614 > L1-anjo5726.cloud.65000: Flags [S], seq 1986449925, win 1024, options [mss 1460], length 0
01:05:12.458794 IP S1-anjo5726.cloud.47614 > L1-anjo5726.cloud.1148: Flags [S], seq 1986449925, win 1024, options [mss 1460], length 0
01:05:12.458804 IP S1-anjo5726.cloud.47614 > L1-anjo5726.cloud.1049: Flags [S], seq 1986449925, win 1024, options [mss 1460], length 0
01:05:12.458814 IP S1-anjo5726.cloud.47614 > L1-anjo5726.cloud.12174: Flags [S], seq 1986449925, win 1024, options [mss 1460], length 0
01:05:12.458824 IP S1-anjo5726.cloud.47614 > L1-anjo5726.cloud.2161: Flags [S], seq 1986449925, win 1024, options [mss 1460], length 0
01:05:12.458847 IP S1-anjo5726.cloud.47614 > L1-anjo5726.cloud.5950: Flags [S], seq 1986449925, win 1024, options [mss 1460], length 0
01:05:12.458860 IP S1-anjo5726.cloud.47614 > L1-anjo5726.cloud.telnets: Flags [S], seq 1986449925, win 1024, options [mss 1460], length 0
01:05:12.458871 IP S1-anjo5726.cloud.47614 > L1-anjo5726.cloud.1102: Flags [S], seq 1986449925, win 1024, options [mss 1460], length 0
01:05:12.458881 IP S1-anjo5726.cloud.47614 > L1-anjo5726.cloud.9100: Flags [S], seq 1986449925, win 1024, options [mss 1460], length 0
01:05:12.458891 IP S1-anjo5726.cloud.47614 > L1-anjo5726.cloud.8899: Flags [S], seq 1986449925, win 1024, options [mss 1460], length 0
01:05:12.458902 IP S1-anjo5726.cloud.47614 > L1-anjo5726.cloud.32783: Flags [S], seq 1986449925, win 1024, options [mss 1460], length 0
01:05:12.458912 IP S1-anjo5726.cloud.47614 > L1-anjo5726.cloud.8045: Flags [S], seq 1986449925, win 1024, options [mss 1460], length 0
01:05:12.459472 IP L1-anjo5726.cloud.5633 > S1-anjo5726.cloud.47614: Flags [R.], seq 0, ack 1986449926, win 0, length 0
01:05:12.459473 IP L1-anjo5726.cloud.49158 > S1-anjo5726.cloud.47614: Flags [R.], seq 0, ack 1986449926, win 0, length 0
01:05:12.459474 IP L1-anjo5726.cloud.5800 > S1-anjo5726.cloud.47614: Flags [R.], seq 0, ack 1986449926, win 0, length 0
01:05:12.459476 IP L1-anjo5726.cloud.9968 > S1-anjo5726.cloud.47614: Flags [R.], seq 0, ack 1986449926, win 0, length 0
01:05:12.459481 IP L1-anjo5726.cloud.19801 > S1-anjo5726.cloud.47614: Flags [R.], seq 0, ack 1986449926, win 0, length 0
01:05:12.459482 IP L1-anjo5726.cloud.1039 > S1-anjo5726.cloud.47614: Flags [R.], seq 0, ack 1986449926, win 0, length 0
01:05:12.459483 IP L1-anjo5726.cloud.280 > S1-anjo5726.cloud.47614: Flags [R.], seq 0, ack 1986449926, win 0, length 0
01:05:12.459484 IP L1-anjo5726.cloud.8192 > S1-anjo5726.cloud.47614: Flags [R.], seq 0, ack 1986449926, win 0, length 0
01:05:12.459516 IP L1-anjo5726.cloud.1028 > S1-anjo5726.cloud.47614: Flags [R.], seq 0, ack 1986449926, win 0, length 0
01:05:12.459517 IP L1-anjo5726.cloud.9929 > S1-anjo5726.cloud.47614: Flags [R.], seq 0, ack 1986449926, win 0, length 0
01:05:12.459519 IP L1-anjo5726.cloud.3325 > S1-anjo5726.cloud.47614: Flags [R.], seq 0, ack 1986449926, win 0, length 0
01:05:12.459520 IP L1-anjo5726.cloud.55600 > S1-anjo5726.cloud.47614: Flags [R.], seq 0, ack 1986449926, win 0, length 0
01:05:12.459521 IP L1-anjo5726.cloud.144 > S1-anjo5726.cloud.47614: Flags [R.], seq 0, ack 1986449926, win 0, length 0
01:05:12.459521 IP L1-anjo5726.cloud.1065 > S1-anjo5726.cloud.47614: Flags [R.], seq 0, ack 1986449926, win 0, length 0
01:05:12.459523 IP L1-anjo5726.cloud.6009 > S1-anjo5726.cloud.47614: Flags [R.], seq 0, ack 1986449926, win 0, length 0
01:05:12.459524 IP L1-anjo5726.cloud.9111 > S1-anjo5726.cloud.47614: Flags [R.], seq 0, ack 1986449926, win 0, length 0
01:05:12.459553 IP L1-anjo5726.cloud.3880 > S1-anjo5726.cloud.47614: Flags [R.], seq 0, ack 1986449926, win 0, length 0
01:05:12.459554 IP L1-anjo5726.cloud.9877 > S1-anjo5726.cloud.47614: Flags [R.], seq 0, ack 1986449926, win 0, length 0
01:05:12.459555 IP L1-anjo5726.cloud.2013 > S1-anjo5726.cloud.47614: Flags [R.], seq 0, ack 1986449926, win 0, length 0
01:05:12.459559 IP L1-anjo5726.cloud.5544 > S1-anjo5726.cloud.47614: Flags [R.], seq 0, ack 1986449926, win 0, length 0
01:05:12.459560 IP L1-anjo5726.cloud.1201 > S1-anjo5726.cloud.47614: Flags [R.], seq 0, ack 1986449926, win 0, length 0
01:05:12.459562 IP L1-anjo5726.cloud.2001 > S1-anjo5726.cloud.47614: Flags [R.], seq 0, ack 1986449926, win 0, length 0
01:05:12.459563 IP L1-anjo5726.cloud.6100 > S1-anjo5726.cloud.47614: Flags [R.], seq 0, ack 1986449926, win 0, length 0
01:05:12.459564 IP L1-anjo5726.cloud.616 > S1-anjo5726.cloud.47614: Flags [R.], seq 0, ack 1986449926, win 0, length 0
01:05:12.459590 IP L1-anjo5726.cloud.9898 > S1-anjo5726.cloud.47614: Flags [R.], seq 0, ack 1986449926, win 0, length 0
01:05:12.459591 IP L1-anjo5726.cloud.65000 > S1-anjo5726.cloud.47614: Flags [R.], seq 0, ack 1986449926, win 0, length 0
01:05:12.459592 IP L1-anjo5726.cloud.1148 > S1-anjo5726.cloud.47614: Flags [R.], seq 0, ack 1986449926, win 0, length 0
01:05:12.459593 IP L1-anjo5726.cloud.1049 > S1-anjo5726.cloud.47614: Flags [R.], seq 0, ack 1986449926, win 0, length 0
01:05:12.459594 IP L1-anjo5726.cloud.12174 > S1-anjo5726.cloud.47614: Flags [R.], seq 0, ack 1986449926, win 0, length 0
01:05:12.459595 IP L1-anjo5726.cloud.2161 > S1-anjo5726.cloud.47614: Flags [R.], seq 0, ack 1986449926, win 0, length 0
01:05:12.459596 IP L1-anjo5726.cloud.5950 > S1-anjo5726.cloud.47614: Flags [R.], seq 0, ack 1986449926, win 0, length 0
01:05:12.459597 IP L1-anjo5726.cloud.telnets > S1-anjo5726.cloud.47614: Flags [R.], seq 0, ack 1986449926, win 0, length 0
01:05:12.459635 IP L1-anjo5726.cloud.1102 > S1-anjo5726.cloud.47614: Flags [R.], seq 0, ack 1986449926, win 0, length 0
01:05:12.459636 IP L1-anjo5726.cloud.9100 > S1-anjo5726.cloud.47614: Flags [R.], seq 0, ack 1986449926, win 0, length 0
01:05:12.459637 IP L1-anjo5726.cloud.8899 > S1-anjo5726.cloud.47614: Flags [R.], seq 0, ack 1986449926, win 0, length 0
01:05:12.459638 IP L1-anjo5726.cloud.32783 > S1-anjo5726.cloud.47614: Flags [R.], seq 0, ack 1986449926, win 0, length 0
01:05:12.459639 IP L1-anjo5726.cloud.8045 > S1-anjo5726.cloud.47614: Flags [R.], seq 0, ack 1986449926, win 0, length 0
01:05:12.459899 IP S1-anjo5726.cloud.47614 > L1-anjo5726.cloud.524: Flags [S], seq 1986449925, win 1024, options [mss 1460], length 0
01:05:12.459925 IP S1-anjo5726.cloud.47614 > L1-anjo5726.cloud.5902: Flags [S], seq 1986449925, win 1024, options [mss 1460], length 0
01:05:12.459937 IP S1-anjo5726.cloud.47614 > L1-anjo5726.cloud.1067: Flags [S], seq 1986449925, win 1024, options [mss 1460], length 0
01:05:12.459948 IP S1-anjo5726.cloud.47614 > L1-anjo5726.cloud.31337: Flags [S], seq 1986449925, win 1024, options [mss 1460], length 0
01:05:12.459961 IP S1-anjo5726.cloud.47614 > L1-anjo5726.cloud.49163: Flags [S], seq 1986449925, win 1024, options [mss 1460], length 0
01:05:12.459972 IP S1-anjo5726.cloud.47614 > L1-anjo5726.cloud.5298: Flags [S], seq 1986449925, win 1024, options [mss 1460], length 0
01:05:12.459982 IP S1-anjo5726.cloud.47614 > L1-anjo5726.cloud.2179: Flags [S], seq 1986449925, win 1024, options [mss 1460], length 0
01:05:12.459993 IP S1-anjo5726.cloud.47614 > L1-anjo5726.cloud.5120: Flags [S], seq 1986449925, win 1024, options [mss 1460], length 0
01:05:12.460003 IP S1-anjo5726.cloud.47614 > L1-anjo5726.cloud.2107: Flags [S], seq 1986449925, win 1024, options [mss 1460], length 0
01:05:12.460013 IP S1-anjo5726.cloud.47614 > L1-anjo5726.cloud.5080: Flags [S], seq 1986449925, win 1024, options [mss 1460], length 0
01:05:12.460023 IP S1-anjo5726.cloud.47614 > L1-anjo5726.cloud.9000: Flags [S], seq 1986449925, win 1024, options [mss 1460], length 0
01:05:12.460033 IP S1-anjo5726.cloud.47614 > L1-anjo5726.cloud.89: Flags [S], seq 1986449925, win 1024, options [mss 1460], length 0
01:05:12.460045 IP S1-anjo5726.cloud.47614 > L1-anjo5726.cloud.1783: Flags [S], seq 1986449925, win 1024, options [mss 1460], length 0
01:05:12.460056 IP S1-anjo5726.cloud.47614 > L1-anjo5726.cloud.54328: Flags [S], seq 1986449925, win 1024, options [mss 1460], length 0
01:05:12.460093 IP S1-anjo5726.cloud.47614 > L1-anjo5726.cloud.1501: Flags [S], seq 1986449925, win 1024, options [mss 1460], length 0
01:05:12.460107 IP S1-anjo5726.cloud.47614 > L1-anjo5726.cloud.9917: Flags [S], seq 1986449925, win 1024, options [mss 1460], length 0
01:05:12.460118 IP S1-anjo5726.cloud.47614 > L1-anjo5726.cloud.8000: Flags [S], seq 1986449925, win 1024, options [mss 1460], length 0
01:05:12.460128 IP S1-anjo5726.cloud.47614 > L1-anjo5726.cloud.gopher: Flags [S], seq 1986449925, win 1024, options [mss 1460], length 0
01:05:12.460138 IP S1-anjo5726.cloud.47614 > L1-anjo5726.cloud.1074: Flags [S], seq 1986449925, win 1024, options [mss 1460], length 0
01:05:12.460148 IP S1-anjo5726.cloud.47614 > L1-anjo5726.cloud.8400: Flags [S], seq 1986449925, win 1024, options [mss 1460], length 0
01:05:12.460168 IP S1-anjo5726.cloud.47614 > L1-anjo5726.cloud.ircd: Flags [S], seq 1986449925, win 1024, options [mss 1460], length 0
01:05:12.460182 IP S1-anjo5726.cloud.47614 > L1-anjo5726.cloud.1027: Flags [S], seq 1986449925, win 1024, options [mss 1460], length 0
01:05:12.460192 IP S1-anjo5726.cloud.47614 > L1-anjo5726.cloud.9290: Flags [S], seq 1986449925, win 1024, options [mss 1460], length 0
01:05:12.460202 IP S1-anjo5726.cloud.47614 > L1-anjo5726.cloud.9502: Flags [S], seq 1986449925, win 1024, options [mss 1460], length 0
01:05:12.460212 IP S1-anjo5726.cloud.47614 > L1-anjo5726.cloud.8090: Flags [S], seq 1986449925, win 1024, options [mss 1460], length 0
01:05:12.460222 IP S1-anjo5726.cloud.47614 > L1-anjo5726.cloud.648: Flags [S], seq 1986449925, win 1024, options [mss 1460], length 0
01:05:12.460232 IP S1-anjo5726.cloud.47614 > L1-anjo5726.cloud.bacula-dir: Flags [S], seq 1986449925, win 1024, options [mss 1460], length 0
01:05:12.460242 IP S1-anjo5726.cloud.47614 > L1-anjo5726.cloud.1011: Flags [S], seq 1986449925, win 1024, options [mss 1460], length 0
01:05:12.460266 IP S1-anjo5726.cloud.47614 > L1-anjo5726.cloud.49153: Flags [S], seq 1986449925, win 1024, options [mss 1460], length 0
01:05:12.460279 IP S1-anjo5726.cloud.47614 > L1-anjo5726.cloud.isisd: Flags [S], seq 1986449925, win 1024, options [mss 1460], length 0
01:05:12.460289 IP S1-anjo5726.cloud.47614 > L1-anjo5726.cloud.zebra: Flags [S], seq 1986449925, win 1024, options [mss 1460], length 0
01:05:12.460299 IP S1-anjo5726.cloud.47614 > L1-anjo5726.cloud.3370: Flags [S], seq 1986449925, win 1024, options [mss 1460], length 0
01:05:12.460309 IP S1-anjo5726.cloud.47614 > L1-anjo5726.cloud.13783: Flags [S], seq 1986449925, win 1024, options [mss 1460], length 0
01:05:12.460319 IP S1-anjo5726.cloud.47614 > L1-anjo5726.cloud.3945: Flags [S], seq 1986449925, win 1024, options [mss 1460], length 0
01:05:12.460329 IP S1-anjo5726.cloud.47614 > L1-anjo5726.cloud.8654: Flags [S], seq 1986449925, win 1024, options [mss 1460], length 0
01:05:12.460345 IP S1-anjo5726.cloud.47614 > L1-anjo5726.cloud.2920: Flags [S], seq 1986449925, win 1024, options [mss 1460], length 0
01:05:12.460369 IP S1-anjo5726.cloud.47614 > L1-anjo5726.cloud.8031: Flags [S], seq 1986449925, win 1024, options [mss 1460], length 0
01:05:12.460382 IP S1-anjo5726.cloud.47614 > L1-anjo5726.cloud.40193: Flags [S], seq 1986449925, win 1024, options [mss 1460], length 0
01:05:12.460392 IP S1-anjo5726.cloud.47614 > L1-anjo5726.cloud.echo: Flags [S], seq 1986449925, win 1024, options [mss 1460], length 0
01:05:12.460402 IP S1-anjo5726.cloud.47614 > L1-anjo5726.cloud.32773: Flags [S], seq 1986449925, win 1024, options [mss 1460], length 0
01:05:12.460412 IP S1-anjo5726.cloud.47614 > L1-anjo5726.cloud.ldap: Flags [S], seq 1986449925, win 1024, options [mss 1460], length 0
01:05:12.460422 IP S1-anjo5726.cloud.47614 > L1-anjo5726.cloud.6646: Flags [S], seq 1986449925, win 1024, options [mss 1460], length 0
01:05:12.460432 IP S1-anjo5726.cloud.47614 > L1-anjo5726.cloud.2718: Flags [S], seq 1986449925, win 1024, options [mss 1460], length 0
01:05:12.460442 IP S1-anjo5726.cloud.47614 > L1-anjo5726.cloud.7741: Flags [S], seq 1986449925, win 1024, options [mss 1460], length 0
01:05:12.460464 IP S1-anjo5726.cloud.47614 > L1-anjo5726.cloud.1123: Flags [S], seq 1986449925, win 1024, options [mss 1460], length 0
01:05:12.460477 IP S1-anjo5726.cloud.47614 > L1-anjo5726.cloud.2106: Flags [S], seq 1986449925, win 1024, options [mss 1460], length 0
01:05:12.460488 IP S1-anjo5726.cloud.47614 > L1-anjo5726.cloud.1042: Flags [S], seq 1986449925, win 1024, options [mss 1460], length 0
01:05:12.460498 IP S1-anjo5726.cloud.47614 > L1-anjo5726.cloud.49156: Flags [S], seq 1986449925, win 1024, options [mss 1460], length 0
01:05:12.460507 IP S1-anjo5726.cloud.47614 > L1-anjo5726.cloud.2008: Flags [S], seq 1986449925, win 1024, options [mss 1460], length 0
01:05:12.460518 IP S1-anjo5726.cloud.47614 > L1-anjo5726.cloud.6: Flags [S], seq 1986449925, win 1024, options [mss 1460], length 0
01:05:12.461196 IP L1-anjo5726.cloud.524 > S1-anjo5726.cloud.47614: Flags [R.], seq 0, ack 1986449926, win 0, length 0
01:05:12.461198 IP L1-anjo5726.cloud.5902 > S1-anjo5726.cloud.47614: Flags [R.], seq 0, ack 1986449926, win 0, length 0
01:05:12.461200 IP L1-anjo5726.cloud.1067 > S1-anjo5726.cloud.47614: Flags [R.], seq 0, ack 1986449926, win 0, length 0
01:05:12.461201 IP L1-anjo5726.cloud.31337 > S1-anjo5726.cloud.47614: Flags [R.], seq 0, ack 1986449926, win 0, length 0
01:05:12.461202 IP L1-anjo5726.cloud.49163 > S1-anjo5726.cloud.47614: Flags [R.], seq 0, ack 1986449926, win 0, length 0
01:05:12.461203 IP L1-anjo5726.cloud.5298 > S1-anjo5726.cloud.47614: Flags [R.], seq 0, ack 1986449926, win 0, length 0
01:05:12.461204 IP L1-anjo5726.cloud.2179 > S1-anjo5726.cloud.47614: Flags [R.], seq 0, ack 1986449926, win 0, length 0
01:05:12.461205 IP L1-anjo5726.cloud.5120 > S1-anjo5726.cloud.47614: Flags [R.], seq 0, ack 1986449926, win 0, length 0
01:05:12.461236 IP L1-anjo5726.cloud.2107 > S1-anjo5726.cloud.47614: Flags [R.], seq 0, ack 1986449926, win 0, length 0
01:05:12.461237 IP L1-anjo5726.cloud.5080 > S1-anjo5726.cloud.47614: Flags [R.], seq 0, ack 1986449926, win 0, length 0
01:05:12.461238 IP L1-anjo5726.cloud.9000 > S1-anjo5726.cloud.47614: Flags [R.], seq 0, ack 1986449926, win 0, length 0
01:05:12.461240 IP L1-anjo5726.cloud.89 > S1-anjo5726.cloud.47614: Flags [R.], seq 0, ack 1986449926, win 0, length 0
01:05:12.461241 IP L1-anjo5726.cloud.1783 > S1-anjo5726.cloud.47614: Flags [R.], seq 0, ack 1986449926, win 0, length 0
01:05:12.461242 IP L1-anjo5726.cloud.54328 > S1-anjo5726.cloud.47614: Flags [R.], seq 0, ack 1986449926, win 0, length 0
01:05:12.461243 IP L1-anjo5726.cloud.1501 > S1-anjo5726.cloud.47614: Flags [R.], seq 0, ack 1986449926, win 0, length 0
01:05:12.461244 IP L1-anjo5726.cloud.9917 > S1-anjo5726.cloud.47614: Flags [R.], seq 0, ack 1986449926, win 0, length 0
01:05:12.461273 IP L1-anjo5726.cloud.8000 > S1-anjo5726.cloud.47614: Flags [R.], seq 0, ack 1986449926, win 0, length 0
01:05:12.461274 IP L1-anjo5726.cloud.gopher > S1-anjo5726.cloud.47614: Flags [R.], seq 0, ack 1986449926, win 0, length 0
01:05:12.461275 IP L1-anjo5726.cloud.1074 > S1-anjo5726.cloud.47614: Flags [R.], seq 0, ack 1986449926, win 0, length 0
01:05:12.461276 IP L1-anjo5726.cloud.8400 > S1-anjo5726.cloud.47614: Flags [R.], seq 0, ack 1986449926, win 0, length 0
01:05:12.461277 IP L1-anjo5726.cloud.ircd > S1-anjo5726.cloud.47614: Flags [R.], seq 0, ack 1986449926, win 0, length 0
01:05:12.461278 IP L1-anjo5726.cloud.1027 > S1-anjo5726.cloud.47614: Flags [R.], seq 0, ack 1986449926, win 0, length 0
01:05:12.461280 IP L1-anjo5726.cloud.9290 > S1-anjo5726.cloud.47614: Flags [R.], seq 0, ack 1986449926, win 0, length 0
01:05:12.461281 IP L1-anjo5726.cloud.9502 > S1-anjo5726.cloud.47614: Flags [R.], seq 0, ack 1986449926, win 0, length 0
01:05:12.461309 IP L1-anjo5726.cloud.8090 > S1-anjo5726.cloud.47614: Flags [R.], seq 0, ack 1986449926, win 0, length 0
01:05:12.461310 IP L1-anjo5726.cloud.648 > S1-anjo5726.cloud.47614: Flags [R.], seq 0, ack 1986449926, win 0, length 0
01:05:12.461311 IP L1-anjo5726.cloud.bacula-dir > S1-anjo5726.cloud.47614: Flags [R.], seq 0, ack 1986449926, win 0, length 0
01:05:12.461312 IP L1-anjo5726.cloud.1011 > S1-anjo5726.cloud.47614: Flags [R.], seq 0, ack 1986449926, win 0, length 0
01:05:12.461313 IP L1-anjo5726.cloud.49153 > S1-anjo5726.cloud.47614: Flags [R.], seq 0, ack 1986449926, win 0, length 0
01:05:12.461314 IP L1-anjo5726.cloud.isisd > S1-anjo5726.cloud.47614: Flags [R.], seq 0, ack 1986449926, win 0, length 0
01:05:12.461316 IP L1-anjo5726.cloud.zebra > S1-anjo5726.cloud.47614: Flags [R.], seq 0, ack 1986449926, win 0, length 0
01:05:12.461317 IP L1-anjo5726.cloud.3370 > S1-anjo5726.cloud.47614: Flags [R.], seq 0, ack 1986449926, win 0, length 0
01:05:12.461344 IP L1-anjo5726.cloud.13783 > S1-anjo5726.cloud.47614: Flags [R.], seq 0, ack 1986449926, win 0, length 0
01:05:12.461345 IP L1-anjo5726.cloud.3945 > S1-anjo5726.cloud.47614: Flags [R.], seq 0, ack 1986449926, win 0, length 0
01:05:12.461347 IP L1-anjo5726.cloud.8654 > S1-anjo5726.cloud.47614: Flags [R.], seq 0, ack 1986449926, win 0, length 0
01:05:12.461348 IP L1-anjo5726.cloud.2920 > S1-anjo5726.cloud.47614: Flags [R.], seq 0, ack 1986449926, win 0, length 0
01:05:12.461349 IP L1-anjo5726.cloud.8031 > S1-anjo5726.cloud.47614: Flags [R.], seq 0, ack 1986449926, win 0, length 0
01:05:12.461350 IP L1-anjo5726.cloud.40193 > S1-anjo5726.cloud.47614: Flags [R.], seq 0, ack 1986449926, win 0, length 0
01:05:12.461351 IP L1-anjo5726.cloud.echo > S1-anjo5726.cloud.47614: Flags [R.], seq 0, ack 1986449926, win 0, length 0
01:05:12.461352 IP L1-anjo5726.cloud.32773 > S1-anjo5726.cloud.47614: Flags [R.], seq 0, ack 1986449926, win 0, length 0
01:05:12.461380 IP L1-anjo5726.cloud.ldap > S1-anjo5726.cloud.47614: Flags [R.], seq 0, ack 1986449926, win 0, length 0
01:05:12.461381 IP L1-anjo5726.cloud.6646 > S1-anjo5726.cloud.47614: Flags [R.], seq 0, ack 1986449926, win 0, length 0
01:05:12.461382 IP L1-anjo5726.cloud.2718 > S1-anjo5726.cloud.47614: Flags [R.], seq 0, ack 1986449926, win 0, length 0
01:05:12.461383 IP L1-anjo5726.cloud.7741 > S1-anjo5726.cloud.47614: Flags [R.], seq 0, ack 1986449926, win 0, length 0
01:05:12.461384 IP L1-anjo5726.cloud.1123 > S1-anjo5726.cloud.47614: Flags [R.], seq 0, ack 1986449926, win 0, length 0
01:05:12.461385 IP L1-anjo5726.cloud.2106 > S1-anjo5726.cloud.47614: Flags [R.], seq 0, ack 1986449926, win 0, length 0
01:05:12.461386 IP L1-anjo5726.cloud.1042 > S1-anjo5726.cloud.47614: Flags [R.], seq 0, ack 1986449926, win 0, length 0
01:05:12.461387 IP L1-anjo5726.cloud.49156 > S1-anjo5726.cloud.47614: Flags [R.], seq 0, ack 1986449926, win 0, length 0
01:05:12.461423 IP L1-anjo5726.cloud.2008 > S1-anjo5726.cloud.47614: Flags [R.], seq 0, ack 1986449926, win 0, length 0
01:05:12.461424 IP L1-anjo5726.cloud.6 > S1-anjo5726.cloud.47614: Flags [R.], seq 0, ack 1986449926, win 0, length 0
01:05:12.461754 IP S1-anjo5726.cloud.47614 > L1-anjo5726.cloud.3372: Flags [S], seq 1986449925, win 1024, options [mss 1460], length 0
01:05:12.461778 IP S1-anjo5726.cloud.47614 > L1-anjo5726.cloud.8002: Flags [S], seq 1986449925, win 1024, options [mss 1460], length 0
01:05:12.461797 IP S1-anjo5726.cloud.47614 > L1-anjo5726.cloud.1009: Flags [S], seq 1986449925, win 1024, options [mss 1460], length 0
01:05:12.461809 IP S1-anjo5726.cloud.47614 > L1-anjo5726.cloud.10012: Flags [S], seq 1986449925, win 1024, options [mss 1460], length 0
01:05:12.461820 IP S1-anjo5726.cloud.47614 > L1-anjo5726.cloud.1029: Flags [S], seq 1986449925, win 1024, options [mss 1460], length 0
01:05:12.461830 IP S1-anjo5726.cloud.47614 > L1-anjo5726.cloud.nntps: Flags [S], seq 1986449925, win 1024, options [mss 1460], length 0
01:05:12.461845 IP S1-anjo5726.cloud.47614 > L1-anjo5726.cloud.2725: Flags [S], seq 1986449925, win 1024, options [mss 1460], length 0
01:05:12.461858 IP S1-anjo5726.cloud.47614 > L1-anjo5726.cloud.32782: Flags [S], seq 1986449925, win 1024, options [mss 1460], length 0
01:05:12.461875 IP S1-anjo5726.cloud.47614 > L1-anjo5726.cloud.1137: Flags [S], seq 1986449925, win 1024, options [mss 1460], length 0
01:05:12.461887 IP S1-anjo5726.cloud.47614 > L1-anjo5726.cloud.20031: Flags [S], seq 1986449925, win 1024, options [mss 1460], length 0
01:05:12.461905 IP S1-anjo5726.cloud.47614 > L1-anjo5726.cloud.1947: Flags [S], seq 1986449925, win 1024, options [mss 1460], length 0
01:05:12.461918 IP S1-anjo5726.cloud.47614 > L1-anjo5726.cloud.ftps: Flags [S], seq 1986449925, win 1024, options [mss 1460], length 0
01:05:12.461928 IP S1-anjo5726.cloud.47614 > L1-anjo5726.cloud.8701: Flags [S], seq 1986449925, win 1024, options [mss 1460], length 0
01:05:12.461938 IP S1-anjo5726.cloud.47614 > L1-anjo5726.cloud.3784: Flags [S], seq 1986449925, win 1024, options [mss 1460], length 0
01:05:12.461948 IP S1-anjo5726.cloud.47614 > L1-anjo5726.cloud.3517: Flags [S], seq 1986449925, win 1024, options [mss 1460], length 0
01:05:12.461958 IP S1-anjo5726.cloud.47614 > L1-anjo5726.cloud.8500: Flags [S], seq 1986449925, win 1024, options [mss 1460], length 0
01:05:12.461977 IP S1-anjo5726.cloud.47614 > L1-anjo5726.cloud.3371: Flags [S], seq 1986449925, win 1024, options [mss 1460], length 0
01:05:12.461988 IP S1-anjo5726.cloud.47614 > L1-anjo5726.cloud.1248: Flags [S], seq 1986449925, win 1024, options [mss 1460], length 0
01:05:12.462006 IP S1-anjo5726.cloud.47614 > L1-anjo5726.cloud.16000: Flags [S], seq 1986449925, win 1024, options [mss 1460], length 0
01:05:12.462018 IP S1-anjo5726.cloud.47614 > L1-anjo5726.cloud.1040: Flags [S], seq 1986449925, win 1024, options [mss 1460], length 0
01:05:12.462028 IP S1-anjo5726.cloud.47614 > L1-anjo5726.cloud.55055: Flags [S], seq 1986449925, win 1024, options [mss 1460], length 0
01:05:12.462039 IP S1-anjo5726.cloud.47614 > L1-anjo5726.cloud.212: Flags [S], seq 1986449925, win 1024, options [mss 1460], length 0
01:05:12.462049 IP S1-anjo5726.cloud.47614 > L1-anjo5726.cloud.7106: Flags [S], seq 1986449925, win 1024, options [mss 1460], length 0
01:05:12.462059 IP S1-anjo5726.cloud.47614 > L1-anjo5726.cloud.1271: Flags [S], seq 1986449925, win 1024, options [mss 1460], length 0
01:05:12.462076 IP S1-anjo5726.cloud.47614 > L1-anjo5726.cloud.5405: Flags [S], seq 1986449925, win 1024, options [mss 1460], length 0
01:05:12.462088 IP S1-anjo5726.cloud.47614 > L1-anjo5726.cloud.32785: Flags [S], seq 1986449925, win 1024, options [mss 1460], length 0
01:05:12.462105 IP S1-anjo5726.cloud.47614 > L1-anjo5726.cloud.55056: Flags [S], seq 1986449925, win 1024, options [mss 1460], length 0
01:05:12.462122 IP S1-anjo5726.cloud.47614 > L1-anjo5726.cloud.32772: Flags [S], seq 1986449925, win 1024, options [mss 1460], length 0
01:05:12.462133 IP S1-anjo5726.cloud.47614 > L1-anjo5726.cloud.2288: Flags [S], seq 1986449925, win 1024, options [mss 1460], length 0
01:05:12.462143 IP S1-anjo5726.cloud.47614 > L1-anjo5726.cloud.52673: Flags [S], seq 1986449925, win 1024, options [mss 1460], length 0
01:05:12.462153 IP S1-anjo5726.cloud.47614 > L1-anjo5726.cloud.6510: Flags [S], seq 1986449925, win 1024, options [mss 1460], length 0
01:05:12.462162 IP S1-anjo5726.cloud.47614 > L1-anjo5726.cloud.5988: Flags [S], seq 1986449925, win 1024, options [mss 1460], length 0
01:05:12.462180 IP S1-anjo5726.cloud.47614 > L1-anjo5726.cloud.1213: Flags [S], seq 1986449925, win 1024, options [mss 1460], length 0
01:05:12.462191 IP S1-anjo5726.cloud.47614 > L1-anjo5726.cloud.1721: Flags [S], seq 1986449925, win 1024, options [mss 1460], length 0
01:05:12.462201 IP S1-anjo5726.cloud.47614 > L1-anjo5726.cloud.1010: Flags [S], seq 1986449925, win 1024, options [mss 1460], length 0
01:05:12.462211 IP S1-anjo5726.cloud.47614 > L1-anjo5726.cloud.8200: Flags [S], seq 1986449925, win 1024, options [mss 1460], length 0
01:05:12.462220 IP S1-anjo5726.cloud.47614 > L1-anjo5726.cloud.3333: Flags [S], seq 1986449925, win 1024, options [mss 1460], length 0
01:05:12.462229 IP S1-anjo5726.cloud.47614 > L1-anjo5726.cloud.4045: Flags [S], seq 1986449925, win 1024, options [mss 1460], length 0
01:05:12.462239 IP S1-anjo5726.cloud.47614 > L1-anjo5726.cloud.x11-6: Flags [S], seq 1986449925, win 1024, options [mss 1460], length 0
01:05:12.462249 IP S1-anjo5726.cloud.47614 > L1-anjo5726.cloud.2005: Flags [S], seq 1986449925, win 1024, options [mss 1460], length 0
01:05:12.462291 IP S1-anjo5726.cloud.47614 > L1-anjo5726.cloud.8194: Flags [S], seq 1986449925, win 1024, options [mss 1460], length 0
01:05:12.462363 IP S1-anjo5726.cloud.47614 > L1-anjo5726.cloud.6788: Flags [S], seq 1986449925, win 1024, options [mss 1460], length 0
01:05:12.462374 IP S1-anjo5726.cloud.47614 > L1-anjo5726.cloud.3918: Flags [S], seq 1986449925, win 1024, options [mss 1460], length 0
01:05:12.462384 IP S1-anjo5726.cloud.47614 > L1-anjo5726.cloud.ingreslock: Flags [S], seq 1986449925, win 1024, options [mss 1460], length 0
01:05:12.462394 IP S1-anjo5726.cloud.47614 > L1-anjo5726.cloud.5054: Flags [S], seq 1986449925, win 1024, options [mss 1460], length 0
01:05:12.462404 IP S1-anjo5726.cloud.47614 > L1-anjo5726.cloud.9207: Flags [S], seq 1986449925, win 1024, options [mss 1460], length 0
01:05:12.462414 IP S1-anjo5726.cloud.47614 > L1-anjo5726.cloud.discard: Flags [S], seq 1986449925, win 1024, options [mss 1460], length 0
01:05:12.462424 IP S1-anjo5726.cloud.47614 > L1-anjo5726.cloud.4443: Flags [S], seq 1986449925, win 1024, options [mss 1460], length 0
01:05:12.462436 IP S1-anjo5726.cloud.47614 > L1-anjo5726.cloud.44443: Flags [S], seq 1986449925, win 1024, options [mss 1460], length 0
01:05:12.462446 IP S1-anjo5726.cloud.47614 > L1-anjo5726.cloud.2702: Flags [S], seq 1986449925, win 1024, options [mss 1460], length 0
01:05:12.463023 IP L1-anjo5726.cloud.3372 > S1-anjo5726.cloud.47614: Flags [R.], seq 0, ack 1986449926, win 0, length 0
01:05:12.463024 IP L1-anjo5726.cloud.8002 > S1-anjo5726.cloud.47614: Flags [R.], seq 0, ack 1986449926, win 0, length 0
01:05:12.463025 IP L1-anjo5726.cloud.1009 > S1-anjo5726.cloud.47614: Flags [R.], seq 0, ack 1986449926, win 0, length 0
01:05:12.463026 IP L1-anjo5726.cloud.10012 > S1-anjo5726.cloud.47614: Flags [R.], seq 0, ack 1986449926, win 0, length 0
01:05:12.463027 IP L1-anjo5726.cloud.1029 > S1-anjo5726.cloud.47614: Flags [R.], seq 0, ack 1986449926, win 0, length 0
01:05:12.463027 IP L1-anjo5726.cloud.nntps > S1-anjo5726.cloud.47614: Flags [R.], seq 0, ack 1986449926, win 0, length 0
01:05:12.463028 IP L1-anjo5726.cloud.2725 > S1-anjo5726.cloud.47614: Flags [R.], seq 0, ack 1986449926, win 0, length 0
01:05:12.463029 IP L1-anjo5726.cloud.32782 > S1-anjo5726.cloud.47614: Flags [R.], seq 0, ack 1986449926, win 0, length 0
01:05:12.463058 IP L1-anjo5726.cloud.1137 > S1-anjo5726.cloud.47614: Flags [R.], seq 0, ack 1986449926, win 0, length 0
01:05:12.463059 IP L1-anjo5726.cloud.20031 > S1-anjo5726.cloud.47614: Flags [R.], seq 0, ack 1986449926, win 0, length 0
