01:07:29.928635 IP L1-anjo5726.cloud.ntp > ntp60.kashra-server.com.ntp: NTPv4, Client, length 48
01:07:29.965654 IP ntp60.kashra-server.com.ntp > L1-anjo5726.cloud.ntp: NTPv4, Server, length 48
01:07:30.069523 IP L1-anjo5726.cloud.44429 > router1.cloud.domain: 52760+ PTR? 69.85.89.51.in-addr.arpa. (42)
01:07:30.070607 IP router1.cloud.domain > L1-anjo5726.cloud.44429: 52760 1/0/0 PTR ntp60.kashra-server.com. (79)
01:07:30.070903 IP L1-anjo5726.cloud.51925 > router1.cloud.domain: 18784+ PTR? 16.0.16.172.in-addr.arpa. (42)
01:07:30.071803 IP router1.cloud.domain > L1-anjo5726.cloud.51925: 18784* 1/0/0 PTR L1-anjo5726.cloud. (73)
01:07:31.092627 IP L1-anjo5726.cloud.46627 > router1.cloud.domain: 29620+ PTR? 1.0.16.172.in-addr.arpa. (41)
01:07:31.093899 IP router1.cloud.domain > L1-anjo5726.cloud.46627: 29620* 1/0/0 PTR router1.cloud. (68)
01:07:34.964239 ARP, Request who-has router1.cloud tell L1-anjo5726.cloud, length 28
01:07:34.965150 ARP, Reply router1.cloud is-at 02:00:ac:10:00:01 (oui Unknown), length 28
01:07:35.154312 ARP, Request who-has L1-anjo5726.cloud tell router1.cloud, length 28
01:07:35.154335 ARP, Reply L1-anjo5726.cloud is-at 02:00:ac:10:00:10 (oui Unknown), length 28
01:07:39.928600 IP L1-anjo5726.cloud.ntp > ntp61.kashra-server.com.ntp: NTPv4, Client, length 48
01:07:39.965806 IP ntp61.kashra-server.com.ntp > L1-anjo5726.cloud.ntp: NTPv4, Server, length 48
01:07:40.308641 IP L1-anjo5726.cloud.59544 > router1.cloud.domain: 15465+ PTR? 70.85.89.51.in-addr.arpa. (42)
01:07:40.309876 IP router1.cloud.domain > L1-anjo5726.cloud.59544: 15465 1/0/0 PTR ntp61.kashra-server.com. (79)
01:07:48.889168 ARP, Request who-has L1-anjo5726.cloud tell S1-anjo5726.cloud, length 28
01:07:48.889196 ARP, Reply L1-anjo5726.cloud is-at 02:00:ac:10:00:10 (oui Unknown), length 28
01:07:48.892738 IP S1-anjo5726.cloud.33173 > L1-anjo5726.cloud.1720: Flags [S], seq 3262295046, win 1024, options [mss 1460], length 0
01:07:48.892739 IP S1-anjo5726.cloud.33173 > L1-anjo5726.cloud.1025: Flags [S], seq 3262295046, win 1024, options [mss 1460], length 0
01:07:48.892739 IP S1-anjo5726.cloud.33173 > L1-anjo5726.cloud.imap2: Flags [S], seq 3262295046, win 1024, options [mss 1460], length 0
01:07:48.892739 IP S1-anjo5726.cloud.33173 > L1-anjo5726.cloud.microsoft-ds: Flags [S], seq 3262295046, win 1024, options [mss 1460], length 0
01:07:48.892739 IP S1-anjo5726.cloud.33173 > L1-anjo5726.cloud.1723: Flags [S], seq 3262295046, win 1024, options [mss 1460], length 0
01:07:48.892739 IP S1-anjo5726.cloud.33173 > L1-anjo5726.cloud.pop3: Flags [S], seq 3262295046, win 1024, options [mss 1460], length 0
01:07:48.892739 IP S1-anjo5726.cloud.33173 > L1-anjo5726.cloud.epmap: Flags [S], seq 3262295046, win 1024, options [mss 1460], length 0
01:07:48.892739 IP S1-anjo5726.cloud.33173 > L1-anjo5726.cloud.5900: Flags [S], seq 3262295046, win 1024, options [mss 1460], length 0
01:07:48.892826 IP L1-anjo5726.cloud.1720 > S1-anjo5726.cloud.33173: Flags [R.], seq 0, ack 3262295047, win 0, length 0
01:07:48.892842 IP L1-anjo5726.cloud.1025 > S1-anjo5726.cloud.33173: Flags [R.], seq 0, ack 3262295047, win 0, length 0
01:07:48.892864 IP L1-anjo5726.cloud.imap2 > S1-anjo5726.cloud.33173: Flags [R.], seq 0, ack 3262295047, win 0, length 0
01:07:48.892881 IP L1-anjo5726.cloud.microsoft-ds > S1-anjo5726.cloud.33173: Flags [R.], seq 0, ack 3262295047, win 0, length 0
01:07:48.892896 IP L1-anjo5726.cloud.1723 > S1-anjo5726.cloud.33173: Flags [R.], seq 0, ack 3262295047, win 0, length 0
01:07:48.892907 IP L1-anjo5726.cloud.pop3 > S1-anjo5726.cloud.33173: Flags [R.], seq 0, ack 3262295047, win 0, length 0
01:07:48.892918 IP L1-anjo5726.cloud.epmap > S1-anjo5726.cloud.33173: Flags [R.], seq 0, ack 3262295047, win 0, length 0
01:07:48.892928 IP L1-anjo5726.cloud.5900 > S1-anjo5726.cloud.33173: Flags [R.], seq 0, ack 3262295047, win 0, length 0
01:07:48.892971 IP S1-anjo5726.cloud.33173 > L1-anjo5726.cloud.8888: Flags [S], seq 3262295046, win 1024, options [mss 1460], length 0
01:07:48.892971 IP S1-anjo5726.cloud.33173 > L1-anjo5726.cloud.submission: Flags [S], seq 3262295046, win 1024, options [mss 1460], length 0
01:07:48.892989 IP L1-anjo5726.cloud.8888 > S1-anjo5726.cloud.33173: Flags [R.], seq 0, ack 3262295047, win 0, length 0
01:07:48.893001 IP L1-anjo5726.cloud.submission > S1-anjo5726.cloud.33173: Flags [R.], seq 0, ack 3262295047, win 0, length 0
01:07:48.893515 IP S1-anjo5726.cloud.33173 > L1-anjo5726.cloud.smux: Flags [S], seq 3262295046, win 1024, options [mss 1460], length 0
01:07:48.893515 IP S1-anjo5726.cloud.33173 > L1-anjo5726.cloud.imaps: Flags [S], seq 3262295046, win 1024, options [mss 1460], length 0
01:07:48.893515 IP S1-anjo5726.cloud.33173 > L1-anjo5726.cloud.rtsp: Flags [S], seq 3262295046, win 1024, options [mss 1460], length 0
01:07:48.893515 IP S1-anjo5726.cloud.33173 > L1-anjo5726.cloud.pop3s: Flags [S], seq 3262295046, win 1024, options [mss 1460], length 0
01:07:48.893515 IP S1-anjo5726.cloud.33173 > L1-anjo5726.cloud.mysql: Flags [S], seq 3262295046, win 1024, options [mss 1460], length 0
01:07:48.893559 IP L1-anjo5726.cloud.smux > S1-anjo5726.cloud.33173: Flags [R.], seq 0, ack 3262295047, win 0, length 0
01:07:48.893580 IP L1-anjo5726.cloud.imaps > S1-anjo5726.cloud.33173: Flags [R.], seq 0, ack 3262295047, win 0, length 0
01:07:48.893586 IP L1-anjo5726.cloud.rtsp > S1-anjo5726.cloud.33173: Flags [R.], seq 0, ack 3262295047, win 0, length 0
01:07:48.893591 IP L1-anjo5726.cloud.pop3s > S1-anjo5726.cloud.33173: Flags [R.], seq 0, ack 3262295047, win 0, length 0
01:07:48.893596 IP L1-anjo5726.cloud.mysql > S1-anjo5726.cloud.33173: Flags [R.], seq 0, ack 3262295047, win 0, length 0
01:07:48.893606 IP S1-anjo5726.cloud.33173 > L1-anjo5726.cloud.sunrpc: Flags [S], seq 3262295046, win 1024, options [mss 1460], length 0
01:07:48.893606 IP S1-anjo5726.cloud.33173 > L1-anjo5726.cloud.http-alt: Flags [S], seq 3262295046, win 1024, options [mss 1460], length 0
01:07:48.893606 IP S1-anjo5726.cloud.33173 > L1-anjo5726.cloud.telnet: Flags [S], seq 3262295046, win 1024, options [mss 1460], length 0
01:07:48.893606 IP S1-anjo5726.cloud.33173 > L1-anjo5726.cloud.netbios-ssn: Flags [S], seq 3262295046, win 1024, options [mss 1460], length 0
01:07:48.893679 IP L1-anjo5726.cloud.sunrpc > S1-anjo5726.cloud.33173: Flags [S.], seq 3394964221, ack 3262295047, win 64240, options [mss 1460], length 0
01:07:48.893701 IP L1-anjo5726.cloud.http-alt > S1-anjo5726.cloud.33173: Flags [R.], seq 0, ack 3262295047, win 0, length 0
01:07:48.893707 IP L1-anjo5726.cloud.telnet > S1-anjo5726.cloud.33173: Flags [R.], seq 0, ack 3262295047, win 0, length 0
01:07:48.893712 IP L1-anjo5726.cloud.netbios-ssn > S1-anjo5726.cloud.33173: Flags [R.], seq 0, ack 3262295047, win 0, length 0
01:07:48.893727 IP S1-anjo5726.cloud.33173 > L1-anjo5726.cloud.http: Flags [S], seq 3262295046, win 1024, options [mss 1460], length 0
01:07:48.893727 IP S1-anjo5726.cloud.33173 > L1-anjo5726.cloud.auth: Flags [S], seq 3262295046, win 1024, options [mss 1460], length 0
01:07:48.893727 IP S1-anjo5726.cloud.33173 > L1-anjo5726.cloud.smtp: Flags [S], seq 3262295046, win 1024, options [mss 1460], length 0
01:07:48.893727 IP S1-anjo5726.cloud.33173 > L1-anjo5726.cloud.256: Flags [S], seq 3262295046, win 1024, options [mss 1460], length 0
01:07:48.893727 IP S1-anjo5726.cloud.33173 > L1-anjo5726.cloud.ftp: Flags [S], seq 3262295046, win 1024, options [mss 1460], length 0
01:07:48.893727 IP S1-anjo5726.cloud.33173 > L1-anjo5726.cloud.https: Flags [S], seq 3262295046, win 1024, options [mss 1460], length 0
01:07:48.893742 IP L1-anjo5726.cloud.http > S1-anjo5726.cloud.33173: Flags [S.], seq 994299667, ack 3262295047, win 64240, options [mss 1460], length 0
01:07:48.893773 IP L1-anjo5726.cloud.auth > S1-anjo5726.cloud.33173: Flags [R.], seq 0, ack 3262295047, win 0, length 0
01:07:48.893795 IP L1-anjo5726.cloud.smtp > S1-anjo5726.cloud.33173: Flags [S.], seq 939483003, ack 3262295047, win 64240, options [mss 1460], length 0
01:07:48.893801 IP L1-anjo5726.cloud.256 > S1-anjo5726.cloud.33173: Flags [R.], seq 0, ack 3262295047, win 0, length 0
01:07:48.893818 IP L1-anjo5726.cloud.ftp > S1-anjo5726.cloud.33173: Flags [S.], seq 26339492, ack 3262295047, win 64240, options [mss 1460], length 0
01:07:48.893836 IP L1-anjo5726.cloud.https > S1-anjo5726.cloud.33173: Flags [R.], seq 0, ack 3262295047, win 0, length 0
01:07:48.893846 IP S1-anjo5726.cloud.33173 > L1-anjo5726.cloud.ms-wbt-server: Flags [S], seq 3262295046, win 1024, options [mss 1460], length 0
01:07:48.893846 IP S1-anjo5726.cloud.33173 > L1-anjo5726.cloud.domain: Flags [S], seq 3262295046, win 1024, options [mss 1460], length 0
01:07:48.893846 IP S1-anjo5726.cloud.33173 > L1-anjo5726.cloud.ssh: Flags [S], seq 3262295046, win 1024, options [mss 1460], length 0
01:07:48.893846 IP S1-anjo5726.cloud.33173 > L1-anjo5726.cloud.10617: Flags [S], seq 3262295046, win 1024, options [mss 1460], length 0
01:07:48.893846 IP S1-anjo5726.cloud.33173 > L1-anjo5726.cloud.668: Flags [S], seq 3262295046, win 1024, options [mss 1460], length 0
01:07:48.893853 IP L1-anjo5726.cloud.ms-wbt-server > S1-anjo5726.cloud.33173: Flags [R.], seq 0, ack 3262295047, win 0, length 0
01:07:48.893866 IP L1-anjo5726.cloud.domain > S1-anjo5726.cloud.33173: Flags [S.], seq 3529805659, ack 3262295047, win 64240, options [mss 1460], length 0
01:07:48.893908 IP L1-anjo5726.cloud.ssh > S1-anjo5726.cloud.33173: Flags [S.], seq 170333105, ack 3262295047, win 64240, options [mss 1460], length 0
01:07:48.893922 IP L1-anjo5726.cloud.10617 > S1-anjo5726.cloud.33173: Flags [R.], seq 0, ack 3262295047, win 0, length 0
01:07:48.893927 IP L1-anjo5726.cloud.668 > S1-anjo5726.cloud.33173: Flags [R.], seq 0, ack 3262295047, win 0, length 0
01:07:48.894052 IP S1-anjo5726.cloud.33173 > L1-anjo5726.cloud.sunrpc: Flags [R], seq 3262295047, win 0, length 0
01:07:48.894052 IP S1-anjo5726.cloud.33173 > L1-anjo5726.cloud.http: Flags [R], seq 3262295047, win 0, length 0
01:07:48.894052 IP S1-anjo5726.cloud.33173 > L1-anjo5726.cloud.smtp: Flags [R], seq 3262295047, win 0, length 0
01:07:48.894083 IP S1-anjo5726.cloud.33173 > L1-anjo5726.cloud.ftp: Flags [R], seq 3262295047, win 0, length 0
01:07:48.894131 IP S1-anjo5726.cloud.33173 > L1-anjo5726.cloud.domain: Flags [R], seq 3262295047, win 0, length 0
01:07:48.894131 IP S1-anjo5726.cloud.33173 > L1-anjo5726.cloud.ssh: Flags [R], seq 3262295047, win 0, length 0
01:07:48.894392 IP S1-anjo5726.cloud.33173 > L1-anjo5726.cloud.49167: Flags [S], seq 3262295046, win 1024, options [mss 1460], length 0
01:07:48.894392 IP S1-anjo5726.cloud.33173 > L1-anjo5726.cloud.34571: Flags [S], seq 3262295046, win 1024, options [mss 1460], length 0
01:07:48.894392 IP S1-anjo5726.cloud.33173 > L1-anjo5726.cloud.32784: Flags [S], seq 3262295046, win 1024, options [mss 1460], length 0
01:07:48.894419 IP L1-anjo5726.cloud.49167 > S1-anjo5726.cloud.33173: Flags [R.], seq 0, ack 3262295047, win 0, length 0
01:07:48.894436 IP L1-anjo5726.cloud.34571 > S1-anjo5726.cloud.33173: Flags [R.], seq 0, ack 3262295047, win 0, length 0
01:07:48.894441 IP L1-anjo5726.cloud.32784 > S1-anjo5726.cloud.33173: Flags [R.], seq 0, ack 3262295047, win 0, length 0
01:07:48.894447 IP S1-anjo5726.cloud.33173 > L1-anjo5726.cloud.1234: Flags [S], seq 3262295046, win 1024, options [mss 1460], length 0
01:07:48.894447 IP S1-anjo5726.cloud.33173 > L1-anjo5726.cloud.8200: Flags [S], seq 3262295046, win 1024, options [mss 1460], length 0
01:07:48.894452 IP L1-anjo5726.cloud.1234 > S1-anjo5726.cloud.33173: Flags [R.], seq 0, ack 3262295047, win 0, length 0
01:07:48.894457 IP L1-anjo5726.cloud.8200 > S1-anjo5726.cloud.33173: Flags [R.], seq 0, ack 3262295047, win 0, length 0
01:07:48.894581 IP S1-anjo5726.cloud.33173 > L1-anjo5726.cloud.41511: Flags [S], seq 3262295046, win 1024, options [mss 1460], length 0
01:07:48.894581 IP S1-anjo5726.cloud.33173 > L1-anjo5726.cloud.7512: Flags [S], seq 3262295046, win 1024, options [mss 1460], length 0
01:07:48.894581 IP S1-anjo5726.cloud.33173 > L1-anjo5726.cloud.zebra: Flags [S], seq 3262295046, win 1024, options [mss 1460], length 0
01:07:48.894581 IP S1-anjo5726.cloud.33173 > L1-anjo5726.cloud.4129: Flags [S], seq 3262295046, win 1024, options [mss 1460], length 0
01:07:48.894581 IP S1-anjo5726.cloud.33173 > L1-anjo5726.cloud.5101: Flags [S], seq 3262295046, win 1024, options [mss 1460], length 0
01:07:48.894581 IP S1-anjo5726.cloud.33173 > L1-anjo5726.cloud.1090: Flags [S], seq 3262295046, win 1024, options [mss 1460], length 0
01:07:48.894582 IP S1-anjo5726.cloud.33173 > L1-anjo5726.cloud.8082: Flags [S], seq 3262295046, win 1024, options [mss 1460], length 0
01:07:48.894582 IP S1-anjo5726.cloud.33173 > L1-anjo5726.cloud.65000: Flags [S], seq 3262295046, win 1024, options [mss 1460], length 0
01:07:48.894602 IP L1-anjo5726.cloud.41511 > S1-anjo5726.cloud.33173: Flags [R.], seq 0, ack 3262295047, win 0, length 0
01:07:48.894617 IP L1-anjo5726.cloud.7512 > S1-anjo5726.cloud.33173: Flags [R.], seq 0, ack 3262295047, win 0, length 0
01:07:48.894621 IP L1-anjo5726.cloud.zebra > S1-anjo5726.cloud.33173: Flags [R.], seq 0, ack 3262295047, win 0, length 0
01:07:48.894625 IP L1-anjo5726.cloud.4129 > S1-anjo5726.cloud.33173: Flags [R.], seq 0, ack 3262295047, win 0, length 0
01:07:48.894630 IP L1-anjo5726.cloud.5101 > S1-anjo5726.cloud.33173: Flags [R.], seq 0, ack 3262295047, win 0, length 0
01:07:48.894634 IP L1-anjo5726.cloud.1090 > S1-anjo5726.cloud.33173: Flags [R.], seq 0, ack 3262295047, win 0, length 0
01:07:48.894637 IP L1-anjo5726.cloud.8082 > S1-anjo5726.cloud.33173: Flags [R.], seq 0, ack 3262295047, win 0, length 0
01:07:48.894642 IP L1-anjo5726.cloud.65000 > S1-anjo5726.cloud.33173: Flags [R.], seq 0, ack 3262295047, win 0, length 0
01:07:48.894665 IP S1-anjo5726.cloud.33173 > L1-anjo5726.cloud.2002: Flags [S], seq 3262295046, win 1024, options [mss 1460], length 0
01:07:48.894665 IP S1-anjo5726.cloud.33173 > L1-anjo5726.cloud.2393: Flags [S], seq 3262295046, win 1024, options [mss 1460], length 0
01:07:48.894672 IP L1-anjo5726.cloud.2002 > S1-anjo5726.cloud.33173: Flags [R.], seq 0, ack 3262295047, win 0, length 0
01:07:48.894677 IP L1-anjo5726.cloud.2393 > S1-anjo5726.cloud.33173: Flags [R.], seq 0, ack 3262295047, win 0, length 0
01:07:48.894769 IP S1-anjo5726.cloud.33173 > L1-anjo5726.cloud.1666: Flags [S], seq 3262295046, win 1024, options [mss 1460], length 0
01:07:48.894769 IP S1-anjo5726.cloud.33173 > L1-anjo5726.cloud.1122: Flags [S], seq 3262295046, win 1024, options [mss 1460], length 0
01:07:48.894769 IP S1-anjo5726.cloud.33173 > L1-anjo5726.cloud.5051: Flags [S], seq 3262295046, win 1024, options [mss 1460], length 0
01:07:48.894769 IP S1-anjo5726.cloud.33173 > L1-anjo5726.cloud.1461: Flags [S], seq 3262295046, win 1024, options [mss 1460], length 0
01:07:48.894769 IP S1-anjo5726.cloud.33173 > L1-anjo5726.cloud.rmtcfg: Flags [S], seq 3262295046, win 1024, options [mss 1460], length 0
01:07:48.894769 IP S1-anjo5726.cloud.33173 > L1-anjo5726.cloud.1721: Flags [S], seq 3262295046, win 1024, options [mss 1460], length 0
01:07:48.894770 IP S1-anjo5726.cloud.33173 > L1-anjo5726.cloud.8701: Flags [S], seq 3262295046, win 1024, options [mss 1460], length 0
01:07:48.894770 IP S1-anjo5726.cloud.33173 > L1-anjo5726.cloud.shell: Flags [S], seq 3262295046, win 1024, options [mss 1460], length 0
01:07:48.894801 IP L1-anjo5726.cloud.1666 > S1-anjo5726.cloud.33173: Flags [R.], seq 0, ack 3262295047, win 0, length 0
01:07:48.894818 IP L1-anjo5726.cloud.1122 > S1-anjo5726.cloud.33173: Flags [R.], seq 0, ack 3262295047, win 0, length 0
01:07:48.894824 IP L1-anjo5726.cloud.5051 > S1-anjo5726.cloud.33173: Flags [R.], seq 0, ack 3262295047, win 0, length 0
01:07:48.894829 IP L1-anjo5726.cloud.1461 > S1-anjo5726.cloud.33173: Flags [R.], seq 0, ack 3262295047, win 0, length 0
01:07:48.894834 IP L1-anjo5726.cloud.rmtcfg > S1-anjo5726.cloud.33173: Flags [R.], seq 0, ack 3262295047, win 0, length 0
01:07:48.894840 IP L1-anjo5726.cloud.1721 > S1-anjo5726.cloud.33173: Flags [R.], seq 0, ack 3262295047, win 0, length 0
01:07:48.894845 IP L1-anjo5726.cloud.8701 > S1-anjo5726.cloud.33173: Flags [R.], seq 0, ack 3262295047, win 0, length 0
01:07:48.894850 IP L1-anjo5726.cloud.shell > S1-anjo5726.cloud.33173: Flags [R.], seq 0, ack 3262295047, win 0, length 0
01:07:48.894857 IP S1-anjo5726.cloud.33173 > L1-anjo5726.cloud.7777: Flags [S], seq 3262295046, win 1024, options [mss 1460], length 0
01:07:48.894857 IP S1-anjo5726.cloud.33173 > L1-anjo5726.cloud.27356: Flags [S], seq 3262295046, win 1024, options [mss 1460], length 0
01:07:48.894857 IP S1-anjo5726.cloud.33173 > L1-anjo5726.cloud.1310: Flags [S], seq 3262295046, win 1024, options [mss 1460], length 0
01:07:48.894864 IP L1-anjo5726.cloud.7777 > S1-anjo5726.cloud.33173: Flags [R.], seq 0, ack 3262295047, win 0, length 0
01:07:48.894870 IP L1-anjo5726.cloud.27356 > S1-anjo5726.cloud.33173: Flags [R.], seq 0, ack 3262295047, win 0, length 0
01:07:48.894875 IP L1-anjo5726.cloud.1310 > S1-anjo5726.cloud.33173: Flags [R.], seq 0, ack 3262295047, win 0, length 0
01:07:48.894996 IP S1-anjo5726.cloud.33173 > L1-anjo5726.cloud.2710: Flags [S], seq 3262295046, win 1024, options [mss 1460], length 0
01:07:48.894996 IP S1-anjo5726.cloud.33173 > L1-anjo5726.cloud.15002: Flags [S], seq 3262295046, win 1024, options [mss 1460], length 0
01:07:48.894996 IP S1-anjo5726.cloud.33173 > L1-anjo5726.cloud.x11-6: Flags [S], seq 3262295046, win 1024, options [mss 1460], length 0
01:07:48.894996 IP S1-anjo5726.cloud.33173 > L1-anjo5726.cloud.1108: Flags [S], seq 3262295046, win 1024, options [mss 1460], length 0
01:07:48.894996 IP S1-anjo5726.cloud.33173 > L1-anjo5726.cloud.1687: Flags [S], seq 3262295046, win 1024, options [mss 1460], length 0
01:07:48.894997 IP S1-anjo5726.cloud.33173 > L1-anjo5726.cloud.3333: Flags [S], seq 3262295046, win 1024, options [mss 1460], length 0
01:07:48.894997 IP S1-anjo5726.cloud.33173 > L1-anjo5726.cloud.1050: Flags [S], seq 3262295046, win 1024, options [mss 1460], length 0
01:07:48.894997 IP S1-anjo5726.cloud.33173 > L1-anjo5726.cloud.31038: Flags [S], seq 3262295046, win 1024, options [mss 1460], length 0
01:07:48.895015 IP L1-anjo5726.cloud.2710 > S1-anjo5726.cloud.33173: Flags [R.], seq 0, ack 3262295047, win 0, length 0
01:07:48.895030 IP L1-anjo5726.cloud.15002 > S1-anjo5726.cloud.33173: Flags [R.], seq 0, ack 3262295047, win 0, length 0
01:07:48.895037 IP L1-anjo5726.cloud.x11-6 > S1-anjo5726.cloud.33173: Flags [R.], seq 0, ack 3262295047, win 0, length 0
01:07:48.895042 IP L1-anjo5726.cloud.1108 > S1-anjo5726.cloud.33173: Flags [R.], seq 0, ack 3262295047, win 0, length 0
01:07:48.895047 IP L1-anjo5726.cloud.1687 > S1-anjo5726.cloud.33173: Flags [R.], seq 0, ack 3262295047, win 0, length 0
01:07:48.895053 IP L1-anjo5726.cloud.3333 > S1-anjo5726.cloud.33173: Flags [R.], seq 0, ack 3262295047, win 0, length 0
01:07:48.895058 IP L1-anjo5726.cloud.1050 > S1-anjo5726.cloud.33173: Flags [R.], seq 0, ack 3262295047, win 0, length 0
01:07:48.895063 IP L1-anjo5726.cloud.31038 > S1-anjo5726.cloud.33173: Flags [R.], seq 0, ack 3262295047, win 0, length 0
01:07:48.895069 IP S1-anjo5726.cloud.33173 > L1-anjo5726.cloud.10024: Flags [S], seq 3262295046, win 1024, options [mss 1460], length 0
01:07:48.895070 IP S1-anjo5726.cloud.33173 > L1-anjo5726.cloud.3551: Flags [S], seq 3262295046, win 1024, options [mss 1460], length 0
01:07:48.895070 IP S1-anjo5726.cloud.33173 > L1-anjo5726.cloud.zope-ftp: Flags [S], seq 3262295046, win 1024, options [mss 1460], length 0
01:07:48.895076 IP L1-anjo5726.cloud.10024 > S1-anjo5726.cloud.33173: Flags [R.], seq 0, ack 3262295047, win 0, length 0
01:07:48.895083 IP L1-anjo5726.cloud.3551 > S1-anjo5726.cloud.33173: Flags [R.], seq 0, ack 3262295047, win 0, length 0
01:07:48.895088 IP L1-anjo5726.cloud.zope-ftp > S1-anjo5726.cloud.33173: Flags [R.], seq 0, ack 3262295047, win 0, length 0
01:07:48.895186 IP S1-anjo5726.cloud.33173 > L1-anjo5726.cloud.6881: Flags [S], seq 3262295046, win 1024, options [mss 1460], length 0
01:07:48.895186 IP S1-anjo5726.cloud.33173 > L1-anjo5726.cloud.9943: Flags [S], seq 3262295046, win 1024, options [mss 1460], length 0
01:07:48.895186 IP S1-anjo5726.cloud.33173 > L1-anjo5726.cloud.1112: Flags [S], seq 3262295046, win 1024, options [mss 1460], length 0
01:07:48.895195 IP L1-anjo5726.cloud.6881 > S1-anjo5726.cloud.33173: Flags [R.], seq 0, ack 3262295047, win 0, length 0
01:07:48.895208 IP L1-anjo5726.cloud.9943 > S1-anjo5726.cloud.33173: Flags [R.], seq 0, ack 3262295047, win 0, length 0
01:07:48.895213 IP L1-anjo5726.cloud.1112 > S1-anjo5726.cloud.33173: Flags [R.], seq 0, ack 3262295047, win 0, length 0
01:07:48.895712 IP S1-anjo5726.cloud.33173 > L1-anjo5726.cloud.9003: Flags [S], seq 3262295046, win 1024, options [mss 1460], length 0
01:07:48.895727 IP L1-anjo5726.cloud.9003 > S1-anjo5726.cloud.33173: Flags [R.], seq 0, ack 3262295047, win 0, length 0
01:07:48.895738 IP S1-anjo5726.cloud.33173 > L1-anjo5726.cloud.9091: Flags [S], seq 3262295046, win 1024, options [mss 1460], length 0
01:07:48.895738 IP S1-anjo5726.cloud.33173 > L1-anjo5726.cloud.9110: Flags [S], seq 3262295046, win 1024, options [mss 1460], length 0
01:07:48.895744 IP L1-anjo5726.cloud.9091 > S1-anjo5726.cloud.33173: Flags [R.], seq 0, ack 3262295047, win 0, length 0
01:07:48.895748 IP L1-anjo5726.cloud.9110 > S1-anjo5726.cloud.33173: Flags [R.], seq 0, ack 3262295047, win 0, length 0
01:07:48.895871 IP S1-anjo5726.cloud.33173 > L1-anjo5726.cloud.497: Flags [S], seq 3262295046, win 1024, options [mss 1460], length 0
01:07:48.895871 IP S1-anjo5726.cloud.33173 > L1-anjo5726.cloud.32779: Flags [S], seq 3262295046, win 1024, options [mss 1460], length 0
01:07:48.895871 IP S1-anjo5726.cloud.33173 > L1-anjo5726.cloud.4550: Flags [S], seq 3262295046, win 1024, options [mss 1460], length 0
01:07:48.895872 IP S1-anjo5726.cloud.33173 > L1-anjo5726.cloud.3826: Flags [S], seq 3262295046, win 1024, options [mss 1460], length 0
01:07:48.895872 IP S1-anjo5726.cloud.33173 > L1-anjo5726.cloud.19350: Flags [S], seq 3262295046, win 1024, options [mss 1460], length 0
01:07:48.895892 IP L1-anjo5726.cloud.497 > S1-anjo5726.cloud.33173: Flags [R.], seq 0, ack 3262295047, win 0, length 0
01:07:48.895906 IP L1-anjo5726.cloud.32779 > S1-anjo5726.cloud.33173: Flags [R.], seq 0, ack 3262295047, win 0, length 0
01:07:48.895911 IP L1-anjo5726.cloud.4550 > S1-anjo5726.cloud.33173: Flags [R.], seq 0, ack 3262295047, win 0, length 0
01:07:48.895915 IP L1-anjo5726.cloud.3826 > S1-anjo5726.cloud.33173: Flags [R.], seq 0, ack 3262295047, win 0, length 0
01:07:48.895919 IP L1-anjo5726.cloud.19350 > S1-anjo5726.cloud.33173: Flags [R.], seq 0, ack 3262295047, win 0, length 0
01:07:48.895938 IP S1-anjo5726.cloud.33173 > L1-anjo5726.cloud.2381: Flags [S], seq 3262295046, win 1024, options [mss 1460], length 0
01:07:48.895938 IP S1-anjo5726.cloud.33173 > L1-anjo5726.cloud.14442: Flags [S], seq 3262295046, win 1024, options [mss 1460], length 0
01:07:48.895938 IP S1-anjo5726.cloud.33173 > L1-anjo5726.cloud.5801: Flags [S], seq 3262295046, win 1024, options [mss 1460], length 0
01:07:48.895946 IP L1-anjo5726.cloud.2381 > S1-anjo5726.cloud.33173: Flags [R.], seq 0, ack 3262295047, win 0, length 0
01:07:48.895951 IP L1-anjo5726.cloud.14442 > S1-anjo5726.cloud.33173: Flags [R.], seq 0, ack 3262295047, win 0, length 0
01:07:48.895955 IP L1-anjo5726.cloud.5801 > S1-anjo5726.cloud.33173: Flags [R.], seq 0, ack 3262295047, win 0, length 0
01:07:48.896034 IP S1-anjo5726.cloud.33173 > L1-anjo5726.cloud.31337: Flags [S], seq 3262295046, win 1024, options [mss 1460], length 0
01:07:48.896034 IP S1-anjo5726.cloud.33173 > L1-anjo5726.cloud.49161: Flags [S], seq 3262295046, win 1024, options [mss 1460], length 0
01:07:48.896034 IP S1-anjo5726.cloud.33173 > L1-anjo5726.cloud.89: Flags [S], seq 3262295046, win 1024, options [mss 1460], length 0
01:07:48.896034 IP S1-anjo5726.cloud.33173 > L1-anjo5726.cloud.1009: Flags [S], seq 3262295046, win 1024, options [mss 1460], length 0
01:07:48.896034 IP S1-anjo5726.cloud.33173 > L1-anjo5726.cloud.6792: Flags [S], seq 3262295046, win 1024, options [mss 1460], length 0
01:07:48.896034 IP S1-anjo5726.cloud.33173 > L1-anjo5726.cloud.2103: Flags [S], seq 3262295046, win 1024, options [mss 1460], length 0
01:07:48.896051 IP L1-anjo5726.cloud.31337 > S1-anjo5726.cloud.33173: Flags [R.], seq 0, ack 3262295047, win 0, length 0
01:07:48.896062 IP L1-anjo5726.cloud.49161 > S1-anjo5726.cloud.33173: Flags [R.], seq 0, ack 3262295047, win 0, length 0
01:07:48.896066 IP L1-anjo5726.cloud.89 > S1-anjo5726.cloud.33173: Flags [R.], seq 0, ack 3262295047, win 0, length 0
01:07:48.896070 IP L1-anjo5726.cloud.1009 > S1-anjo5726.cloud.33173: Flags [R.], seq 0, ack 3262295047, win 0, length 0
01:07:48.896073 IP L1-anjo5726.cloud.6792 > S1-anjo5726.cloud.33173: Flags [R.], seq 0, ack 3262295047, win 0, length 0
01:07:48.896077 IP L1-anjo5726.cloud.2103 > S1-anjo5726.cloud.33173: Flags [R.], seq 0, ack 3262295047, win 0, length 0
01:07:48.896088 IP S1-anjo5726.cloud.33173 > L1-anjo5726.cloud.1600: Flags [S], seq 3262295046, win 1024, options [mss 1460], length 0
01:07:48.896088 IP S1-anjo5726.cloud.33173 > L1-anjo5726.cloud.9929: Flags [S], seq 3262295046, win 1024, options [mss 1460], length 0
01:07:48.896094 IP L1-anjo5726.cloud.1600 > S1-anjo5726.cloud.33173: Flags [R.], seq 0, ack 3262295047, win 0, length 0
01:07:48.896099 IP L1-anjo5726.cloud.9929 > S1-anjo5726.cloud.33173: Flags [R.], seq 0, ack 3262295047, win 0, length 0
01:07:48.896192 IP S1-anjo5726.cloud.33173 > L1-anjo5726.cloud.1984: Flags [S], seq 3262295046, win 1024, options [mss 1460], length 0
01:07:48.896192 IP S1-anjo5726.cloud.33173 > L1-anjo5726.cloud.3007: Flags [S], seq 3262295046, win 1024, options [mss 1460], length 0
01:07:48.896192 IP S1-anjo5726.cloud.33173 > L1-anjo5726.cloud.login: Flags [S], seq 3262295046, win 1024, options [mss 1460], length 0
01:07:48.896192 IP S1-anjo5726.cloud.33173 > L1-anjo5726.cloud.2394: Flags [S], seq 3262295046, win 1024, options [mss 1460], length 0
01:07:48.896192 IP S1-anjo5726.cloud.33173 > L1-anjo5726.cloud.416: Flags [S], seq 3262295046, win 1024, options [mss 1460], length 0
01:07:48.896192 IP S1-anjo5726.cloud.33173 > L1-anjo5726.cloud.5214: Flags [S], seq 3262295046, win 1024, options [mss 1460], length 0
01:07:48.896192 IP S1-anjo5726.cloud.33173 > L1-anjo5726.cloud.1078: Flags [S], seq 3262295046, win 1024, options [mss 1460], length 0
01:07:48.896204 IP L1-anjo5726.cloud.1984 > S1-anjo5726.cloud.33173: Flags [R.], seq 0, ack 3262295047, win 0, length 0
01:07:48.896222 IP L1-anjo5726.cloud.3007 > S1-anjo5726.cloud.33173: Flags [R.], seq 0, ack 3262295047, win 0, length 0
01:07:48.896226 IP L1-anjo5726.cloud.login > S1-anjo5726.cloud.33173: Flags [R.], seq 0, ack 3262295047, win 0, length 0
01:07:48.896230 IP L1-anjo5726.cloud.2394 > S1-anjo5726.cloud.33173: Flags [R.], seq 0, ack 3262295047, win 0, length 0
01:07:48.896234 IP L1-anjo5726.cloud.416 > S1-anjo5726.cloud.33173: Flags [R.], seq 0, ack 3262295047, win 0, length 0
01:07:48.896238 IP L1-anjo5726.cloud.5214 > S1-anjo5726.cloud.33173: Flags [R.], seq 0, ack 3262295047, win 0, length 0
01:07:48.896242 IP L1-anjo5726.cloud.1078 > S1-anjo5726.cloud.33173: Flags [R.], seq 0, ack 3262295047, win 0, length 0
01:07:48.896246 IP S1-anjo5726.cloud.33173 > L1-anjo5726.cloud.10616: Flags [S], seq 3262295046, win 1024, options [mss 1460], length 0
01:07:48.896251 IP L1-anjo5726.cloud.10616 > S1-anjo5726.cloud.33173: Flags [R.], seq 0, ack 3262295047, win 0, length 0
01:07:48.896322 IP S1-anjo5726.cloud.33173 > L1-anjo5726.cloud.5910: Flags [S], seq 3262295046, win 1024, options [mss 1460], length 0
01:07:48.896322 IP S1-anjo5726.cloud.33173 > L1-anjo5726.cloud.3828: Flags [S], seq 3262295046, win 1024, options [mss 1460], length 0
01:07:48.896322 IP S1-anjo5726.cloud.33173 > L1-anjo5726.cloud.1097: Flags [S], seq 3262295046, win 1024, options [mss 1460], length 0
01:07:48.896322 IP S1-anjo5726.cloud.33173 > L1-anjo5726.cloud.1148: Flags [S], seq 3262295046, win 1024, options [mss 1460], length 0
01:07:48.896322 IP S1-anjo5726.cloud.33173 > L1-anjo5726.cloud.5903: Flags [S], seq 3262295046, win 1024, options [mss 1460], length 0
01:07:48.896322 IP S1-anjo5726.cloud.33173 > L1-anjo5726.cloud.1183: Flags [S], seq 3262295046, win 1024, options [mss 1460], length 0
01:07:48.896332 IP L1-anjo5726.cloud.5910 > S1-anjo5726.cloud.33173: Flags [R.], seq 0, ack 3262295047, win 0, length 0
01:07:48.896348 IP L1-anjo5726.cloud.3828 > S1-anjo5726.cloud.33173: Flags [R.], seq 0, ack 3262295047, win 0, length 0
01:07:48.896353 IP L1-anjo5726.cloud.1097 > S1-anjo5726.cloud.33173: Flags [R.], seq 0, ack 3262295047, win 0, length 0
01:07:48.896357 IP L1-anjo5726.cloud.1148 > S1-anjo5726.cloud.33173: Flags [R.], seq 0, ack 3262295047, win 0, length 0
01:07:48.896361 IP L1-anjo5726.cloud.5903 > S1-anjo5726.cloud.33173: Flags [R.], seq 0, ack 3262295047, win 0, length 0
01:07:48.896364 IP L1-anjo5726.cloud.1183 > S1-anjo5726.cloud.33173: Flags [R.], seq 0, ack 3262295047, win 0, length 0
01:07:48.896369 IP S1-anjo5726.cloud.33173 > L1-anjo5726.cloud.3851: Flags [S], seq 3262295046, win 1024, options [mss 1460], length 0
01:07:48.896373 IP L1-anjo5726.cloud.3851 > S1-anjo5726.cloud.33173: Flags [R.], seq 0, ack 3262295047, win 0, length 0
01:07:48.896493 IP S1-anjo5726.cloud.33173 > L1-anjo5726.cloud.3814: Flags [S], seq 3262295046, win 1024, options [mss 1460], length 0
01:07:48.896493 IP S1-anjo5726.cloud.33173 > L1-anjo5726.cloud.667: Flags [S], seq 3262295046, win 1024, options [mss 1460], length 0
01:07:48.896493 IP S1-anjo5726.cloud.33173 > L1-anjo5726.cloud.65389: Flags [S], seq 3262295046, win 1024, options [mss 1460], length 0
01:07:48.896493 IP S1-anjo5726.cloud.33173 > L1-anjo5726.cloud.1169: Flags [S], seq 3262295046, win 1024, options [mss 1460], length 0
01:07:48.896493 IP S1-anjo5726.cloud.33173 > L1-anjo5726.cloud.8022: Flags [S], seq 3262295046, win 1024, options [mss 1460], length 0
01:07:48.896493 IP S1-anjo5726.cloud.33173 > L1-anjo5726.cloud.1862: Flags [S], seq 3262295046, win 1024, options [mss 1460], length 0
01:07:48.896493 IP S1-anjo5726.cloud.33173 > L1-anjo5726.cloud.8093: Flags [S], seq 3262295046, win 1024, options [mss 1460], length 0
01:07:48.896508 IP L1-anjo5726.cloud.3814 > S1-anjo5726.cloud.33173: Flags [R.], seq 0, ack 3262295047, win 0, length 0
01:07:48.896525 IP L1-anjo5726.cloud.667 > S1-anjo5726.cloud.33173: Flags [R.], seq 0, ack 3262295047, win 0, length 0
01:07:48.896531 IP L1-anjo5726.cloud.65389 > S1-anjo5726.cloud.33173: Flags [R.], seq 0, ack 3262295047, win 0, length 0
01:07:48.896536 IP L1-anjo5726.cloud.1169 > S1-anjo5726.cloud.33173: Flags [R.], seq 0, ack 3262295047, win 0, length 0
01:07:48.896541 IP L1-anjo5726.cloud.8022 > S1-anjo5726.cloud.33173: Flags [R.], seq 0, ack 3262295047, win 0, length 0
01:07:48.896547 IP L1-anjo5726.cloud.1862 > S1-anjo5726.cloud.33173: Flags [R.], seq 0, ack 3262295047, win 0, length 0
01:07:48.896552 IP L1-anjo5726.cloud.8093 > S1-anjo5726.cloud.33173: Flags [R.], seq 0, ack 3262295047, win 0, length 0
01:07:48.896559 IP S1-anjo5726.cloud.33173 > L1-anjo5726.cloud.458: Flags [S], seq 3262295046, win 1024, options [mss 1460], length 0
01:07:48.896559 IP S1-anjo5726.cloud.33173 > L1-anjo5726.cloud.8600: Flags [S], seq 3262295046, win 1024, options [mss 1460], length 0
01:07:48.896566 IP L1-anjo5726.cloud.458 > S1-anjo5726.cloud.33173: Flags [R.], seq 0, ack 3262295047, win 0, length 0
01:07:48.896572 IP L1-anjo5726.cloud.8600 > S1-anjo5726.cloud.33173: Flags [R.], seq 0, ack 3262295047, win 0, length 0
01:07:48.896646 IP S1-anjo5726.cloud.33173 > L1-anjo5726.cloud.901: Flags [S], seq 3262295046, win 1024, options [mss 1460], length 0
01:07:48.896646 IP S1-anjo5726.cloud.33173 > L1-anjo5726.cloud.255: Flags [S], seq 3262295046, win 1024, options [mss 1460], length 0
01:07:48.896646 IP S1-anjo5726.cloud.33173 > L1-anjo5726.cloud.2048: Flags [S], seq 3262295046, win 1024, options [mss 1460], length 0
01:07:48.896646 IP S1-anjo5726.cloud.33173 > L1-anjo5726.cloud.2190: Flags [S], seq 3262295046, win 1024, options [mss 1460], length 0
01:07:48.896646 IP S1-anjo5726.cloud.33173 > L1-anjo5726.cloud.34572: Flags [S], seq 3262295046, win 1024, options [mss 1460], length 0
01:07:48.896646 IP S1-anjo5726.cloud.33173 > L1-anjo5726.cloud.541: Flags [S], seq 3262295046, win 1024, options [mss 1460], length 0
01:07:48.896646 IP S1-anjo5726.cloud.33173 > L1-anjo5726.cloud.8291: Flags [S], seq 3262295046, win 1024, options [mss 1460], length 0
01:07:48.896658 IP L1-anjo5726.cloud.901 > S1-anjo5726.cloud.33173: Flags [R.], seq 0, ack 3262295047, win 0, length 0
01:07:48.896672 IP L1-anjo5726.cloud.255 > S1-anjo5726.cloud.33173: Flags [R.], seq 0, ack 3262295047, win 0, length 0
01:07:48.896678 IP L1-anjo5726.cloud.2048 > S1-anjo5726.cloud.33173: Flags [R.], seq 0, ack 3262295047, win 0, length 0
01:07:48.896683 IP L1-anjo5726.cloud.2190 > S1-anjo5726.cloud.33173: Flags [R.], seq 0, ack 3262295047, win 0, length 0
01:07:48.896701 IP L1-anjo5726.cloud.34572 > S1-anjo5726.cloud.33173: Flags [R.], seq 0, ack 3262295047, win 0, length 0
01:07:48.896705 IP L1-anjo5726.cloud.541 > S1-anjo5726.cloud.33173: Flags [R.], seq 0, ack 3262295047, win 0, length 0
01:07:48.896709 IP L1-anjo5726.cloud.8291 > S1-anjo5726.cloud.33173: Flags [R.], seq 0, ack 3262295047, win 0, length 0
01:07:48.897550 IP S1-anjo5726.cloud.33173 > L1-anjo5726.cloud.11967: Flags [S], seq 3262295046, win 1024, options [mss 1460], length 0
01:07:48.897550 IP S1-anjo5726.cloud.33173 > L1-anjo5726.cloud.1077: Flags [S], seq 3262295046, win 1024, options [mss 1460], length 0
01:07:48.897560 IP L1-anjo5726.cloud.11967 > S1-anjo5726.cloud.33173: Flags [R.], seq 0, ack 3262295047, win 0, length 0
01:07:48.897580 IP L1-anjo5726.cloud.1077 > S1-anjo5726.cloud.33173: Flags [R.], seq 0, ack 3262295047, win 0, length 0
01:07:48.897584 IP S1-anjo5726.cloud.33173 > L1-anjo5726.cloud.5030: Flags [S], seq 3262295046, win 1024, options [mss 1460], length 0
01:07:48.897589 IP L1-anjo5726.cloud.5030 > S1-anjo5726.cloud.33173: Flags [R.], seq 0, ack 3262295047, win 0, length 0
01:07:48.897722 IP S1-anjo5726.cloud.33173 > L1-anjo5726.cloud.8402: Flags [S], seq 3262295046, win 1024, options [mss 1460], length 0
01:07:48.897723 IP S1-anjo5726.cloud.33173 > L1-anjo5726.cloud.5815: Flags [S], seq 3262295046, win 1024, options [mss 1460], length 0
01:07:48.897723 IP S1-anjo5726.cloud.33173 > L1-anjo5726.cloud.61532: Flags [S], seq 3262295046, win 1024, options [mss 1460], length 0
01:07:48.897723 IP S1-anjo5726.cloud.33173 > L1-anjo5726.cloud.1011: Flags [S], seq 3262295046, win 1024, options [mss 1460], length 0
01:07:48.897723 IP S1-anjo5726.cloud.33173 > L1-anjo5726.cloud.2126: Flags [S], seq 3262295046, win 1024, options [mss 1460], length 0
01:07:48.897723 IP S1-anjo5726.cloud.33173 > L1-anjo5726.cloud.nut: Flags [S], seq 3262295046, win 1024, options [mss 1460], length 0
01:07:48.897723 IP S1-anjo5726.cloud.33173 > L1-anjo5726.cloud.50500: Flags [S], seq 3262295046, win 1024, options [mss 1460], length 0
01:07:48.897723 IP S1-anjo5726.cloud.33173 > L1-anjo5726.cloud.23502: Flags [S], seq 3262295046, win 1024, options [mss 1460], length 0
01:07:48.897744 IP L1-anjo5726.cloud.8402 > S1-anjo5726.cloud.33173: Flags [R.], seq 0, ack 3262295047, win 0, length 0
01:07:48.897760 IP L1-anjo5726.cloud.5815 > S1-anjo5726.cloud.33173: Flags [R.], seq 0, ack 3262295047, win 0, length 0
01:07:48.897765 IP L1-anjo5726.cloud.61532 > S1-anjo5726.cloud.33173: Flags [R.], seq 0, ack 3262295047, win 0, length 0
01:07:48.897769 IP L1-anjo5726.cloud.1011 > S1-anjo5726.cloud.33173: Flags [R.], seq 0, ack 3262295047, win 0, length 0
01:07:48.897772 IP L1-anjo5726.cloud.2126 > S1-anjo5726.cloud.33173: Flags [R.], seq 0, ack 3262295047, win 0, length 0
01:07:48.897776 IP L1-anjo5726.cloud.nut > S1-anjo5726.cloud.33173: Flags [R.], seq 0, ack 3262295047, win 0, length 0
01:07:48.897780 IP L1-anjo5726.cloud.50500 > S1-anjo5726.cloud.33173: Flags [R.], seq 0, ack 3262295047, win 0, length 0
01:07:48.897784 IP L1-anjo5726.cloud.23502 > S1-anjo5726.cloud.33173: Flags [R.], seq 0, ack 3262295047, win 0, length 0
01:07:48.897794 IP S1-anjo5726.cloud.33173 > L1-anjo5726.cloud.8899: Flags [S], seq 3262295046, win 1024, options [mss 1460], length 0
01:07:48.897794 IP S1-anjo5726.cloud.33173 > L1-anjo5726.cloud.3546: Flags [S], seq 3262295046, win 1024, options [mss 1460], length 0
01:07:48.897801 IP L1-anjo5726.cloud.8899 > S1-anjo5726.cloud.33173: Flags [R.], seq 0, ack 3262295047, win 0, length 0
01:07:48.897805 IP L1-anjo5726.cloud.3546 > S1-anjo5726.cloud.33173: Flags [R.], seq 0, ack 3262295047, win 0, length 0
01:07:48.897959 IP S1-anjo5726.cloud.33173 > L1-anjo5726.cloud.5003: Flags [S], seq 3262295046, win 1024, options [mss 1460], length 0
01:07:48.897959 IP S1-anjo5726.cloud.33173 > L1-anjo5726.cloud.10010: Flags [S], seq 3262295046, win 1024, options [mss 1460], length 0
01:07:48.897959 IP S1-anjo5726.cloud.33173 > L1-anjo5726.cloud.5009: Flags [S], seq 3262295046, win 1024, options [mss 1460], length 0
01:07:48.897959 IP S1-anjo5726.cloud.33173 > L1-anjo5726.cloud.3517: Flags [S], seq 3262295046, win 1024, options [mss 1460], length 0
01:07:48.897959 IP S1-anjo5726.cloud.33173 > L1-anjo5726.cloud.1032: Flags [S], seq 3262295046, win 1024, options [mss 1460], length 0
01:07:48.897960 IP S1-anjo5726.cloud.33173 > L1-anjo5726.cloud.7938: Flags [S], seq 3262295046, win 1024, options [mss 1460], length 0
01:07:48.897960 IP S1-anjo5726.cloud.33173 > L1-anjo5726.cloud.1056: Flags [S], seq 3262295046, win 1024, options [mss 1460], length 0
01:07:48.897960 IP S1-anjo5726.cloud.33173 > L1-anjo5726.cloud.6389: Flags [S], seq 3262295046, win 1024, options [mss 1460], length 0
01:07:48.897980 IP L1-anjo5726.cloud.5003 > S1-anjo5726.cloud.33173: Flags [R.], seq 0, ack 3262295047, win 0, length 0
01:07:48.897993 IP L1-anjo5726.cloud.10010 > S1-anjo5726.cloud.33173: Flags [R.], seq 0, ack 3262295047, win 0, length 0
01:07:48.897998 IP L1-anjo5726.cloud.5009 > S1-anjo5726.cloud.33173: Flags [R.], seq 0, ack 3262295047, win 0, length 0
01:07:48.898002 IP L1-anjo5726.cloud.3517 > S1-anjo5726.cloud.33173: Flags [R.], seq 0, ack 3262295047, win 0, length 0
01:07:48.898006 IP L1-anjo5726.cloud.1032 > S1-anjo5726.cloud.33173: Flags [R.], seq 0, ack 3262295047, win 0, length 0
01:07:48.898010 IP L1-anjo5726.cloud.7938 > S1-anjo5726.cloud.33173: Flags [R.], seq 0, ack 3262295047, win 0, length 0
01:07:48.898013 IP L1-anjo5726.cloud.1056 > S1-anjo5726.cloud.33173: Flags [R.], seq 0, ack 3262295047, win 0, length 0
01:07:48.898017 IP L1-anjo5726.cloud.6389 > S1-anjo5726.cloud.33173: Flags [R.], seq 0, ack 3262295047, win 0, length 0
01:07:48.898059 IP S1-anjo5726.cloud.33173 > L1-anjo5726.cloud.rootd: Flags [S], seq 3262295046, win 1024, options [mss 1460], length 0
01:07:48.898059 IP S1-anjo5726.cloud.33173 > L1-anjo5726.cloud.1216: Flags [S], seq 3262295046, win 1024, options [mss 1460], length 0
01:07:48.898059 IP S1-anjo5726.cloud.33173 > L1-anjo5726.cloud.1074: Flags [S], seq 3262295046, win 1024, options [mss 1460], length 0
01:07:48.898059 IP S1-anjo5726.cloud.33173 > L1-anjo5726.cloud.5907: Flags [S], seq 3262295046, win 1024, options [mss 1460], length 0
01:07:48.898079 IP L1-anjo5726.cloud.rootd > S1-anjo5726.cloud.33173: Flags [R.], seq 0, ack 3262295047, win 0, length 0
01:07:48.898086 IP L1-anjo5726.cloud.1216 > S1-anjo5726.cloud.33173: Flags [R.], seq 0, ack 3262295047, win 0, length 0
01:07:48.898092 IP L1-anjo5726.cloud.1074 > S1-anjo5726.cloud.33173: Flags [R.], seq 0, ack 3262295047, win 0, length 0
01:07:48.898097 IP L1-anjo5726.cloud.5907 > S1-anjo5726.cloud.33173: Flags [R.], seq 0, ack 3262295047, win 0, length 0
01:07:48.898303 IP S1-anjo5726.cloud.33173 > L1-anjo5726.cloud.24800: Flags [S], seq 3262295046, win 1024, options [mss 1460], length 0
