01:07:48.358035 ARP, Request who-has L1-anjo5726.cloud tell S1-anjo5726.cloud, length 28
01:07:48.358765 ARP, Reply L1-anjo5726.cloud is-at 02:00:ac:10:00:10 (oui Unknown), length 28
01:07:48.359500 IP S1-anjo5726.cloud.43047 > router1.cloud.domain: 3849+ PTR? 16.0.16.172.in-addr.arpa. (42)
01:07:48.360781 IP router1.cloud.domain > S1-anjo5726.cloud.43047: 3849* 1/0/0 PTR L1-anjo5726.cloud. (73)
01:07:48.361635 IP S1-anjo5726.cloud.33173 > L1-anjo5726.cloud.1720: Flags [S], seq 3262295046, win 1024, options [mss 1460], length 0
01:07:48.361659 IP S1-anjo5726.cloud.33173 > L1-anjo5726.cloud.1025: Flags [S], seq 3262295046, win 1024, options [mss 1460], length 0
01:07:48.361669 IP S1-anjo5726.cloud.33173 > L1-anjo5726.cloud.imap2: Flags [S], seq 3262295046, win 1024, options [mss 1460], length 0
01:07:48.361680 IP S1-anjo5726.cloud.33173 > L1-anjo5726.cloud.microsoft-ds: Flags [S], seq 3262295046, win 1024, options [mss 1460], length 0
01:07:48.361690 IP S1-anjo5726.cloud.33173 > L1-anjo5726.cloud.1723: Flags [S], seq 3262295046, win 1024, options [mss 1460], length 0
01:07:48.361700 IP S1-anjo5726.cloud.33173 > L1-anjo5726.cloud.pop3: Flags [S], seq 3262295046, win 1024, options [mss 1460], length 0
01:07:48.361711 IP S1-anjo5726.cloud.33173 > L1-anjo5726.cloud.epmap: Flags [S], seq 3262295046, win 1024, options [mss 1460], length 0
01:07:48.361722 IP S1-anjo5726.cloud.33173 > L1-anjo5726.cloud.5900: Flags [S], seq 3262295046, win 1024, options [mss 1460], length 0
01:07:48.361732 IP S1-anjo5726.cloud.33173 > L1-anjo5726.cloud.8888: Flags [S], seq 3262295046, win 1024, options [mss 1460], length 0
01:07:48.361743 IP S1-anjo5726.cloud.33173 > L1-anjo5726.cloud.submission: Flags [S], seq 3262295046, win 1024, options [mss 1460], length 0
01:07:48.362336 IP L1-anjo5726.cloud.1720 > S1-anjo5726.cloud.33173: Flags [R.], seq 0, ack 3262295047, win 0, length 0
01:07:48.362338 IP L1-anjo5726.cloud.1025 > S1-anjo5726.cloud.33173: Flags [R.], seq 0, ack 3262295047, win 0, length 0
01:07:48.362339 IP L1-anjo5726.cloud.imap2 > S1-anjo5726.cloud.33173: Flags [R.], seq 0, ack 3262295047, win 0, length 0
01:07:48.362340 IP L1-anjo5726.cloud.microsoft-ds > S1-anjo5726.cloud.33173: Flags [R.], seq 0, ack 3262295047, win 0, length 0
01:07:48.362342 IP L1-anjo5726.cloud.1723 > S1-anjo5726.cloud.33173: Flags [R.], seq 0, ack 3262295047, win 0, length 0
01:07:48.362343 IP L1-anjo5726.cloud.pop3 > S1-anjo5726.cloud.33173: Flags [R.], seq 0, ack 3262295047, win 0, length 0
01:07:48.362344 IP L1-anjo5726.cloud.epmap > S1-anjo5726.cloud.33173: Flags [R.], seq 0, ack 3262295047, win 0, length 0
01:07:48.362344 IP L1-anjo5726.cloud.5900 > S1-anjo5726.cloud.33173: Flags [R.], seq 0, ack 3262295047, win 0, length 0
01:07:48.362381 IP L1-anjo5726.cloud.8888 > S1-anjo5726.cloud.33173: Flags [R.], seq 0, ack 3262295047, win 0, length 0
01:07:48.362382 IP L1-anjo5726.cloud.submission > S1-anjo5726.cloud.33173: Flags [R.], seq 0, ack 3262295047, win 0, length 0
01:07:48.362522 IP S1-anjo5726.cloud.33173 > L1-anjo5726.cloud.smux: Flags [S], seq 3262295046, win 1024, options [mss 1460], length 0
01:07:48.362546 IP S1-anjo5726.cloud.33173 > L1-anjo5726.cloud.imaps: Flags [S], seq 3262295046, win 1024, options [mss 1460], length 0
01:07:48.362557 IP S1-anjo5726.cloud.33173 > L1-anjo5726.cloud.rtsp: Flags [S], seq 3262295046, win 1024, options [mss 1460], length 0
01:07:48.362568 IP S1-anjo5726.cloud.33173 > L1-anjo5726.cloud.pop3s: Flags [S], seq 3262295046, win 1024, options [mss 1460], length 0
01:07:48.362579 IP S1-anjo5726.cloud.33173 > L1-anjo5726.cloud.mysql: Flags [S], seq 3262295046, win 1024, options [mss 1460], length 0
01:07:48.362590 IP S1-anjo5726.cloud.33173 > L1-anjo5726.cloud.sunrpc: Flags [S], seq 3262295046, win 1024, options [mss 1460], length 0
01:07:48.362600 IP S1-anjo5726.cloud.33173 > L1-anjo5726.cloud.http-alt: Flags [S], seq 3262295046, win 1024, options [mss 1460], length 0
01:07:48.362611 IP S1-anjo5726.cloud.33173 > L1-anjo5726.cloud.telnet: Flags [S], seq 3262295046, win 1024, options [mss 1460], length 0
01:07:48.362621 IP S1-anjo5726.cloud.33173 > L1-anjo5726.cloud.netbios-ssn: Flags [S], seq 3262295046, win 1024, options [mss 1460], length 0
01:07:48.362631 IP S1-anjo5726.cloud.33173 > L1-anjo5726.cloud.http: Flags [S], seq 3262295046, win 1024, options [mss 1460], length 0
01:07:48.362641 IP S1-anjo5726.cloud.33173 > L1-anjo5726.cloud.auth: Flags [S], seq 3262295046, win 1024, options [mss 1460], length 0
01:07:48.362651 IP S1-anjo5726.cloud.33173 > L1-anjo5726.cloud.smtp: Flags [S], seq 3262295046, win 1024, options [mss 1460], length 0
01:07:48.362662 IP S1-anjo5726.cloud.33173 > L1-anjo5726.cloud.256: Flags [S], seq 3262295046, win 1024, options [mss 1460], length 0
01:07:48.362673 IP S1-anjo5726.cloud.33173 > L1-anjo5726.cloud.ftp: Flags [S], seq 3262295046, win 1024, options [mss 1460], length 0
01:07:48.362683 IP S1-anjo5726.cloud.33173 > L1-anjo5726.cloud.https: Flags [S], seq 3262295046, win 1024, options [mss 1460], length 0
01:07:48.362694 IP S1-anjo5726.cloud.33173 > L1-anjo5726.cloud.ms-wbt-server: Flags [S], seq 3262295046, win 1024, options [mss 1460], length 0
01:07:48.362704 IP S1-anjo5726.cloud.33173 > L1-anjo5726.cloud.domain: Flags [S], seq 3262295046, win 1024, options [mss 1460], length 0
01:07:48.362715 IP S1-anjo5726.cloud.33173 > L1-anjo5726.cloud.ssh: Flags [S], seq 3262295046, win 1024, options [mss 1460], length 0
01:07:48.362725 IP S1-anjo5726.cloud.33173 > L1-anjo5726.cloud.10617: Flags [S], seq 3262295046, win 1024, options [mss 1460], length 0
01:07:48.362735 IP S1-anjo5726.cloud.33173 > L1-anjo5726.cloud.668: Flags [S], seq 3262295046, win 1024, options [mss 1460], length 0
01:07:48.363165 IP L1-anjo5726.cloud.smux > S1-anjo5726.cloud.33173: Flags [R.], seq 0, ack 3262295047, win 0, length 0
01:07:48.363166 IP L1-anjo5726.cloud.imaps > S1-anjo5726.cloud.33173: Flags [R.], seq 0, ack 3262295047, win 0, length 0
01:07:48.363168 IP L1-anjo5726.cloud.rtsp > S1-anjo5726.cloud.33173: Flags [R.], seq 0, ack 3262295047, win 0, length 0
01:07:48.363169 IP L1-anjo5726.cloud.pop3s > S1-anjo5726.cloud.33173: Flags [R.], seq 0, ack 3262295047, win 0, length 0
01:07:48.363170 IP L1-anjo5726.cloud.mysql > S1-anjo5726.cloud.33173: Flags [R.], seq 0, ack 3262295047, win 0, length 0
01:07:48.363171 IP L1-anjo5726.cloud.sunrpc > S1-anjo5726.cloud.33173: Flags [S.], seq 3394964221, ack 3262295047, win 64240, options [mss 1460], length 0
01:07:48.363172 IP L1-anjo5726.cloud.http-alt > S1-anjo5726.cloud.33173: Flags [R.], seq 0, ack 3262295047, win 0, length 0
01:07:48.363173 IP L1-anjo5726.cloud.telnet > S1-anjo5726.cloud.33173: Flags [R.], seq 0, ack 3262295047, win 0, length 0
01:07:48.363200 IP S1-anjo5726.cloud.33173 > L1-anjo5726.cloud.sunrpc: Flags [R], seq 3262295047, win 0, length 0
01:07:48.363235 IP L1-anjo5726.cloud.netbios-ssn > S1-anjo5726.cloud.33173: Flags [R.], seq 0, ack 3262295047, win 0, length 0
01:07:48.363236 IP L1-anjo5726.cloud.http > S1-anjo5726.cloud.33173: Flags [S.], seq 994299667, ack 3262295047, win 64240, options [mss 1460], length 0
01:07:48.363238 IP L1-anjo5726.cloud.auth > S1-anjo5726.cloud.33173: Flags [R.], seq 0, ack 3262295047, win 0, length 0
01:07:48.363239 IP L1-anjo5726.cloud.smtp > S1-anjo5726.cloud.33173: Flags [S.], seq 939483003, ack 3262295047, win 64240, options [mss 1460], length 0
01:07:48.363240 IP L1-anjo5726.cloud.256 > S1-anjo5726.cloud.33173: Flags [R.], seq 0, ack 3262295047, win 0, length 0
01:07:48.363241 IP L1-anjo5726.cloud.ftp > S1-anjo5726.cloud.33173: Flags [S.], seq 26339492, ack 3262295047, win 64240, options [mss 1460], length 0
01:07:48.363242 IP L1-anjo5726.cloud.https > S1-anjo5726.cloud.33173: Flags [R.], seq 0, ack 3262295047, win 0, length 0
01:07:48.363251 IP L1-anjo5726.cloud.ms-wbt-server > S1-anjo5726.cloud.33173: Flags [R.], seq 0, ack 3262295047, win 0, length 0
01:07:48.363260 IP S1-anjo5726.cloud.33173 > L1-anjo5726.cloud.http: Flags [R], seq 3262295047, win 0, length 0
01:07:48.363274 IP S1-anjo5726.cloud.33173 > L1-anjo5726.cloud.smtp: Flags [R], seq 3262295047, win 0, length 0
01:07:48.363280 IP S1-anjo5726.cloud.33173 > L1-anjo5726.cloud.ftp: Flags [R], seq 3262295047, win 0, length 0
01:07:48.363319 IP L1-anjo5726.cloud.domain > S1-anjo5726.cloud.33173: Flags [S.], seq 3529805659, ack 3262295047, win 64240, options [mss 1460], length 0
01:07:48.363320 IP L1-anjo5726.cloud.ssh > S1-anjo5726.cloud.33173: Flags [S.], seq 170333105, ack 3262295047, win 64240, options [mss 1460], length 0
01:07:48.363321 IP L1-anjo5726.cloud.10617 > S1-anjo5726.cloud.33173: Flags [R.], seq 0, ack 3262295047, win 0, length 0
01:07:48.363322 IP L1-anjo5726.cloud.668 > S1-anjo5726.cloud.33173: Flags [R.], seq 0, ack 3262295047, win 0, length 0
01:07:48.363339 IP S1-anjo5726.cloud.33173 > L1-anjo5726.cloud.domain: Flags [R], seq 3262295047, win 0, length 0
01:07:48.363353 IP S1-anjo5726.cloud.33173 > L1-anjo5726.cloud.ssh: Flags [R], seq 3262295047, win 0, length 0
01:07:48.363533 IP S1-anjo5726.cloud.33173 > L1-anjo5726.cloud.49167: Flags [S], seq 3262295046, win 1024, options [mss 1460], length 0
01:07:48.363555 IP S1-anjo5726.cloud.33173 > L1-anjo5726.cloud.34571: Flags [S], seq 3262295046, win 1024, options [mss 1460], length 0
01:07:48.363566 IP S1-anjo5726.cloud.33173 > L1-anjo5726.cloud.32784: Flags [S], seq 3262295046, win 1024, options [mss 1460], length 0
01:07:48.363577 IP S1-anjo5726.cloud.33173 > L1-anjo5726.cloud.1234: Flags [S], seq 3262295046, win 1024, options [mss 1460], length 0
01:07:48.363588 IP S1-anjo5726.cloud.33173 > L1-anjo5726.cloud.8200: Flags [S], seq 3262295046, win 1024, options [mss 1460], length 0
01:07:48.363598 IP S1-anjo5726.cloud.33173 > L1-anjo5726.cloud.41511: Flags [S], seq 3262295046, win 1024, options [mss 1460], length 0
01:07:48.363608 IP S1-anjo5726.cloud.33173 > L1-anjo5726.cloud.7512: Flags [S], seq 3262295046, win 1024, options [mss 1460], length 0
01:07:48.363620 IP S1-anjo5726.cloud.33173 > L1-anjo5726.cloud.zebra: Flags [S], seq 3262295046, win 1024, options [mss 1460], length 0
01:07:48.363630 IP S1-anjo5726.cloud.33173 > L1-anjo5726.cloud.4129: Flags [S], seq 3262295046, win 1024, options [mss 1460], length 0
01:07:48.363641 IP S1-anjo5726.cloud.33173 > L1-anjo5726.cloud.5101: Flags [S], seq 3262295046, win 1024, options [mss 1460], length 0
01:07:48.363651 IP S1-anjo5726.cloud.33173 > L1-anjo5726.cloud.1090: Flags [S], seq 3262295046, win 1024, options [mss 1460], length 0
01:07:48.363661 IP S1-anjo5726.cloud.33173 > L1-anjo5726.cloud.8082: Flags [S], seq 3262295046, win 1024, options [mss 1460], length 0
01:07:48.363672 IP S1-anjo5726.cloud.33173 > L1-anjo5726.cloud.65000: Flags [S], seq 3262295046, win 1024, options [mss 1460], length 0
01:07:48.363682 IP S1-anjo5726.cloud.33173 > L1-anjo5726.cloud.2002: Flags [S], seq 3262295046, win 1024, options [mss 1460], length 0
01:07:48.363693 IP S1-anjo5726.cloud.33173 > L1-anjo5726.cloud.2393: Flags [S], seq 3262295046, win 1024, options [mss 1460], length 0
01:07:48.363703 IP S1-anjo5726.cloud.33173 > L1-anjo5726.cloud.1666: Flags [S], seq 3262295046, win 1024, options [mss 1460], length 0
01:07:48.363714 IP S1-anjo5726.cloud.33173 > L1-anjo5726.cloud.1122: Flags [S], seq 3262295046, win 1024, options [mss 1460], length 0
01:07:48.363725 IP S1-anjo5726.cloud.33173 > L1-anjo5726.cloud.5051: Flags [S], seq 3262295046, win 1024, options [mss 1460], length 0
01:07:48.363735 IP S1-anjo5726.cloud.33173 > L1-anjo5726.cloud.1461: Flags [S], seq 3262295046, win 1024, options [mss 1460], length 0
01:07:48.363746 IP S1-anjo5726.cloud.33173 > L1-anjo5726.cloud.rmtcfg: Flags [S], seq 3262295046, win 1024, options [mss 1460], length 0
01:07:48.363759 IP S1-anjo5726.cloud.33173 > L1-anjo5726.cloud.1721: Flags [S], seq 3262295046, win 1024, options [mss 1460], length 0
01:07:48.363770 IP S1-anjo5726.cloud.33173 > L1-anjo5726.cloud.8701: Flags [S], seq 3262295046, win 1024, options [mss 1460], length 0
01:07:48.363780 IP S1-anjo5726.cloud.33173 > L1-anjo5726.cloud.shell: Flags [S], seq 3262295046, win 1024, options [mss 1460], length 0
01:07:48.363790 IP S1-anjo5726.cloud.33173 > L1-anjo5726.cloud.7777: Flags [S], seq 3262295046, win 1024, options [mss 1460], length 0
01:07:48.363801 IP S1-anjo5726.cloud.33173 > L1-anjo5726.cloud.27356: Flags [S], seq 3262295046, win 1024, options [mss 1460], length 0
01:07:48.363811 IP S1-anjo5726.cloud.33173 > L1-anjo5726.cloud.1310: Flags [S], seq 3262295046, win 1024, options [mss 1460], length 0
01:07:48.363821 IP S1-anjo5726.cloud.33173 > L1-anjo5726.cloud.2710: Flags [S], seq 3262295046, win 1024, options [mss 1460], length 0
01:07:48.363840 IP S1-anjo5726.cloud.33173 > L1-anjo5726.cloud.15002: Flags [S], seq 3262295046, win 1024, options [mss 1460], length 0
01:07:48.363854 IP S1-anjo5726.cloud.33173 > L1-anjo5726.cloud.x11-6: Flags [S], seq 3262295046, win 1024, options [mss 1460], length 0
01:07:48.363865 IP S1-anjo5726.cloud.33173 > L1-anjo5726.cloud.1108: Flags [S], seq 3262295046, win 1024, options [mss 1460], length 0
01:07:48.363882 IP S1-anjo5726.cloud.33173 > L1-anjo5726.cloud.1687: Flags [S], seq 3262295046, win 1024, options [mss 1460], length 0
01:07:48.363894 IP S1-anjo5726.cloud.33173 > L1-anjo5726.cloud.3333: Flags [S], seq 3262295046, win 1024, options [mss 1460], length 0
01:07:48.363904 IP S1-anjo5726.cloud.33173 > L1-anjo5726.cloud.1050: Flags [S], seq 3262295046, win 1024, options [mss 1460], length 0
01:07:48.363915 IP S1-anjo5726.cloud.33173 > L1-anjo5726.cloud.31038: Flags [S], seq 3262295046, win 1024, options [mss 1460], length 0
01:07:48.363925 IP S1-anjo5726.cloud.33173 > L1-anjo5726.cloud.10024: Flags [S], seq 3262295046, win 1024, options [mss 1460], length 0
01:07:48.363936 IP S1-anjo5726.cloud.33173 > L1-anjo5726.cloud.3551: Flags [S], seq 3262295046, win 1024, options [mss 1460], length 0
01:07:48.363948 IP S1-anjo5726.cloud.33173 > L1-anjo5726.cloud.zope-ftp: Flags [S], seq 3262295046, win 1024, options [mss 1460], length 0
01:07:48.363959 IP S1-anjo5726.cloud.33173 > L1-anjo5726.cloud.6881: Flags [S], seq 3262295046, win 1024, options [mss 1460], length 0
01:07:48.363969 IP S1-anjo5726.cloud.33173 > L1-anjo5726.cloud.9943: Flags [S], seq 3262295046, win 1024, options [mss 1460], length 0
01:07:48.363979 IP S1-anjo5726.cloud.33173 > L1-anjo5726.cloud.1112: Flags [S], seq 3262295046, win 1024, options [mss 1460], length 0
01:07:48.364465 IP L1-anjo5726.cloud.49167 > S1-anjo5726.cloud.33173: Flags [R.], seq 0, ack 3262295047, win 0, length 0
01:07:48.364467 IP L1-anjo5726.cloud.34571 > S1-anjo5726.cloud.33173: Flags [R.], seq 0, ack 3262295047, win 0, length 0
01:07:48.364471 IP L1-anjo5726.cloud.32784 > S1-anjo5726.cloud.33173: Flags [R.], seq 0, ack 3262295047, win 0, length 0
01:07:48.364473 IP L1-anjo5726.cloud.1234 > S1-anjo5726.cloud.33173: Flags [R.], seq 0, ack 3262295047, win 0, length 0
01:07:48.364474 IP L1-anjo5726.cloud.8200 > S1-anjo5726.cloud.33173: Flags [R.], seq 0, ack 3262295047, win 0, length 0
01:07:48.364475 IP L1-anjo5726.cloud.41511 > S1-anjo5726.cloud.33173: Flags [R.], seq 0, ack 3262295047, win 0, length 0
01:07:48.364476 IP L1-anjo5726.cloud.7512 > S1-anjo5726.cloud.33173: Flags [R.], seq 0, ack 3262295047, win 0, length 0
01:07:48.364477 IP L1-anjo5726.cloud.zebra > S1-anjo5726.cloud.33173: Flags [R.], seq 0, ack 3262295047, win 0, length 0
01:07:48.364513 IP L1-anjo5726.cloud.4129 > S1-anjo5726.cloud.33173: Flags [R.], seq 0, ack 3262295047, win 0, length 0
01:07:48.364514 IP L1-anjo5726.cloud.5101 > S1-anjo5726.cloud.33173: Flags [R.], seq 0, ack 3262295047, win 0, length 0
01:07:48.364516 IP L1-anjo5726.cloud.1090 > S1-anjo5726.cloud.33173: Flags [R.], seq 0, ack 3262295047, win 0, length 0
01:07:48.364517 IP L1-anjo5726.cloud.8082 > S1-anjo5726.cloud.33173: Flags [R.], seq 0, ack 3262295047, win 0, length 0
01:07:48.364518 IP L1-anjo5726.cloud.65000 > S1-anjo5726.cloud.33173: Flags [R.], seq 0, ack 3262295047, win 0, length 0
01:07:48.364519 IP L1-anjo5726.cloud.2002 > S1-anjo5726.cloud.33173: Flags [R.], seq 0, ack 3262295047, win 0, length 0
01:07:48.364520 IP L1-anjo5726.cloud.2393 > S1-anjo5726.cloud.33173: Flags [R.], seq 0, ack 3262295047, win 0, length 0
01:07:48.364521 IP L1-anjo5726.cloud.1666 > S1-anjo5726.cloud.33173: Flags [R.], seq 0, ack 3262295047, win 0, length 0
01:07:48.364538 IP L1-anjo5726.cloud.1122 > S1-anjo5726.cloud.33173: Flags [R.], seq 0, ack 3262295047, win 0, length 0
01:07:48.364539 IP L1-anjo5726.cloud.5051 > S1-anjo5726.cloud.33173: Flags [R.], seq 0, ack 3262295047, win 0, length 0
01:07:48.364542 IP L1-anjo5726.cloud.1461 > S1-anjo5726.cloud.33173: Flags [R.], seq 0, ack 3262295047, win 0, length 0
01:07:48.364543 IP L1-anjo5726.cloud.rmtcfg > S1-anjo5726.cloud.33173: Flags [R.], seq 0, ack 3262295047, win 0, length 0
01:07:48.364543 IP L1-anjo5726.cloud.1721 > S1-anjo5726.cloud.33173: Flags [R.], seq 0, ack 3262295047, win 0, length 0
01:07:48.364544 IP L1-anjo5726.cloud.8701 > S1-anjo5726.cloud.33173: Flags [R.], seq 0, ack 3262295047, win 0, length 0
01:07:48.364546 IP L1-anjo5726.cloud.shell > S1-anjo5726.cloud.33173: Flags [R.], seq 0, ack 3262295047, win 0, length 0
01:07:48.364547 IP L1-anjo5726.cloud.7777 > S1-anjo5726.cloud.33173: Flags [R.], seq 0, ack 3262295047, win 0, length 0
01:07:48.364562 IP L1-anjo5726.cloud.27356 > S1-anjo5726.cloud.33173: Flags [R.], seq 0, ack 3262295047, win 0, length 0
01:07:48.364563 IP L1-anjo5726.cloud.1310 > S1-anjo5726.cloud.33173: Flags [R.], seq 0, ack 3262295047, win 0, length 0
01:07:48.364564 IP L1-anjo5726.cloud.2710 > S1-anjo5726.cloud.33173: Flags [R.], seq 0, ack 3262295047, win 0, length 0
01:07:48.364565 IP L1-anjo5726.cloud.15002 > S1-anjo5726.cloud.33173: Flags [R.], seq 0, ack 3262295047, win 0, length 0
01:07:48.364566 IP L1-anjo5726.cloud.x11-6 > S1-anjo5726.cloud.33173: Flags [R.], seq 0, ack 3262295047, win 0, length 0
01:07:48.364567 IP L1-anjo5726.cloud.1108 > S1-anjo5726.cloud.33173: Flags [R.], seq 0, ack 3262295047, win 0, length 0
01:07:48.364568 IP L1-anjo5726.cloud.1687 > S1-anjo5726.cloud.33173: Flags [R.], seq 0, ack 3262295047, win 0, length 0
01:07:48.364569 IP L1-anjo5726.cloud.3333 > S1-anjo5726.cloud.33173: Flags [R.], seq 0, ack 3262295047, win 0, length 0
01:07:48.364584 IP L1-anjo5726.cloud.1050 > S1-anjo5726.cloud.33173: Flags [R.], seq 0, ack 3262295047, win 0, length 0
01:07:48.364585 IP L1-anjo5726.cloud.31038 > S1-anjo5726.cloud.33173: Flags [R.], seq 0, ack 3262295047, win 0, length 0
01:07:48.364588 IP L1-anjo5726.cloud.10024 > S1-anjo5726.cloud.33173: Flags [R.], seq 0, ack 3262295047, win 0, length 0
01:07:48.364589 IP L1-anjo5726.cloud.3551 > S1-anjo5726.cloud.33173: Flags [R.], seq 0, ack 3262295047, win 0, length 0
01:07:48.364590 IP L1-anjo5726.cloud.zope-ftp > S1-anjo5726.cloud.33173: Flags [R.], seq 0, ack 3262295047, win 0, length 0
01:07:48.364591 IP L1-anjo5726.cloud.6881 > S1-anjo5726.cloud.33173: Flags [R.], seq 0, ack 3262295047, win 0, length 0
01:07:48.364592 IP L1-anjo5726.cloud.9943 > S1-anjo5726.cloud.33173: Flags [R.], seq 0, ack 3262295047, win 0, length 0
01:07:48.364593 IP L1-anjo5726.cloud.1112 > S1-anjo5726.cloud.33173: Flags [R.], seq 0, ack 3262295047, win 0, length 0
01:07:48.364901 IP S1-anjo5726.cloud.33173 > L1-anjo5726.cloud.9003: Flags [S], seq 3262295046, win 1024, options [mss 1460], length 0
01:07:48.364925 IP S1-anjo5726.cloud.33173 > L1-anjo5726.cloud.9091: Flags [S], seq 3262295046, win 1024, options [mss 1460], length 0
01:07:48.364936 IP S1-anjo5726.cloud.33173 > L1-anjo5726.cloud.9110: Flags [S], seq 3262295046, win 1024, options [mss 1460], length 0
01:07:48.364947 IP S1-anjo5726.cloud.33173 > L1-anjo5726.cloud.497: Flags [S], seq 3262295046, win 1024, options [mss 1460], length 0
01:07:48.364960 IP S1-anjo5726.cloud.33173 > L1-anjo5726.cloud.32779: Flags [S], seq 3262295046, win 1024, options [mss 1460], length 0
01:07:48.364972 IP S1-anjo5726.cloud.33173 > L1-anjo5726.cloud.4550: Flags [S], seq 3262295046, win 1024, options [mss 1460], length 0
01:07:48.364982 IP S1-anjo5726.cloud.33173 > L1-anjo5726.cloud.3826: Flags [S], seq 3262295046, win 1024, options [mss 1460], length 0
01:07:48.364993 IP S1-anjo5726.cloud.33173 > L1-anjo5726.cloud.19350: Flags [S], seq 3262295046, win 1024, options [mss 1460], length 0
01:07:48.365003 IP S1-anjo5726.cloud.33173 > L1-anjo5726.cloud.2381: Flags [S], seq 3262295046, win 1024, options [mss 1460], length 0
01:07:48.365014 IP S1-anjo5726.cloud.33173 > L1-anjo5726.cloud.14442: Flags [S], seq 3262295046, win 1024, options [mss 1460], length 0
01:07:48.365024 IP S1-anjo5726.cloud.33173 > L1-anjo5726.cloud.5801: Flags [S], seq 3262295046, win 1024, options [mss 1460], length 0
01:07:48.365034 IP S1-anjo5726.cloud.33173 > L1-anjo5726.cloud.31337: Flags [S], seq 3262295046, win 1024, options [mss 1460], length 0
01:07:48.365046 IP S1-anjo5726.cloud.33173 > L1-anjo5726.cloud.49161: Flags [S], seq 3262295046, win 1024, options [mss 1460], length 0
01:07:48.365057 IP S1-anjo5726.cloud.33173 > L1-anjo5726.cloud.89: Flags [S], seq 3262295046, win 1024, options [mss 1460], length 0
01:07:48.365068 IP S1-anjo5726.cloud.33173 > L1-anjo5726.cloud.1009: Flags [S], seq 3262295046, win 1024, options [mss 1460], length 0
01:07:48.365079 IP S1-anjo5726.cloud.33173 > L1-anjo5726.cloud.6792: Flags [S], seq 3262295046, win 1024, options [mss 1460], length 0
01:07:48.365089 IP S1-anjo5726.cloud.33173 > L1-anjo5726.cloud.2103: Flags [S], seq 3262295046, win 1024, options [mss 1460], length 0
01:07:48.365099 IP S1-anjo5726.cloud.33173 > L1-anjo5726.cloud.1600: Flags [S], seq 3262295046, win 1024, options [mss 1460], length 0
01:07:48.365108 IP S1-anjo5726.cloud.33173 > L1-anjo5726.cloud.9929: Flags [S], seq 3262295046, win 1024, options [mss 1460], length 0
01:07:48.365119 IP S1-anjo5726.cloud.33173 > L1-anjo5726.cloud.1984: Flags [S], seq 3262295046, win 1024, options [mss 1460], length 0
01:07:48.365131 IP S1-anjo5726.cloud.33173 > L1-anjo5726.cloud.3007: Flags [S], seq 3262295046, win 1024, options [mss 1460], length 0
01:07:48.365142 IP S1-anjo5726.cloud.33173 > L1-anjo5726.cloud.login: Flags [S], seq 3262295046, win 1024, options [mss 1460], length 0
01:07:48.365152 IP S1-anjo5726.cloud.33173 > L1-anjo5726.cloud.2394: Flags [S], seq 3262295046, win 1024, options [mss 1460], length 0
01:07:48.365163 IP S1-anjo5726.cloud.33173 > L1-anjo5726.cloud.416: Flags [S], seq 3262295046, win 1024, options [mss 1460], length 0
01:07:48.365173 IP S1-anjo5726.cloud.33173 > L1-anjo5726.cloud.5214: Flags [S], seq 3262295046, win 1024, options [mss 1460], length 0
01:07:48.365184 IP S1-anjo5726.cloud.33173 > L1-anjo5726.cloud.1078: Flags [S], seq 3262295046, win 1024, options [mss 1460], length 0
01:07:48.365195 IP S1-anjo5726.cloud.33173 > L1-anjo5726.cloud.10616: Flags [S], seq 3262295046, win 1024, options [mss 1460], length 0
01:07:48.365217 IP S1-anjo5726.cloud.33173 > L1-anjo5726.cloud.5910: Flags [S], seq 3262295046, win 1024, options [mss 1460], length 0
01:07:48.365268 IP S1-anjo5726.cloud.33173 > L1-anjo5726.cloud.3828: Flags [S], seq 3262295046, win 1024, options [mss 1460], length 0
01:07:48.365291 IP S1-anjo5726.cloud.33173 > L1-anjo5726.cloud.1097: Flags [S], seq 3262295046, win 1024, options [mss 1460], length 0
01:07:48.365311 IP S1-anjo5726.cloud.33173 > L1-anjo5726.cloud.1148: Flags [S], seq 3262295046, win 1024, options [mss 1460], length 0
01:07:48.365326 IP S1-anjo5726.cloud.33173 > L1-anjo5726.cloud.5903: Flags [S], seq 3262295046, win 1024, options [mss 1460], length 0
01:07:48.365336 IP S1-anjo5726.cloud.33173 > L1-anjo5726.cloud.1183: Flags [S], seq 3262295046, win 1024, options [mss 1460], length 0
01:07:48.365346 IP S1-anjo5726.cloud.33173 > L1-anjo5726.cloud.3851: Flags [S], seq 3262295046, win 1024, options [mss 1460], length 0
01:07:48.365357 IP S1-anjo5726.cloud.33173 > L1-anjo5726.cloud.3814: Flags [S], seq 3262295046, win 1024, options [mss 1460], length 0
01:07:48.365368 IP S1-anjo5726.cloud.33173 > L1-anjo5726.cloud.667: Flags [S], seq 3262295046, win 1024, options [mss 1460], length 0
01:07:48.365398 IP S1-anjo5726.cloud.33173 > L1-anjo5726.cloud.65389: Flags [S], seq 3262295046, win 1024, options [mss 1460], length 0
01:07:48.365411 IP S1-anjo5726.cloud.33173 > L1-anjo5726.cloud.1169: Flags [S], seq 3262295046, win 1024, options [mss 1460], length 0
01:07:48.365422 IP S1-anjo5726.cloud.33173 > L1-anjo5726.cloud.8022: Flags [S], seq 3262295046, win 1024, options [mss 1460], length 0
01:07:48.365432 IP S1-anjo5726.cloud.33173 > L1-anjo5726.cloud.1862: Flags [S], seq 3262295046, win 1024, options [mss 1460], length 0
01:07:48.365442 IP S1-anjo5726.cloud.33173 > L1-anjo5726.cloud.8093: Flags [S], seq 3262295046, win 1024, options [mss 1460], length 0
01:07:48.365452 IP S1-anjo5726.cloud.33173 > L1-anjo5726.cloud.458: Flags [S], seq 3262295046, win 1024, options [mss 1460], length 0
01:07:48.365474 IP S1-anjo5726.cloud.33173 > L1-anjo5726.cloud.8600: Flags [S], seq 3262295046, win 1024, options [mss 1460], length 0
01:07:48.365504 IP S1-anjo5726.cloud.33173 > L1-anjo5726.cloud.901: Flags [S], seq 3262295046, win 1024, options [mss 1460], length 0
01:07:48.365546 IP S1-anjo5726.cloud.33173 > L1-anjo5726.cloud.255: Flags [S], seq 3262295046, win 1024, options [mss 1460], length 0
01:07:48.365569 IP S1-anjo5726.cloud.33173 > L1-anjo5726.cloud.2048: Flags [S], seq 3262295046, win 1024, options [mss 1460], length 0
01:07:48.365587 IP S1-anjo5726.cloud.33173 > L1-anjo5726.cloud.2190: Flags [S], seq 3262295046, win 1024, options [mss 1460], length 0
01:07:48.365607 IP S1-anjo5726.cloud.33173 > L1-anjo5726.cloud.34572: Flags [S], seq 3262295046, win 1024, options [mss 1460], length 0
01:07:48.365626 IP S1-anjo5726.cloud.33173 > L1-anjo5726.cloud.541: Flags [S], seq 3262295046, win 1024, options [mss 1460], length 0
01:07:48.365638 IP S1-anjo5726.cloud.33173 > L1-anjo5726.cloud.8291: Flags [S], seq 3262295046, win 1024, options [mss 1460], length 0
01:07:48.366041 IP L1-anjo5726.cloud.9003 > S1-anjo5726.cloud.33173: Flags [R.], seq 0, ack 3262295047, win 0, length 0
01:07:48.366042 IP L1-anjo5726.cloud.9091 > S1-anjo5726.cloud.33173: Flags [R.], seq 0, ack 3262295047, win 0, length 0
01:07:48.366043 IP L1-anjo5726.cloud.9110 > S1-anjo5726.cloud.33173: Flags [R.], seq 0, ack 3262295047, win 0, length 0
01:07:48.366044 IP L1-anjo5726.cloud.497 > S1-anjo5726.cloud.33173: Flags [R.], seq 0, ack 3262295047, win 0, length 0
01:07:48.366045 IP L1-anjo5726.cloud.32779 > S1-anjo5726.cloud.33173: Flags [R.], seq 0, ack 3262295047, win 0, length 0
01:07:48.366046 IP L1-anjo5726.cloud.4550 > S1-anjo5726.cloud.33173: Flags [R.], seq 0, ack 3262295047, win 0, length 0
01:07:48.366047 IP L1-anjo5726.cloud.3826 > S1-anjo5726.cloud.33173: Flags [R.], seq 0, ack 3262295047, win 0, length 0
01:07:48.366048 IP L1-anjo5726.cloud.19350 > S1-anjo5726.cloud.33173: Flags [R.], seq 0, ack 3262295047, win 0, length 0
01:07:48.366074 IP L1-anjo5726.cloud.2381 > S1-anjo5726.cloud.33173: Flags [R.], seq 0, ack 3262295047, win 0, length 0
01:07:48.366075 IP L1-anjo5726.cloud.14442 > S1-anjo5726.cloud.33173: Flags [R.], seq 0, ack 3262295047, win 0, length 0
01:07:48.366076 IP L1-anjo5726.cloud.5801 > S1-anjo5726.cloud.33173: Flags [R.], seq 0, ack 3262295047, win 0, length 0
01:07:48.366077 IP L1-anjo5726.cloud.31337 > S1-anjo5726.cloud.33173: Flags [R.], seq 0, ack 3262295047, win 0, length 0
01:07:48.366078 IP L1-anjo5726.cloud.49161 > S1-anjo5726.cloud.33173: Flags [R.], seq 0, ack 3262295047, win 0, length 0
01:07:48.366079 IP L1-anjo5726.cloud.89 > S1-anjo5726.cloud.33173: Flags [R.], seq 0, ack 3262295047, win 0, length 0
01:07:48.366086 IP L1-anjo5726.cloud.1009 > S1-anjo5726.cloud.33173: Flags [R.], seq 0, ack 3262295047, win 0, length 0
01:07:48.366087 IP L1-anjo5726.cloud.6792 > S1-anjo5726.cloud.33173: Flags [R.], seq 0, ack 3262295047, win 0, length 0
01:07:48.366108 IP L1-anjo5726.cloud.2103 > S1-anjo5726.cloud.33173: Flags [R.], seq 0, ack 3262295047, win 0, length 0
01:07:48.366109 IP L1-anjo5726.cloud.1600 > S1-anjo5726.cloud.33173: Flags [R.], seq 0, ack 3262295047, win 0, length 0
01:07:48.366110 IP L1-anjo5726.cloud.9929 > S1-anjo5726.cloud.33173: Flags [R.], seq 0, ack 3262295047, win 0, length 0
01:07:48.366111 IP L1-anjo5726.cloud.1984 > S1-anjo5726.cloud.33173: Flags [R.], seq 0, ack 3262295047, win 0, length 0
01:07:48.366112 IP L1-anjo5726.cloud.3007 > S1-anjo5726.cloud.33173: Flags [R.], seq 0, ack 3262295047, win 0, length 0
01:07:48.366113 IP L1-anjo5726.cloud.login > S1-anjo5726.cloud.33173: Flags [R.], seq 0, ack 3262295047, win 0, length 0
01:07:48.366114 IP L1-anjo5726.cloud.2394 > S1-anjo5726.cloud.33173: Flags [R.], seq 0, ack 3262295047, win 0, length 0
01:07:48.366115 IP L1-anjo5726.cloud.416 > S1-anjo5726.cloud.33173: Flags [R.], seq 0, ack 3262295047, win 0, length 0
01:07:48.366134 IP L1-anjo5726.cloud.5214 > S1-anjo5726.cloud.33173: Flags [R.], seq 0, ack 3262295047, win 0, length 0
01:07:48.366135 IP L1-anjo5726.cloud.1078 > S1-anjo5726.cloud.33173: Flags [R.], seq 0, ack 3262295047, win 0, length 0
01:07:48.366136 IP L1-anjo5726.cloud.10616 > S1-anjo5726.cloud.33173: Flags [R.], seq 0, ack 3262295047, win 0, length 0
01:07:48.366137 IP L1-anjo5726.cloud.5910 > S1-anjo5726.cloud.33173: Flags [R.], seq 0, ack 3262295047, win 0, length 0
01:07:48.366138 IP L1-anjo5726.cloud.3828 > S1-anjo5726.cloud.33173: Flags [R.], seq 0, ack 3262295047, win 0, length 0
01:07:48.366139 IP L1-anjo5726.cloud.1097 > S1-anjo5726.cloud.33173: Flags [R.], seq 0, ack 3262295047, win 0, length 0
01:07:48.366146 IP L1-anjo5726.cloud.1148 > S1-anjo5726.cloud.33173: Flags [R.], seq 0, ack 3262295047, win 0, length 0
01:07:48.366147 IP L1-anjo5726.cloud.5903 > S1-anjo5726.cloud.33173: Flags [R.], seq 0, ack 3262295047, win 0, length 0
01:07:48.366166 IP L1-anjo5726.cloud.1183 > S1-anjo5726.cloud.33173: Flags [R.], seq 0, ack 3262295047, win 0, length 0
01:07:48.366167 IP L1-anjo5726.cloud.3851 > S1-anjo5726.cloud.33173: Flags [R.], seq 0, ack 3262295047, win 0, length 0
01:07:48.366168 IP L1-anjo5726.cloud.3814 > S1-anjo5726.cloud.33173: Flags [R.], seq 0, ack 3262295047, win 0, length 0
01:07:48.366169 IP L1-anjo5726.cloud.667 > S1-anjo5726.cloud.33173: Flags [R.], seq 0, ack 3262295047, win 0, length 0
01:07:48.366170 IP L1-anjo5726.cloud.65389 > S1-anjo5726.cloud.33173: Flags [R.], seq 0, ack 3262295047, win 0, length 0
01:07:48.366171 IP L1-anjo5726.cloud.1169 > S1-anjo5726.cloud.33173: Flags [R.], seq 0, ack 3262295047, win 0, length 0
01:07:48.366172 IP L1-anjo5726.cloud.8022 > S1-anjo5726.cloud.33173: Flags [R.], seq 0, ack 3262295047, win 0, length 0
01:07:48.366173 IP L1-anjo5726.cloud.1862 > S1-anjo5726.cloud.33173: Flags [R.], seq 0, ack 3262295047, win 0, length 0
01:07:48.366193 IP L1-anjo5726.cloud.8093 > S1-anjo5726.cloud.33173: Flags [R.], seq 0, ack 3262295047, win 0, length 0
01:07:48.366194 IP L1-anjo5726.cloud.458 > S1-anjo5726.cloud.33173: Flags [R.], seq 0, ack 3262295047, win 0, length 0
01:07:48.366195 IP L1-anjo5726.cloud.8600 > S1-anjo5726.cloud.33173: Flags [R.], seq 0, ack 3262295047, win 0, length 0
01:07:48.366196 IP L1-anjo5726.cloud.901 > S1-anjo5726.cloud.33173: Flags [R.], seq 0, ack 3262295047, win 0, length 0
01:07:48.366196 IP L1-anjo5726.cloud.255 > S1-anjo5726.cloud.33173: Flags [R.], seq 0, ack 3262295047, win 0, length 0
01:07:48.366197 IP L1-anjo5726.cloud.2048 > S1-anjo5726.cloud.33173: Flags [R.], seq 0, ack 3262295047, win 0, length 0
01:07:48.366204 IP L1-anjo5726.cloud.2190 > S1-anjo5726.cloud.33173: Flags [R.], seq 0, ack 3262295047, win 0, length 0
01:07:48.366205 IP L1-anjo5726.cloud.34572 > S1-anjo5726.cloud.33173: Flags [R.], seq 0, ack 3262295047, win 0, length 0
01:07:48.366232 IP L1-anjo5726.cloud.541 > S1-anjo5726.cloud.33173: Flags [R.], seq 0, ack 3262295047, win 0, length 0
01:07:48.366233 IP L1-anjo5726.cloud.8291 > S1-anjo5726.cloud.33173: Flags [R.], seq 0, ack 3262295047, win 0, length 0
01:07:48.366710 IP S1-anjo5726.cloud.33173 > L1-anjo5726.cloud.11967: Flags [S], seq 3262295046, win 1024, options [mss 1460], length 0
01:07:48.366736 IP S1-anjo5726.cloud.33173 > L1-anjo5726.cloud.1077: Flags [S], seq 3262295046, win 1024, options [mss 1460], length 0
01:07:48.366746 IP S1-anjo5726.cloud.33173 > L1-anjo5726.cloud.5030: Flags [S], seq 3262295046, win 1024, options [mss 1460], length 0
01:07:48.366757 IP S1-anjo5726.cloud.33173 > L1-anjo5726.cloud.8402: Flags [S], seq 3262295046, win 1024, options [mss 1460], length 0
01:07:48.366767 IP S1-anjo5726.cloud.33173 > L1-anjo5726.cloud.5815: Flags [S], seq 3262295046, win 1024, options [mss 1460], length 0
01:07:48.366777 IP S1-anjo5726.cloud.33173 > L1-anjo5726.cloud.61532: Flags [S], seq 3262295046, win 1024, options [mss 1460], length 0
01:07:48.366788 IP S1-anjo5726.cloud.33173 > L1-anjo5726.cloud.1011: Flags [S], seq 3262295046, win 1024, options [mss 1460], length 0
01:07:48.366798 IP S1-anjo5726.cloud.33173 > L1-anjo5726.cloud.2126: Flags [S], seq 3262295046, win 1024, options [mss 1460], length 0
01:07:48.366812 IP S1-anjo5726.cloud.33173 > L1-anjo5726.cloud.nut: Flags [S], seq 3262295046, win 1024, options [mss 1460], length 0
01:07:48.366823 IP S1-anjo5726.cloud.33173 > L1-anjo5726.cloud.50500: Flags [S], seq 3262295046, win 1024, options [mss 1460], length 0
01:07:48.366833 IP S1-anjo5726.cloud.33173 > L1-anjo5726.cloud.23502: Flags [S], seq 3262295046, win 1024, options [mss 1460], length 0
01:07:48.366843 IP S1-anjo5726.cloud.33173 > L1-anjo5726.cloud.8899: Flags [S], seq 3262295046, win 1024, options [mss 1460], length 0
01:07:48.366853 IP S1-anjo5726.cloud.33173 > L1-anjo5726.cloud.3546: Flags [S], seq 3262295046, win 1024, options [mss 1460], length 0
01:07:48.366864 IP S1-anjo5726.cloud.33173 > L1-anjo5726.cloud.5003: Flags [S], seq 3262295046, win 1024, options [mss 1460], length 0
01:07:48.366875 IP S1-anjo5726.cloud.33173 > L1-anjo5726.cloud.10010: Flags [S], seq 3262295046, win 1024, options [mss 1460], length 0
01:07:48.366886 IP S1-anjo5726.cloud.33173 > L1-anjo5726.cloud.5009: Flags [S], seq 3262295046, win 1024, options [mss 1460], length 0
01:07:48.366897 IP S1-anjo5726.cloud.33173 > L1-anjo5726.cloud.3517: Flags [S], seq 3262295046, win 1024, options [mss 1460], length 0
01:07:48.366908 IP S1-anjo5726.cloud.33173 > L1-anjo5726.cloud.1032: Flags [S], seq 3262295046, win 1024, options [mss 1460], length 0
01:07:48.366918 IP S1-anjo5726.cloud.33173 > L1-anjo5726.cloud.7938: Flags [S], seq 3262295046, win 1024, options [mss 1460], length 0
01:07:48.366929 IP S1-anjo5726.cloud.33173 > L1-anjo5726.cloud.1056: Flags [S], seq 3262295046, win 1024, options [mss 1460], length 0
01:07:48.366939 IP S1-anjo5726.cloud.33173 > L1-anjo5726.cloud.6389: Flags [S], seq 3262295046, win 1024, options [mss 1460], length 0
01:07:48.366951 IP S1-anjo5726.cloud.33173 > L1-anjo5726.cloud.rootd: Flags [S], seq 3262295046, win 1024, options [mss 1460], length 0
01:07:48.366962 IP S1-anjo5726.cloud.33173 > L1-anjo5726.cloud.1216: Flags [S], seq 3262295046, win 1024, options [mss 1460], length 0
01:07:48.366973 IP S1-anjo5726.cloud.33173 > L1-anjo5726.cloud.1074: Flags [S], seq 3262295046, win 1024, options [mss 1460], length 0
01:07:48.366985 IP S1-anjo5726.cloud.33173 > L1-anjo5726.cloud.5907: Flags [S], seq 3262295046, win 1024, options [mss 1460], length 0
01:07:48.366996 IP S1-anjo5726.cloud.33173 > L1-anjo5726.cloud.24800: Flags [S], seq 3262295046, win 1024, options [mss 1460], length 0
01:07:48.367006 IP S1-anjo5726.cloud.33173 > L1-anjo5726.cloud.9080: Flags [S], seq 3262295046, win 1024, options [mss 1460], length 0
01:07:48.367017 IP S1-anjo5726.cloud.33173 > L1-anjo5726.cloud.iprop: Flags [S], seq 3262295046, win 1024, options [mss 1460], length 0
01:07:48.367028 IP S1-anjo5726.cloud.33173 > L1-anjo5726.cloud.1081: Flags [S], seq 3262295046, win 1024, options [mss 1460], length 0
01:07:48.367038 IP S1-anjo5726.cloud.33173 > L1-anjo5726.cloud.56738: Flags [S], seq 3262295046, win 1024, options [mss 1460], length 0
01:07:48.367048 IP S1-anjo5726.cloud.33173 > L1-anjo5726.cloud.2009: Flags [S], seq 3262295046, win 1024, options [mss 1460], length 0
01:07:48.367057 IP S1-anjo5726.cloud.33173 > L1-anjo5726.cloud.1088: Flags [S], seq 3262295046, win 1024, options [mss 1460], length 0
01:07:48.367068 IP S1-anjo5726.cloud.33173 > L1-anjo5726.cloud.3476: Flags [S], seq 3262295046, win 1024, options [mss 1460], length 0
01:07:48.367079 IP S1-anjo5726.cloud.33173 > L1-anjo5726.cloud.3945: Flags [S], seq 3262295046, win 1024, options [mss 1460], length 0
01:07:48.367089 IP S1-anjo5726.cloud.33173 > L1-anjo5726.cloud.1755: Flags [S], seq 3262295046, win 1024, options [mss 1460], length 0
01:07:48.367099 IP S1-anjo5726.cloud.33173 > L1-anjo5726.cloud.52848: Flags [S], seq 3262295046, win 1024, options [mss 1460], length 0
01:07:48.367109 IP S1-anjo5726.cloud.33173 > L1-anjo5726.cloud.bgp: Flags [S], seq 3262295046, win 1024, options [mss 1460], length 0
01:07:48.367119 IP S1-anjo5726.cloud.33173 > L1-anjo5726.cloud.5961: Flags [S], seq 3262295046, win 1024, options [mss 1460], length 0
01:07:48.367129 IP S1-anjo5726.cloud.33173 > L1-anjo5726.cloud.5500: Flags [S], seq 3262295046, win 1024, options [mss 1460], length 0
01:07:48.367139 IP S1-anjo5726.cloud.33173 > L1-anjo5726.cloud.1026: Flags [S], seq 3262295046, win 1024, options [mss 1460], length 0
01:07:48.367151 IP S1-anjo5726.cloud.33173 > L1-anjo5726.cloud.19780: Flags [S], seq 3262295046, win 1024, options [mss 1460], length 0
01:07:48.367162 IP S1-anjo5726.cloud.33173 > L1-anjo5726.cloud.5100: Flags [S], seq 3262295046, win 1024, options [mss 1460], length 0
01:07:48.367172 IP S1-anjo5726.cloud.33173 > L1-anjo5726.cloud.6101: Flags [S], seq 3262295046, win 1024, options [mss 1460], length 0
01:07:48.367181 IP S1-anjo5726.cloud.33173 > L1-anjo5726.cloud.1287: Flags [S], seq 3262295046, win 1024, options [mss 1460], length 0
01:07:48.367191 IP S1-anjo5726.cloud.33173 > L1-anjo5726.cloud.5000: Flags [S], seq 3262295046, win 1024, options [mss 1460], length 0
01:07:48.367200 IP S1-anjo5726.cloud.33173 > L1-anjo5726.cloud.9100: Flags [S], seq 3262295046, win 1024, options [mss 1460], length 0
01:07:48.367210 IP S1-anjo5726.cloud.33173 > L1-anjo5726.cloud.1198: Flags [S], seq 3262295046, win 1024, options [mss 1460], length 0
01:07:48.367219 IP S1-anjo5726.cloud.33173 > L1-anjo5726.cloud.25735: Flags [S], seq 3262295046, win 1024, options [mss 1460], length 0
01:07:48.367231 IP S1-anjo5726.cloud.33173 > L1-anjo5726.cloud.340: Flags [S], seq 3262295046, win 1024, options [mss 1460], length 0
01:07:48.367241 IP S1-anjo5726.cloud.33173 > L1-anjo5726.cloud.1035: Flags [S], seq 3262295046, win 1024, options [mss 1460], length 0
01:07:48.367851 IP L1-anjo5726.cloud.11967 > S1-anjo5726.cloud.33173: Flags [R.], seq 0, ack 3262295047, win 0, length 0
01:07:48.367853 IP L1-anjo5726.cloud.1077 > S1-anjo5726.cloud.33173: Flags [R.], seq 0, ack 3262295047, win 0, length 0
01:07:48.367854 IP L1-anjo5726.cloud.5030 > S1-anjo5726.cloud.33173: Flags [R.], seq 0, ack 3262295047, win 0, length 0
01:07:48.367854 IP L1-anjo5726.cloud.8402 > S1-anjo5726.cloud.33173: Flags [R.], seq 0, ack 3262295047, win 0, length 0
01:07:48.367855 IP L1-anjo5726.cloud.5815 > S1-anjo5726.cloud.33173: Flags [R.], seq 0, ack 3262295047, win 0, length 0
01:07:48.367856 IP L1-anjo5726.cloud.61532 > S1-anjo5726.cloud.33173: Flags [R.], seq 0, ack 3262295047, win 0, length 0
01:07:48.367857 IP L1-anjo5726.cloud.1011 > S1-anjo5726.cloud.33173: Flags [R.], seq 0, ack 3262295047, win 0, length 0
01:07:48.367858 IP L1-anjo5726.cloud.2126 > S1-anjo5726.cloud.33173: Flags [R.], seq 0, ack 3262295047, win 0, length 0
01:07:48.367877 IP L1-anjo5726.cloud.nut > S1-anjo5726.cloud.33173: Flags [R.], seq 0, ack 3262295047, win 0, length 0
01:07:48.367878 IP L1-anjo5726.cloud.50500 > S1-anjo5726.cloud.33173: Flags [R.], seq 0, ack 3262295047, win 0, length 0
