01:42:45.672552 ARP, Request who-has L1-anjo5726.cloud tell S1-anjo5726.cloud, length 28
01:42:45.672588 ARP, Reply L1-anjo5726.cloud is-at 02:00:ac:10:00:10 (oui Unknown), length 28
01:42:45.675350 IP S1-anjo5726.cloud.47628 > L1-anjo5726.cloud.smtp: Flags [S], seq 2425181482, win 64240, options [mss 1460,sackOK,TS val 1930885776 ecr 0,nop,wscale 6], length 0
01:42:45.675350 IP S1-anjo5726.cloud.60446 > L1-anjo5726.cloud.rtsp: Flags [S], seq 2004777282, win 64240, options [mss 1460,sackOK,TS val 1930885776 ecr 0,nop,wscale 6], length 0
01:42:45.675426 IP L1-anjo5726.cloud.smtp > S1-anjo5726.cloud.47628: Flags [S.], seq 1128346697, ack 2425181483, win 65160, options [mss 1460,sackOK,TS val 3420221539 ecr 1930885776,nop,wscale 6], length 0
01:42:45.675461 IP L1-anjo5726.cloud.rtsp > S1-anjo5726.cloud.60446: Flags [R.], seq 0, ack 2004777283, win 0, length 0
01:42:45.675473 IP S1-anjo5726.cloud.47822 > L1-anjo5726.cloud.sunrpc: Flags [S], seq 1871991454, win 64240, options [mss 1460,sackOK,TS val 1930885776 ecr 0,nop,wscale 6], length 0
01:42:45.675474 IP S1-anjo5726.cloud.54382 > L1-anjo5726.cloud.ftp: Flags [S], seq 361007618, win 64240, options [mss 1460,sackOK,TS val 1930885776 ecr 0,nop,wscale 6], length 0
01:42:45.675474 IP S1-anjo5726.cloud.49530 > L1-anjo5726.cloud.mysql: Flags [S], seq 1971271033, win 64240, options [mss 1460,sackOK,TS val 1930885776 ecr 0,nop,wscale 6], length 0
01:42:45.675493 IP L1-anjo5726.cloud.sunrpc > S1-anjo5726.cloud.47822: Flags [S.], seq 890831049, ack 1871991455, win 65160, options [mss 1460,sackOK,TS val 3420221539 ecr 1930885776,nop,wscale 6], length 0
01:42:45.675509 IP L1-anjo5726.cloud.ftp > S1-anjo5726.cloud.54382: Flags [S.], seq 81995408, ack 361007619, win 65160, options [mss 1460,sackOK,TS val 3420221539 ecr 1930885776,nop,wscale 6], length 0
01:42:45.675532 IP L1-anjo5726.cloud.mysql > S1-anjo5726.cloud.49530: Flags [R.], seq 0, ack 1971271034, win 0, length 0
01:42:45.675551 IP S1-anjo5726.cloud.33560 > L1-anjo5726.cloud.8888: Flags [S], seq 2532601868, win 64240, options [mss 1460,sackOK,TS val 1930885776 ecr 0,nop,wscale 6], length 0
01:42:45.675577 IP L1-anjo5726.cloud.8888 > S1-anjo5726.cloud.33560: Flags [R.], seq 0, ack 2532601869, win 0, length 0
01:42:45.675651 IP S1-anjo5726.cloud.52852 > L1-anjo5726.cloud.epmap: Flags [S], seq 1789458747, win 64240, options [mss 1460,sackOK,TS val 1930885777 ecr 0,nop,wscale 6], length 0
01:42:45.675651 IP S1-anjo5726.cloud.37710 > L1-anjo5726.cloud.http: Flags [S], seq 2674870198, win 64240, options [mss 1460,sackOK,TS val 1930885777 ecr 0,nop,wscale 6], length 0
01:42:45.675659 IP L1-anjo5726.cloud.epmap > S1-anjo5726.cloud.52852: Flags [R.], seq 0, ack 1789458748, win 0, length 0
01:42:45.675689 IP L1-anjo5726.cloud.http > S1-anjo5726.cloud.37710: Flags [S.], seq 241193772, ack 2674870199, win 65160, options [mss 1460,sackOK,TS val 3420221539 ecr 1930885777,nop,wscale 6], length 0
01:42:45.675731 IP S1-anjo5726.cloud.47628 > L1-anjo5726.cloud.smtp: Flags [.], ack 1, win 1004, options [nop,nop,TS val 1930885777 ecr 3420221539], length 0
01:42:45.676687 IP S1-anjo5726.cloud.47822 > L1-anjo5726.cloud.sunrpc: Flags [.], ack 1, win 1004, options [nop,nop,TS val 1930885777 ecr 3420221539], length 0
01:42:45.676687 IP S1-anjo5726.cloud.54382 > L1-anjo5726.cloud.ftp: Flags [.], ack 1, win 1004, options [nop,nop,TS val 1930885777 ecr 3420221539], length 0
01:42:45.676687 IP S1-anjo5726.cloud.37710 > L1-anjo5726.cloud.http: Flags [.], ack 1, win 1004, options [nop,nop,TS val 1930885777 ecr 3420221539], length 0
01:42:45.676687 IP S1-anjo5726.cloud.44514 > L1-anjo5726.cloud.smux: Flags [S], seq 2252154627, win 64240, options [mss 1460,sackOK,TS val 1930885777 ecr 0,nop,wscale 6], length 0
01:42:45.676687 IP S1-anjo5726.cloud.58010 > L1-anjo5726.cloud.netbios-ssn: Flags [S], seq 1008865707, win 64240, options [mss 1460,sackOK,TS val 1930885777 ecr 0,nop,wscale 6], length 0
01:42:45.676687 IP S1-anjo5726.cloud.47628 > L1-anjo5726.cloud.smtp: Flags [R.], seq 1, ack 1, win 1004, options [nop,nop,TS val 1930885777 ecr 3420221539], length 0
01:42:45.676687 IP S1-anjo5726.cloud.47822 > L1-anjo5726.cloud.sunrpc: Flags [R.], seq 1, ack 1, win 1004, options [nop,nop,TS val 1930885777 ecr 3420221539], length 0
01:42:45.676687 IP S1-anjo5726.cloud.54382 > L1-anjo5726.cloud.ftp: Flags [R.], seq 1, ack 1, win 1004, options [nop,nop,TS val 1930885777 ecr 3420221539], length 0
01:42:45.676798 IP L1-anjo5726.cloud.smux > S1-anjo5726.cloud.44514: Flags [R.], seq 0, ack 2252154628, win 0, length 0
01:42:45.676814 IP L1-anjo5726.cloud.netbios-ssn > S1-anjo5726.cloud.58010: Flags [R.], seq 0, ack 1008865708, win 0, length 0
01:42:45.676845 IP S1-anjo5726.cloud.37710 > L1-anjo5726.cloud.http: Flags [R.], seq 1, ack 1, win 1004, options [nop,nop,TS val 1930885777 ecr 3420221539], length 0
01:42:45.676845 IP S1-anjo5726.cloud.33038 > L1-anjo5726.cloud.ms-wbt-server: Flags [S], seq 296084674, win 64240, options [mss 1460,sackOK,TS val 1930885777 ecr 0,nop,wscale 6], length 0
01:42:45.676845 IP S1-anjo5726.cloud.50608 > L1-anjo5726.cloud.imap2: Flags [S], seq 871919937, win 64240, options [mss 1460,sackOK,TS val 1930885777 ecr 0,nop,wscale 6], length 0
01:42:45.676845 IP S1-anjo5726.cloud.33314 > L1-anjo5726.cloud.ssh: Flags [S], seq 112044671, win 64240, options [mss 1460,sackOK,TS val 1930885777 ecr 0,nop,wscale 6], length 0
01:42:45.676845 IP S1-anjo5726.cloud.49468 > L1-anjo5726.cloud.telnet: Flags [S], seq 677451442, win 64240, options [mss 1460,sackOK,TS val 1930885777 ecr 0,nop,wscale 6], length 0
01:42:45.676845 IP S1-anjo5726.cloud.43530 > L1-anjo5726.cloud.pop3s: Flags [S], seq 1796326137, win 64240, options [mss 1460,sackOK,TS val 1930885777 ecr 0,nop,wscale 6], length 0
01:42:45.676846 IP S1-anjo5726.cloud.52198 > L1-anjo5726.cloud.domain: Flags [S], seq 1057304479, win 64240, options [mss 1460,sackOK,TS val 1930885778 ecr 0,nop,wscale 6], length 0
01:42:45.676846 IP S1-anjo5726.cloud.57220 > L1-anjo5726.cloud.1025: Flags [S], seq 1454299644, win 64240, options [mss 1460,sackOK,TS val 1930885778 ecr 0,nop,wscale 6], length 0
01:42:45.676867 IP L1-anjo5726.cloud.ms-wbt-server > S1-anjo5726.cloud.33038: Flags [R.], seq 0, ack 296084675, win 0, length 0
01:42:45.676881 IP L1-anjo5726.cloud.imap2 > S1-anjo5726.cloud.50608: Flags [R.], seq 0, ack 871919938, win 0, length 0
01:42:45.676909 IP L1-anjo5726.cloud.ssh > S1-anjo5726.cloud.33314: Flags [S.], seq 1882397664, ack 112044672, win 65160, options [mss 1460,sackOK,TS val 3420221540 ecr 1930885777,nop,wscale 6], length 0
01:42:45.676924 IP L1-anjo5726.cloud.telnet > S1-anjo5726.cloud.49468: Flags [R.], seq 0, ack 677451443, win 0, length 0
01:42:45.676936 IP L1-anjo5726.cloud.pop3s > S1-anjo5726.cloud.43530: Flags [R.], seq 0, ack 1796326138, win 0, length 0
01:42:45.676969 IP L1-anjo5726.cloud.domain > S1-anjo5726.cloud.52198: Flags [S.], seq 3403755806, ack 1057304480, win 65160, options [mss 1460,sackOK,TS val 3420221540 ecr 1930885778,nop,wscale 6], length 0
01:42:45.676993 IP L1-anjo5726.cloud.1025 > S1-anjo5726.cloud.57220: Flags [R.], seq 0, ack 1454299645, win 0, length 0
01:42:45.677022 IP S1-anjo5726.cloud.57316 > L1-anjo5726.cloud.http-alt: Flags [S], seq 643001216, win 64240, options [mss 1460,sackOK,TS val 1930885778 ecr 0,nop,wscale 6], length 0
01:42:45.677022 IP S1-anjo5726.cloud.40646 > L1-anjo5726.cloud.auth: Flags [S], seq 3341281060, win 64240, options [mss 1460,sackOK,TS val 1930885778 ecr 0,nop,wscale 6], length 0
01:42:45.677022 IP S1-anjo5726.cloud.42498 > L1-anjo5726.cloud.1720: Flags [S], seq 3353790829, win 64240, options [mss 1460,sackOK,TS val 1930885778 ecr 0,nop,wscale 6], length 0
01:42:45.677022 IP S1-anjo5726.cloud.34368 > L1-anjo5726.cloud.submission: Flags [S], seq 2533926377, win 64240, options [mss 1460,sackOK,TS val 1930885778 ecr 0,nop,wscale 6], length 0
01:42:45.677022 IP S1-anjo5726.cloud.33314 > L1-anjo5726.cloud.ssh: Flags [.], ack 1, win 1004, options [nop,nop,TS val 1930885778 ecr 3420221540], length 0
01:42:45.677032 IP L1-anjo5726.cloud.http-alt > S1-anjo5726.cloud.57316: Flags [R.], seq 0, ack 643001217, win 0, length 0
01:42:45.677064 IP L1-anjo5726.cloud.auth > S1-anjo5726.cloud.40646: Flags [R.], seq 0, ack 3341281061, win 0, length 0
01:42:45.677069 IP L1-anjo5726.cloud.1720 > S1-anjo5726.cloud.42498: Flags [R.], seq 0, ack 3353790830, win 0, length 0
01:42:45.677073 IP L1-anjo5726.cloud.submission > S1-anjo5726.cloud.34368: Flags [R.], seq 0, ack 2533926378, win 0, length 0
01:42:45.677153 IP S1-anjo5726.cloud.52198 > L1-anjo5726.cloud.domain: Flags [.], ack 1, win 1004, options [nop,nop,TS val 1930885778 ecr 3420221540], length 0
01:42:45.677237 IP S1-anjo5726.cloud.48410 > L1-anjo5726.cloud.5900: Flags [S], seq 3618515685, win 64240, options [mss 1460,sackOK,TS val 1930885778 ecr 0,nop,wscale 6], length 0
01:42:45.677247 IP L1-anjo5726.cloud.5900 > S1-anjo5726.cloud.48410: Flags [R.], seq 0, ack 3618515686, win 0, length 0
01:42:45.677298 IP S1-anjo5726.cloud.36944 > L1-anjo5726.cloud.imaps: Flags [S], seq 2823146135, win 64240, options [mss 1460,sackOK,TS val 1930885778 ecr 0,nop,wscale 6], length 0
01:42:45.677306 IP L1-anjo5726.cloud.imaps > S1-anjo5726.cloud.36944: Flags [R.], seq 0, ack 2823146136, win 0, length 0
01:42:45.677401 IP S1-anjo5726.cloud.44522 > L1-anjo5726.cloud.microsoft-ds: Flags [S], seq 454933120, win 64240, options [mss 1460,sackOK,TS val 1930885778 ecr 0,nop,wscale 6], length 0
01:42:45.677410 IP L1-anjo5726.cloud.microsoft-ds > S1-anjo5726.cloud.44522: Flags [R.], seq 0, ack 454933121, win 0, length 0
01:42:45.677466 IP S1-anjo5726.cloud.34936 > L1-anjo5726.cloud.https: Flags [S], seq 478464937, win 64240, options [mss 1460,sackOK,TS val 1930885778 ecr 0,nop,wscale 6], length 0
01:42:45.677474 IP L1-anjo5726.cloud.https > S1-anjo5726.cloud.34936: Flags [R.], seq 0, ack 478464938, win 0, length 0
01:42:45.677581 IP S1-anjo5726.cloud.55740 > L1-anjo5726.cloud.256: Flags [S], seq 3141715421, win 64240, options [mss 1460,sackOK,TS val 1930885779 ecr 0,nop,wscale 6], length 0
01:42:45.677592 IP L1-anjo5726.cloud.256 > S1-anjo5726.cloud.55740: Flags [R.], seq 0, ack 3141715422, win 0, length 0
01:42:45.677780 IP S1-anjo5726.cloud.33314 > L1-anjo5726.cloud.ssh: Flags [R.], seq 1, ack 1, win 1004, options [nop,nop,TS val 1930885779 ecr 3420221540], length 0
01:42:45.677849 IP S1-anjo5726.cloud.52198 > L1-anjo5726.cloud.domain: Flags [R.], seq 1, ack 1, win 1004, options [nop,nop,TS val 1930885779 ecr 3420221540], length 0
01:42:45.678142 IP S1-anjo5726.cloud.33276 > L1-anjo5726.cloud.pop3: Flags [S], seq 1268525454, win 64240, options [mss 1460,sackOK,TS val 1930885779 ecr 0,nop,wscale 6], length 0
01:42:45.678155 IP L1-anjo5726.cloud.pop3 > S1-anjo5726.cloud.33276: Flags [R.], seq 0, ack 1268525455, win 0, length 0
01:42:45.678357 IP S1-anjo5726.cloud.50544 > L1-anjo5726.cloud.1723: Flags [S], seq 3723441977, win 64240, options [mss 1460,sackOK,TS val 1930885779 ecr 0,nop,wscale 6], length 0
01:42:45.678357 IP S1-anjo5726.cloud.39176 > L1-anjo5726.cloud.exec: Flags [S], seq 2105988547, win 64240, options [mss 1460,sackOK,TS val 1930885779 ecr 0,nop,wscale 6], length 0
01:42:45.678370 IP L1-anjo5726.cloud.1723 > S1-anjo5726.cloud.50544: Flags [R.], seq 0, ack 3723441978, win 0, length 0
01:42:45.678383 IP L1-anjo5726.cloud.exec > S1-anjo5726.cloud.39176: Flags [R.], seq 0, ack 2105988548, win 0, length 0
01:42:45.678471 IP S1-anjo5726.cloud.60404 > L1-anjo5726.cloud.4998: Flags [S], seq 3937664510, win 64240, options [mss 1460,sackOK,TS val 1930885779 ecr 0,nop,wscale 6], length 0
01:42:45.678486 IP L1-anjo5726.cloud.4998 > S1-anjo5726.cloud.60404: Flags [R.], seq 0, ack 3937664511, win 0, length 0
01:42:45.678502 IP S1-anjo5726.cloud.38284 > L1-anjo5726.cloud.6901: Flags [S], seq 704633456, win 64240, options [mss 1460,sackOK,TS val 1930885779 ecr 0,nop,wscale 6], length 0
01:42:45.678503 IP S1-anjo5726.cloud.44996 > L1-anjo5726.cloud.8290: Flags [S], seq 4234022140, win 64240, options [mss 1460,sackOK,TS val 1930885779 ecr 0,nop,wscale 6], length 0
01:42:45.678516 IP L1-anjo5726.cloud.6901 > S1-anjo5726.cloud.38284: Flags [R.], seq 0, ack 704633457, win 0, length 0
01:42:45.678529 IP L1-anjo5726.cloud.8290 > S1-anjo5726.cloud.44996: Flags [R.], seq 0, ack 4234022141, win 0, length 0
01:42:45.678628 IP S1-anjo5726.cloud.40668 > L1-anjo5726.cloud.366: Flags [S], seq 1975338634, win 64240, options [mss 1460,sackOK,TS val 1930885780 ecr 0,nop,wscale 6], length 0
01:42:45.678637 IP L1-anjo5726.cloud.366 > S1-anjo5726.cloud.40668: Flags [R.], seq 0, ack 1975338635, win 0, length 0
01:42:45.678742 IP S1-anjo5726.cloud.34582 > L1-anjo5726.cloud.9002: Flags [S], seq 2610157139, win 64240, options [mss 1460,sackOK,TS val 1930885780 ecr 0,nop,wscale 6], length 0
01:42:45.678758 IP L1-anjo5726.cloud.9002 > S1-anjo5726.cloud.34582: Flags [R.], seq 0, ack 2610157140, win 0, length 0
01:42:45.678774 IP S1-anjo5726.cloud.53146 > L1-anjo5726.cloud.x11-1: Flags [S], seq 3061381754, win 64240, options [mss 1460,sackOK,TS val 1930885780 ecr 0,nop,wscale 6], length 0
01:42:45.678775 IP S1-anjo5726.cloud.58948 > L1-anjo5726.cloud.2048: Flags [S], seq 877528025, win 64240, options [mss 1460,sackOK,TS val 1930885780 ecr 0,nop,wscale 6], length 0
01:42:45.678788 IP L1-anjo5726.cloud.x11-1 > S1-anjo5726.cloud.53146: Flags [R.], seq 0, ack 3061381755, win 0, length 0
01:42:45.678801 IP L1-anjo5726.cloud.2048 > S1-anjo5726.cloud.58948: Flags [R.], seq 0, ack 877528026, win 0, length 0
01:42:45.678904 IP S1-anjo5726.cloud.46024 > L1-anjo5726.cloud.poppassd: Flags [S], seq 2475232112, win 64240, options [mss 1460,sackOK,TS val 1930885780 ecr 0,nop,wscale 6], length 0
01:42:45.678913 IP L1-anjo5726.cloud.poppassd > S1-anjo5726.cloud.46024: Flags [R.], seq 0, ack 2475232113, win 0, length 0
01:42:45.678953 IP S1-anjo5726.cloud.50924 > L1-anjo5726.cloud.4001: Flags [S], seq 1358331339, win 64240, options [mss 1460,sackOK,TS val 1930885780 ecr 0,nop,wscale 6], length 0
01:42:45.678961 IP L1-anjo5726.cloud.4001 > S1-anjo5726.cloud.50924: Flags [R.], seq 0, ack 1358331340, win 0, length 0
01:42:45.679066 IP S1-anjo5726.cloud.57696 > L1-anjo5726.cloud.7496: Flags [S], seq 3966233781, win 64240, options [mss 1460,sackOK,TS val 1930885780 ecr 0,nop,wscale 6], length 0
01:42:45.679075 IP L1-anjo5726.cloud.7496 > S1-anjo5726.cloud.57696: Flags [R.], seq 0, ack 3966233782, win 0, length 0
01:42:45.679287 IP S1-anjo5726.cloud.33874 > L1-anjo5726.cloud.49158: Flags [S], seq 987940304, win 64240, options [mss 1460,sackOK,TS val 1930885780 ecr 0,nop,wscale 6], length 0
01:42:45.679299 IP L1-anjo5726.cloud.49158 > S1-anjo5726.cloud.33874: Flags [R.], seq 0, ack 987940305, win 0, length 0
01:42:45.679339 IP S1-anjo5726.cloud.57908 > L1-anjo5726.cloud.1104: Flags [S], seq 2352132759, win 64240, options [mss 1460,sackOK,TS val 1930885780 ecr 0,nop,wscale 6], length 0
01:42:45.679349 IP L1-anjo5726.cloud.1104 > S1-anjo5726.cloud.57908: Flags [R.], seq 0, ack 2352132760, win 0, length 0
01:42:45.679468 IP S1-anjo5726.cloud.58058 > L1-anjo5726.cloud.55555: Flags [S], seq 1421679934, win 64240, options [mss 1460,sackOK,TS val 1930885780 ecr 0,nop,wscale 6], length 0
01:42:45.679480 IP L1-anjo5726.cloud.55555 > S1-anjo5726.cloud.58058: Flags [R.], seq 0, ack 1421679935, win 0, length 0
01:42:45.679518 IP S1-anjo5726.cloud.57314 > L1-anjo5726.cloud.2717: Flags [S], seq 3018877832, win 64240, options [mss 1460,sackOK,TS val 1930885780 ecr 0,nop,wscale 6], length 0
01:42:45.679526 IP L1-anjo5726.cloud.2717 > S1-anjo5726.cloud.57314: Flags [R.], seq 0, ack 3018877833, win 0, length 0
01:42:45.679592 IP S1-anjo5726.cloud.38398 > L1-anjo5726.cloud.4445: Flags [S], seq 4078384180, win 64240, options [mss 1460,sackOK,TS val 1930885781 ecr 0,nop,wscale 6], length 0
01:42:45.679600 IP L1-anjo5726.cloud.4445 > S1-anjo5726.cloud.38398: Flags [R.], seq 0, ack 4078384181, win 0, length 0
01:42:45.679708 IP S1-anjo5726.cloud.40570 > L1-anjo5726.cloud.44442: Flags [S], seq 1731345703, win 64240, options [mss 1460,sackOK,TS val 1930885781 ecr 0,nop,wscale 6], length 0
01:42:45.679717 IP L1-anjo5726.cloud.44442 > S1-anjo5726.cloud.40570: Flags [R.], seq 0, ack 1731345704, win 0, length 0
01:42:45.679765 IP S1-anjo5726.cloud.55068 > L1-anjo5726.cloud.6699: Flags [S], seq 2181806881, win 64240, options [mss 1460,sackOK,TS val 1930885781 ecr 0,nop,wscale 6], length 0
01:42:45.679773 IP L1-anjo5726.cloud.6699 > S1-anjo5726.cloud.55068: Flags [R.], seq 0, ack 2181806882, win 0, length 0
01:42:45.679877 IP S1-anjo5726.cloud.51146 > L1-anjo5726.cloud.6669: Flags [S], seq 2456012957, win 64240, options [mss 1460,sackOK,TS val 1930885781 ecr 0,nop,wscale 6], length 0
01:42:45.679887 IP L1-anjo5726.cloud.6669 > S1-anjo5726.cloud.51146: Flags [R.], seq 0, ack 2456012958, win 0, length 0
01:42:45.679944 IP S1-anjo5726.cloud.49316 > L1-anjo5726.cloud.4550: Flags [S], seq 505547340, win 64240, options [mss 1460,sackOK,TS val 1930885781 ecr 0,nop,wscale 6], length 0
01:42:45.679952 IP L1-anjo5726.cloud.4550 > S1-anjo5726.cloud.49316: Flags [R.], seq 0, ack 505547341, win 0, length 0
01:42:45.680034 IP S1-anjo5726.cloud.59050 > L1-anjo5726.cloud.5904: Flags [S], seq 3790146346, win 64240, options [mss 1460,sackOK,TS val 1930885781 ecr 0,nop,wscale 6], length 0
01:42:45.680044 IP L1-anjo5726.cloud.5904 > S1-anjo5726.cloud.59050: Flags [R.], seq 0, ack 3790146347, win 0, length 0
01:42:45.680121 IP S1-anjo5726.cloud.57044 > L1-anjo5726.cloud.2191: Flags [S], seq 3973009256, win 64240, options [mss 1460,sackOK,TS val 1930885781 ecr 0,nop,wscale 6], length 0
01:42:45.680148 IP L1-anjo5726.cloud.2191 > S1-anjo5726.cloud.57044: Flags [R.], seq 0, ack 3973009257, win 0, length 0
01:42:45.683245 IP S1-anjo5726.cloud.40990 > L1-anjo5726.cloud.3001: Flags [S], seq 442345739, win 64240, options [mss 1460,sackOK,TS val 1930885781 ecr 0,nop,wscale 6], length 0
01:42:45.683245 IP S1-anjo5726.cloud.57068 > L1-anjo5726.cloud.1971: Flags [S], seq 1942168175, win 64240, options [mss 1460,sackOK,TS val 1930885781 ecr 0,nop,wscale 6], length 0
01:42:45.683245 IP S1-anjo5726.cloud.47386 > L1-anjo5726.cloud.63331: Flags [S], seq 1655890744, win 64240, options [mss 1460,sackOK,TS val 1930885781 ecr 0,nop,wscale 6], length 0
01:42:45.683245 IP S1-anjo5726.cloud.44626 > L1-anjo5726.cloud.787: Flags [S], seq 3497979854, win 64240, options [mss 1460,sackOK,TS val 1930885781 ecr 0,nop,wscale 6], length 0
01:42:45.683245 IP S1-anjo5726.cloud.49008 > L1-anjo5726.cloud.32785: Flags [S], seq 1749510548, win 64240, options [mss 1460,sackOK,TS val 1930885781 ecr 0,nop,wscale 6], length 0
01:42:45.683245 IP S1-anjo5726.cloud.43628 > L1-anjo5726.cloud.8100: Flags [S], seq 4279370575, win 64240, options [mss 1460,sackOK,TS val 1930885781 ecr 0,nop,wscale 6], length 0
01:42:45.683245 IP S1-anjo5726.cloud.33750 > L1-anjo5726.cloud.1076: Flags [S], seq 53348819, win 64240, options [mss 1460,sackOK,TS val 1930885782 ecr 0,nop,wscale 6], length 0
01:42:45.683245 IP S1-anjo5726.cloud.42556 > L1-anjo5726.cloud.6646: Flags [S], seq 966070707, win 64240, options [mss 1460,sackOK,TS val 1930885782 ecr 0,nop,wscale 6], length 0
01:42:45.683264 IP L1-anjo5726.cloud.3001 > S1-anjo5726.cloud.40990: Flags [R.], seq 0, ack 442345740, win 0, length 0
01:42:45.683281 IP L1-anjo5726.cloud.1971 > S1-anjo5726.cloud.57068: Flags [R.], seq 0, ack 1942168176, win 0, length 0
01:42:45.683286 IP L1-anjo5726.cloud.63331 > S1-anjo5726.cloud.47386: Flags [R.], seq 0, ack 1655890745, win 0, length 0
01:42:45.683290 IP L1-anjo5726.cloud.787 > S1-anjo5726.cloud.44626: Flags [R.], seq 0, ack 3497979855, win 0, length 0
01:42:45.683294 IP L1-anjo5726.cloud.32785 > S1-anjo5726.cloud.49008: Flags [R.], seq 0, ack 1749510549, win 0, length 0
01:42:45.683299 IP L1-anjo5726.cloud.8100 > S1-anjo5726.cloud.43628: Flags [R.], seq 0, ack 4279370576, win 0, length 0
01:42:45.683303 IP L1-anjo5726.cloud.1076 > S1-anjo5726.cloud.33750: Flags [R.], seq 0, ack 53348820, win 0, length 0
01:42:45.683307 IP L1-anjo5726.cloud.6646 > S1-anjo5726.cloud.42556: Flags [R.], seq 0, ack 966070708, win 0, length 0
01:42:45.683336 IP S1-anjo5726.cloud.51450 > L1-anjo5726.cloud.1132: Flags [S], seq 1635702544, win 64240, options [mss 1460,sackOK,TS val 1930885782 ecr 0,nop,wscale 6], length 0
01:42:45.683336 IP S1-anjo5726.cloud.34882 > L1-anjo5726.cloud.5960: Flags [S], seq 131483192, win 64240, options [mss 1460,sackOK,TS val 1930885782 ecr 0,nop,wscale 6], length 0
01:42:45.683336 IP S1-anjo5726.cloud.36288 > L1-anjo5726.cloud.5033: Flags [S], seq 441164638, win 64240, options [mss 1460,sackOK,TS val 1930885782 ecr 0,nop,wscale 6], length 0
01:42:45.683336 IP S1-anjo5726.cloud.57090 > L1-anjo5726.cloud.6547: Flags [S], seq 1482955920, win 64240, options [mss 1460,sackOK,TS val 1930885782 ecr 0,nop,wscale 6], length 0
01:42:45.683336 IP S1-anjo5726.cloud.41724 > L1-anjo5726.cloud.8082: Flags [S], seq 1308138465, win 64240, options [mss 1460,sackOK,TS val 1930885782 ecr 0,nop,wscale 6], length 0
01:42:45.683336 IP S1-anjo5726.cloud.49684 > L1-anjo5726.cloud.1999: Flags [S], seq 4219191838, win 64240, options [mss 1460,sackOK,TS val 1930885782 ecr 0,nop,wscale 6], length 0
01:42:45.683336 IP S1-anjo5726.cloud.60554 > L1-anjo5726.cloud.5998: Flags [S], seq 102288124, win 64240, options [mss 1460,sackOK,TS val 1930885782 ecr 0,nop,wscale 6], length 0
01:42:45.683336 IP S1-anjo5726.cloud.34046 > L1-anjo5726.cloud.4567: Flags [S], seq 127618590, win 64240, options [mss 1460,sackOK,TS val 1930885782 ecr 0,nop,wscale 6], length 0
01:42:45.683346 IP L1-anjo5726.cloud.1132 > S1-anjo5726.cloud.51450: Flags [R.], seq 0, ack 1635702545, win 0, length 0
01:42:45.683372 IP L1-anjo5726.cloud.5960 > S1-anjo5726.cloud.34882: Flags [R.], seq 0, ack 131483193, win 0, length 0
01:42:45.683377 IP L1-anjo5726.cloud.5033 > S1-anjo5726.cloud.36288: Flags [R.], seq 0, ack 441164639, win 0, length 0
01:42:45.683382 IP L1-anjo5726.cloud.6547 > S1-anjo5726.cloud.57090: Flags [R.], seq 0, ack 1482955921, win 0, length 0
01:42:45.683386 IP L1-anjo5726.cloud.8082 > S1-anjo5726.cloud.41724: Flags [R.], seq 0, ack 1308138466, win 0, length 0
01:42:45.683391 IP L1-anjo5726.cloud.1999 > S1-anjo5726.cloud.49684: Flags [R.], seq 0, ack 4219191839, win 0, length 0
01:42:45.683395 IP L1-anjo5726.cloud.5998 > S1-anjo5726.cloud.60554: Flags [R.], seq 0, ack 102288125, win 0, length 0
01:42:45.683399 IP L1-anjo5726.cloud.4567 > S1-anjo5726.cloud.34046: Flags [R.], seq 0, ack 127618591, win 0, length 0
01:42:45.683417 IP S1-anjo5726.cloud.55588 > L1-anjo5726.cloud.1947: Flags [S], seq 4199909775, win 64240, options [mss 1460,sackOK,TS val 1930885782 ecr 0,nop,wscale 6], length 0
01:42:45.683418 IP S1-anjo5726.cloud.53216 > L1-anjo5726.cloud.1079: Flags [S], seq 1854176594, win 64240, options [mss 1460,sackOK,TS val 1930885783 ecr 0,nop,wscale 6], length 0
01:42:45.683418 IP S1-anjo5726.cloud.38436 > L1-anjo5726.cloud.7911: Flags [S], seq 3181814467, win 64240, options [mss 1460,sackOK,TS val 1930885783 ecr 0,nop,wscale 6], length 0
01:42:45.683418 IP S1-anjo5726.cloud.43840 > L1-anjo5726.cloud.1091: Flags [S], seq 1466065634, win 64240, options [mss 1460,sackOK,TS val 1930885783 ecr 0,nop,wscale 6], length 0
01:42:45.683418 IP S1-anjo5726.cloud.41124 > L1-anjo5726.cloud.amandaidx: Flags [S], seq 1384839091, win 64240, options [mss 1460,sackOK,TS val 1930885783 ecr 0,nop,wscale 6], length 0
01:42:45.683418 IP S1-anjo5726.cloud.53926 > L1-anjo5726.cloud.1100: Flags [S], seq 1853205083, win 64240, options [mss 1460,sackOK,TS val 1930885783 ecr 0,nop,wscale 6], length 0
01:42:45.683418 IP S1-anjo5726.cloud.53408 > L1-anjo5726.cloud.1062: Flags [S], seq 2219605496, win 64240, options [mss 1460,sackOK,TS val 1930885783 ecr 0,nop,wscale 6], length 0
01:42:45.683418 IP S1-anjo5726.cloud.34620 > L1-anjo5726.cloud.84: Flags [S], seq 1145422315, win 64240, options [mss 1460,sackOK,TS val 1930885783 ecr 0,nop,wscale 6], length 0
01:42:45.683427 IP L1-anjo5726.cloud.1947 > S1-anjo5726.cloud.55588: Flags [R.], seq 0, ack 4199909776, win 0, length 0
01:42:45.683432 IP L1-anjo5726.cloud.1079 > S1-anjo5726.cloud.53216: Flags [R.], seq 0, ack 1854176595, win 0, length 0
01:42:45.683436 IP L1-anjo5726.cloud.7911 > S1-anjo5726.cloud.38436: Flags [R.], seq 0, ack 3181814468, win 0, length 0
01:42:45.683441 IP L1-anjo5726.cloud.1091 > S1-anjo5726.cloud.43840: Flags [R.], seq 0, ack 1466065635, win 0, length 0
01:42:45.683445 IP L1-anjo5726.cloud.amandaidx > S1-anjo5726.cloud.41124: Flags [R.], seq 0, ack 1384839092, win 0, length 0
01:42:45.683449 IP L1-anjo5726.cloud.1100 > S1-anjo5726.cloud.53926: Flags [R.], seq 0, ack 1853205084, win 0, length 0
01:42:45.683453 IP L1-anjo5726.cloud.1062 > S1-anjo5726.cloud.53408: Flags [R.], seq 0, ack 2219605497, win 0, length 0
01:42:45.683458 IP L1-anjo5726.cloud.84 > S1-anjo5726.cloud.34620: Flags [R.], seq 0, ack 1145422316, win 0, length 0
01:42:45.683482 IP S1-anjo5726.cloud.44694 > L1-anjo5726.cloud.webmin: Flags [S], seq 3274539906, win 64240, options [mss 1460,sackOK,TS val 1930885783 ecr 0,nop,wscale 6], length 0
01:42:45.683482 IP S1-anjo5726.cloud.59738 > L1-anjo5726.cloud.ircd: Flags [S], seq 737565988, win 64240, options [mss 1460,sackOK,TS val 1930885783 ecr 0,nop,wscale 6], length 0
01:42:45.683483 IP S1-anjo5726.cloud.51354 > L1-anjo5726.cloud.8701: Flags [S], seq 71332592, win 64240, options [mss 1460,sackOK,TS val 1930885783 ecr 0,nop,wscale 6], length 0
01:42:45.683483 IP S1-anjo5726.cloud.47644 > L1-anjo5726.cloud.2200: Flags [S], seq 1782577119, win 64240, options [mss 1460,sackOK,TS val 1930885783 ecr 0,nop,wscale 6], length 0
01:42:45.683483 IP S1-anjo5726.cloud.54810 > L1-anjo5726.cloud.15660: Flags [S], seq 1883476630, win 64240, options [mss 1460,sackOK,TS val 1930885783 ecr 0,nop,wscale 6], length 0
01:42:45.683483 IP S1-anjo5726.cloud.37834 > L1-anjo5726.cloud.911: Flags [S], seq 1884578086, win 64240, options [mss 1460,sackOK,TS val 1930885783 ecr 0,nop,wscale 6], length 0
01:42:45.683483 IP S1-anjo5726.cloud.60628 > L1-anjo5726.cloud.2020: Flags [S], seq 3513584591, win 64240, options [mss 1460,sackOK,TS val 1930885783 ecr 0,nop,wscale 6], length 0
01:42:45.683483 IP S1-anjo5726.cloud.41564 > L1-anjo5726.cloud.2040: Flags [S], seq 1648115314, win 64240, options [mss 1460,sackOK,TS val 1930885783 ecr 0,nop,wscale 6], length 0
01:42:45.683496 IP L1-anjo5726.cloud.webmin > S1-anjo5726.cloud.44694: Flags [R.], seq 0, ack 3274539907, win 0, length 0
01:42:45.683520 IP L1-anjo5726.cloud.ircd > S1-anjo5726.cloud.59738: Flags [R.], seq 0, ack 737565989, win 0, length 0
01:42:45.683525 IP L1-anjo5726.cloud.8701 > S1-anjo5726.cloud.51354: Flags [R.], seq 0, ack 71332593, win 0, length 0
01:42:45.683530 IP L1-anjo5726.cloud.2200 > S1-anjo5726.cloud.47644: Flags [R.], seq 0, ack 1782577120, win 0, length 0
01:42:45.683534 IP L1-anjo5726.cloud.15660 > S1-anjo5726.cloud.54810: Flags [R.], seq 0, ack 1883476631, win 0, length 0
01:42:45.683538 IP L1-anjo5726.cloud.911 > S1-anjo5726.cloud.37834: Flags [R.], seq 0, ack 1884578087, win 0, length 0
01:42:45.683542 IP L1-anjo5726.cloud.2020 > S1-anjo5726.cloud.60628: Flags [R.], seq 0, ack 3513584592, win 0, length 0
01:42:45.683546 IP L1-anjo5726.cloud.2040 > S1-anjo5726.cloud.41564: Flags [R.], seq 0, ack 1648115315, win 0, length 0
01:42:45.683567 IP S1-anjo5726.cloud.33046 > L1-anjo5726.cloud.49165: Flags [S], seq 3924223077, win 64240, options [mss 1460,sackOK,TS val 1930885783 ecr 0,nop,wscale 6], length 0
01:42:45.683567 IP S1-anjo5726.cloud.41814 > L1-anjo5726.cloud.4004: Flags [S], seq 3197770291, win 64240, options [mss 1460,sackOK,TS val 1930885783 ecr 0,nop,wscale 6], length 0
01:42:45.683567 IP S1-anjo5726.cloud.60728 > L1-anjo5726.cloud.4279: Flags [S], seq 1994349820, win 64240, options [mss 1460,sackOK,TS val 1930885783 ecr 0,nop,wscale 6], length 0
01:42:45.683567 IP S1-anjo5726.cloud.37702 > L1-anjo5726.cloud.49153: Flags [S], seq 817811487, win 64240, options [mss 1460,sackOK,TS val 1930885784 ecr 0,nop,wscale 6], length 0
01:42:45.683567 IP S1-anjo5726.cloud.54512 > L1-anjo5726.cloud.1009: Flags [S], seq 87855013, win 64240, options [mss 1460,sackOK,TS val 1930885784 ecr 0,nop,wscale 6], length 0
01:42:45.683567 IP S1-anjo5726.cloud.54736 > L1-anjo5726.cloud.1105: Flags [S], seq 2877679250, win 64240, options [mss 1460,sackOK,TS val 1930885784 ecr 0,nop,wscale 6], length 0
01:42:45.683567 IP S1-anjo5726.cloud.34628 > L1-anjo5726.cloud.500: Flags [S], seq 607659284, win 64240, options [mss 1460,sackOK,TS val 1930885784 ecr 0,nop,wscale 6], length 0
01:42:45.683567 IP S1-anjo5726.cloud.49976 > L1-anjo5726.cloud.5963: Flags [S], seq 931367332, win 64240, options [mss 1460,sackOK,TS val 1930885784 ecr 0,nop,wscale 6], length 0
01:42:45.683576 IP L1-anjo5726.cloud.49165 > S1-anjo5726.cloud.33046: Flags [R.], seq 0, ack 3924223078, win 0, length 0
01:42:45.683581 IP L1-anjo5726.cloud.4004 > S1-anjo5726.cloud.41814: Flags [R.], seq 0, ack 3197770292, win 0, length 0
01:42:45.683586 IP L1-anjo5726.cloud.4279 > S1-anjo5726.cloud.60728: Flags [R.], seq 0, ack 1994349821, win 0, length 0
01:42:45.683590 IP L1-anjo5726.cloud.49153 > S1-anjo5726.cloud.37702: Flags [R.], seq 0, ack 817811488, win 0, length 0
01:42:45.683594 IP L1-anjo5726.cloud.1009 > S1-anjo5726.cloud.54512: Flags [R.], seq 0, ack 87855014, win 0, length 0
01:42:45.683599 IP L1-anjo5726.cloud.1105 > S1-anjo5726.cloud.54736: Flags [R.], seq 0, ack 2877679251, win 0, length 0
01:42:45.683603 IP L1-anjo5726.cloud.500 > S1-anjo5726.cloud.34628: Flags [R.], seq 0, ack 607659285, win 0, length 0
01:42:45.683607 IP L1-anjo5726.cloud.5963 > S1-anjo5726.cloud.49976: Flags [R.], seq 0, ack 931367333, win 0, length 0
01:42:45.683654 IP S1-anjo5726.cloud.44772 > L1-anjo5726.cloud.gopher: Flags [S], seq 1621578910, win 64240, options [mss 1460,sackOK,TS val 1930885784 ecr 0,nop,wscale 6], length 0
01:42:45.683654 IP S1-anjo5726.cloud.52990 > L1-anjo5726.cloud.1070: Flags [S], seq 1492431068, win 64240, options [mss 1460,sackOK,TS val 1930885784 ecr 0,nop,wscale 6], length 0
01:42:45.683654 IP S1-anjo5726.cloud.48132 > L1-anjo5726.cloud.14000: Flags [S], seq 1267617898, win 64240, options [mss 1460,sackOK,TS val 1930885784 ecr 0,nop,wscale 6], length 0
01:42:45.683654 IP S1-anjo5726.cloud.54270 > L1-anjo5726.cloud.35500: Flags [S], seq 1375524530, win 64240, options [mss 1460,sackOK,TS val 1930885784 ecr 0,nop,wscale 6], length 0
01:42:45.683655 IP S1-anjo5726.cloud.34310 > L1-anjo5726.cloud.4005: Flags [S], seq 1887186785, win 64240, options [mss 1460,sackOK,TS val 1930885784 ecr 0,nop,wscale 6], length 0
01:42:45.683655 IP S1-anjo5726.cloud.43928 > L1-anjo5726.cloud.18101: Flags [S], seq 825086767, win 64240, options [mss 1460,sackOK,TS val 1930885784 ecr 0,nop,wscale 6], length 0
01:42:45.683655 IP S1-anjo5726.cloud.40966 > L1-anjo5726.cloud.1043: Flags [S], seq 1299419523, win 64240, options [mss 1460,sackOK,TS val 1930885784 ecr 0,nop,wscale 6], length 0
01:42:45.683665 IP L1-anjo5726.cloud.gopher > S1-anjo5726.cloud.44772: Flags [R.], seq 0, ack 1621578911, win 0, length 0
01:42:45.683682 IP L1-anjo5726.cloud.1070 > S1-anjo5726.cloud.52990: Flags [R.], seq 0, ack 1492431069, win 0, length 0
01:42:45.683686 IP L1-anjo5726.cloud.14000 > S1-anjo5726.cloud.48132: Flags [R.], seq 0, ack 1267617899, win 0, length 0
01:42:45.683692 IP L1-anjo5726.cloud.35500 > S1-anjo5726.cloud.54270: Flags [R.], seq 0, ack 1375524531, win 0, length 0
01:42:45.683696 IP L1-anjo5726.cloud.4005 > S1-anjo5726.cloud.34310: Flags [R.], seq 0, ack 1887186786, win 0, length 0
01:42:45.683700 IP L1-anjo5726.cloud.18101 > S1-anjo5726.cloud.43928: Flags [R.], seq 0, ack 825086768, win 0, length 0
01:42:45.683705 IP L1-anjo5726.cloud.1043 > S1-anjo5726.cloud.40966: Flags [R.], seq 0, ack 1299419524, win 0, length 0
01:42:45.683861 IP S1-anjo5726.cloud.55046 > L1-anjo5726.cloud.50001: Flags [S], seq 2476433029, win 64240, options [mss 1460,sackOK,TS val 1930885785 ecr 0,nop,wscale 6], length 0
01:42:45.683874 IP L1-anjo5726.cloud.50001 > S1-anjo5726.cloud.55046: Flags [R.], seq 0, ack 2476433030, win 0, length 0
01:42:45.683916 IP S1-anjo5726.cloud.56060 > L1-anjo5726.cloud.18988: Flags [S], seq 1691084813, win 64240, options [mss 1460,sackOK,TS val 1930885785 ecr 0,nop,wscale 6], length 0
01:42:45.683924 IP L1-anjo5726.cloud.18988 > S1-anjo5726.cloud.56060: Flags [R.], seq 0, ack 1691084814, win 0, length 0
01:42:45.684003 IP S1-anjo5726.cloud.58592 > L1-anjo5726.cloud.10566: Flags [S], seq 1338907653, win 64240, options [mss 1460,sackOK,TS val 1930885785 ecr 0,nop,wscale 6], length 0
01:42:45.684013 IP L1-anjo5726.cloud.10566 > S1-anjo5726.cloud.58592: Flags [R.], seq 0, ack 1338907654, win 0, length 0
01:42:45.684075 IP S1-anjo5726.cloud.58910 > L1-anjo5726.cloud.6789: Flags [S], seq 4084532174, win 64240, options [mss 1460,sackOK,TS val 1930885785 ecr 0,nop,wscale 6], length 0
01:42:45.684085 IP L1-anjo5726.cloud.6789 > S1-anjo5726.cloud.58910: Flags [R.], seq 0, ack 4084532175, win 0, length 0
01:42:45.684180 IP S1-anjo5726.cloud.59658 > L1-anjo5726.cloud.24: Flags [S], seq 874444136, win 64240, options [mss 1460,sackOK,TS val 1930885785 ecr 0,nop,wscale 6], length 0
01:42:45.684192 IP L1-anjo5726.cloud.24 > S1-anjo5726.cloud.59658: Flags [R.], seq 0, ack 874444137, win 0, length 0
01:42:45.684233 IP S1-anjo5726.cloud.33158 > L1-anjo5726.cloud.1700: Flags [S], seq 668250623, win 64240, options [mss 1460,sackOK,TS val 1930885785 ecr 0,nop,wscale 6], length 0
01:42:45.684242 IP L1-anjo5726.cloud.1700 > S1-anjo5726.cloud.33158: Flags [R.], seq 0, ack 668250624, win 0, length 0
01:42:45.684312 IP S1-anjo5726.cloud.43152 > L1-anjo5726.cloud.1074: Flags [S], seq 3222899893, win 64240, options [mss 1460,sackOK,TS val 1930885785 ecr 0,nop,wscale 6], length 0
01:42:45.684322 IP L1-anjo5726.cloud.1074 > S1-anjo5726.cloud.43152: Flags [R.], seq 0, ack 3222899894, win 0, length 0
01:42:45.684383 IP S1-anjo5726.cloud.40454 > L1-anjo5726.cloud.9080: Flags [S], seq 4038293820, win 64240, options [mss 1460,sackOK,TS val 1930885785 ecr 0,nop,wscale 6], length 0
01:42:45.684393 IP L1-anjo5726.cloud.9080 > S1-anjo5726.cloud.40454: Flags [R.], seq 0, ack 4038293821, win 0, length 0
01:42:45.684484 IP S1-anjo5726.cloud.47920 > L1-anjo5726.cloud.3011: Flags [S], seq 3912057034, win 64240, options [mss 1460,sackOK,TS val 1930885785 ecr 0,nop,wscale 6], length 0
01:42:45.684495 IP L1-anjo5726.cloud.3011 > S1-anjo5726.cloud.47920: Flags [R.], seq 0, ack 3912057035, win 0, length 0
01:42:45.684538 IP S1-anjo5726.cloud.52948 > L1-anjo5726.cloud.4111: Flags [S], seq 3817894762, win 64240, options [mss 1460,sackOK,TS val 1930885786 ecr 0,nop,wscale 6], length 0
01:42:45.684546 IP L1-anjo5726.cloud.4111 > S1-anjo5726.cloud.52948: Flags [R.], seq 0, ack 3817894763, win 0, length 0
01:42:45.684645 IP S1-anjo5726.cloud.35914 > L1-anjo5726.cloud.8383: Flags [S], seq 3087560944, win 64240, options [mss 1460,sackOK,TS val 1930885786 ecr 0,nop,wscale 6], length 0
01:42:45.684657 IP L1-anjo5726.cloud.8383 > S1-anjo5726.cloud.35914: Flags [R.], seq 0, ack 3087560945, win 0, length 0
01:42:45.684698 IP S1-anjo5726.cloud.51392 > L1-anjo5726.cloud.49400: Flags [S], seq 745191254, win 64240, options [mss 1460,sackOK,TS val 1930885786 ecr 0,nop,wscale 6], length 0
01:42:45.684706 IP L1-anjo5726.cloud.49400 > S1-anjo5726.cloud.51392: Flags [R.], seq 0, ack 745191255, win 0, length 0
01:42:45.684793 IP S1-anjo5726.cloud.55764 > L1-anjo5726.cloud.3000: Flags [S], seq 1913716995, win 64240, options [mss 1460,sackOK,TS val 1930885786 ecr 0,nop,wscale 6], length 0
01:42:45.684803 IP L1-anjo5726.cloud.3000 > S1-anjo5726.cloud.55764: Flags [R.], seq 0, ack 1913716996, win 0, length 0
01:42:45.685560 IP S1-anjo5726.cloud.37090 > L1-anjo5726.cloud.50000: Flags [S], seq 4038299300, win 64240, options [mss 1460,sackOK,TS val 1930885787 ecr 0,nop,wscale 6], length 0
01:42:45.685573 IP L1-anjo5726.cloud.50000 > S1-anjo5726.cloud.37090: Flags [R.], seq 0, ack 4038299301, win 0, length 0
01:42:45.685620 IP S1-anjo5726.cloud.52946 > L1-anjo5726.cloud.903: Flags [S], seq 71879546, win 64240, options [mss 1460,sackOK,TS val 1930885787 ecr 0,nop,wscale 6], length 0
01:42:45.685629 IP L1-anjo5726.cloud.903 > S1-anjo5726.cloud.52946: Flags [R.], seq 0, ack 71879547, win 0, length 0
01:42:45.685683 IP S1-anjo5726.cloud.58754 > L1-anjo5726.cloud.42: Flags [S], seq 324636783, win 64240, options [mss 1460,sackOK,TS val 1930885787 ecr 0,nop,wscale 6], length 0
01:42:45.685692 IP L1-anjo5726.cloud.42 > S1-anjo5726.cloud.58754: Flags [R.], seq 0, ack 324636784, win 0, length 0
01:42:45.685781 IP S1-anjo5726.cloud.45306 > L1-anjo5726.cloud.49175: Flags [S], seq 3342142167, win 64240, options [mss 1460,sackOK,TS val 1930885787 ecr 0,nop,wscale 6], length 0
01:42:45.685792 IP L1-anjo5726.cloud.49175 > S1-anjo5726.cloud.45306: Flags [R.], seq 0, ack 3342142168, win 0, length 0
01:42:45.685839 IP S1-anjo5726.cloud.36266 > L1-anjo5726.cloud.2007: Flags [S], seq 1487370428, win 64240, options [mss 1460,sackOK,TS val 1930885787 ecr 0,nop,wscale 6], length 0
01:42:45.685848 IP L1-anjo5726.cloud.2007 > S1-anjo5726.cloud.36266: Flags [R.], seq 0, ack 1487370429, win 0, length 0
01:42:45.685947 IP S1-anjo5726.cloud.37716 > L1-anjo5726.cloud.4129: Flags [S], seq 562320566, win 64240, options [mss 1460,sackOK,TS val 1930885787 ecr 0,nop,wscale 6], length 0
01:42:45.685959 IP L1-anjo5726.cloud.4129 > S1-anjo5726.cloud.37716: Flags [R.], seq 0, ack 562320567, win 0, length 0
01:42:45.685995 IP S1-anjo5726.cloud.38408 > L1-anjo5726.cloud.9071: Flags [S], seq 2588903234, win 64240, options [mss 1460,sackOK,TS val 1930885787 ecr 0,nop,wscale 6], length 0
01:42:45.686003 IP L1-anjo5726.cloud.9071 > S1-anjo5726.cloud.38408: Flags [R.], seq 0, ack 2588903235, win 0, length 0
01:42:45.686093 IP S1-anjo5726.cloud.46836 > L1-anjo5726.cloud.3031: Flags [S], seq 803790742, win 64240, options [mss 1460,sackOK,TS val 1930885787 ecr 0,nop,wscale 6], length 0
01:42:45.686104 IP L1-anjo5726.cloud.3031 > S1-anjo5726.cloud.46836: Flags [R.], seq 0, ack 803790743, win 0, length 0
01:42:45.686164 IP S1-anjo5726.cloud.42378 > L1-anjo5726.cloud.socks: Flags [S], seq 4188341966, win 64240, options [mss 1460,sackOK,TS val 1930885787 ecr 0,nop,wscale 6], length 0
01:42:45.686178 IP L1-anjo5726.cloud.socks > S1-anjo5726.cloud.42378: Flags [R.], seq 0, ack 4188341967, win 0, length 0
01:42:45.686231 IP S1-anjo5726.cloud.49140 > L1-anjo5726.cloud.8194: Flags [S], seq 2840890260, win 64240, options [mss 1460,sackOK,TS val 1930885787 ecr 0,nop,wscale 6], length 0
01:42:45.686239 IP L1-anjo5726.cloud.8194 > S1-anjo5726.cloud.49140: Flags [R.], seq 0, ack 2840890261, win 0, length 0
01:42:45.686349 IP S1-anjo5726.cloud.57802 > L1-anjo5726.cloud.31337: Flags [S], seq 3184104165, win 64240, options [mss 1460,sackOK,TS val 1930885787 ecr 0,nop,wscale 6], length 0
01:42:45.686359 IP L1-anjo5726.cloud.31337 > S1-anjo5726.cloud.57802: Flags [R.], seq 0, ack 3184104166, win 0, length 0
01:42:45.686405 IP S1-anjo5726.cloud.56754 > L1-anjo5726.cloud.5000: Flags [S], seq 2522725648, win 64240, options [mss 1460,sackOK,TS val 1930885787 ecr 0,nop,wscale 6], length 0
01:42:45.686414 IP L1-anjo5726.cloud.5000 > S1-anjo5726.cloud.56754: Flags [R.], seq 0, ack 2522725649, win 0, length 0
01:42:45.686491 IP S1-anjo5726.cloud.56208 > L1-anjo5726.cloud.34572: Flags [S], seq 270515903, win 64240, options [mss 1460,sackOK,TS val 1930885787 ecr 0,nop,wscale 6], length 0
01:42:45.686501 IP L1-anjo5726.cloud.34572 > S1-anjo5726.cloud.56208: Flags [R.], seq 0, ack 270515904, win 0, length 0
01:42:45.686556 IP S1-anjo5726.cloud.43488 > L1-anjo5726.cloud.6567: Flags [S], seq 3877269782, win 64240, options [mss 1460,sackOK,TS val 1930885788 ecr 0,nop,wscale 6], length 0
01:42:45.686565 IP L1-anjo5726.cloud.6567 > S1-anjo5726.cloud.43488: Flags [R.], seq 0, ack 3877269783, win 0, length 0
