01:09:28.121722 ARP, Request who-has L1-anjo5726.cloud tell S1-anjo5726.cloud, length 28
01:09:28.121750 ARP, Reply L1-anjo5726.cloud is-at 02:00:ac:10:00:10 (oui Unknown), length 28
01:09:28.125117 IP S1-anjo5726.cloud.33822 > L1-anjo5726.cloud.ms-wbt-server: Flags [S], seq 2530371907, win 1024, options [mss 1460], length 0
01:09:28.125117 IP S1-anjo5726.cloud.33822 > L1-anjo5726.cloud.submission: Flags [S], seq 2530371907, win 1024, options [mss 1460], length 0
01:09:28.125117 IP S1-anjo5726.cloud.33822 > L1-anjo5726.cloud.8888: Flags [S], seq 2530371907, win 1024, options [mss 1460], length 0
01:09:28.125117 IP S1-anjo5726.cloud.33822 > L1-anjo5726.cloud.mysql: Flags [S], seq 2530371907, win 1024, options [mss 1460], length 0
01:09:28.125117 IP S1-anjo5726.cloud.33822 > L1-anjo5726.cloud.rtsp: Flags [S], seq 2530371907, win 1024, options [mss 1460], length 0
01:09:28.125117 IP S1-anjo5726.cloud.33822 > L1-anjo5726.cloud.ssh: Flags [S], seq 2530371907, win 1024, options [mss 1460], length 0
01:09:28.125117 IP S1-anjo5726.cloud.33822 > L1-anjo5726.cloud.pop3: Flags [S], seq 2530371907, win 1024, options [mss 1460], length 0
01:09:28.125117 IP S1-anjo5726.cloud.33822 > L1-anjo5726.cloud.1723: Flags [S], seq 2530371907, win 1024, options [mss 1460], length 0
01:09:28.125158 IP L1-anjo5726.cloud.ms-wbt-server > S1-anjo5726.cloud.33822: Flags [R.], seq 0, ack 2530371908, win 0, length 0
01:09:28.125186 IP L1-anjo5726.cloud.submission > S1-anjo5726.cloud.33822: Flags [R.], seq 0, ack 2530371908, win 0, length 0
01:09:28.125192 IP L1-anjo5726.cloud.8888 > S1-anjo5726.cloud.33822: Flags [R.], seq 0, ack 2530371908, win 0, length 0
01:09:28.125196 IP L1-anjo5726.cloud.mysql > S1-anjo5726.cloud.33822: Flags [R.], seq 0, ack 2530371908, win 0, length 0
01:09:28.125214 IP L1-anjo5726.cloud.rtsp > S1-anjo5726.cloud.33822: Flags [R.], seq 0, ack 2530371908, win 0, length 0
01:09:28.125237 IP L1-anjo5726.cloud.ssh > S1-anjo5726.cloud.33822: Flags [S.], seq 785859528, ack 2530371908, win 64240, options [mss 1460], length 0
01:09:28.125247 IP L1-anjo5726.cloud.pop3 > S1-anjo5726.cloud.33822: Flags [R.], seq 0, ack 2530371908, win 0, length 0
01:09:28.125256 IP L1-anjo5726.cloud.1723 > S1-anjo5726.cloud.33822: Flags [R.], seq 0, ack 2530371908, win 0, length 0
01:09:28.125264 IP S1-anjo5726.cloud.33822 > L1-anjo5726.cloud.http: Flags [S], seq 2530371907, win 1024, options [mss 1460], length 0
01:09:28.125264 IP S1-anjo5726.cloud.33822 > L1-anjo5726.cloud.5900: Flags [S], seq 2530371907, win 1024, options [mss 1460], length 0
01:09:28.125293 IP L1-anjo5726.cloud.http > S1-anjo5726.cloud.33822: Flags [S.], seq 1495368457, ack 2530371908, win 64240, options [mss 1460], length 0
01:09:28.125328 IP L1-anjo5726.cloud.5900 > S1-anjo5726.cloud.33822: Flags [R.], seq 0, ack 2530371908, win 0, length 0
01:09:28.125416 IP S1-anjo5726.cloud.33822 > L1-anjo5726.cloud.ssh: Flags [R], seq 2530371908, win 0, length 0
01:09:28.125416 IP S1-anjo5726.cloud.33822 > L1-anjo5726.cloud.http: Flags [R], seq 2530371908, win 0, length 0
01:09:28.125628 IP S1-anjo5726.cloud.33822 > L1-anjo5726.cloud.sunrpc: Flags [S], seq 2530371907, win 1024, options [mss 1460], length 0
01:09:28.125628 IP S1-anjo5726.cloud.33822 > L1-anjo5726.cloud.256: Flags [S], seq 2530371907, win 1024, options [mss 1460], length 0
01:09:28.125629 IP S1-anjo5726.cloud.33822 > L1-anjo5726.cloud.microsoft-ds: Flags [S], seq 2530371907, win 1024, options [mss 1460], length 0
01:09:28.125629 IP S1-anjo5726.cloud.33822 > L1-anjo5726.cloud.imaps: Flags [S], seq 2530371907, win 1024, options [mss 1460], length 0
01:09:28.125629 IP S1-anjo5726.cloud.33822 > L1-anjo5726.cloud.pop3s: Flags [S], seq 2530371907, win 1024, options [mss 1460], length 0
01:09:28.125662 IP L1-anjo5726.cloud.sunrpc > S1-anjo5726.cloud.33822: Flags [S.], seq 3845869042, ack 2530371908, win 64240, options [mss 1460], length 0
01:09:28.125683 IP L1-anjo5726.cloud.256 > S1-anjo5726.cloud.33822: Flags [R.], seq 0, ack 2530371908, win 0, length 0
01:09:28.125688 IP L1-anjo5726.cloud.microsoft-ds > S1-anjo5726.cloud.33822: Flags [R.], seq 0, ack 2530371908, win 0, length 0
01:09:28.125693 IP L1-anjo5726.cloud.imaps > S1-anjo5726.cloud.33822: Flags [R.], seq 0, ack 2530371908, win 0, length 0
01:09:28.125697 IP L1-anjo5726.cloud.pop3s > S1-anjo5726.cloud.33822: Flags [R.], seq 0, ack 2530371908, win 0, length 0
01:09:28.125703 IP S1-anjo5726.cloud.33822 > L1-anjo5726.cloud.domain: Flags [S], seq 2530371907, win 1024, options [mss 1460], length 0
01:09:28.125703 IP S1-anjo5726.cloud.33822 > L1-anjo5726.cloud.telnet: Flags [S], seq 2530371907, win 1024, options [mss 1460], length 0
01:09:28.125704 IP S1-anjo5726.cloud.33822 > L1-anjo5726.cloud.epmap: Flags [S], seq 2530371907, win 1024, options [mss 1460], length 0
01:09:28.125704 IP S1-anjo5726.cloud.33822 > L1-anjo5726.cloud.smtp: Flags [S], seq 2530371907, win 1024, options [mss 1460], length 0
01:09:28.125730 IP L1-anjo5726.cloud.domain > S1-anjo5726.cloud.33822: Flags [S.], seq 937330040, ack 2530371908, win 64240, options [mss 1460], length 0
01:09:28.125745 IP L1-anjo5726.cloud.telnet > S1-anjo5726.cloud.33822: Flags [R.], seq 0, ack 2530371908, win 0, length 0
01:09:28.125750 IP L1-anjo5726.cloud.epmap > S1-anjo5726.cloud.33822: Flags [R.], seq 0, ack 2530371908, win 0, length 0
01:09:28.125757 IP L1-anjo5726.cloud.smtp > S1-anjo5726.cloud.33822: Flags [S.], seq 3167180256, ack 2530371908, win 64240, options [mss 1460], length 0
01:09:28.125777 IP S1-anjo5726.cloud.33822 > L1-anjo5726.cloud.netbios-ssn: Flags [S], seq 2530371907, win 1024, options [mss 1460], length 0
01:09:28.125777 IP S1-anjo5726.cloud.33822 > L1-anjo5726.cloud.1720: Flags [S], seq 2530371907, win 1024, options [mss 1460], length 0
01:09:28.125777 IP S1-anjo5726.cloud.33822 > L1-anjo5726.cloud.smux: Flags [S], seq 2530371907, win 1024, options [mss 1460], length 0
01:09:28.125777 IP S1-anjo5726.cloud.33822 > L1-anjo5726.cloud.https: Flags [S], seq 2530371907, win 1024, options [mss 1460], length 0
01:09:28.125777 IP S1-anjo5726.cloud.33822 > L1-anjo5726.cloud.ftp: Flags [S], seq 2530371907, win 1024, options [mss 1460], length 0
01:09:28.125777 IP S1-anjo5726.cloud.33822 > L1-anjo5726.cloud.http-alt: Flags [S], seq 2530371907, win 1024, options [mss 1460], length 0
01:09:28.125777 IP S1-anjo5726.cloud.33822 > L1-anjo5726.cloud.auth: Flags [S], seq 2530371907, win 1024, options [mss 1460], length 0
01:09:28.125777 IP S1-anjo5726.cloud.33822 > L1-anjo5726.cloud.imap2: Flags [S], seq 2530371907, win 1024, options [mss 1460], length 0
01:09:28.125787 IP L1-anjo5726.cloud.netbios-ssn > S1-anjo5726.cloud.33822: Flags [R.], seq 0, ack 2530371908, win 0, length 0
01:09:28.125800 IP L1-anjo5726.cloud.1720 > S1-anjo5726.cloud.33822: Flags [R.], seq 0, ack 2530371908, win 0, length 0
01:09:28.125804 IP L1-anjo5726.cloud.smux > S1-anjo5726.cloud.33822: Flags [R.], seq 0, ack 2530371908, win 0, length 0
01:09:28.125808 IP L1-anjo5726.cloud.https > S1-anjo5726.cloud.33822: Flags [R.], seq 0, ack 2530371908, win 0, length 0
01:09:28.125816 IP L1-anjo5726.cloud.ftp > S1-anjo5726.cloud.33822: Flags [S.], seq 2844622519, ack 2530371908, win 64240, options [mss 1460], length 0
01:09:28.125821 IP L1-anjo5726.cloud.http-alt > S1-anjo5726.cloud.33822: Flags [R.], seq 0, ack 2530371908, win 0, length 0
01:09:28.125825 IP L1-anjo5726.cloud.auth > S1-anjo5726.cloud.33822: Flags [R.], seq 0, ack 2530371908, win 0, length 0
01:09:28.125829 IP L1-anjo5726.cloud.imap2 > S1-anjo5726.cloud.33822: Flags [R.], seq 0, ack 2530371908, win 0, length 0
01:09:28.125856 IP S1-anjo5726.cloud.33822 > L1-anjo5726.cloud.1025: Flags [S], seq 2530371907, win 1024, options [mss 1460], length 0
01:09:28.125857 IP S1-anjo5726.cloud.33822 > L1-anjo5726.cloud.3006: Flags [S], seq 2530371907, win 1024, options [mss 1460], length 0
01:09:28.125857 IP S1-anjo5726.cloud.33822 > L1-anjo5726.cloud.366: Flags [S], seq 2530371907, win 1024, options [mss 1460], length 0
01:09:28.125863 IP L1-anjo5726.cloud.1025 > S1-anjo5726.cloud.33822: Flags [R.], seq 0, ack 2530371908, win 0, length 0
01:09:28.125886 IP L1-anjo5726.cloud.3006 > S1-anjo5726.cloud.33822: Flags [R.], seq 0, ack 2530371908, win 0, length 0
01:09:28.125891 IP L1-anjo5726.cloud.366 > S1-anjo5726.cloud.33822: Flags [R.], seq 0, ack 2530371908, win 0, length 0
01:09:28.125919 IP S1-anjo5726.cloud.33822 > L1-anjo5726.cloud.sunrpc: Flags [R], seq 2530371908, win 0, length 0
01:09:28.125919 IP S1-anjo5726.cloud.33822 > L1-anjo5726.cloud.domain: Flags [R], seq 2530371908, win 0, length 0
01:09:28.126073 IP S1-anjo5726.cloud.33822 > L1-anjo5726.cloud.smtp: Flags [R], seq 2530371908, win 0, length 0
01:09:28.126073 IP S1-anjo5726.cloud.33822 > L1-anjo5726.cloud.ftp: Flags [R], seq 2530371908, win 0, length 0
01:09:28.126384 IP S1-anjo5726.cloud.33822 > L1-anjo5726.cloud.9943: Flags [S], seq 2530371907, win 1024, options [mss 1460], length 0
01:09:28.126384 IP S1-anjo5726.cloud.33822 > L1-anjo5726.cloud.44442: Flags [S], seq 2530371907, win 1024, options [mss 1460], length 0
01:09:28.126402 IP L1-anjo5726.cloud.9943 > S1-anjo5726.cloud.33822: Flags [R.], seq 0, ack 2530371908, win 0, length 0
01:09:28.126422 IP L1-anjo5726.cloud.44442 > S1-anjo5726.cloud.33822: Flags [R.], seq 0, ack 2530371908, win 0, length 0
01:09:28.126462 IP S1-anjo5726.cloud.33822 > L1-anjo5726.cloud.omniorb: Flags [S], seq 2530371907, win 1024, options [mss 1460], length 0
01:09:28.126470 IP L1-anjo5726.cloud.omniorb > S1-anjo5726.cloud.33822: Flags [R.], seq 0, ack 2530371908, win 0, length 0
01:09:28.126608 IP S1-anjo5726.cloud.33822 > L1-anjo5726.cloud.1213: Flags [S], seq 2530371907, win 1024, options [mss 1460], length 0
01:09:28.126608 IP S1-anjo5726.cloud.33822 > L1-anjo5726.cloud.5998: Flags [S], seq 2530371907, win 1024, options [mss 1460], length 0
01:09:28.126633 IP L1-anjo5726.cloud.1213 > S1-anjo5726.cloud.33822: Flags [R.], seq 0, ack 2530371908, win 0, length 0
01:09:28.126651 IP L1-anjo5726.cloud.5998 > S1-anjo5726.cloud.33822: Flags [R.], seq 0, ack 2530371908, win 0, length 0
01:09:28.126657 IP S1-anjo5726.cloud.33822 > L1-anjo5726.cloud.7025: Flags [S], seq 2530371907, win 1024, options [mss 1460], length 0
01:09:28.126657 IP S1-anjo5726.cloud.33822 > L1-anjo5726.cloud.60020: Flags [S], seq 2530371907, win 1024, options [mss 1460], length 0
01:09:28.126663 IP L1-anjo5726.cloud.7025 > S1-anjo5726.cloud.33822: Flags [R.], seq 0, ack 2530371908, win 0, length 0
01:09:28.126668 IP L1-anjo5726.cloud.60020 > S1-anjo5726.cloud.33822: Flags [R.], seq 0, ack 2530371908, win 0, length 0
01:09:28.126713 IP S1-anjo5726.cloud.33822 > L1-anjo5726.cloud.34573: Flags [S], seq 2530371907, win 1024, options [mss 1460], length 0
01:09:28.126713 IP S1-anjo5726.cloud.33822 > L1-anjo5726.cloud.17877: Flags [S], seq 2530371907, win 1024, options [mss 1460], length 0
01:09:28.126713 IP S1-anjo5726.cloud.33822 > L1-anjo5726.cloud.8100: Flags [S], seq 2530371907, win 1024, options [mss 1460], length 0
01:09:28.126714 IP S1-anjo5726.cloud.33822 > L1-anjo5726.cloud.27715: Flags [S], seq 2530371907, win 1024, options [mss 1460], length 0
01:09:28.126722 IP L1-anjo5726.cloud.34573 > S1-anjo5726.cloud.33822: Flags [R.], seq 0, ack 2530371908, win 0, length 0
01:09:28.126740 IP L1-anjo5726.cloud.17877 > S1-anjo5726.cloud.33822: Flags [R.], seq 0, ack 2530371908, win 0, length 0
01:09:28.126745 IP L1-anjo5726.cloud.8100 > S1-anjo5726.cloud.33822: Flags [R.], seq 0, ack 2530371908, win 0, length 0
01:09:28.126749 IP L1-anjo5726.cloud.27715 > S1-anjo5726.cloud.33822: Flags [R.], seq 0, ack 2530371908, win 0, length 0
01:09:28.126753 IP S1-anjo5726.cloud.33822 > L1-anjo5726.cloud.git: Flags [S], seq 2530371907, win 1024, options [mss 1460], length 0
01:09:28.126758 IP L1-anjo5726.cloud.git > S1-anjo5726.cloud.33822: Flags [R.], seq 0, ack 2530371908, win 0, length 0
01:09:28.126796 IP S1-anjo5726.cloud.33822 > L1-anjo5726.cloud.1098: Flags [S], seq 2530371907, win 1024, options [mss 1460], length 0
01:09:28.126802 IP L1-anjo5726.cloud.1098 > S1-anjo5726.cloud.33822: Flags [R.], seq 0, ack 2530371908, win 0, length 0
01:09:28.126850 IP S1-anjo5726.cloud.33822 > L1-anjo5726.cloud.2967: Flags [S], seq 2530371907, win 1024, options [mss 1460], length 0
01:09:28.126856 IP L1-anjo5726.cloud.2967 > S1-anjo5726.cloud.33822: Flags [R.], seq 0, ack 2530371908, win 0, length 0
01:09:28.127096 IP S1-anjo5726.cloud.33822 > L1-anjo5726.cloud.2701: Flags [S], seq 2530371907, win 1024, options [mss 1460], length 0
01:09:28.127097 IP S1-anjo5726.cloud.33822 > L1-anjo5726.cloud.13783: Flags [S], seq 2530371907, win 1024, options [mss 1460], length 0
01:09:28.127125 IP L1-anjo5726.cloud.2701 > S1-anjo5726.cloud.33822: Flags [R.], seq 0, ack 2530371908, win 0, length 0
01:09:28.127139 IP L1-anjo5726.cloud.13783 > S1-anjo5726.cloud.33822: Flags [R.], seq 0, ack 2530371908, win 0, length 0
01:09:28.127145 IP S1-anjo5726.cloud.33822 > L1-anjo5726.cloud.3527: Flags [S], seq 2530371907, win 1024, options [mss 1460], length 0
01:09:28.127145 IP S1-anjo5726.cloud.33822 > L1-anjo5726.cloud.1045: Flags [S], seq 2530371907, win 1024, options [mss 1460], length 0
01:09:28.127150 IP L1-anjo5726.cloud.3527 > S1-anjo5726.cloud.33822: Flags [R.], seq 0, ack 2530371908, win 0, length 0
01:09:28.127154 IP L1-anjo5726.cloud.1045 > S1-anjo5726.cloud.33822: Flags [R.], seq 0, ack 2530371908, win 0, length 0
01:09:28.127201 IP S1-anjo5726.cloud.33822 > L1-anjo5726.cloud.2021: Flags [S], seq 2530371907, win 1024, options [mss 1460], length 0
01:09:28.127201 IP S1-anjo5726.cloud.33822 > L1-anjo5726.cloud.1056: Flags [S], seq 2530371907, win 1024, options [mss 1460], length 0
01:09:28.127201 IP S1-anjo5726.cloud.33822 > L1-anjo5726.cloud.3784: Flags [S], seq 2530371907, win 1024, options [mss 1460], length 0
01:09:28.127209 IP L1-anjo5726.cloud.2021 > S1-anjo5726.cloud.33822: Flags [R.], seq 0, ack 2530371908, win 0, length 0
01:09:28.127223 IP L1-anjo5726.cloud.1056 > S1-anjo5726.cloud.33822: Flags [R.], seq 0, ack 2530371908, win 0, length 0
01:09:28.127227 IP L1-anjo5726.cloud.3784 > S1-anjo5726.cloud.33822: Flags [R.], seq 0, ack 2530371908, win 0, length 0
01:09:28.127273 IP S1-anjo5726.cloud.33822 > L1-anjo5726.cloud.2126: Flags [S], seq 2530371907, win 1024, options [mss 1460], length 0
01:09:28.127279 IP L1-anjo5726.cloud.2126 > S1-anjo5726.cloud.33822: Flags [R.], seq 0, ack 2530371908, win 0, length 0
01:09:28.127295 IP S1-anjo5726.cloud.33822 > L1-anjo5726.cloud.cisco-sccp: Flags [S], seq 2530371907, win 1024, options [mss 1460], length 0
01:09:28.127300 IP L1-anjo5726.cloud.cisco-sccp > S1-anjo5726.cloud.33822: Flags [R.], seq 0, ack 2530371908, win 0, length 0
01:09:28.127321 IP S1-anjo5726.cloud.33822 > L1-anjo5726.cloud.541: Flags [S], seq 2530371907, win 1024, options [mss 1460], length 0
01:09:28.127321 IP S1-anjo5726.cloud.33822 > L1-anjo5726.cloud.616: Flags [S], seq 2530371907, win 1024, options [mss 1460], length 0
01:09:28.127333 IP L1-anjo5726.cloud.541 > S1-anjo5726.cloud.33822: Flags [R.], seq 0, ack 2530371908, win 0, length 0
01:09:28.127344 IP L1-anjo5726.cloud.616 > S1-anjo5726.cloud.33822: Flags [R.], seq 0, ack 2530371908, win 0, length 0
01:09:28.127349 IP S1-anjo5726.cloud.33822 > L1-anjo5726.cloud.9220: Flags [S], seq 2530371907, win 1024, options [mss 1460], length 0
01:09:28.127349 IP S1-anjo5726.cloud.33822 > L1-anjo5726.cloud.720: Flags [S], seq 2530371907, win 1024, options [mss 1460], length 0
01:09:28.127354 IP L1-anjo5726.cloud.9220 > S1-anjo5726.cloud.33822: Flags [R.], seq 0, ack 2530371908, win 0, length 0
01:09:28.127378 IP L1-anjo5726.cloud.720 > S1-anjo5726.cloud.33822: Flags [R.], seq 0, ack 2530371908, win 0, length 0
01:09:28.127483 IP S1-anjo5726.cloud.33822 > L1-anjo5726.cloud.4445: Flags [S], seq 2530371907, win 1024, options [mss 1460], length 0
01:09:28.127483 IP S1-anjo5726.cloud.33822 > L1-anjo5726.cloud.3370: Flags [S], seq 2530371907, win 1024, options [mss 1460], length 0
01:09:28.127483 IP S1-anjo5726.cloud.33822 > L1-anjo5726.cloud.42: Flags [S], seq 2530371907, win 1024, options [mss 1460], length 0
01:09:28.127483 IP S1-anjo5726.cloud.33822 > L1-anjo5726.cloud.5902: Flags [S], seq 2530371907, win 1024, options [mss 1460], length 0
01:09:28.127495 IP L1-anjo5726.cloud.4445 > S1-anjo5726.cloud.33822: Flags [R.], seq 0, ack 2530371908, win 0, length 0
01:09:28.127509 IP L1-anjo5726.cloud.3370 > S1-anjo5726.cloud.33822: Flags [R.], seq 0, ack 2530371908, win 0, length 0
01:09:28.127513 IP L1-anjo5726.cloud.42 > S1-anjo5726.cloud.33822: Flags [R.], seq 0, ack 2530371908, win 0, length 0
01:09:28.127517 IP L1-anjo5726.cloud.5902 > S1-anjo5726.cloud.33822: Flags [R.], seq 0, ack 2530371908, win 0, length 0
01:09:28.127525 IP S1-anjo5726.cloud.33822 > L1-anjo5726.cloud.5999: Flags [S], seq 2530371907, win 1024, options [mss 1460], length 0
01:09:28.127525 IP S1-anjo5726.cloud.33822 > L1-anjo5726.cloud.1717: Flags [S], seq 2530371907, win 1024, options [mss 1460], length 0
01:09:28.127525 IP S1-anjo5726.cloud.33822 > L1-anjo5726.cloud.4343: Flags [S], seq 2530371907, win 1024, options [mss 1460], length 0
01:09:28.127531 IP L1-anjo5726.cloud.5999 > S1-anjo5726.cloud.33822: Flags [R.], seq 0, ack 2530371908, win 0, length 0
01:09:28.127562 IP L1-anjo5726.cloud.1717 > S1-anjo5726.cloud.33822: Flags [R.], seq 0, ack 2530371908, win 0, length 0
01:09:28.127567 IP L1-anjo5726.cloud.4343 > S1-anjo5726.cloud.33822: Flags [R.], seq 0, ack 2530371908, win 0, length 0
01:09:28.127572 IP S1-anjo5726.cloud.33822 > L1-anjo5726.cloud.668: Flags [S], seq 2530371907, win 1024, options [mss 1460], length 0
01:09:28.127572 IP S1-anjo5726.cloud.33822 > L1-anjo5726.cloud.2004: Flags [S], seq 2530371907, win 1024, options [mss 1460], length 0
01:09:28.127577 IP L1-anjo5726.cloud.668 > S1-anjo5726.cloud.33822: Flags [R.], seq 0, ack 2530371908, win 0, length 0
01:09:28.127581 IP L1-anjo5726.cloud.2004 > S1-anjo5726.cloud.33822: Flags [R.], seq 0, ack 2530371908, win 0, length 0
01:09:28.127613 IP S1-anjo5726.cloud.33822 > L1-anjo5726.cloud.8701: Flags [S], seq 2530371907, win 1024, options [mss 1460], length 0
01:09:28.127619 IP L1-anjo5726.cloud.8701 > S1-anjo5726.cloud.33822: Flags [R.], seq 0, ack 2530371908, win 0, length 0
01:09:28.127815 IP S1-anjo5726.cloud.33822 > L1-anjo5726.cloud.54328: Flags [S], seq 2530371907, win 1024, options [mss 1460], length 0
01:09:28.127815 IP S1-anjo5726.cloud.33822 > L1-anjo5726.cloud.3323: Flags [S], seq 2530371907, win 1024, options [mss 1460], length 0
01:09:28.127815 IP S1-anjo5726.cloud.33822 > L1-anjo5726.cloud.4005: Flags [S], seq 2530371907, win 1024, options [mss 1460], length 0
01:09:28.127834 IP L1-anjo5726.cloud.54328 > S1-anjo5726.cloud.33822: Flags [R.], seq 0, ack 2530371908, win 0, length 0
01:09:28.127854 IP L1-anjo5726.cloud.3323 > S1-anjo5726.cloud.33822: Flags [R.], seq 0, ack 2530371908, win 0, length 0
01:09:28.127859 IP L1-anjo5726.cloud.4005 > S1-anjo5726.cloud.33822: Flags [R.], seq 0, ack 2530371908, win 0, length 0
01:09:28.128258 IP S1-anjo5726.cloud.33822 > L1-anjo5726.cloud.32770: Flags [S], seq 2530371907, win 1024, options [mss 1460], length 0
01:09:28.128258 IP S1-anjo5726.cloud.33822 > L1-anjo5726.cloud.7002: Flags [S], seq 2530371907, win 1024, options [mss 1460], length 0
01:09:28.128258 IP S1-anjo5726.cloud.33822 > L1-anjo5726.cloud.52822: Flags [S], seq 2530371907, win 1024, options [mss 1460], length 0
01:09:28.128258 IP S1-anjo5726.cloud.33822 > L1-anjo5726.cloud.gris: Flags [S], seq 2530371907, win 1024, options [mss 1460], length 0
01:09:28.128258 IP S1-anjo5726.cloud.33822 > L1-anjo5726.cloud.1272: Flags [S], seq 2530371907, win 1024, options [mss 1460], length 0
01:09:28.128289 IP L1-anjo5726.cloud.32770 > S1-anjo5726.cloud.33822: Flags [R.], seq 0, ack 2530371908, win 0, length 0
01:09:28.128308 IP L1-anjo5726.cloud.7002 > S1-anjo5726.cloud.33822: Flags [R.], seq 0, ack 2530371908, win 0, length 0
01:09:28.128313 IP L1-anjo5726.cloud.52822 > S1-anjo5726.cloud.33822: Flags [R.], seq 0, ack 2530371908, win 0, length 0
01:09:28.128317 IP L1-anjo5726.cloud.gris > S1-anjo5726.cloud.33822: Flags [R.], seq 0, ack 2530371908, win 0, length 0
01:09:28.128321 IP L1-anjo5726.cloud.1272 > S1-anjo5726.cloud.33822: Flags [R.], seq 0, ack 2530371908, win 0, length 0
01:09:28.128327 IP S1-anjo5726.cloud.33822 > L1-anjo5726.cloud.3851: Flags [S], seq 2530371907, win 1024, options [mss 1460], length 0
01:09:28.128327 IP S1-anjo5726.cloud.33822 > L1-anjo5726.cloud.snpp: Flags [S], seq 2530371907, win 1024, options [mss 1460], length 0
01:09:28.128327 IP S1-anjo5726.cloud.33822 > L1-anjo5726.cloud.264: Flags [S], seq 2530371907, win 1024, options [mss 1460], length 0
01:09:28.128333 IP L1-anjo5726.cloud.3851 > S1-anjo5726.cloud.33822: Flags [R.], seq 0, ack 2530371908, win 0, length 0
01:09:28.128337 IP L1-anjo5726.cloud.snpp > S1-anjo5726.cloud.33822: Flags [R.], seq 0, ack 2530371908, win 0, length 0
01:09:28.128341 IP L1-anjo5726.cloud.264 > S1-anjo5726.cloud.33822: Flags [R.], seq 0, ack 2530371908, win 0, length 0
01:09:28.128461 IP S1-anjo5726.cloud.33822 > L1-anjo5726.cloud.1164: Flags [S], seq 2530371907, win 1024, options [mss 1460], length 0
01:09:28.128462 IP S1-anjo5726.cloud.33822 > L1-anjo5726.cloud.2160: Flags [S], seq 2530371907, win 1024, options [mss 1460], length 0
01:09:28.128462 IP S1-anjo5726.cloud.33822 > L1-anjo5726.cloud.5718: Flags [S], seq 2530371907, win 1024, options [mss 1460], length 0
01:09:28.128462 IP S1-anjo5726.cloud.33822 > L1-anjo5726.cloud.echo: Flags [S], seq 2530371907, win 1024, options [mss 1460], length 0
01:09:28.128462 IP S1-anjo5726.cloud.33822 > L1-anjo5726.cloud.2013: Flags [S], seq 2530371907, win 1024, options [mss 1460], length 0
01:09:28.128462 IP S1-anjo5726.cloud.33822 > L1-anjo5726.cloud.8873: Flags [S], seq 2530371907, win 1024, options [mss 1460], length 0
01:09:28.128462 IP S1-anjo5726.cloud.33822 > L1-anjo5726.cloud.8291: Flags [S], seq 2530371907, win 1024, options [mss 1460], length 0
01:09:28.128490 IP L1-anjo5726.cloud.1164 > S1-anjo5726.cloud.33822: Flags [R.], seq 0, ack 2530371908, win 0, length 0
01:09:28.128509 IP L1-anjo5726.cloud.2160 > S1-anjo5726.cloud.33822: Flags [R.], seq 0, ack 2530371908, win 0, length 0
01:09:28.128514 IP L1-anjo5726.cloud.5718 > S1-anjo5726.cloud.33822: Flags [R.], seq 0, ack 2530371908, win 0, length 0
01:09:28.128518 IP L1-anjo5726.cloud.echo > S1-anjo5726.cloud.33822: Flags [R.], seq 0, ack 2530371908, win 0, length 0
01:09:28.128525 IP L1-anjo5726.cloud.2013 > S1-anjo5726.cloud.33822: Flags [R.], seq 0, ack 2530371908, win 0, length 0
01:09:28.128533 IP L1-anjo5726.cloud.8873 > S1-anjo5726.cloud.33822: Flags [R.], seq 0, ack 2530371908, win 0, length 0
01:09:28.128575 IP L1-anjo5726.cloud.8291 > S1-anjo5726.cloud.33822: Flags [R.], seq 0, ack 2530371908, win 0, length 0
01:09:28.128594 IP S1-anjo5726.cloud.33822 > L1-anjo5726.cloud.19101: Flags [S], seq 2530371907, win 1024, options [mss 1460], length 0
01:09:28.128594 IP S1-anjo5726.cloud.33822 > L1-anjo5726.cloud.1072: Flags [S], seq 2530371907, win 1024, options [mss 1460], length 0
01:09:28.128594 IP S1-anjo5726.cloud.33822 > L1-anjo5726.cloud.5822: Flags [S], seq 2530371907, win 1024, options [mss 1460], length 0
01:09:28.128594 IP S1-anjo5726.cloud.33822 > L1-anjo5726.cloud.8082: Flags [S], seq 2530371907, win 1024, options [mss 1460], length 0
01:09:28.128594 IP S1-anjo5726.cloud.33822 > L1-anjo5726.cloud.901: Flags [S], seq 2530371907, win 1024, options [mss 1460], length 0
01:09:28.128594 IP S1-anjo5726.cloud.33822 > L1-anjo5726.cloud.911: Flags [S], seq 2530371907, win 1024, options [mss 1460], length 0
01:09:28.128594 IP S1-anjo5726.cloud.33822 > L1-anjo5726.cloud.20221: Flags [S], seq 2530371907, win 1024, options [mss 1460], length 0
01:09:28.128594 IP S1-anjo5726.cloud.33822 > L1-anjo5726.cloud.1271: Flags [S], seq 2530371907, win 1024, options [mss 1460], length 0
01:09:28.128605 IP L1-anjo5726.cloud.19101 > S1-anjo5726.cloud.33822: Flags [R.], seq 0, ack 2530371908, win 0, length 0
01:09:28.128609 IP L1-anjo5726.cloud.1072 > S1-anjo5726.cloud.33822: Flags [R.], seq 0, ack 2530371908, win 0, length 0
01:09:28.128613 IP L1-anjo5726.cloud.5822 > S1-anjo5726.cloud.33822: Flags [R.], seq 0, ack 2530371908, win 0, length 0
01:09:28.128617 IP L1-anjo5726.cloud.8082 > S1-anjo5726.cloud.33822: Flags [R.], seq 0, ack 2530371908, win 0, length 0
01:09:28.128621 IP L1-anjo5726.cloud.901 > S1-anjo5726.cloud.33822: Flags [R.], seq 0, ack 2530371908, win 0, length 0
01:09:28.128625 IP L1-anjo5726.cloud.911 > S1-anjo5726.cloud.33822: Flags [R.], seq 0, ack 2530371908, win 0, length 0
01:09:28.128628 IP L1-anjo5726.cloud.20221 > S1-anjo5726.cloud.33822: Flags [R.], seq 0, ack 2530371908, win 0, length 0
01:09:28.128632 IP L1-anjo5726.cloud.1271 > S1-anjo5726.cloud.33822: Flags [R.], seq 0, ack 2530371908, win 0, length 0
01:09:28.128648 IP S1-anjo5726.cloud.33822 > L1-anjo5726.cloud.50636: Flags [S], seq 2530371907, win 1024, options [mss 1460], length 0
01:09:28.128648 IP S1-anjo5726.cloud.33822 > L1-anjo5726.cloud.50389: Flags [S], seq 2530371907, win 1024, options [mss 1460], length 0
01:09:28.128648 IP S1-anjo5726.cloud.33822 > L1-anjo5726.cloud.1583: Flags [S], seq 2530371907, win 1024, options [mss 1460], length 0
01:09:28.128655 IP L1-anjo5726.cloud.50636 > S1-anjo5726.cloud.33822: Flags [R.], seq 0, ack 2530371908, win 0, length 0
01:09:28.128659 IP L1-anjo5726.cloud.50389 > S1-anjo5726.cloud.33822: Flags [R.], seq 0, ack 2530371908, win 0, length 0
01:09:28.128664 IP L1-anjo5726.cloud.1583 > S1-anjo5726.cloud.33822: Flags [R.], seq 0, ack 2530371908, win 0, length 0
01:09:28.128702 IP S1-anjo5726.cloud.33822 > L1-anjo5726.cloud.1108: Flags [S], seq 2530371907, win 1024, options [mss 1460], length 0
01:09:28.128702 IP S1-anjo5726.cloud.33822 > L1-anjo5726.cloud.3322: Flags [S], seq 2530371907, win 1024, options [mss 1460], length 0
01:09:28.128703 IP S1-anjo5726.cloud.33822 > L1-anjo5726.cloud.10616: Flags [S], seq 2530371907, win 1024, options [mss 1460], length 0
01:09:28.128703 IP S1-anjo5726.cloud.33822 > L1-anjo5726.cloud.1073: Flags [S], seq 2530371907, win 1024, options [mss 1460], length 0
01:09:28.128703 IP S1-anjo5726.cloud.33822 > L1-anjo5726.cloud.1501: Flags [S], seq 2530371907, win 1024, options [mss 1460], length 0
01:09:28.128703 IP S1-anjo5726.cloud.33822 > L1-anjo5726.cloud.2260: Flags [S], seq 2530371907, win 1024, options [mss 1460], length 0
01:09:28.128703 IP S1-anjo5726.cloud.33822 > L1-anjo5726.cloud.19283: Flags [S], seq 2530371907, win 1024, options [mss 1460], length 0
01:09:28.128703 IP S1-anjo5726.cloud.33822 > L1-anjo5726.cloud.3880: Flags [S], seq 2530371907, win 1024, options [mss 1460], length 0
01:09:28.128713 IP L1-anjo5726.cloud.1108 > S1-anjo5726.cloud.33822: Flags [R.], seq 0, ack 2530371908, win 0, length 0
01:09:28.128725 IP L1-anjo5726.cloud.3322 > S1-anjo5726.cloud.33822: Flags [R.], seq 0, ack 2530371908, win 0, length 0
01:09:28.128730 IP L1-anjo5726.cloud.10616 > S1-anjo5726.cloud.33822: Flags [R.], seq 0, ack 2530371908, win 0, length 0
01:09:28.128734 IP L1-anjo5726.cloud.1073 > S1-anjo5726.cloud.33822: Flags [R.], seq 0, ack 2530371908, win 0, length 0
01:09:28.128738 IP L1-anjo5726.cloud.1501 > S1-anjo5726.cloud.33822: Flags [R.], seq 0, ack 2530371908, win 0, length 0
01:09:28.128741 IP L1-anjo5726.cloud.2260 > S1-anjo5726.cloud.33822: Flags [R.], seq 0, ack 2530371908, win 0, length 0
01:09:28.128745 IP L1-anjo5726.cloud.19283 > S1-anjo5726.cloud.33822: Flags [R.], seq 0, ack 2530371908, win 0, length 0
01:09:28.128749 IP L1-anjo5726.cloud.3880 > S1-anjo5726.cloud.33822: Flags [R.], seq 0, ack 2530371908, win 0, length 0
01:09:28.128753 IP S1-anjo5726.cloud.33822 > L1-anjo5726.cloud.5440: Flags [S], seq 2530371907, win 1024, options [mss 1460], length 0
01:09:28.128753 IP S1-anjo5726.cloud.33822 > L1-anjo5726.cloud.2366: Flags [S], seq 2530371907, win 1024, options [mss 1460], length 0
01:09:28.128758 IP L1-anjo5726.cloud.5440 > S1-anjo5726.cloud.33822: Flags [R.], seq 0, ack 2530371908, win 0, length 0
01:09:28.128762 IP L1-anjo5726.cloud.2366 > S1-anjo5726.cloud.33822: Flags [R.], seq 0, ack 2530371908, win 0, length 0
01:09:28.128836 IP S1-anjo5726.cloud.33822 > L1-anjo5726.cloud.7625: Flags [S], seq 2530371907, win 1024, options [mss 1460], length 0
01:09:28.128847 IP L1-anjo5726.cloud.7625 > S1-anjo5726.cloud.33822: Flags [R.], seq 0, ack 2530371908, win 0, length 0
01:09:28.128980 IP S1-anjo5726.cloud.33822 > L1-anjo5726.cloud.6547: Flags [S], seq 2530371907, win 1024, options [mss 1460], length 0
01:09:28.128980 IP S1-anjo5726.cloud.33822 > L1-anjo5726.cloud.9898: Flags [S], seq 2530371907, win 1024, options [mss 1460], length 0
01:09:28.128980 IP S1-anjo5726.cloud.33822 > L1-anjo5726.cloud.1036: Flags [S], seq 2530371907, win 1024, options [mss 1460], length 0
01:09:28.128980 IP S1-anjo5726.cloud.33822 > L1-anjo5726.cloud.8649: Flags [S], seq 2530371907, win 1024, options [mss 1460], length 0
01:09:28.129000 IP L1-anjo5726.cloud.6547 > S1-anjo5726.cloud.33822: Flags [R.], seq 0, ack 2530371908, win 0, length 0
01:09:28.129015 IP L1-anjo5726.cloud.9898 > S1-anjo5726.cloud.33822: Flags [R.], seq 0, ack 2530371908, win 0, length 0
01:09:28.129020 IP L1-anjo5726.cloud.1036 > S1-anjo5726.cloud.33822: Flags [R.], seq 0, ack 2530371908, win 0, length 0
01:09:28.129024 IP L1-anjo5726.cloud.8649 > S1-anjo5726.cloud.33822: Flags [R.], seq 0, ack 2530371908, win 0, length 0
01:09:28.129029 IP S1-anjo5726.cloud.33822 > L1-anjo5726.cloud.1095: Flags [S], seq 2530371907, win 1024, options [mss 1460], length 0
01:09:28.129029 IP S1-anjo5726.cloud.33822 > L1-anjo5726.cloud.7201: Flags [S], seq 2530371907, win 1024, options [mss 1460], length 0
01:09:28.129034 IP L1-anjo5726.cloud.1095 > S1-anjo5726.cloud.33822: Flags [R.], seq 0, ack 2530371908, win 0, length 0
01:09:28.129038 IP L1-anjo5726.cloud.7201 > S1-anjo5726.cloud.33822: Flags [R.], seq 0, ack 2530371908, win 0, length 0
01:09:28.129094 IP S1-anjo5726.cloud.33822 > L1-anjo5726.cloud.9502: Flags [S], seq 2530371907, win 1024, options [mss 1460], length 0
01:09:28.129094 IP S1-anjo5726.cloud.33822 > L1-anjo5726.cloud.3546: Flags [S], seq 2530371907, win 1024, options [mss 1460], length 0
01:09:28.129094 IP S1-anjo5726.cloud.33822 > L1-anjo5726.cloud.font-service: Flags [S], seq 2530371907, win 1024, options [mss 1460], length 0
01:09:28.129104 IP L1-anjo5726.cloud.9502 > S1-anjo5726.cloud.33822: Flags [R.], seq 0, ack 2530371908, win 0, length 0
01:09:28.129118 IP L1-anjo5726.cloud.3546 > S1-anjo5726.cloud.33822: Flags [R.], seq 0, ack 2530371908, win 0, length 0
01:09:28.129122 IP L1-anjo5726.cloud.font-service > S1-anjo5726.cloud.33822: Flags [R.], seq 0, ack 2530371908, win 0, length 0
01:09:28.129194 IP S1-anjo5726.cloud.33822 > L1-anjo5726.cloud.2998: Flags [S], seq 2530371907, win 1024, options [mss 1460], length 0
01:09:28.129199 IP L1-anjo5726.cloud.2998 > S1-anjo5726.cloud.33822: Flags [R.], seq 0, ack 2530371908, win 0, length 0
01:09:28.129246 IP S1-anjo5726.cloud.33822 > L1-anjo5726.cloud.44176: Flags [S], seq 2530371907, win 1024, options [mss 1460], length 0
01:09:28.129246 IP S1-anjo5726.cloud.33822 > L1-anjo5726.cloud.5910: Flags [S], seq 2530371907, win 1024, options [mss 1460], length 0
01:09:28.129252 IP L1-anjo5726.cloud.44176 > S1-anjo5726.cloud.33822: Flags [R.], seq 0, ack 2530371908, win 0, length 0
01:09:28.129268 IP L1-anjo5726.cloud.5910 > S1-anjo5726.cloud.33822: Flags [R.], seq 0, ack 2530371908, win 0, length 0
01:09:28.129272 IP S1-anjo5726.cloud.33822 > L1-anjo5726.cloud.1122: Flags [S], seq 2530371907, win 1024, options [mss 1460], length 0
01:09:28.129276 IP L1-anjo5726.cloud.1122 > S1-anjo5726.cloud.33822: Flags [R.], seq 0, ack 2530371908, win 0, length 0
01:09:28.129761 IP S1-anjo5726.cloud.33822 > L1-anjo5726.cloud.1334: Flags [S], seq 2530371907, win 1024, options [mss 1460], length 0
01:09:28.129761 IP S1-anjo5726.cloud.33822 > L1-anjo5726.cloud.5560: Flags [S], seq 2530371907, win 1024, options [mss 1460], length 0
01:09:28.129761 IP S1-anjo5726.cloud.33822 > L1-anjo5726.cloud.gopher: Flags [S], seq 2530371907, win 1024, options [mss 1460], length 0
01:09:28.129780 IP L1-anjo5726.cloud.1334 > S1-anjo5726.cloud.33822: Flags [R.], seq 0, ack 2530371908, win 0, length 0
01:09:28.129791 IP L1-anjo5726.cloud.5560 > S1-anjo5726.cloud.33822: Flags [R.], seq 0, ack 2530371908, win 0, length 0
01:09:28.129795 IP L1-anjo5726.cloud.gopher > S1-anjo5726.cloud.33822: Flags [R.], seq 0, ack 2530371908, win 0, length 0
01:09:28.129802 IP S1-anjo5726.cloud.33822 > L1-anjo5726.cloud.5679: Flags [S], seq 2530371907, win 1024, options [mss 1460], length 0
01:09:28.129802 IP S1-anjo5726.cloud.33822 > L1-anjo5726.cloud.3703: Flags [S], seq 2530371907, win 1024, options [mss 1460], length 0
01:09:28.129802 IP S1-anjo5726.cloud.33822 > L1-anjo5726.cloud.1247: Flags [S], seq 2530371907, win 1024, options [mss 1460], length 0
01:09:28.129808 IP L1-anjo5726.cloud.5679 > S1-anjo5726.cloud.33822: Flags [R.], seq 0, ack 2530371908, win 0, length 0
01:09:28.129812 IP L1-anjo5726.cloud.3703 > S1-anjo5726.cloud.33822: Flags [R.], seq 0, ack 2530371908, win 0, length 0
01:09:28.129816 IP L1-anjo5726.cloud.1247 > S1-anjo5726.cloud.33822: Flags [R.], seq 0, ack 2530371908, win 0, length 0
01:09:28.129885 IP S1-anjo5726.cloud.33822 > L1-anjo5726.cloud.5087: Flags [S], seq 2530371907, win 1024, options [mss 1460], length 0
01:09:28.129885 IP S1-anjo5726.cloud.33822 > L1-anjo5726.cloud.2301: Flags [S], seq 2530371907, win 1024, options [mss 1460], length 0
01:09:28.129885 IP S1-anjo5726.cloud.33822 > L1-anjo5726.cloud.2042: Flags [S], seq 2530371907, win 1024, options [mss 1460], length 0
01:09:28.129897 IP L1-anjo5726.cloud.5087 > S1-anjo5726.cloud.33822: Flags [R.], seq 0, ack 2530371908, win 0, length 0
01:09:28.129916 IP L1-anjo5726.cloud.2301 > S1-anjo5726.cloud.33822: Flags [R.], seq 0, ack 2530371908, win 0, length 0
01:09:28.129942 IP L1-anjo5726.cloud.2042 > S1-anjo5726.cloud.33822: Flags [R.], seq 0, ack 2530371908, win 0, length 0
01:09:28.129965 IP S1-anjo5726.cloud.33822 > L1-anjo5726.cloud.1030: Flags [S], seq 2530371907, win 1024, options [mss 1460], length 0
01:09:28.129965 IP S1-anjo5726.cloud.33822 > L1-anjo5726.cloud.10566: Flags [S], seq 2530371907, win 1024, options [mss 1460], length 0
01:09:28.129987 IP L1-anjo5726.cloud.1030 > S1-anjo5726.cloud.33822: Flags [R.], seq 0, ack 2530371908, win 0, length 0
01:09:28.130001 IP L1-anjo5726.cloud.10566 > S1-anjo5726.cloud.33822: Flags [R.], seq 0, ack 2530371908, win 0, length 0
01:09:28.130029 IP S1-anjo5726.cloud.33822 > L1-anjo5726.cloud.2107: Flags [S], seq 2530371907, win 1024, options [mss 1460], length 0
01:09:28.130029 IP S1-anjo5726.cloud.33822 > L1-anjo5726.cloud.1023: Flags [S], seq 2530371907, win 1024, options [mss 1460], length 0
01:09:28.130036 IP L1-anjo5726.cloud.2107 > S1-anjo5726.cloud.33822: Flags [R.], seq 0, ack 2530371908, win 0, length 0
01:09:28.130048 IP L1-anjo5726.cloud.1023 > S1-anjo5726.cloud.33822: Flags [R.], seq 0, ack 2530371908, win 0, length 0
01:09:28.130065 IP S1-anjo5726.cloud.33822 > L1-anjo5726.cloud.50000: Flags [S], seq 2530371907, win 1024, options [mss 1460], length 0
01:09:28.130065 IP S1-anjo5726.cloud.33822 > L1-anjo5726.cloud.30000: Flags [S], seq 2530371907, win 1024, options [mss 1460], length 0
01:09:28.130071 IP L1-anjo5726.cloud.50000 > S1-anjo5726.cloud.33822: Flags [R.], seq 0, ack 2530371908, win 0, length 0
01:09:28.130089 IP L1-anjo5726.cloud.30000 > S1-anjo5726.cloud.33822: Flags [R.], seq 0, ack 2530371908, win 0, length 0
01:09:28.130141 IP S1-anjo5726.cloud.33822 > L1-anjo5726.cloud.1102: Flags [S], seq 2530371907, win 1024, options [mss 1460], length 0
01:09:28.130151 IP L1-anjo5726.cloud.1102 > S1-anjo5726.cloud.33822: Flags [R.], seq 0, ack 2530371908, win 0, length 0
01:09:28.130183 IP S1-anjo5726.cloud.33822 > L1-anjo5726.cloud.14238: Flags [S], seq 2530371907, win 1024, options [mss 1460], length 0
01:09:28.130183 IP S1-anjo5726.cloud.33822 > L1-anjo5726.cloud.sip: Flags [S], seq 2530371907, win 1024, options [mss 1460], length 0
01:09:28.130190 IP L1-anjo5726.cloud.14238 > S1-anjo5726.cloud.33822: Flags [R.], seq 0, ack 2530371908, win 0, length 0
01:09:28.130207 IP L1-anjo5726.cloud.sip > S1-anjo5726.cloud.33822: Flags [R.], seq 0, ack 2530371908, win 0, length 0
01:09:28.130211 IP S1-anjo5726.cloud.33822 > L1-anjo5726.cloud.1082: Flags [S], seq 2530371907, win 1024, options [mss 1460], length 0
01:09:28.130216 IP L1-anjo5726.cloud.1082 > S1-anjo5726.cloud.33822: Flags [R.], seq 0, ack 2530371908, win 0, length 0
01:09:28.130239 IP S1-anjo5726.cloud.33822 > L1-anjo5726.cloud.32783: Flags [S], seq 2530371907, win 1024, options [mss 1460], length 0
01:09:28.130245 IP L1-anjo5726.cloud.32783 > S1-anjo5726.cloud.33822: Flags [R.], seq 0, ack 2530371908, win 0, length 0
01:09:28.130352 IP S1-anjo5726.cloud.33822 > L1-anjo5726.cloud.1165: Flags [S], seq 2530371907, win 1024, options [mss 1460], length 0
01:09:28.130352 IP S1-anjo5726.cloud.33822 > L1-anjo5726.cloud.3869: Flags [S], seq 2530371907, win 1024, options [mss 1460], length 0
01:09:28.130352 IP S1-anjo5726.cloud.33822 > L1-anjo5726.cloud.7920: Flags [S], seq 2530371907, win 1024, options [mss 1460], length 0
01:09:28.130352 IP S1-anjo5726.cloud.33822 > L1-anjo5726.cloud.9011: Flags [S], seq 2530371907, win 1024, options [mss 1460], length 0
01:09:28.130371 IP L1-anjo5726.cloud.1165 > S1-anjo5726.cloud.33822: Flags [R.], seq 0, ack 2530371908, win 0, length 0
01:09:28.130385 IP L1-anjo5726.cloud.3869 > S1-anjo5726.cloud.33822: Flags [R.], seq 0, ack 2530371908, win 0, length 0
01:09:28.130389 IP L1-anjo5726.cloud.7920 > S1-anjo5726.cloud.33822: Flags [R.], seq 0, ack 2530371908, win 0, length 0
01:09:28.130394 IP L1-anjo5726.cloud.9011 > S1-anjo5726.cloud.33822: Flags [R.], seq 0, ack 2530371908, win 0, length 0
01:09:28.130399 IP S1-anjo5726.cloud.33822 > L1-anjo5726.cloud.3766: Flags [S], seq 2530371907, win 1024, options [mss 1460], length 0
01:09:28.130399 IP S1-anjo5726.cloud.33822 > L1-anjo5726.cloud.9900: Flags [S], seq 2530371907, win 1024, options [mss 1460], length 0
01:09:28.130405 IP L1-anjo5726.cloud.3766 > S1-anjo5726.cloud.33822: Flags [R.], seq 0, ack 2530371908, win 0, length 0
01:09:28.130409 IP L1-anjo5726.cloud.9900 > S1-anjo5726.cloud.33822: Flags [R.], seq 0, ack 2530371908, win 0, length 0
01:09:28.130439 IP S1-anjo5726.cloud.33822 > L1-anjo5726.cloud.2001: Flags [S], seq 2530371907, win 1024, options [mss 1460], length 0
01:09:28.130439 IP S1-anjo5726.cloud.33822 > L1-anjo5726.cloud.1096: Flags [S], seq 2530371907, win 1024, options [mss 1460], length 0
01:09:28.130451 IP L1-anjo5726.cloud.2001 > S1-anjo5726.cloud.33822: Flags [R.], seq 0, ack 2530371908, win 0, length 0
01:09:28.130463 IP L1-anjo5726.cloud.1096 > S1-anjo5726.cloud.33822: Flags [R.], seq 0, ack 2530371908, win 0, length 0
01:09:28.130467 IP S1-anjo5726.cloud.33822 > L1-anjo5726.cloud.3301: Flags [S], seq 2530371907, win 1024, options [mss 1460], length 0
01:09:28.130471 IP L1-anjo5726.cloud.3301 > S1-anjo5726.cloud.33822: Flags [R.], seq 0, ack 2530371908, win 0, length 0
01:09:28.130552 IP S1-anjo5726.cloud.33822 > L1-anjo5726.cloud.5825: Flags [S], seq 2530371907, win 1024, options [mss 1460], length 0
01:09:28.130552 IP S1-anjo5726.cloud.33822 > L1-anjo5726.cloud.2875: Flags [S], seq 2530371907, win 1024, options [mss 1460], length 0
01:09:28.130560 IP L1-anjo5726.cloud.5825 > S1-anjo5726.cloud.33822: Flags [R.], seq 0, ack 2530371908, win 0, length 0
01:09:28.130575 IP L1-anjo5726.cloud.2875 > S1-anjo5726.cloud.33822: Flags [R.], seq 0, ack 2530371908, win 0, length 0
01:09:28.130579 IP S1-anjo5726.cloud.33822 > L1-anjo5726.cloud.9111: Flags [S], seq 2530371907, win 1024, options [mss 1460], length 0
01:09:28.130584 IP L1-anjo5726.cloud.9111 > S1-anjo5726.cloud.33822: Flags [R.], seq 0, ack 2530371908, win 0, length 0
