01:09:27.592080 ARP, Request who-has L1-anjo5726.cloud tell S1-anjo5726.cloud, length 28
01:09:27.592604 ARP, Reply L1-anjo5726.cloud is-at 02:00:ac:10:00:10 (oui Unknown), length 28
01:09:27.593597 IP S1-anjo5726.cloud.42885 > router1.cloud.domain: 33778+ PTR? 16.0.16.172.in-addr.arpa. (42)
01:09:27.594658 IP router1.cloud.domain > S1-anjo5726.cloud.42885: 33778* 1/0/0 PTR L1-anjo5726.cloud. (73)
01:09:27.595536 IP S1-anjo5726.cloud.33822 > L1-anjo5726.cloud.ms-wbt-server: Flags [S], seq 2530371907, win 1024, options [mss 1460], length 0
01:09:27.595563 IP S1-anjo5726.cloud.33822 > L1-anjo5726.cloud.submission: Flags [S], seq 2530371907, win 1024, options [mss 1460], length 0
01:09:27.595574 IP S1-anjo5726.cloud.33822 > L1-anjo5726.cloud.8888: Flags [S], seq 2530371907, win 1024, options [mss 1460], length 0
01:09:27.595585 IP S1-anjo5726.cloud.33822 > L1-anjo5726.cloud.mysql: Flags [S], seq 2530371907, win 1024, options [mss 1460], length 0
01:09:27.595596 IP S1-anjo5726.cloud.33822 > L1-anjo5726.cloud.rtsp: Flags [S], seq 2530371907, win 1024, options [mss 1460], length 0
01:09:27.595614 IP S1-anjo5726.cloud.33822 > L1-anjo5726.cloud.ssh: Flags [S], seq 2530371907, win 1024, options [mss 1460], length 0
01:09:27.595632 IP S1-anjo5726.cloud.33822 > L1-anjo5726.cloud.pop3: Flags [S], seq 2530371907, win 1024, options [mss 1460], length 0
01:09:27.595645 IP S1-anjo5726.cloud.33822 > L1-anjo5726.cloud.1723: Flags [S], seq 2530371907, win 1024, options [mss 1460], length 0
01:09:27.595656 IP S1-anjo5726.cloud.33822 > L1-anjo5726.cloud.http: Flags [S], seq 2530371907, win 1024, options [mss 1460], length 0
01:09:27.595667 IP S1-anjo5726.cloud.33822 > L1-anjo5726.cloud.5900: Flags [S], seq 2530371907, win 1024, options [mss 1460], length 0
01:09:27.595973 IP L1-anjo5726.cloud.ms-wbt-server > S1-anjo5726.cloud.33822: Flags [R.], seq 0, ack 2530371908, win 0, length 0
01:09:27.595975 IP L1-anjo5726.cloud.submission > S1-anjo5726.cloud.33822: Flags [R.], seq 0, ack 2530371908, win 0, length 0
01:09:27.595976 IP L1-anjo5726.cloud.8888 > S1-anjo5726.cloud.33822: Flags [R.], seq 0, ack 2530371908, win 0, length 0
01:09:27.595977 IP L1-anjo5726.cloud.mysql > S1-anjo5726.cloud.33822: Flags [R.], seq 0, ack 2530371908, win 0, length 0
01:09:27.595979 IP L1-anjo5726.cloud.rtsp > S1-anjo5726.cloud.33822: Flags [R.], seq 0, ack 2530371908, win 0, length 0
01:09:27.595980 IP L1-anjo5726.cloud.ssh > S1-anjo5726.cloud.33822: Flags [S.], seq 785859528, ack 2530371908, win 64240, options [mss 1460], length 0
01:09:27.595981 IP L1-anjo5726.cloud.pop3 > S1-anjo5726.cloud.33822: Flags [R.], seq 0, ack 2530371908, win 0, length 0
01:09:27.595981 IP L1-anjo5726.cloud.1723 > S1-anjo5726.cloud.33822: Flags [R.], seq 0, ack 2530371908, win 0, length 0
01:09:27.596025 IP S1-anjo5726.cloud.33822 > L1-anjo5726.cloud.ssh: Flags [R], seq 2530371908, win 0, length 0
01:09:27.596043 IP L1-anjo5726.cloud.http > S1-anjo5726.cloud.33822: Flags [S.], seq 1495368457, ack 2530371908, win 64240, options [mss 1460], length 0
01:09:27.596044 IP L1-anjo5726.cloud.5900 > S1-anjo5726.cloud.33822: Flags [R.], seq 0, ack 2530371908, win 0, length 0
01:09:27.596054 IP S1-anjo5726.cloud.33822 > L1-anjo5726.cloud.http: Flags [R], seq 2530371908, win 0, length 0
01:09:27.596180 IP S1-anjo5726.cloud.33822 > L1-anjo5726.cloud.sunrpc: Flags [S], seq 2530371907, win 1024, options [mss 1460], length 0
01:09:27.596206 IP S1-anjo5726.cloud.33822 > L1-anjo5726.cloud.256: Flags [S], seq 2530371907, win 1024, options [mss 1460], length 0
01:09:27.596217 IP S1-anjo5726.cloud.33822 > L1-anjo5726.cloud.microsoft-ds: Flags [S], seq 2530371907, win 1024, options [mss 1460], length 0
01:09:27.596235 IP S1-anjo5726.cloud.33822 > L1-anjo5726.cloud.imaps: Flags [S], seq 2530371907, win 1024, options [mss 1460], length 0
01:09:27.596247 IP S1-anjo5726.cloud.33822 > L1-anjo5726.cloud.pop3s: Flags [S], seq 2530371907, win 1024, options [mss 1460], length 0
01:09:27.596257 IP S1-anjo5726.cloud.33822 > L1-anjo5726.cloud.domain: Flags [S], seq 2530371907, win 1024, options [mss 1460], length 0
01:09:27.596268 IP S1-anjo5726.cloud.33822 > L1-anjo5726.cloud.telnet: Flags [S], seq 2530371907, win 1024, options [mss 1460], length 0
01:09:27.596285 IP S1-anjo5726.cloud.33822 > L1-anjo5726.cloud.epmap: Flags [S], seq 2530371907, win 1024, options [mss 1460], length 0
01:09:27.596296 IP S1-anjo5726.cloud.33822 > L1-anjo5726.cloud.smtp: Flags [S], seq 2530371907, win 1024, options [mss 1460], length 0
01:09:27.596307 IP S1-anjo5726.cloud.33822 > L1-anjo5726.cloud.netbios-ssn: Flags [S], seq 2530371907, win 1024, options [mss 1460], length 0
01:09:27.596318 IP S1-anjo5726.cloud.33822 > L1-anjo5726.cloud.1720: Flags [S], seq 2530371907, win 1024, options [mss 1460], length 0
01:09:27.596337 IP S1-anjo5726.cloud.33822 > L1-anjo5726.cloud.smux: Flags [S], seq 2530371907, win 1024, options [mss 1460], length 0
01:09:27.596350 IP S1-anjo5726.cloud.33822 > L1-anjo5726.cloud.https: Flags [S], seq 2530371907, win 1024, options [mss 1460], length 0
01:09:27.596361 IP S1-anjo5726.cloud.33822 > L1-anjo5726.cloud.ftp: Flags [S], seq 2530371907, win 1024, options [mss 1460], length 0
01:09:27.596371 IP S1-anjo5726.cloud.33822 > L1-anjo5726.cloud.http-alt: Flags [S], seq 2530371907, win 1024, options [mss 1460], length 0
01:09:27.596387 IP S1-anjo5726.cloud.33822 > L1-anjo5726.cloud.auth: Flags [S], seq 2530371907, win 1024, options [mss 1460], length 0
01:09:27.596399 IP S1-anjo5726.cloud.33822 > L1-anjo5726.cloud.imap2: Flags [S], seq 2530371907, win 1024, options [mss 1460], length 0
01:09:27.596410 IP S1-anjo5726.cloud.33822 > L1-anjo5726.cloud.1025: Flags [S], seq 2530371907, win 1024, options [mss 1460], length 0
01:09:27.596421 IP S1-anjo5726.cloud.33822 > L1-anjo5726.cloud.3006: Flags [S], seq 2530371907, win 1024, options [mss 1460], length 0
01:09:27.596437 IP S1-anjo5726.cloud.33822 > L1-anjo5726.cloud.366: Flags [S], seq 2530371907, win 1024, options [mss 1460], length 0
01:09:27.596519 IP L1-anjo5726.cloud.sunrpc > S1-anjo5726.cloud.33822: Flags [S.], seq 3845869042, ack 2530371908, win 64240, options [mss 1460], length 0
01:09:27.596520 IP L1-anjo5726.cloud.256 > S1-anjo5726.cloud.33822: Flags [R.], seq 0, ack 2530371908, win 0, length 0
01:09:27.596521 IP L1-anjo5726.cloud.microsoft-ds > S1-anjo5726.cloud.33822: Flags [R.], seq 0, ack 2530371908, win 0, length 0
01:09:27.596523 IP L1-anjo5726.cloud.imaps > S1-anjo5726.cloud.33822: Flags [R.], seq 0, ack 2530371908, win 0, length 0
01:09:27.596524 IP L1-anjo5726.cloud.pop3s > S1-anjo5726.cloud.33822: Flags [R.], seq 0, ack 2530371908, win 0, length 0
01:09:27.596525 IP L1-anjo5726.cloud.domain > S1-anjo5726.cloud.33822: Flags [S.], seq 937330040, ack 2530371908, win 64240, options [mss 1460], length 0
01:09:27.596526 IP L1-anjo5726.cloud.telnet > S1-anjo5726.cloud.33822: Flags [R.], seq 0, ack 2530371908, win 0, length 0
01:09:27.596527 IP L1-anjo5726.cloud.epmap > S1-anjo5726.cloud.33822: Flags [R.], seq 0, ack 2530371908, win 0, length 0
01:09:27.596543 IP S1-anjo5726.cloud.33822 > L1-anjo5726.cloud.sunrpc: Flags [R], seq 2530371908, win 0, length 0
01:09:27.596559 IP S1-anjo5726.cloud.33822 > L1-anjo5726.cloud.domain: Flags [R], seq 2530371908, win 0, length 0
01:09:27.596597 IP L1-anjo5726.cloud.smtp > S1-anjo5726.cloud.33822: Flags [S.], seq 3167180256, ack 2530371908, win 64240, options [mss 1460], length 0
01:09:27.596599 IP L1-anjo5726.cloud.netbios-ssn > S1-anjo5726.cloud.33822: Flags [R.], seq 0, ack 2530371908, win 0, length 0
01:09:27.596600 IP L1-anjo5726.cloud.1720 > S1-anjo5726.cloud.33822: Flags [R.], seq 0, ack 2530371908, win 0, length 0
01:09:27.596601 IP L1-anjo5726.cloud.smux > S1-anjo5726.cloud.33822: Flags [R.], seq 0, ack 2530371908, win 0, length 0
01:09:27.596602 IP L1-anjo5726.cloud.https > S1-anjo5726.cloud.33822: Flags [R.], seq 0, ack 2530371908, win 0, length 0
01:09:27.596603 IP L1-anjo5726.cloud.ftp > S1-anjo5726.cloud.33822: Flags [S.], seq 2844622519, ack 2530371908, win 64240, options [mss 1460], length 0
01:09:27.596604 IP L1-anjo5726.cloud.http-alt > S1-anjo5726.cloud.33822: Flags [R.], seq 0, ack 2530371908, win 0, length 0
01:09:27.596605 IP L1-anjo5726.cloud.auth > S1-anjo5726.cloud.33822: Flags [R.], seq 0, ack 2530371908, win 0, length 0
01:09:27.596668 IP S1-anjo5726.cloud.33822 > L1-anjo5726.cloud.smtp: Flags [R], seq 2530371908, win 0, length 0
01:09:27.596700 IP S1-anjo5726.cloud.33822 > L1-anjo5726.cloud.ftp: Flags [R], seq 2530371908, win 0, length 0
01:09:27.596757 IP L1-anjo5726.cloud.imap2 > S1-anjo5726.cloud.33822: Flags [R.], seq 0, ack 2530371908, win 0, length 0
01:09:27.596758 IP L1-anjo5726.cloud.1025 > S1-anjo5726.cloud.33822: Flags [R.], seq 0, ack 2530371908, win 0, length 0
01:09:27.596759 IP L1-anjo5726.cloud.3006 > S1-anjo5726.cloud.33822: Flags [R.], seq 0, ack 2530371908, win 0, length 0
01:09:27.596760 IP L1-anjo5726.cloud.366 > S1-anjo5726.cloud.33822: Flags [R.], seq 0, ack 2530371908, win 0, length 0
01:09:27.596973 IP S1-anjo5726.cloud.33822 > L1-anjo5726.cloud.9943: Flags [S], seq 2530371907, win 1024, options [mss 1460], length 0
01:09:27.596996 IP S1-anjo5726.cloud.33822 > L1-anjo5726.cloud.44442: Flags [S], seq 2530371907, win 1024, options [mss 1460], length 0
01:09:27.597090 IP S1-anjo5726.cloud.33822 > L1-anjo5726.cloud.omniorb: Flags [S], seq 2530371907, win 1024, options [mss 1460], length 0
01:09:27.597136 IP L1-anjo5726.cloud.9943 > S1-anjo5726.cloud.33822: Flags [R.], seq 0, ack 2530371908, win 0, length 0
01:09:27.597137 IP L1-anjo5726.cloud.44442 > S1-anjo5726.cloud.33822: Flags [R.], seq 0, ack 2530371908, win 0, length 0
01:09:27.597163 IP S1-anjo5726.cloud.33822 > L1-anjo5726.cloud.1213: Flags [S], seq 2530371907, win 1024, options [mss 1460], length 0
01:09:27.597196 IP S1-anjo5726.cloud.33822 > L1-anjo5726.cloud.5998: Flags [S], seq 2530371907, win 1024, options [mss 1460], length 0
01:09:27.597235 IP S1-anjo5726.cloud.33822 > L1-anjo5726.cloud.7025: Flags [S], seq 2530371907, win 1024, options [mss 1460], length 0
01:09:27.597252 IP L1-anjo5726.cloud.omniorb > S1-anjo5726.cloud.33822: Flags [R.], seq 0, ack 2530371908, win 0, length 0
01:09:27.597281 IP S1-anjo5726.cloud.33822 > L1-anjo5726.cloud.60020: Flags [S], seq 2530371907, win 1024, options [mss 1460], length 0
01:09:27.597301 IP S1-anjo5726.cloud.33822 > L1-anjo5726.cloud.34573: Flags [S], seq 2530371907, win 1024, options [mss 1460], length 0
01:09:27.597319 IP S1-anjo5726.cloud.33822 > L1-anjo5726.cloud.17877: Flags [S], seq 2530371907, win 1024, options [mss 1460], length 0
01:09:27.597341 IP S1-anjo5726.cloud.33822 > L1-anjo5726.cloud.8100: Flags [S], seq 2530371907, win 1024, options [mss 1460], length 0
01:09:27.597362 IP S1-anjo5726.cloud.33822 > L1-anjo5726.cloud.27715: Flags [S], seq 2530371907, win 1024, options [mss 1460], length 0
01:09:27.597372 IP S1-anjo5726.cloud.33822 > L1-anjo5726.cloud.git: Flags [S], seq 2530371907, win 1024, options [mss 1460], length 0
01:09:27.597406 IP S1-anjo5726.cloud.33822 > L1-anjo5726.cloud.1098: Flags [S], seq 2530371907, win 1024, options [mss 1460], length 0
01:09:27.597428 IP L1-anjo5726.cloud.1213 > S1-anjo5726.cloud.33822: Flags [R.], seq 0, ack 2530371908, win 0, length 0
01:09:27.597429 IP L1-anjo5726.cloud.5998 > S1-anjo5726.cloud.33822: Flags [R.], seq 0, ack 2530371908, win 0, length 0
01:09:27.597445 IP L1-anjo5726.cloud.7025 > S1-anjo5726.cloud.33822: Flags [R.], seq 0, ack 2530371908, win 0, length 0
01:09:27.597446 IP L1-anjo5726.cloud.60020 > S1-anjo5726.cloud.33822: Flags [R.], seq 0, ack 2530371908, win 0, length 0
01:09:27.597471 IP L1-anjo5726.cloud.34573 > S1-anjo5726.cloud.33822: Flags [R.], seq 0, ack 2530371908, win 0, length 0
01:09:27.597472 IP L1-anjo5726.cloud.17877 > S1-anjo5726.cloud.33822: Flags [R.], seq 0, ack 2530371908, win 0, length 0
01:09:27.597474 IP L1-anjo5726.cloud.8100 > S1-anjo5726.cloud.33822: Flags [R.], seq 0, ack 2530371908, win 0, length 0
01:09:27.597475 IP L1-anjo5726.cloud.27715 > S1-anjo5726.cloud.33822: Flags [R.], seq 0, ack 2530371908, win 0, length 0
01:09:27.597475 IP L1-anjo5726.cloud.git > S1-anjo5726.cloud.33822: Flags [R.], seq 0, ack 2530371908, win 0, length 0
01:09:27.597495 IP S1-anjo5726.cloud.33822 > L1-anjo5726.cloud.2967: Flags [S], seq 2530371907, win 1024, options [mss 1460], length 0
01:09:27.597515 IP L1-anjo5726.cloud.1098 > S1-anjo5726.cloud.33822: Flags [R.], seq 0, ack 2530371908, win 0, length 0
01:09:27.597544 IP S1-anjo5726.cloud.33822 > L1-anjo5726.cloud.2701: Flags [S], seq 2530371907, win 1024, options [mss 1460], length 0
01:09:27.597632 IP L1-anjo5726.cloud.2967 > S1-anjo5726.cloud.33822: Flags [R.], seq 0, ack 2530371908, win 0, length 0
01:09:27.597657 IP S1-anjo5726.cloud.33822 > L1-anjo5726.cloud.13783: Flags [S], seq 2530371907, win 1024, options [mss 1460], length 0
01:09:27.597717 IP S1-anjo5726.cloud.33822 > L1-anjo5726.cloud.3527: Flags [S], seq 2530371907, win 1024, options [mss 1460], length 0
01:09:27.597767 IP S1-anjo5726.cloud.33822 > L1-anjo5726.cloud.1045: Flags [S], seq 2530371907, win 1024, options [mss 1460], length 0
01:09:27.597810 IP S1-anjo5726.cloud.33822 > L1-anjo5726.cloud.2021: Flags [S], seq 2530371907, win 1024, options [mss 1460], length 0
01:09:27.597832 IP S1-anjo5726.cloud.33822 > L1-anjo5726.cloud.1056: Flags [S], seq 2530371907, win 1024, options [mss 1460], length 0
01:09:27.597843 IP S1-anjo5726.cloud.33822 > L1-anjo5726.cloud.3784: Flags [S], seq 2530371907, win 1024, options [mss 1460], length 0
01:09:27.597888 IP L1-anjo5726.cloud.2701 > S1-anjo5726.cloud.33822: Flags [R.], seq 0, ack 2530371908, win 0, length 0
01:09:27.597889 IP L1-anjo5726.cloud.13783 > S1-anjo5726.cloud.33822: Flags [R.], seq 0, ack 2530371908, win 0, length 0
01:09:27.597890 IP L1-anjo5726.cloud.3527 > S1-anjo5726.cloud.33822: Flags [R.], seq 0, ack 2530371908, win 0, length 0
01:09:27.597891 IP L1-anjo5726.cloud.1045 > S1-anjo5726.cloud.33822: Flags [R.], seq 0, ack 2530371908, win 0, length 0
01:09:27.597913 IP S1-anjo5726.cloud.33822 > L1-anjo5726.cloud.2126: Flags [S], seq 2530371907, win 1024, options [mss 1460], length 0
01:09:27.597933 IP S1-anjo5726.cloud.33822 > L1-anjo5726.cloud.cisco-sccp: Flags [S], seq 2530371907, win 1024, options [mss 1460], length 0
01:09:27.597944 IP S1-anjo5726.cloud.33822 > L1-anjo5726.cloud.541: Flags [S], seq 2530371907, win 1024, options [mss 1460], length 0
01:09:27.597961 IP S1-anjo5726.cloud.33822 > L1-anjo5726.cloud.616: Flags [S], seq 2530371907, win 1024, options [mss 1460], length 0
01:09:27.597973 IP S1-anjo5726.cloud.33822 > L1-anjo5726.cloud.9220: Flags [S], seq 2530371907, win 1024, options [mss 1460], length 0
01:09:27.597990 IP S1-anjo5726.cloud.33822 > L1-anjo5726.cloud.720: Flags [S], seq 2530371907, win 1024, options [mss 1460], length 0
01:09:27.598002 IP S1-anjo5726.cloud.33822 > L1-anjo5726.cloud.4445: Flags [S], seq 2530371907, win 1024, options [mss 1460], length 0
01:09:27.598012 IP S1-anjo5726.cloud.33822 > L1-anjo5726.cloud.3370: Flags [S], seq 2530371907, win 1024, options [mss 1460], length 0
01:09:27.598023 IP S1-anjo5726.cloud.33822 > L1-anjo5726.cloud.42: Flags [S], seq 2530371907, win 1024, options [mss 1460], length 0
01:09:27.598034 IP S1-anjo5726.cloud.33822 > L1-anjo5726.cloud.5902: Flags [S], seq 2530371907, win 1024, options [mss 1460], length 0
01:09:27.598045 IP S1-anjo5726.cloud.33822 > L1-anjo5726.cloud.5999: Flags [S], seq 2530371907, win 1024, options [mss 1460], length 0
01:09:27.598055 IP S1-anjo5726.cloud.33822 > L1-anjo5726.cloud.1717: Flags [S], seq 2530371907, win 1024, options [mss 1460], length 0
01:09:27.598073 IP S1-anjo5726.cloud.33822 > L1-anjo5726.cloud.4343: Flags [S], seq 2530371907, win 1024, options [mss 1460], length 0
01:09:27.598125 IP L1-anjo5726.cloud.2021 > S1-anjo5726.cloud.33822: Flags [R.], seq 0, ack 2530371908, win 0, length 0
01:09:27.598126 IP L1-anjo5726.cloud.1056 > S1-anjo5726.cloud.33822: Flags [R.], seq 0, ack 2530371908, win 0, length 0
01:09:27.598127 IP L1-anjo5726.cloud.3784 > S1-anjo5726.cloud.33822: Flags [R.], seq 0, ack 2530371908, win 0, length 0
01:09:27.598128 IP L1-anjo5726.cloud.2126 > S1-anjo5726.cloud.33822: Flags [R.], seq 0, ack 2530371908, win 0, length 0
01:09:27.598129 IP L1-anjo5726.cloud.cisco-sccp > S1-anjo5726.cloud.33822: Flags [R.], seq 0, ack 2530371908, win 0, length 0
01:09:27.598130 IP L1-anjo5726.cloud.541 > S1-anjo5726.cloud.33822: Flags [R.], seq 0, ack 2530371908, win 0, length 0
01:09:27.598131 IP L1-anjo5726.cloud.616 > S1-anjo5726.cloud.33822: Flags [R.], seq 0, ack 2530371908, win 0, length 0
01:09:27.598132 IP L1-anjo5726.cloud.9220 > S1-anjo5726.cloud.33822: Flags [R.], seq 0, ack 2530371908, win 0, length 0
01:09:27.598149 IP L1-anjo5726.cloud.720 > S1-anjo5726.cloud.33822: Flags [R.], seq 0, ack 2530371908, win 0, length 0
01:09:27.598167 IP S1-anjo5726.cloud.33822 > L1-anjo5726.cloud.668: Flags [S], seq 2530371907, win 1024, options [mss 1460], length 0
01:09:27.598187 IP S1-anjo5726.cloud.33822 > L1-anjo5726.cloud.2004: Flags [S], seq 2530371907, win 1024, options [mss 1460], length 0
01:09:27.598221 IP S1-anjo5726.cloud.33822 > L1-anjo5726.cloud.8701: Flags [S], seq 2530371907, win 1024, options [mss 1460], length 0
01:09:27.598243 IP L1-anjo5726.cloud.4445 > S1-anjo5726.cloud.33822: Flags [R.], seq 0, ack 2530371908, win 0, length 0
01:09:27.598244 IP L1-anjo5726.cloud.3370 > S1-anjo5726.cloud.33822: Flags [R.], seq 0, ack 2530371908, win 0, length 0
01:09:27.598245 IP L1-anjo5726.cloud.42 > S1-anjo5726.cloud.33822: Flags [R.], seq 0, ack 2530371908, win 0, length 0
01:09:27.598246 IP L1-anjo5726.cloud.5902 > S1-anjo5726.cloud.33822: Flags [R.], seq 0, ack 2530371908, win 0, length 0
01:09:27.598327 IP L1-anjo5726.cloud.5999 > S1-anjo5726.cloud.33822: Flags [R.], seq 0, ack 2530371908, win 0, length 0
01:09:27.598328 IP L1-anjo5726.cloud.1717 > S1-anjo5726.cloud.33822: Flags [R.], seq 0, ack 2530371908, win 0, length 0
01:09:27.598329 IP L1-anjo5726.cloud.4343 > S1-anjo5726.cloud.33822: Flags [R.], seq 0, ack 2530371908, win 0, length 0
01:09:27.598330 IP L1-anjo5726.cloud.668 > S1-anjo5726.cloud.33822: Flags [R.], seq 0, ack 2530371908, win 0, length 0
01:09:27.598331 IP L1-anjo5726.cloud.2004 > S1-anjo5726.cloud.33822: Flags [R.], seq 0, ack 2530371908, win 0, length 0
01:09:27.598356 IP L1-anjo5726.cloud.8701 > S1-anjo5726.cloud.33822: Flags [R.], seq 0, ack 2530371908, win 0, length 0
01:09:27.598402 IP S1-anjo5726.cloud.33822 > L1-anjo5726.cloud.54328: Flags [S], seq 2530371907, win 1024, options [mss 1460], length 0
01:09:27.598430 IP S1-anjo5726.cloud.33822 > L1-anjo5726.cloud.3323: Flags [S], seq 2530371907, win 1024, options [mss 1460], length 0
01:09:27.598460 IP S1-anjo5726.cloud.33822 > L1-anjo5726.cloud.4005: Flags [S], seq 2530371907, win 1024, options [mss 1460], length 0
01:09:27.598552 IP L1-anjo5726.cloud.54328 > S1-anjo5726.cloud.33822: Flags [R.], seq 0, ack 2530371908, win 0, length 0
01:09:27.598553 IP L1-anjo5726.cloud.3323 > S1-anjo5726.cloud.33822: Flags [R.], seq 0, ack 2530371908, win 0, length 0
01:09:27.598574 IP L1-anjo5726.cloud.4005 > S1-anjo5726.cloud.33822: Flags [R.], seq 0, ack 2530371908, win 0, length 0
01:09:27.598767 IP S1-anjo5726.cloud.33822 > L1-anjo5726.cloud.32770: Flags [S], seq 2530371907, win 1024, options [mss 1460], length 0
01:09:27.598796 IP S1-anjo5726.cloud.33822 > L1-anjo5726.cloud.7002: Flags [S], seq 2530371907, win 1024, options [mss 1460], length 0
01:09:27.598854 IP S1-anjo5726.cloud.33822 > L1-anjo5726.cloud.52822: Flags [S], seq 2530371907, win 1024, options [mss 1460], length 0
01:09:27.598874 IP S1-anjo5726.cloud.33822 > L1-anjo5726.cloud.gris: Flags [S], seq 2530371907, win 1024, options [mss 1460], length 0
01:09:27.598903 IP S1-anjo5726.cloud.33822 > L1-anjo5726.cloud.1272: Flags [S], seq 2530371907, win 1024, options [mss 1460], length 0
01:09:27.598924 IP S1-anjo5726.cloud.33822 > L1-anjo5726.cloud.3851: Flags [S], seq 2530371907, win 1024, options [mss 1460], length 0
01:09:27.598937 IP S1-anjo5726.cloud.33822 > L1-anjo5726.cloud.snpp: Flags [S], seq 2530371907, win 1024, options [mss 1460], length 0
01:09:27.598949 IP S1-anjo5726.cloud.33822 > L1-anjo5726.cloud.264: Flags [S], seq 2530371907, win 1024, options [mss 1460], length 0
01:09:27.598959 IP S1-anjo5726.cloud.33822 > L1-anjo5726.cloud.1164: Flags [S], seq 2530371907, win 1024, options [mss 1460], length 0
01:09:27.598970 IP S1-anjo5726.cloud.33822 > L1-anjo5726.cloud.2160: Flags [S], seq 2530371907, win 1024, options [mss 1460], length 0
01:09:27.598980 IP S1-anjo5726.cloud.33822 > L1-anjo5726.cloud.5718: Flags [S], seq 2530371907, win 1024, options [mss 1460], length 0
01:09:27.598990 IP S1-anjo5726.cloud.33822 > L1-anjo5726.cloud.echo: Flags [S], seq 2530371907, win 1024, options [mss 1460], length 0
01:09:27.599002 IP S1-anjo5726.cloud.33822 > L1-anjo5726.cloud.2013: Flags [S], seq 2530371907, win 1024, options [mss 1460], length 0
01:09:27.599012 IP S1-anjo5726.cloud.33822 > L1-anjo5726.cloud.8873: Flags [S], seq 2530371907, win 1024, options [mss 1460], length 0
01:09:27.599049 IP S1-anjo5726.cloud.33822 > L1-anjo5726.cloud.8291: Flags [S], seq 2530371907, win 1024, options [mss 1460], length 0
01:09:27.599088 IP L1-anjo5726.cloud.32770 > S1-anjo5726.cloud.33822: Flags [R.], seq 0, ack 2530371908, win 0, length 0
01:09:27.599089 IP L1-anjo5726.cloud.7002 > S1-anjo5726.cloud.33822: Flags [R.], seq 0, ack 2530371908, win 0, length 0
01:09:27.599090 IP L1-anjo5726.cloud.52822 > S1-anjo5726.cloud.33822: Flags [R.], seq 0, ack 2530371908, win 0, length 0
01:09:27.599091 IP L1-anjo5726.cloud.gris > S1-anjo5726.cloud.33822: Flags [R.], seq 0, ack 2530371908, win 0, length 0
01:09:27.599092 IP L1-anjo5726.cloud.1272 > S1-anjo5726.cloud.33822: Flags [R.], seq 0, ack 2530371908, win 0, length 0
01:09:27.599092 IP L1-anjo5726.cloud.3851 > S1-anjo5726.cloud.33822: Flags [R.], seq 0, ack 2530371908, win 0, length 0
01:09:27.599093 IP L1-anjo5726.cloud.snpp > S1-anjo5726.cloud.33822: Flags [R.], seq 0, ack 2530371908, win 0, length 0
01:09:27.599094 IP L1-anjo5726.cloud.264 > S1-anjo5726.cloud.33822: Flags [R.], seq 0, ack 2530371908, win 0, length 0
01:09:27.599119 IP S1-anjo5726.cloud.33822 > L1-anjo5726.cloud.19101: Flags [S], seq 2530371907, win 1024, options [mss 1460], length 0
01:09:27.599139 IP S1-anjo5726.cloud.33822 > L1-anjo5726.cloud.1072: Flags [S], seq 2530371907, win 1024, options [mss 1460], length 0
01:09:27.599150 IP S1-anjo5726.cloud.33822 > L1-anjo5726.cloud.5822: Flags [S], seq 2530371907, win 1024, options [mss 1460], length 0
01:09:27.599160 IP S1-anjo5726.cloud.33822 > L1-anjo5726.cloud.8082: Flags [S], seq 2530371907, win 1024, options [mss 1460], length 0
01:09:27.599171 IP S1-anjo5726.cloud.33822 > L1-anjo5726.cloud.901: Flags [S], seq 2530371907, win 1024, options [mss 1460], length 0
01:09:27.599183 IP S1-anjo5726.cloud.33822 > L1-anjo5726.cloud.911: Flags [S], seq 2530371907, win 1024, options [mss 1460], length 0
01:09:27.599194 IP S1-anjo5726.cloud.33822 > L1-anjo5726.cloud.20221: Flags [S], seq 2530371907, win 1024, options [mss 1460], length 0
01:09:27.599205 IP S1-anjo5726.cloud.33822 > L1-anjo5726.cloud.1271: Flags [S], seq 2530371907, win 1024, options [mss 1460], length 0
01:09:27.599216 IP S1-anjo5726.cloud.33822 > L1-anjo5726.cloud.50636: Flags [S], seq 2530371907, win 1024, options [mss 1460], length 0
01:09:27.599228 IP S1-anjo5726.cloud.33822 > L1-anjo5726.cloud.50389: Flags [S], seq 2530371907, win 1024, options [mss 1460], length 0
01:09:27.599239 IP S1-anjo5726.cloud.33822 > L1-anjo5726.cloud.1583: Flags [S], seq 2530371907, win 1024, options [mss 1460], length 0
01:09:27.599249 IP S1-anjo5726.cloud.33822 > L1-anjo5726.cloud.1108: Flags [S], seq 2530371907, win 1024, options [mss 1460], length 0
01:09:27.599259 IP S1-anjo5726.cloud.33822 > L1-anjo5726.cloud.3322: Flags [S], seq 2530371907, win 1024, options [mss 1460], length 0
01:09:27.599271 IP S1-anjo5726.cloud.33822 > L1-anjo5726.cloud.10616: Flags [S], seq 2530371907, win 1024, options [mss 1460], length 0
01:09:27.599282 IP S1-anjo5726.cloud.33822 > L1-anjo5726.cloud.1073: Flags [S], seq 2530371907, win 1024, options [mss 1460], length 0
01:09:27.599292 IP S1-anjo5726.cloud.33822 > L1-anjo5726.cloud.1501: Flags [S], seq 2530371907, win 1024, options [mss 1460], length 0
01:09:27.599303 IP S1-anjo5726.cloud.33822 > L1-anjo5726.cloud.2260: Flags [S], seq 2530371907, win 1024, options [mss 1460], length 0
01:09:27.599314 IP S1-anjo5726.cloud.33822 > L1-anjo5726.cloud.19283: Flags [S], seq 2530371907, win 1024, options [mss 1460], length 0
01:09:27.599325 IP S1-anjo5726.cloud.33822 > L1-anjo5726.cloud.3880: Flags [S], seq 2530371907, win 1024, options [mss 1460], length 0
01:09:27.599336 IP S1-anjo5726.cloud.33822 > L1-anjo5726.cloud.5440: Flags [S], seq 2530371907, win 1024, options [mss 1460], length 0
01:09:27.599354 IP S1-anjo5726.cloud.33822 > L1-anjo5726.cloud.2366: Flags [S], seq 2530371907, win 1024, options [mss 1460], length 0
01:09:27.599382 IP S1-anjo5726.cloud.33822 > L1-anjo5726.cloud.7625: Flags [S], seq 2530371907, win 1024, options [mss 1460], length 0
01:09:27.599435 IP L1-anjo5726.cloud.1164 > S1-anjo5726.cloud.33822: Flags [R.], seq 0, ack 2530371908, win 0, length 0
01:09:27.599436 IP L1-anjo5726.cloud.2160 > S1-anjo5726.cloud.33822: Flags [R.], seq 0, ack 2530371908, win 0, length 0
01:09:27.599437 IP L1-anjo5726.cloud.5718 > S1-anjo5726.cloud.33822: Flags [R.], seq 0, ack 2530371908, win 0, length 0
01:09:27.599438 IP L1-anjo5726.cloud.echo > S1-anjo5726.cloud.33822: Flags [R.], seq 0, ack 2530371908, win 0, length 0
01:09:27.599439 IP L1-anjo5726.cloud.2013 > S1-anjo5726.cloud.33822: Flags [R.], seq 0, ack 2530371908, win 0, length 0
01:09:27.599440 IP L1-anjo5726.cloud.8873 > S1-anjo5726.cloud.33822: Flags [R.], seq 0, ack 2530371908, win 0, length 0
01:09:27.599441 IP L1-anjo5726.cloud.8291 > S1-anjo5726.cloud.33822: Flags [R.], seq 0, ack 2530371908, win 0, length 0
01:09:27.599442 IP L1-anjo5726.cloud.19101 > S1-anjo5726.cloud.33822: Flags [R.], seq 0, ack 2530371908, win 0, length 0
01:09:27.599470 IP L1-anjo5726.cloud.1072 > S1-anjo5726.cloud.33822: Flags [R.], seq 0, ack 2530371908, win 0, length 0
01:09:27.599471 IP L1-anjo5726.cloud.5822 > S1-anjo5726.cloud.33822: Flags [R.], seq 0, ack 2530371908, win 0, length 0
01:09:27.599472 IP L1-anjo5726.cloud.8082 > S1-anjo5726.cloud.33822: Flags [R.], seq 0, ack 2530371908, win 0, length 0
01:09:27.599473 IP L1-anjo5726.cloud.901 > S1-anjo5726.cloud.33822: Flags [R.], seq 0, ack 2530371908, win 0, length 0
01:09:27.599474 IP L1-anjo5726.cloud.911 > S1-anjo5726.cloud.33822: Flags [R.], seq 0, ack 2530371908, win 0, length 0
01:09:27.599475 IP L1-anjo5726.cloud.20221 > S1-anjo5726.cloud.33822: Flags [R.], seq 0, ack 2530371908, win 0, length 0
01:09:27.599476 IP L1-anjo5726.cloud.1271 > S1-anjo5726.cloud.33822: Flags [R.], seq 0, ack 2530371908, win 0, length 0
01:09:27.599477 IP L1-anjo5726.cloud.50636 > S1-anjo5726.cloud.33822: Flags [R.], seq 0, ack 2530371908, win 0, length 0
01:09:27.599502 IP L1-anjo5726.cloud.50389 > S1-anjo5726.cloud.33822: Flags [R.], seq 0, ack 2530371908, win 0, length 0
01:09:27.599503 IP L1-anjo5726.cloud.1583 > S1-anjo5726.cloud.33822: Flags [R.], seq 0, ack 2530371908, win 0, length 0
01:09:27.599504 IP L1-anjo5726.cloud.1108 > S1-anjo5726.cloud.33822: Flags [R.], seq 0, ack 2530371908, win 0, length 0
01:09:27.599505 IP L1-anjo5726.cloud.3322 > S1-anjo5726.cloud.33822: Flags [R.], seq 0, ack 2530371908, win 0, length 0
01:09:27.599511 IP L1-anjo5726.cloud.10616 > S1-anjo5726.cloud.33822: Flags [R.], seq 0, ack 2530371908, win 0, length 0
01:09:27.599512 IP L1-anjo5726.cloud.1073 > S1-anjo5726.cloud.33822: Flags [R.], seq 0, ack 2530371908, win 0, length 0
01:09:27.599513 IP L1-anjo5726.cloud.1501 > S1-anjo5726.cloud.33822: Flags [R.], seq 0, ack 2530371908, win 0, length 0
01:09:27.599514 IP L1-anjo5726.cloud.2260 > S1-anjo5726.cloud.33822: Flags [R.], seq 0, ack 2530371908, win 0, length 0
01:09:27.599547 IP L1-anjo5726.cloud.19283 > S1-anjo5726.cloud.33822: Flags [R.], seq 0, ack 2530371908, win 0, length 0
01:09:27.599555 IP L1-anjo5726.cloud.3880 > S1-anjo5726.cloud.33822: Flags [R.], seq 0, ack 2530371908, win 0, length 0
01:09:27.599556 IP L1-anjo5726.cloud.5440 > S1-anjo5726.cloud.33822: Flags [R.], seq 0, ack 2530371908, win 0, length 0
01:09:27.599557 IP L1-anjo5726.cloud.2366 > S1-anjo5726.cloud.33822: Flags [R.], seq 0, ack 2530371908, win 0, length 0
01:09:27.599564 IP L1-anjo5726.cloud.7625 > S1-anjo5726.cloud.33822: Flags [R.], seq 0, ack 2530371908, win 0, length 0
01:09:27.599583 IP S1-anjo5726.cloud.33822 > L1-anjo5726.cloud.6547: Flags [S], seq 2530371907, win 1024, options [mss 1460], length 0
01:09:27.599604 IP S1-anjo5726.cloud.33822 > L1-anjo5726.cloud.9898: Flags [S], seq 2530371907, win 1024, options [mss 1460], length 0
01:09:27.599624 IP S1-anjo5726.cloud.33822 > L1-anjo5726.cloud.1036: Flags [S], seq 2530371907, win 1024, options [mss 1460], length 0
01:09:27.599636 IP S1-anjo5726.cloud.33822 > L1-anjo5726.cloud.8649: Flags [S], seq 2530371907, win 1024, options [mss 1460], length 0
01:09:27.599647 IP S1-anjo5726.cloud.33822 > L1-anjo5726.cloud.1095: Flags [S], seq 2530371907, win 1024, options [mss 1460], length 0
01:09:27.599657 IP S1-anjo5726.cloud.33822 > L1-anjo5726.cloud.7201: Flags [S], seq 2530371907, win 1024, options [mss 1460], length 0
01:09:27.599667 IP S1-anjo5726.cloud.33822 > L1-anjo5726.cloud.9502: Flags [S], seq 2530371907, win 1024, options [mss 1460], length 0
01:09:27.599685 IP S1-anjo5726.cloud.33822 > L1-anjo5726.cloud.3546: Flags [S], seq 2530371907, win 1024, options [mss 1460], length 0
01:09:27.599697 IP S1-anjo5726.cloud.33822 > L1-anjo5726.cloud.font-service: Flags [S], seq 2530371907, win 1024, options [mss 1460], length 0
01:09:27.599773 IP L1-anjo5726.cloud.6547 > S1-anjo5726.cloud.33822: Flags [R.], seq 0, ack 2530371908, win 0, length 0
01:09:27.599774 IP L1-anjo5726.cloud.9898 > S1-anjo5726.cloud.33822: Flags [R.], seq 0, ack 2530371908, win 0, length 0
01:09:27.599775 IP L1-anjo5726.cloud.1036 > S1-anjo5726.cloud.33822: Flags [R.], seq 0, ack 2530371908, win 0, length 0
01:09:27.599776 IP L1-anjo5726.cloud.8649 > S1-anjo5726.cloud.33822: Flags [R.], seq 0, ack 2530371908, win 0, length 0
01:09:27.599777 IP L1-anjo5726.cloud.1095 > S1-anjo5726.cloud.33822: Flags [R.], seq 0, ack 2530371908, win 0, length 0
01:09:27.599777 IP L1-anjo5726.cloud.7201 > S1-anjo5726.cloud.33822: Flags [R.], seq 0, ack 2530371908, win 0, length 0
01:09:27.599807 IP S1-anjo5726.cloud.33822 > L1-anjo5726.cloud.2998: Flags [S], seq 2530371907, win 1024, options [mss 1460], length 0
01:09:27.599846 IP L1-anjo5726.cloud.9502 > S1-anjo5726.cloud.33822: Flags [R.], seq 0, ack 2530371908, win 0, length 0
01:09:27.599847 IP L1-anjo5726.cloud.3546 > S1-anjo5726.cloud.33822: Flags [R.], seq 0, ack 2530371908, win 0, length 0
01:09:27.599848 IP L1-anjo5726.cloud.font-service > S1-anjo5726.cloud.33822: Flags [R.], seq 0, ack 2530371908, win 0, length 0
01:09:27.599878 IP S1-anjo5726.cloud.33822 > L1-anjo5726.cloud.44176: Flags [S], seq 2530371907, win 1024, options [mss 1460], length 0
01:09:27.599899 IP S1-anjo5726.cloud.33822 > L1-anjo5726.cloud.5910: Flags [S], seq 2530371907, win 1024, options [mss 1460], length 0
01:09:27.599911 IP S1-anjo5726.cloud.33822 > L1-anjo5726.cloud.1122: Flags [S], seq 2530371907, win 1024, options [mss 1460], length 0
01:09:27.599958 IP L1-anjo5726.cloud.2998 > S1-anjo5726.cloud.33822: Flags [R.], seq 0, ack 2530371908, win 0, length 0
01:09:27.599970 IP L1-anjo5726.cloud.44176 > S1-anjo5726.cloud.33822: Flags [R.], seq 0, ack 2530371908, win 0, length 0
01:09:27.599985 IP L1-anjo5726.cloud.5910 > S1-anjo5726.cloud.33822: Flags [R.], seq 0, ack 2530371908, win 0, length 0
01:09:27.600000 IP L1-anjo5726.cloud.1122 > S1-anjo5726.cloud.33822: Flags [R.], seq 0, ack 2530371908, win 0, length 0
01:09:27.600356 IP S1-anjo5726.cloud.33822 > L1-anjo5726.cloud.1334: Flags [S], seq 2530371907, win 1024, options [mss 1460], length 0
01:09:27.600381 IP S1-anjo5726.cloud.33822 > L1-anjo5726.cloud.5560: Flags [S], seq 2530371907, win 1024, options [mss 1460], length 0
01:09:27.600401 IP S1-anjo5726.cloud.33822 > L1-anjo5726.cloud.gopher: Flags [S], seq 2530371907, win 1024, options [mss 1460], length 0
01:09:27.600414 IP S1-anjo5726.cloud.33822 > L1-anjo5726.cloud.5679: Flags [S], seq 2530371907, win 1024, options [mss 1460], length 0
01:09:27.600424 IP S1-anjo5726.cloud.33822 > L1-anjo5726.cloud.3703: Flags [S], seq 2530371907, win 1024, options [mss 1460], length 0
01:09:27.600435 IP S1-anjo5726.cloud.33822 > L1-anjo5726.cloud.1247: Flags [S], seq 2530371907, win 1024, options [mss 1460], length 0
01:09:27.600451 IP S1-anjo5726.cloud.33822 > L1-anjo5726.cloud.5087: Flags [S], seq 2530371907, win 1024, options [mss 1460], length 0
01:09:27.600462 IP S1-anjo5726.cloud.33822 > L1-anjo5726.cloud.2301: Flags [S], seq 2530371907, win 1024, options [mss 1460], length 0
01:09:27.600480 IP S1-anjo5726.cloud.33822 > L1-anjo5726.cloud.2042: Flags [S], seq 2530371907, win 1024, options [mss 1460], length 0
01:09:27.600525 IP L1-anjo5726.cloud.1334 > S1-anjo5726.cloud.33822: Flags [R.], seq 0, ack 2530371908, win 0, length 0
01:09:27.600527 IP L1-anjo5726.cloud.5560 > S1-anjo5726.cloud.33822: Flags [R.], seq 0, ack 2530371908, win 0, length 0
01:09:27.600528 IP L1-anjo5726.cloud.gopher > S1-anjo5726.cloud.33822: Flags [R.], seq 0, ack 2530371908, win 0, length 0
01:09:27.600528 IP L1-anjo5726.cloud.5679 > S1-anjo5726.cloud.33822: Flags [R.], seq 0, ack 2530371908, win 0, length 0
01:09:27.600529 IP L1-anjo5726.cloud.3703 > S1-anjo5726.cloud.33822: Flags [R.], seq 0, ack 2530371908, win 0, length 0
01:09:27.600530 IP L1-anjo5726.cloud.1247 > S1-anjo5726.cloud.33822: Flags [R.], seq 0, ack 2530371908, win 0, length 0
01:09:27.600553 IP S1-anjo5726.cloud.33822 > L1-anjo5726.cloud.1030: Flags [S], seq 2530371907, win 1024, options [mss 1460], length 0
01:09:27.600589 IP S1-anjo5726.cloud.33822 > L1-anjo5726.cloud.10566: Flags [S], seq 2530371907, win 1024, options [mss 1460], length 0
01:09:27.600616 IP L1-anjo5726.cloud.5087 > S1-anjo5726.cloud.33822: Flags [R.], seq 0, ack 2530371908, win 0, length 0
01:09:27.600635 IP L1-anjo5726.cloud.2301 > S1-anjo5726.cloud.33822: Flags [R.], seq 0, ack 2530371908, win 0, length 0
01:09:27.600657 IP L1-anjo5726.cloud.2042 > S1-anjo5726.cloud.33822: Flags [R.], seq 0, ack 2530371908, win 0, length 0
01:09:27.600664 IP S1-anjo5726.cloud.33822 > L1-anjo5726.cloud.2107: Flags [S], seq 2530371907, win 1024, options [mss 1460], length 0
01:09:27.600685 IP S1-anjo5726.cloud.33822 > L1-anjo5726.cloud.1023: Flags [S], seq 2530371907, win 1024, options [mss 1460], length 0
01:09:27.600696 IP S1-anjo5726.cloud.33822 > L1-anjo5726.cloud.50000: Flags [S], seq 2530371907, win 1024, options [mss 1460], length 0
01:09:27.600707 IP S1-anjo5726.cloud.33822 > L1-anjo5726.cloud.30000: Flags [S], seq 2530371907, win 1024, options [mss 1460], length 0
01:09:27.600743 IP S1-anjo5726.cloud.33822 > L1-anjo5726.cloud.1102: Flags [S], seq 2530371907, win 1024, options [mss 1460], length 0
01:09:27.600763 IP L1-anjo5726.cloud.1030 > S1-anjo5726.cloud.33822: Flags [R.], seq 0, ack 2530371908, win 0, length 0
01:09:27.600764 IP L1-anjo5726.cloud.10566 > S1-anjo5726.cloud.33822: Flags [R.], seq 0, ack 2530371908, win 0, length 0
01:09:27.600765 IP L1-anjo5726.cloud.2107 > S1-anjo5726.cloud.33822: Flags [R.], seq 0, ack 2530371908, win 0, length 0
01:09:27.600766 IP L1-anjo5726.cloud.1023 > S1-anjo5726.cloud.33822: Flags [R.], seq 0, ack 2530371908, win 0, length 0
01:09:27.600797 IP L1-anjo5726.cloud.50000 > S1-anjo5726.cloud.33822: Flags [R.], seq 0, ack 2530371908, win 0, length 0
01:09:27.600798 IP L1-anjo5726.cloud.30000 > S1-anjo5726.cloud.33822: Flags [R.], seq 0, ack 2530371908, win 0, length 0
01:09:27.600815 IP S1-anjo5726.cloud.33822 > L1-anjo5726.cloud.14238: Flags [S], seq 2530371907, win 1024, options [mss 1460], length 0
01:09:27.600834 IP S1-anjo5726.cloud.33822 > L1-anjo5726.cloud.sip: Flags [S], seq 2530371907, win 1024, options [mss 1460], length 0
01:09:27.600844 IP S1-anjo5726.cloud.33822 > L1-anjo5726.cloud.1082: Flags [S], seq 2530371907, win 1024, options [mss 1460], length 0
01:09:27.600863 IP S1-anjo5726.cloud.33822 > L1-anjo5726.cloud.32783: Flags [S], seq 2530371907, win 1024, options [mss 1460], length 0
01:09:27.600889 IP L1-anjo5726.cloud.1102 > S1-anjo5726.cloud.33822: Flags [R.], seq 0, ack 2530371908, win 0, length 0
01:09:27.600940 IP L1-anjo5726.cloud.14238 > S1-anjo5726.cloud.33822: Flags [R.], seq 0, ack 2530371908, win 0, length 0
01:09:27.600941 IP L1-anjo5726.cloud.sip > S1-anjo5726.cloud.33822: Flags [R.], seq 0, ack 2530371908, win 0, length 0
01:09:27.600942 IP L1-anjo5726.cloud.1082 > S1-anjo5726.cloud.33822: Flags [R.], seq 0, ack 2530371908, win 0, length 0
01:09:27.600955 IP L1-anjo5726.cloud.32783 > S1-anjo5726.cloud.33822: Flags [R.], seq 0, ack 2530371908, win 0, length 0
01:09:27.600962 IP S1-anjo5726.cloud.33822 > L1-anjo5726.cloud.1165: Flags [S], seq 2530371907, win 1024, options [mss 1460], length 0
01:09:27.600984 IP S1-anjo5726.cloud.33822 > L1-anjo5726.cloud.3869: Flags [S], seq 2530371907, win 1024, options [mss 1460], length 0
01:09:27.600994 IP S1-anjo5726.cloud.33822 > L1-anjo5726.cloud.7920: Flags [S], seq 2530371907, win 1024, options [mss 1460], length 0
01:09:27.601004 IP S1-anjo5726.cloud.33822 > L1-anjo5726.cloud.9011: Flags [S], seq 2530371907, win 1024, options [mss 1460], length 0
01:09:27.601014 IP S1-anjo5726.cloud.33822 > L1-anjo5726.cloud.3766: Flags [S], seq 2530371907, win 1024, options [mss 1460], length 0
01:09:27.601024 IP S1-anjo5726.cloud.33822 > L1-anjo5726.cloud.9900: Flags [S], seq 2530371907, win 1024, options [mss 1460], length 0
01:09:27.601034 IP S1-anjo5726.cloud.33822 > L1-anjo5726.cloud.2001: Flags [S], seq 2530371907, win 1024, options [mss 1460], length 0
01:09:27.601051 IP S1-anjo5726.cloud.33822 > L1-anjo5726.cloud.1096: Flags [S], seq 2530371907, win 1024, options [mss 1460], length 0
01:09:27.601086 IP S1-anjo5726.cloud.33822 > L1-anjo5726.cloud.3301: Flags [S], seq 2530371907, win 1024, options [mss 1460], length 0
01:09:27.601109 IP L1-anjo5726.cloud.1165 > S1-anjo5726.cloud.33822: Flags [R.], seq 0, ack 2530371908, win 0, length 0
01:09:27.601110 IP L1-anjo5726.cloud.3869 > S1-anjo5726.cloud.33822: Flags [R.], seq 0, ack 2530371908, win 0, length 0
01:09:27.601111 IP L1-anjo5726.cloud.7920 > S1-anjo5726.cloud.33822: Flags [R.], seq 0, ack 2530371908, win 0, length 0
01:09:27.601112 IP L1-anjo5726.cloud.9011 > S1-anjo5726.cloud.33822: Flags [R.], seq 0, ack 2530371908, win 0, length 0
01:09:27.601141 IP L1-anjo5726.cloud.3766 > S1-anjo5726.cloud.33822: Flags [R.], seq 0, ack 2530371908, win 0, length 0
01:09:27.601141 IP L1-anjo5726.cloud.9900 > S1-anjo5726.cloud.33822: Flags [R.], seq 0, ack 2530371908, win 0, length 0
01:09:27.601170 IP L1-anjo5726.cloud.2001 > S1-anjo5726.cloud.33822: Flags [R.], seq 0, ack 2530371908, win 0, length 0
01:09:27.601170 IP L1-anjo5726.cloud.1096 > S1-anjo5726.cloud.33822: Flags [R.], seq 0, ack 2530371908, win 0, length 0
01:09:27.601171 IP L1-anjo5726.cloud.3301 > S1-anjo5726.cloud.33822: Flags [R.], seq 0, ack 2530371908, win 0, length 0
01:09:27.601185 IP S1-anjo5726.cloud.33822 > L1-anjo5726.cloud.5825: Flags [S], seq 2530371907, win 1024, options [mss 1460], length 0
01:09:27.601205 IP S1-anjo5726.cloud.33822 > L1-anjo5726.cloud.2875: Flags [S], seq 2530371907, win 1024, options [mss 1460], length 0
01:09:27.601215 IP S1-anjo5726.cloud.33822 > L1-anjo5726.cloud.9111: Flags [S], seq 2530371907, win 1024, options [mss 1460], length 0
01:09:27.601225 IP S1-anjo5726.cloud.33822 > L1-anjo5726.cloud.xmpp-server: Flags [S], seq 2530371907, win 1024, options [mss 1460], length 0
