01:10:11.928552 IP L1-anjo5726.cloud.ntp > ns2.telecom.lt.ntp: NTPv4, Client, length 48
01:10:11.931331 IP ns2.telecom.lt.ntp > L1-anjo5726.cloud.ntp: NTPv4, Server, length 48
01:10:12.853553 IP L1-anjo5726.cloud.58738 > router1.cloud.domain: 9585+ PTR? 2.0.59.212.in-addr.arpa. (41)
01:10:12.856259 IP router1.cloud.domain > L1-anjo5726.cloud.58738: 9585 1/2/2 PTR ns2.telecom.lt. (133)
01:10:12.856535 IP L1-anjo5726.cloud.40055 > router1.cloud.domain: 1068+ PTR? 16.0.16.172.in-addr.arpa. (42)
01:10:12.857495 IP router1.cloud.domain > L1-anjo5726.cloud.40055: 1068* 1/0/0 PTR L1-anjo5726.cloud. (73)
01:10:13.876618 IP L1-anjo5726.cloud.45437 > router1.cloud.domain: 44682+ PTR? 1.0.16.172.in-addr.arpa. (41)
01:10:13.877813 IP router1.cloud.domain > L1-anjo5726.cloud.45437: 44682* 1/0/0 PTR router1.cloud. (68)
01:10:16.946399 ARP, Request who-has L1-anjo5726.cloud tell router1.cloud, length 28
01:10:16.946434 ARP, Reply L1-anjo5726.cloud is-at 02:00:ac:10:00:10 (oui Unknown), length 28
01:10:17.012231 ARP, Request who-has router1.cloud tell L1-anjo5726.cloud, length 28
01:10:17.013184 ARP, Reply router1.cloud is-at 02:00:ac:10:00:01 (oui Unknown), length 28
01:10:23.171791 ARP, Request who-has L1-anjo5726.cloud tell S1-anjo5726.cloud, length 28
01:10:23.171819 ARP, Reply L1-anjo5726.cloud is-at 02:00:ac:10:00:10 (oui Unknown), length 28
01:10:23.174931 IP S1-anjo5726.cloud.38034 > L1-anjo5726.cloud.rtsp: Flags [S], seq 2330597225, win 1024, options [mss 1460], length 0
01:10:23.174931 IP S1-anjo5726.cloud.38034 > L1-anjo5726.cloud.microsoft-ds: Flags [S], seq 2330597225, win 1024, options [mss 1460], length 0
01:10:23.174931 IP S1-anjo5726.cloud.38034 > L1-anjo5726.cloud.smux: Flags [S], seq 2330597225, win 1024, options [mss 1460], length 0
01:10:23.174931 IP S1-anjo5726.cloud.38034 > L1-anjo5726.cloud.ms-wbt-server: Flags [S], seq 2330597225, win 1024, options [mss 1460], length 0
01:10:23.174931 IP S1-anjo5726.cloud.38034 > L1-anjo5726.cloud.ssh: Flags [S], seq 2330597225, win 1024, options [mss 1460], length 0
01:10:23.174931 IP S1-anjo5726.cloud.38034 > L1-anjo5726.cloud.https: Flags [S], seq 2330597225, win 1024, options [mss 1460], length 0
01:10:23.174931 IP S1-anjo5726.cloud.38034 > L1-anjo5726.cloud.http: Flags [S], seq 2330597225, win 1024, options [mss 1460], length 0
01:10:23.174932 IP S1-anjo5726.cloud.38034 > L1-anjo5726.cloud.imaps: Flags [S], seq 2330597225, win 1024, options [mss 1460], length 0
01:10:23.174983 IP L1-anjo5726.cloud.rtsp > S1-anjo5726.cloud.38034: Flags [R.], seq 0, ack 2330597226, win 0, length 0
01:10:23.175020 IP L1-anjo5726.cloud.microsoft-ds > S1-anjo5726.cloud.38034: Flags [R.], seq 0, ack 2330597226, win 0, length 0
01:10:23.175025 IP L1-anjo5726.cloud.smux > S1-anjo5726.cloud.38034: Flags [R.], seq 0, ack 2330597226, win 0, length 0
01:10:23.175029 IP L1-anjo5726.cloud.ms-wbt-server > S1-anjo5726.cloud.38034: Flags [R.], seq 0, ack 2330597226, win 0, length 0
01:10:23.175050 IP L1-anjo5726.cloud.ssh > S1-anjo5726.cloud.38034: Flags [S.], seq 3089415642, ack 2330597226, win 64240, options [mss 1460], length 0
01:10:23.175055 IP L1-anjo5726.cloud.https > S1-anjo5726.cloud.38034: Flags [R.], seq 0, ack 2330597226, win 0, length 0
01:10:23.175062 IP L1-anjo5726.cloud.http > S1-anjo5726.cloud.38034: Flags [S.], seq 1735977133, ack 2330597226, win 64240, options [mss 1460], length 0
01:10:23.175081 IP L1-anjo5726.cloud.imaps > S1-anjo5726.cloud.38034: Flags [R.], seq 0, ack 2330597226, win 0, length 0
01:10:23.175087 IP S1-anjo5726.cloud.38034 > L1-anjo5726.cloud.netbios-ssn: Flags [S], seq 2330597225, win 1024, options [mss 1460], length 0
01:10:23.175087 IP S1-anjo5726.cloud.38034 > L1-anjo5726.cloud.mysql: Flags [S], seq 2330597225, win 1024, options [mss 1460], length 0
01:10:23.175094 IP L1-anjo5726.cloud.netbios-ssn > S1-anjo5726.cloud.38034: Flags [R.], seq 0, ack 2330597226, win 0, length 0
01:10:23.175099 IP L1-anjo5726.cloud.mysql > S1-anjo5726.cloud.38034: Flags [R.], seq 0, ack 2330597226, win 0, length 0
01:10:23.175456 IP S1-anjo5726.cloud.38034 > L1-anjo5726.cloud.ssh: Flags [R], seq 2330597226, win 0, length 0
01:10:23.175456 IP S1-anjo5726.cloud.38034 > L1-anjo5726.cloud.http: Flags [R], seq 2330597226, win 0, length 0
01:10:23.175638 IP S1-anjo5726.cloud.38034 > L1-anjo5726.cloud.sunrpc: Flags [S], seq 2330597225, win 1024, options [mss 1460], length 0
01:10:23.175638 IP S1-anjo5726.cloud.38034 > L1-anjo5726.cloud.ftp: Flags [S], seq 2330597225, win 1024, options [mss 1460], length 0
01:10:23.175638 IP S1-anjo5726.cloud.38034 > L1-anjo5726.cloud.pop3: Flags [S], seq 2330597225, win 1024, options [mss 1460], length 0
01:10:23.175638 IP S1-anjo5726.cloud.38034 > L1-anjo5726.cloud.auth: Flags [S], seq 2330597225, win 1024, options [mss 1460], length 0
01:10:23.175638 IP S1-anjo5726.cloud.38034 > L1-anjo5726.cloud.5900: Flags [S], seq 2330597225, win 1024, options [mss 1460], length 0
01:10:23.175638 IP S1-anjo5726.cloud.38034 > L1-anjo5726.cloud.256: Flags [S], seq 2330597225, win 1024, options [mss 1460], length 0
01:10:23.175638 IP S1-anjo5726.cloud.38034 > L1-anjo5726.cloud.submission: Flags [S], seq 2330597225, win 1024, options [mss 1460], length 0
01:10:23.175638 IP S1-anjo5726.cloud.38034 > L1-anjo5726.cloud.smtp: Flags [S], seq 2330597225, win 1024, options [mss 1460], length 0
01:10:23.175664 IP L1-anjo5726.cloud.sunrpc > S1-anjo5726.cloud.38034: Flags [S.], seq 1966628504, ack 2330597226, win 64240, options [mss 1460], length 0
01:10:23.175682 IP L1-anjo5726.cloud.ftp > S1-anjo5726.cloud.38034: Flags [S.], seq 148719639, ack 2330597226, win 64240, options [mss 1460], length 0
01:10:23.175689 IP L1-anjo5726.cloud.pop3 > S1-anjo5726.cloud.38034: Flags [R.], seq 0, ack 2330597226, win 0, length 0
01:10:23.175693 IP L1-anjo5726.cloud.auth > S1-anjo5726.cloud.38034: Flags [R.], seq 0, ack 2330597226, win 0, length 0
01:10:23.175698 IP L1-anjo5726.cloud.5900 > S1-anjo5726.cloud.38034: Flags [R.], seq 0, ack 2330597226, win 0, length 0
01:10:23.175702 IP L1-anjo5726.cloud.256 > S1-anjo5726.cloud.38034: Flags [R.], seq 0, ack 2330597226, win 0, length 0
01:10:23.175705 IP L1-anjo5726.cloud.submission > S1-anjo5726.cloud.38034: Flags [R.], seq 0, ack 2330597226, win 0, length 0
01:10:23.175713 IP L1-anjo5726.cloud.smtp > S1-anjo5726.cloud.38034: Flags [S.], seq 29663354, ack 2330597226, win 64240, options [mss 1460], length 0
01:10:23.175768 IP S1-anjo5726.cloud.38034 > L1-anjo5726.cloud.8888: Flags [S], seq 2330597225, win 1024, options [mss 1460], length 0
01:10:23.175768 IP S1-anjo5726.cloud.38034 > L1-anjo5726.cloud.domain: Flags [S], seq 2330597225, win 1024, options [mss 1460], length 0
01:10:23.175768 IP S1-anjo5726.cloud.38034 > L1-anjo5726.cloud.imap2: Flags [S], seq 2330597225, win 1024, options [mss 1460], length 0
01:10:23.175769 IP S1-anjo5726.cloud.38034 > L1-anjo5726.cloud.pop3s: Flags [S], seq 2330597225, win 1024, options [mss 1460], length 0
01:10:23.175769 IP S1-anjo5726.cloud.38034 > L1-anjo5726.cloud.http-alt: Flags [S], seq 2330597225, win 1024, options [mss 1460], length 0
01:10:23.175782 IP L1-anjo5726.cloud.8888 > S1-anjo5726.cloud.38034: Flags [R.], seq 0, ack 2330597226, win 0, length 0
01:10:23.175822 IP L1-anjo5726.cloud.domain > S1-anjo5726.cloud.38034: Flags [S.], seq 1715592496, ack 2330597226, win 64240, options [mss 1460], length 0
01:10:23.175828 IP L1-anjo5726.cloud.imap2 > S1-anjo5726.cloud.38034: Flags [R.], seq 0, ack 2330597226, win 0, length 0
01:10:23.175832 IP L1-anjo5726.cloud.pop3s > S1-anjo5726.cloud.38034: Flags [R.], seq 0, ack 2330597226, win 0, length 0
01:10:23.175836 IP L1-anjo5726.cloud.http-alt > S1-anjo5726.cloud.38034: Flags [R.], seq 0, ack 2330597226, win 0, length 0
01:10:23.175845 IP S1-anjo5726.cloud.38034 > L1-anjo5726.cloud.1723: Flags [S], seq 2330597225, win 1024, options [mss 1460], length 0
01:10:23.175845 IP S1-anjo5726.cloud.38034 > L1-anjo5726.cloud.telnet: Flags [S], seq 2330597225, win 1024, options [mss 1460], length 0
01:10:23.175845 IP S1-anjo5726.cloud.38034 > L1-anjo5726.cloud.1720: Flags [S], seq 2330597225, win 1024, options [mss 1460], length 0
01:10:23.175845 IP S1-anjo5726.cloud.38034 > L1-anjo5726.cloud.epmap: Flags [S], seq 2330597225, win 1024, options [mss 1460], length 0
01:10:23.175845 IP S1-anjo5726.cloud.38034 > L1-anjo5726.cloud.1025: Flags [S], seq 2330597225, win 1024, options [mss 1460], length 0
01:10:23.175845 IP S1-anjo5726.cloud.38034 > L1-anjo5726.cloud.5033: Flags [S], seq 2330597225, win 1024, options [mss 1460], length 0
01:10:23.175846 IP S1-anjo5726.cloud.38034 > L1-anjo5726.cloud.1081: Flags [S], seq 2330597225, win 1024, options [mss 1460], length 0
01:10:23.175863 IP L1-anjo5726.cloud.1723 > S1-anjo5726.cloud.38034: Flags [R.], seq 0, ack 2330597226, win 0, length 0
01:10:23.175876 IP L1-anjo5726.cloud.telnet > S1-anjo5726.cloud.38034: Flags [R.], seq 0, ack 2330597226, win 0, length 0
01:10:23.175880 IP L1-anjo5726.cloud.1720 > S1-anjo5726.cloud.38034: Flags [R.], seq 0, ack 2330597226, win 0, length 0
01:10:23.175884 IP L1-anjo5726.cloud.epmap > S1-anjo5726.cloud.38034: Flags [R.], seq 0, ack 2330597226, win 0, length 0
01:10:23.175888 IP L1-anjo5726.cloud.1025 > S1-anjo5726.cloud.38034: Flags [R.], seq 0, ack 2330597226, win 0, length 0
01:10:23.175892 IP L1-anjo5726.cloud.5033 > S1-anjo5726.cloud.38034: Flags [R.], seq 0, ack 2330597226, win 0, length 0
01:10:23.175896 IP L1-anjo5726.cloud.1081 > S1-anjo5726.cloud.38034: Flags [R.], seq 0, ack 2330597226, win 0, length 0
01:10:23.175929 IP S1-anjo5726.cloud.38034 > L1-anjo5726.cloud.sunrpc: Flags [R], seq 2330597226, win 0, length 0
01:10:23.175930 IP S1-anjo5726.cloud.38034 > L1-anjo5726.cloud.ftp: Flags [R], seq 2330597226, win 0, length 0
01:10:23.175930 IP S1-anjo5726.cloud.38034 > L1-anjo5726.cloud.smtp: Flags [R], seq 2330597226, win 0, length 0
01:10:23.175982 IP S1-anjo5726.cloud.38034 > L1-anjo5726.cloud.domain: Flags [R], seq 2330597226, win 0, length 0
01:10:23.176275 IP S1-anjo5726.cloud.38034 > L1-anjo5726.cloud.9666: Flags [S], seq 2330597225, win 1024, options [mss 1460], length 0
01:10:23.176275 IP S1-anjo5726.cloud.38034 > L1-anjo5726.cloud.1311: Flags [S], seq 2330597225, win 1024, options [mss 1460], length 0
01:10:23.176275 IP S1-anjo5726.cloud.38034 > L1-anjo5726.cloud.8300: Flags [S], seq 2330597225, win 1024, options [mss 1460], length 0
01:10:23.176275 IP S1-anjo5726.cloud.38034 > L1-anjo5726.cloud.16001: Flags [S], seq 2330597225, win 1024, options [mss 1460], length 0
01:10:23.176275 IP S1-anjo5726.cloud.38034 > L1-anjo5726.cloud.1009: Flags [S], seq 2330597225, win 1024, options [mss 1460], length 0
01:10:23.176302 IP L1-anjo5726.cloud.9666 > S1-anjo5726.cloud.38034: Flags [R.], seq 0, ack 2330597226, win 0, length 0
01:10:23.176321 IP L1-anjo5726.cloud.1311 > S1-anjo5726.cloud.38034: Flags [R.], seq 0, ack 2330597226, win 0, length 0
01:10:23.176325 IP L1-anjo5726.cloud.8300 > S1-anjo5726.cloud.38034: Flags [R.], seq 0, ack 2330597226, win 0, length 0
01:10:23.176329 IP L1-anjo5726.cloud.16001 > S1-anjo5726.cloud.38034: Flags [R.], seq 0, ack 2330597226, win 0, length 0
01:10:23.176333 IP L1-anjo5726.cloud.1009 > S1-anjo5726.cloud.38034: Flags [R.], seq 0, ack 2330597226, win 0, length 0
01:10:23.176339 IP S1-anjo5726.cloud.38034 > L1-anjo5726.cloud.2301: Flags [S], seq 2330597225, win 1024, options [mss 1460], length 0
01:10:23.176340 IP S1-anjo5726.cloud.38034 > L1-anjo5726.cloud.2033: Flags [S], seq 2330597225, win 1024, options [mss 1460], length 0
01:10:23.176340 IP S1-anjo5726.cloud.38034 > L1-anjo5726.cloud.snmp: Flags [S], seq 2330597225, win 1024, options [mss 1460], length 0
01:10:23.176345 IP L1-anjo5726.cloud.2301 > S1-anjo5726.cloud.38034: Flags [R.], seq 0, ack 2330597226, win 0, length 0
01:10:23.176370 IP L1-anjo5726.cloud.2033 > S1-anjo5726.cloud.38034: Flags [R.], seq 0, ack 2330597226, win 0, length 0
01:10:23.176383 IP L1-anjo5726.cloud.snmp > S1-anjo5726.cloud.38034: Flags [R.], seq 0, ack 2330597226, win 0, length 0
01:10:23.176391 IP S1-anjo5726.cloud.38034 > L1-anjo5726.cloud.8899: Flags [S], seq 2330597225, win 1024, options [mss 1460], length 0
01:10:23.176391 IP S1-anjo5726.cloud.38034 > L1-anjo5726.cloud.5030: Flags [S], seq 2330597225, win 1024, options [mss 1460], length 0
01:10:23.176391 IP S1-anjo5726.cloud.38034 > L1-anjo5726.cloud.1328: Flags [S], seq 2330597225, win 1024, options [mss 1460], length 0
01:10:23.176391 IP S1-anjo5726.cloud.38034 > L1-anjo5726.cloud.1051: Flags [S], seq 2330597225, win 1024, options [mss 1460], length 0
01:10:23.176391 IP S1-anjo5726.cloud.38034 > L1-anjo5726.cloud.kshell: Flags [S], seq 2330597225, win 1024, options [mss 1460], length 0
01:10:23.176391 IP S1-anjo5726.cloud.38034 > L1-anjo5726.cloud.49152: Flags [S], seq 2330597225, win 1024, options [mss 1460], length 0
01:10:23.176415 IP L1-anjo5726.cloud.8899 > S1-anjo5726.cloud.38034: Flags [R.], seq 0, ack 2330597226, win 0, length 0
01:10:23.176424 IP L1-anjo5726.cloud.5030 > S1-anjo5726.cloud.38034: Flags [R.], seq 0, ack 2330597226, win 0, length 0
01:10:23.176429 IP L1-anjo5726.cloud.1328 > S1-anjo5726.cloud.38034: Flags [R.], seq 0, ack 2330597226, win 0, length 0
01:10:23.176432 IP L1-anjo5726.cloud.1051 > S1-anjo5726.cloud.38034: Flags [R.], seq 0, ack 2330597226, win 0, length 0
01:10:23.176436 IP L1-anjo5726.cloud.kshell > S1-anjo5726.cloud.38034: Flags [R.], seq 0, ack 2330597226, win 0, length 0
01:10:23.176440 IP L1-anjo5726.cloud.49152 > S1-anjo5726.cloud.38034: Flags [R.], seq 0, ack 2330597226, win 0, length 0
01:10:23.176446 IP S1-anjo5726.cloud.38034 > L1-anjo5726.cloud.49159: Flags [S], seq 2330597225, win 1024, options [mss 1460], length 0
01:10:23.176446 IP S1-anjo5726.cloud.38034 > L1-anjo5726.cloud.3211: Flags [S], seq 2330597225, win 1024, options [mss 1460], length 0
01:10:23.176446 IP S1-anjo5726.cloud.38034 > L1-anjo5726.cloud.34571: Flags [S], seq 2330597225, win 1024, options [mss 1460], length 0
01:10:23.176446 IP S1-anjo5726.cloud.38034 > L1-anjo5726.cloud.903: Flags [S], seq 2330597225, win 1024, options [mss 1460], length 0
01:10:23.176452 IP L1-anjo5726.cloud.49159 > S1-anjo5726.cloud.38034: Flags [R.], seq 0, ack 2330597226, win 0, length 0
01:10:23.176456 IP L1-anjo5726.cloud.3211 > S1-anjo5726.cloud.38034: Flags [R.], seq 0, ack 2330597226, win 0, length 0
01:10:23.176460 IP L1-anjo5726.cloud.34571 > S1-anjo5726.cloud.38034: Flags [R.], seq 0, ack 2330597226, win 0, length 0
01:10:23.176463 IP L1-anjo5726.cloud.903 > S1-anjo5726.cloud.38034: Flags [R.], seq 0, ack 2330597226, win 0, length 0
01:10:23.176510 IP S1-anjo5726.cloud.38034 > L1-anjo5726.cloud.10025: Flags [S], seq 2330597225, win 1024, options [mss 1460], length 0
01:10:23.176510 IP S1-anjo5726.cloud.38034 > L1-anjo5726.cloud.2038: Flags [S], seq 2330597225, win 1024, options [mss 1460], length 0
01:10:23.176510 IP S1-anjo5726.cloud.38034 > L1-anjo5726.cloud.1862: Flags [S], seq 2330597225, win 1024, options [mss 1460], length 0
01:10:23.176510 IP S1-anjo5726.cloud.38034 > L1-anjo5726.cloud.49160: Flags [S], seq 2330597225, win 1024, options [mss 1460], length 0
01:10:23.176510 IP S1-anjo5726.cloud.38034 > L1-anjo5726.cloud.50500: Flags [S], seq 2330597225, win 1024, options [mss 1460], length 0
01:10:23.176510 IP S1-anjo5726.cloud.38034 > L1-anjo5726.cloud.9207: Flags [S], seq 2330597225, win 1024, options [mss 1460], length 0
01:10:23.176510 IP S1-anjo5726.cloud.38034 > L1-anjo5726.cloud.7106: Flags [S], seq 2330597225, win 1024, options [mss 1460], length 0
01:10:23.176510 IP S1-anjo5726.cloud.38034 > L1-anjo5726.cloud.moira-update: Flags [S], seq 2330597225, win 1024, options [mss 1460], length 0
01:10:23.176520 IP L1-anjo5726.cloud.10025 > S1-anjo5726.cloud.38034: Flags [R.], seq 0, ack 2330597226, win 0, length 0
01:10:23.176533 IP L1-anjo5726.cloud.2038 > S1-anjo5726.cloud.38034: Flags [R.], seq 0, ack 2330597226, win 0, length 0
01:10:23.176538 IP L1-anjo5726.cloud.1862 > S1-anjo5726.cloud.38034: Flags [R.], seq 0, ack 2330597226, win 0, length 0
01:10:23.176542 IP L1-anjo5726.cloud.49160 > S1-anjo5726.cloud.38034: Flags [R.], seq 0, ack 2330597226, win 0, length 0
01:10:23.176546 IP L1-anjo5726.cloud.50500 > S1-anjo5726.cloud.38034: Flags [R.], seq 0, ack 2330597226, win 0, length 0
01:10:23.176551 IP L1-anjo5726.cloud.9207 > S1-anjo5726.cloud.38034: Flags [R.], seq 0, ack 2330597226, win 0, length 0
01:10:23.176555 IP L1-anjo5726.cloud.7106 > S1-anjo5726.cloud.38034: Flags [R.], seq 0, ack 2330597226, win 0, length 0
01:10:23.176558 IP L1-anjo5726.cloud.moira-update > S1-anjo5726.cloud.38034: Flags [R.], seq 0, ack 2330597226, win 0, length 0
01:10:23.176588 IP S1-anjo5726.cloud.38034 > L1-anjo5726.cloud.714: Flags [S], seq 2330597225, win 1024, options [mss 1460], length 0
01:10:23.176595 IP L1-anjo5726.cloud.714 > S1-anjo5726.cloud.38034: Flags [R.], seq 0, ack 2330597226, win 0, length 0
01:10:23.176612 IP S1-anjo5726.cloud.38034 > L1-anjo5726.cloud.7004: Flags [S], seq 2330597225, win 1024, options [mss 1460], length 0
01:10:23.176612 IP S1-anjo5726.cloud.38034 > L1-anjo5726.cloud.2967: Flags [S], seq 2330597225, win 1024, options [mss 1460], length 0
01:10:23.176612 IP S1-anjo5726.cloud.38034 > L1-anjo5726.cloud.8085: Flags [S], seq 2330597225, win 1024, options [mss 1460], length 0
01:10:23.176612 IP S1-anjo5726.cloud.38034 > L1-anjo5726.cloud.1041: Flags [S], seq 2330597225, win 1024, options [mss 1460], length 0
01:10:23.176613 IP S1-anjo5726.cloud.38034 > L1-anjo5726.cloud.3404: Flags [S], seq 2330597225, win 1024, options [mss 1460], length 0
01:10:23.176613 IP S1-anjo5726.cloud.38034 > L1-anjo5726.cloud.1183: Flags [S], seq 2330597225, win 1024, options [mss 1460], length 0
01:10:23.176613 IP S1-anjo5726.cloud.38034 > L1-anjo5726.cloud.45100: Flags [S], seq 2330597225, win 1024, options [mss 1460], length 0
01:10:23.176637 IP L1-anjo5726.cloud.7004 > S1-anjo5726.cloud.38034: Flags [R.], seq 0, ack 2330597226, win 0, length 0
01:10:23.176647 IP L1-anjo5726.cloud.2967 > S1-anjo5726.cloud.38034: Flags [R.], seq 0, ack 2330597226, win 0, length 0
01:10:23.176651 IP L1-anjo5726.cloud.8085 > S1-anjo5726.cloud.38034: Flags [R.], seq 0, ack 2330597226, win 0, length 0
01:10:23.176655 IP L1-anjo5726.cloud.1041 > S1-anjo5726.cloud.38034: Flags [R.], seq 0, ack 2330597226, win 0, length 0
01:10:23.176659 IP L1-anjo5726.cloud.3404 > S1-anjo5726.cloud.38034: Flags [R.], seq 0, ack 2330597226, win 0, length 0
01:10:23.176663 IP L1-anjo5726.cloud.1183 > S1-anjo5726.cloud.38034: Flags [R.], seq 0, ack 2330597226, win 0, length 0
01:10:23.176667 IP L1-anjo5726.cloud.45100 > S1-anjo5726.cloud.38034: Flags [R.], seq 0, ack 2330597226, win 0, length 0
01:10:23.176672 IP S1-anjo5726.cloud.38034 > L1-anjo5726.cloud.5730: Flags [S], seq 2330597225, win 1024, options [mss 1460], length 0
01:10:23.176672 IP S1-anjo5726.cloud.38034 > L1-anjo5726.cloud.50389: Flags [S], seq 2330597225, win 1024, options [mss 1460], length 0
01:10:23.176672 IP S1-anjo5726.cloud.38034 > L1-anjo5726.cloud.8090: Flags [S], seq 2330597225, win 1024, options [mss 1460], length 0
01:10:23.176672 IP S1-anjo5726.cloud.38034 > L1-anjo5726.cloud.1083: Flags [S], seq 2330597225, win 1024, options [mss 1460], length 0
01:10:23.176678 IP L1-anjo5726.cloud.5730 > S1-anjo5726.cloud.38034: Flags [R.], seq 0, ack 2330597226, win 0, length 0
01:10:23.176682 IP L1-anjo5726.cloud.50389 > S1-anjo5726.cloud.38034: Flags [R.], seq 0, ack 2330597226, win 0, length 0
01:10:23.176686 IP L1-anjo5726.cloud.8090 > S1-anjo5726.cloud.38034: Flags [R.], seq 0, ack 2330597226, win 0, length 0
01:10:23.176690 IP L1-anjo5726.cloud.1083 > S1-anjo5726.cloud.38034: Flags [R.], seq 0, ack 2330597226, win 0, length 0
01:10:23.176751 IP S1-anjo5726.cloud.38034 > L1-anjo5726.cloud.x11-2: Flags [S], seq 2330597225, win 1024, options [mss 1460], length 0
01:10:23.176751 IP S1-anjo5726.cloud.38034 > L1-anjo5726.cloud.3986: Flags [S], seq 2330597225, win 1024, options [mss 1460], length 0
01:10:23.176761 IP L1-anjo5726.cloud.x11-2 > S1-anjo5726.cloud.38034: Flags [R.], seq 0, ack 2330597226, win 0, length 0
01:10:23.176774 IP L1-anjo5726.cloud.3986 > S1-anjo5726.cloud.38034: Flags [R.], seq 0, ack 2330597226, win 0, length 0
01:10:23.177266 IP S1-anjo5726.cloud.38034 > L1-anjo5726.cloud.8800: Flags [S], seq 2330597225, win 1024, options [mss 1460], length 0
01:10:23.177266 IP S1-anjo5726.cloud.38034 > L1-anjo5726.cloud.49157: Flags [S], seq 2330597225, win 1024, options [mss 1460], length 0
01:10:23.177266 IP S1-anjo5726.cloud.38034 > L1-anjo5726.cloud.20031: Flags [S], seq 2330597225, win 1024, options [mss 1460], length 0
01:10:23.177266 IP S1-anjo5726.cloud.38034 > L1-anjo5726.cloud.15742: Flags [S], seq 2330597225, win 1024, options [mss 1460], length 0
01:10:23.177266 IP S1-anjo5726.cloud.38034 > L1-anjo5726.cloud.5051: Flags [S], seq 2330597225, win 1024, options [mss 1460], length 0
01:10:23.177294 IP L1-anjo5726.cloud.8800 > S1-anjo5726.cloud.38034: Flags [R.], seq 0, ack 2330597226, win 0, length 0
01:10:23.177312 IP L1-anjo5726.cloud.49157 > S1-anjo5726.cloud.38034: Flags [R.], seq 0, ack 2330597226, win 0, length 0
01:10:23.177317 IP L1-anjo5726.cloud.20031 > S1-anjo5726.cloud.38034: Flags [R.], seq 0, ack 2330597226, win 0, length 0
01:10:23.177321 IP L1-anjo5726.cloud.15742 > S1-anjo5726.cloud.38034: Flags [R.], seq 0, ack 2330597226, win 0, length 0
01:10:23.177325 IP L1-anjo5726.cloud.5051 > S1-anjo5726.cloud.38034: Flags [R.], seq 0, ack 2330597226, win 0, length 0
01:10:23.177331 IP S1-anjo5726.cloud.38034 > L1-anjo5726.cloud.1494: Flags [S], seq 2330597225, win 1024, options [mss 1460], length 0
01:10:23.177331 IP S1-anjo5726.cloud.38034 > L1-anjo5726.cloud.7937: Flags [S], seq 2330597225, win 1024, options [mss 1460], length 0
01:10:23.177331 IP S1-anjo5726.cloud.38034 > L1-anjo5726.cloud.1124: Flags [S], seq 2330597225, win 1024, options [mss 1460], length 0
01:10:23.177336 IP L1-anjo5726.cloud.1494 > S1-anjo5726.cloud.38034: Flags [R.], seq 0, ack 2330597226, win 0, length 0
01:10:23.177341 IP L1-anjo5726.cloud.7937 > S1-anjo5726.cloud.38034: Flags [R.], seq 0, ack 2330597226, win 0, length 0
01:10:23.177345 IP L1-anjo5726.cloud.1124 > S1-anjo5726.cloud.38034: Flags [R.], seq 0, ack 2330597226, win 0, length 0
01:10:23.177393 IP S1-anjo5726.cloud.38034 > L1-anjo5726.cloud.1122: Flags [S], seq 2330597225, win 1024, options [mss 1460], length 0
01:10:23.177393 IP S1-anjo5726.cloud.38034 > L1-anjo5726.cloud.9593: Flags [S], seq 2330597225, win 1024, options [mss 1460], length 0
01:10:23.177393 IP S1-anjo5726.cloud.38034 > L1-anjo5726.cloud.iscsi-target: Flags [S], seq 2330597225, win 1024, options [mss 1460], length 0
01:10:23.177393 IP S1-anjo5726.cloud.38034 > L1-anjo5726.cloud.1001: Flags [S], seq 2330597225, win 1024, options [mss 1460], length 0
01:10:23.177393 IP S1-anjo5726.cloud.38034 > L1-anjo5726.cloud.2557: Flags [S], seq 2330597225, win 1024, options [mss 1460], length 0
01:10:23.177393 IP S1-anjo5726.cloud.38034 > L1-anjo5726.cloud.2717: Flags [S], seq 2330597225, win 1024, options [mss 1460], length 0
01:10:23.177393 IP S1-anjo5726.cloud.38034 > L1-anjo5726.cloud.62078: Flags [S], seq 2330597225, win 1024, options [mss 1460], length 0
01:10:23.177393 IP S1-anjo5726.cloud.38034 > L1-anjo5726.cloud.5087: Flags [S], seq 2330597225, win 1024, options [mss 1460], length 0
01:10:23.177404 IP L1-anjo5726.cloud.1122 > S1-anjo5726.cloud.38034: Flags [R.], seq 0, ack 2330597226, win 0, length 0
01:10:23.177417 IP L1-anjo5726.cloud.9593 > S1-anjo5726.cloud.38034: Flags [R.], seq 0, ack 2330597226, win 0, length 0
01:10:23.177421 IP L1-anjo5726.cloud.iscsi-target > S1-anjo5726.cloud.38034: Flags [R.], seq 0, ack 2330597226, win 0, length 0
01:10:23.177425 IP L1-anjo5726.cloud.1001 > S1-anjo5726.cloud.38034: Flags [R.], seq 0, ack 2330597226, win 0, length 0
01:10:23.177429 IP L1-anjo5726.cloud.2557 > S1-anjo5726.cloud.38034: Flags [R.], seq 0, ack 2330597226, win 0, length 0
01:10:23.177433 IP L1-anjo5726.cloud.2717 > S1-anjo5726.cloud.38034: Flags [R.], seq 0, ack 2330597226, win 0, length 0
01:10:23.177437 IP L1-anjo5726.cloud.62078 > S1-anjo5726.cloud.38034: Flags [R.], seq 0, ack 2330597226, win 0, length 0
01:10:23.177441 IP L1-anjo5726.cloud.5087 > S1-anjo5726.cloud.38034: Flags [R.], seq 0, ack 2330597226, win 0, length 0
01:10:23.177445 IP S1-anjo5726.cloud.38034 > L1-anjo5726.cloud.8400: Flags [S], seq 2330597225, win 1024, options [mss 1460], length 0
01:10:23.177445 IP S1-anjo5726.cloud.38034 > L1-anjo5726.cloud.5902: Flags [S], seq 2330597225, win 1024, options [mss 1460], length 0
01:10:23.177450 IP L1-anjo5726.cloud.8400 > S1-anjo5726.cloud.38034: Flags [R.], seq 0, ack 2330597226, win 0, length 0
01:10:23.177454 IP L1-anjo5726.cloud.5902 > S1-anjo5726.cloud.38034: Flags [R.], seq 0, ack 2330597226, win 0, length 0
01:10:23.177494 IP S1-anjo5726.cloud.38034 > L1-anjo5726.cloud.4129: Flags [S], seq 2330597225, win 1024, options [mss 1460], length 0
01:10:23.177495 IP S1-anjo5726.cloud.38034 > L1-anjo5726.cloud.1717: Flags [S], seq 2330597225, win 1024, options [mss 1460], length 0
01:10:23.177495 IP S1-anjo5726.cloud.38034 > L1-anjo5726.cloud.648: Flags [S], seq 2330597225, win 1024, options [mss 1460], length 0
01:10:23.177495 IP S1-anjo5726.cloud.38034 > L1-anjo5726.cloud.3784: Flags [S], seq 2330597225, win 1024, options [mss 1460], length 0
01:10:23.177495 IP S1-anjo5726.cloud.38034 > L1-anjo5726.cloud.2288: Flags [S], seq 2330597225, win 1024, options [mss 1460], length 0
01:10:23.177495 IP S1-anjo5726.cloud.38034 > L1-anjo5726.cloud.3011: Flags [S], seq 2330597225, win 1024, options [mss 1460], length 0
01:10:23.177495 IP S1-anjo5726.cloud.38034 > L1-anjo5726.cloud.3370: Flags [S], seq 2330597225, win 1024, options [mss 1460], length 0
01:10:23.177495 IP S1-anjo5726.cloud.38034 > L1-anjo5726.cloud.1056: Flags [S], seq 2330597225, win 1024, options [mss 1460], length 0
01:10:23.177504 IP L1-anjo5726.cloud.4129 > S1-anjo5726.cloud.38034: Flags [R.], seq 0, ack 2330597226, win 0, length 0
01:10:23.177515 IP L1-anjo5726.cloud.1717 > S1-anjo5726.cloud.38034: Flags [R.], seq 0, ack 2330597226, win 0, length 0
01:10:23.177519 IP L1-anjo5726.cloud.648 > S1-anjo5726.cloud.38034: Flags [R.], seq 0, ack 2330597226, win 0, length 0
01:10:23.177524 IP L1-anjo5726.cloud.3784 > S1-anjo5726.cloud.38034: Flags [R.], seq 0, ack 2330597226, win 0, length 0
01:10:23.177527 IP L1-anjo5726.cloud.2288 > S1-anjo5726.cloud.38034: Flags [R.], seq 0, ack 2330597226, win 0, length 0
01:10:23.177531 IP L1-anjo5726.cloud.3011 > S1-anjo5726.cloud.38034: Flags [R.], seq 0, ack 2330597226, win 0, length 0
01:10:23.177535 IP L1-anjo5726.cloud.3370 > S1-anjo5726.cloud.38034: Flags [R.], seq 0, ack 2330597226, win 0, length 0
01:10:23.177539 IP L1-anjo5726.cloud.1056 > S1-anjo5726.cloud.38034: Flags [R.], seq 0, ack 2330597226, win 0, length 0
01:10:23.177561 IP S1-anjo5726.cloud.38034 > L1-anjo5726.cloud.5859: Flags [S], seq 2330597225, win 1024, options [mss 1460], length 0
01:10:23.177561 IP S1-anjo5726.cloud.38034 > L1-anjo5726.cloud.1192: Flags [S], seq 2330597225, win 1024, options [mss 1460], length 0
01:10:23.177585 IP L1-anjo5726.cloud.5859 > S1-anjo5726.cloud.38034: Flags [R.], seq 0, ack 2330597226, win 0, length 0
01:10:23.177599 IP L1-anjo5726.cloud.1192 > S1-anjo5726.cloud.38034: Flags [R.], seq 0, ack 2330597226, win 0, length 0
01:10:23.177607 IP S1-anjo5726.cloud.38034 > L1-anjo5726.cloud.1900: Flags [S], seq 2330597225, win 1024, options [mss 1460], length 0
01:10:23.177607 IP S1-anjo5726.cloud.38034 > L1-anjo5726.cloud.109: Flags [S], seq 2330597225, win 1024, options [mss 1460], length 0
01:10:23.177607 IP S1-anjo5726.cloud.38034 > L1-anjo5726.cloud.3737: Flags [S], seq 2330597225, win 1024, options [mss 1460], length 0
01:10:23.177607 IP S1-anjo5726.cloud.38034 > L1-anjo5726.cloud.9099: Flags [S], seq 2330597225, win 1024, options [mss 1460], length 0
01:10:23.177607 IP S1-anjo5726.cloud.38034 > L1-anjo5726.cloud.40193: Flags [S], seq 2330597225, win 1024, options [mss 1460], length 0
01:10:23.177607 IP S1-anjo5726.cloud.38034 > L1-anjo5726.cloud.2160: Flags [S], seq 2330597225, win 1024, options [mss 1460], length 0
01:10:23.177607 IP S1-anjo5726.cloud.38034 > L1-anjo5726.cloud.10004: Flags [S], seq 2330597225, win 1024, options [mss 1460], length 0
01:10:23.177631 IP L1-anjo5726.cloud.1900 > S1-anjo5726.cloud.38034: Flags [R.], seq 0, ack 2330597226, win 0, length 0
01:10:23.177643 IP L1-anjo5726.cloud.109 > S1-anjo5726.cloud.38034: Flags [R.], seq 0, ack 2330597226, win 0, length 0
01:10:23.177647 IP L1-anjo5726.cloud.3737 > S1-anjo5726.cloud.38034: Flags [R.], seq 0, ack 2330597226, win 0, length 0
01:10:23.177651 IP L1-anjo5726.cloud.9099 > S1-anjo5726.cloud.38034: Flags [R.], seq 0, ack 2330597226, win 0, length 0
01:10:23.177655 IP L1-anjo5726.cloud.40193 > S1-anjo5726.cloud.38034: Flags [R.], seq 0, ack 2330597226, win 0, length 0
01:10:23.177659 IP L1-anjo5726.cloud.2160 > S1-anjo5726.cloud.38034: Flags [R.], seq 0, ack 2330597226, win 0, length 0
01:10:23.177663 IP L1-anjo5726.cloud.10004 > S1-anjo5726.cloud.38034: Flags [R.], seq 0, ack 2330597226, win 0, length 0
01:10:23.177667 IP S1-anjo5726.cloud.38034 > L1-anjo5726.cloud.3261: Flags [S], seq 2330597225, win 1024, options [mss 1460], length 0
01:10:23.177667 IP S1-anjo5726.cloud.38034 > L1-anjo5726.cloud.bgp: Flags [S], seq 2330597225, win 1024, options [mss 1460], length 0
01:10:23.177673 IP L1-anjo5726.cloud.3261 > S1-anjo5726.cloud.38034: Flags [R.], seq 0, ack 2330597226, win 0, length 0
01:10:23.177677 IP L1-anjo5726.cloud.bgp > S1-anjo5726.cloud.38034: Flags [R.], seq 0, ack 2330597226, win 0, length 0
01:10:23.177719 IP S1-anjo5726.cloud.38034 > L1-anjo5726.cloud.tproxy: Flags [S], seq 2330597225, win 1024, options [mss 1460], length 0
01:10:23.177726 IP L1-anjo5726.cloud.tproxy > S1-anjo5726.cloud.38034: Flags [R.], seq 0, ack 2330597226, win 0, length 0
01:10:23.177924 IP S1-anjo5726.cloud.38034 > L1-anjo5726.cloud.1022: Flags [S], seq 2330597225, win 1024, options [mss 1460], length 0
01:10:23.177924 IP S1-anjo5726.cloud.38034 > L1-anjo5726.cloud.20222: Flags [S], seq 2330597225, win 1024, options [mss 1460], length 0
01:10:23.177924 IP S1-anjo5726.cloud.38034 > L1-anjo5726.cloud.89: Flags [S], seq 2330597225, win 1024, options [mss 1460], length 0
01:10:23.177924 IP S1-anjo5726.cloud.38034 > L1-anjo5726.cloud.55055: Flags [S], seq 2330597225, win 1024, options [mss 1460], length 0
01:10:23.177924 IP S1-anjo5726.cloud.38034 > L1-anjo5726.cloud.8600: Flags [S], seq 2330597225, win 1024, options [mss 1460], length 0
01:10:23.177952 IP L1-anjo5726.cloud.1022 > S1-anjo5726.cloud.38034: Flags [R.], seq 0, ack 2330597226, win 0, length 0
01:10:23.177971 IP L1-anjo5726.cloud.20222 > S1-anjo5726.cloud.38034: Flags [R.], seq 0, ack 2330597226, win 0, length 0
01:10:23.177975 IP L1-anjo5726.cloud.89 > S1-anjo5726.cloud.38034: Flags [R.], seq 0, ack 2330597226, win 0, length 0
01:10:23.177979 IP L1-anjo5726.cloud.55055 > S1-anjo5726.cloud.38034: Flags [R.], seq 0, ack 2330597226, win 0, length 0
01:10:23.177983 IP L1-anjo5726.cloud.8600 > S1-anjo5726.cloud.38034: Flags [R.], seq 0, ack 2330597226, win 0, length 0
01:10:23.177991 IP S1-anjo5726.cloud.38034 > L1-anjo5726.cloud.3390: Flags [S], seq 2330597225, win 1024, options [mss 1460], length 0
01:10:23.177991 IP S1-anjo5726.cloud.38034 > L1-anjo5726.cloud.616: Flags [S], seq 2330597225, win 1024, options [mss 1460], length 0
01:10:23.177991 IP S1-anjo5726.cloud.38034 > L1-anjo5726.cloud.1864: Flags [S], seq 2330597225, win 1024, options [mss 1460], length 0
01:10:23.177997 IP L1-anjo5726.cloud.3390 > S1-anjo5726.cloud.38034: Flags [R.], seq 0, ack 2330597226, win 0, length 0
01:10:23.178027 IP L1-anjo5726.cloud.616 > S1-anjo5726.cloud.38034: Flags [R.], seq 0, ack 2330597226, win 0, length 0
01:10:23.178032 IP L1-anjo5726.cloud.1864 > S1-anjo5726.cloud.38034: Flags [R.], seq 0, ack 2330597226, win 0, length 0
01:10:23.178038 IP S1-anjo5726.cloud.38034 > L1-anjo5726.cloud.1037: Flags [S], seq 2330597225, win 1024, options [mss 1460], length 0
01:10:23.178039 IP S1-anjo5726.cloud.38034 > L1-anjo5726.cloud.25735: Flags [S], seq 2330597225, win 1024, options [mss 1460], length 0
01:10:23.178039 IP S1-anjo5726.cloud.38034 > L1-anjo5726.cloud.65389: Flags [S], seq 2330597225, win 1024, options [mss 1460], length 0
01:10:23.178039 IP S1-anjo5726.cloud.38034 > L1-anjo5726.cloud.51493: Flags [S], seq 2330597225, win 1024, options [mss 1460], length 0
01:10:23.178045 IP L1-anjo5726.cloud.1037 > S1-anjo5726.cloud.38034: Flags [R.], seq 0, ack 2330597226, win 0, length 0
01:10:23.178049 IP L1-anjo5726.cloud.25735 > S1-anjo5726.cloud.38034: Flags [R.], seq 0, ack 2330597226, win 0, length 0
01:10:23.178053 IP L1-anjo5726.cloud.65389 > S1-anjo5726.cloud.38034: Flags [R.], seq 0, ack 2330597226, win 0, length 0
01:10:23.178057 IP L1-anjo5726.cloud.51493 > S1-anjo5726.cloud.38034: Flags [R.], seq 0, ack 2330597226, win 0, length 0
01:10:23.178458 IP S1-anjo5726.cloud.38034 > L1-anjo5726.cloud.1104: Flags [S], seq 2330597225, win 1024, options [mss 1460], length 0
01:10:23.178458 IP S1-anjo5726.cloud.38034 > L1-anjo5726.cloud.9943: Flags [S], seq 2330597225, win 1024, options [mss 1460], length 0
01:10:23.178458 IP S1-anjo5726.cloud.38034 > L1-anjo5726.cloud.880: Flags [S], seq 2330597225, win 1024, options [mss 1460], length 0
01:10:23.178458 IP S1-anjo5726.cloud.38034 > L1-anjo5726.cloud.16113: Flags [S], seq 2330597225, win 1024, options [mss 1460], length 0
01:10:23.178458 IP S1-anjo5726.cloud.38034 > L1-anjo5726.cloud.32770: Flags [S], seq 2330597225, win 1024, options [mss 1460], length 0
01:10:23.178485 IP L1-anjo5726.cloud.1104 > S1-anjo5726.cloud.38034: Flags [R.], seq 0, ack 2330597226, win 0, length 0
01:10:23.178504 IP L1-anjo5726.cloud.9943 > S1-anjo5726.cloud.38034: Flags [R.], seq 0, ack 2330597226, win 0, length 0
01:10:23.178509 IP L1-anjo5726.cloud.880 > S1-anjo5726.cloud.38034: Flags [R.], seq 0, ack 2330597226, win 0, length 0
01:10:23.178513 IP L1-anjo5726.cloud.16113 > S1-anjo5726.cloud.38034: Flags [R.], seq 0, ack 2330597226, win 0, length 0
01:10:23.178517 IP L1-anjo5726.cloud.32770 > S1-anjo5726.cloud.38034: Flags [R.], seq 0, ack 2330597226, win 0, length 0
01:10:23.178523 IP S1-anjo5726.cloud.38034 > L1-anjo5726.cloud.32774: Flags [S], seq 2330597225, win 1024, options [mss 1460], length 0
01:10:23.178523 IP S1-anjo5726.cloud.38034 > L1-anjo5726.cloud.5405: Flags [S], seq 2330597225, win 1024, options [mss 1460], length 0
01:10:23.178523 IP S1-anjo5726.cloud.38034 > L1-anjo5726.cloud.x11-6: Flags [S], seq 2330597225, win 1024, options [mss 1460], length 0
01:10:23.178529 IP L1-anjo5726.cloud.32774 > S1-anjo5726.cloud.38034: Flags [R.], seq 0, ack 2330597226, win 0, length 0
01:10:23.178553 IP L1-anjo5726.cloud.5405 > S1-anjo5726.cloud.38034: Flags [R.], seq 0, ack 2330597226, win 0, length 0
01:10:23.178567 IP L1-anjo5726.cloud.x11-6 > S1-anjo5726.cloud.38034: Flags [R.], seq 0, ack 2330597226, win 0, length 0
01:10:23.178600 IP S1-anjo5726.cloud.38034 > L1-anjo5726.cloud.264: Flags [S], seq 2330597225, win 1024, options [mss 1460], length 0
01:10:23.178600 IP S1-anjo5726.cloud.38034 > L1-anjo5726.cloud.5102: Flags [S], seq 2330597225, win 1024, options [mss 1460], length 0
01:10:23.178600 IP S1-anjo5726.cloud.38034 > L1-anjo5726.cloud.2638: Flags [S], seq 2330597225, win 1024, options [mss 1460], length 0
01:10:23.178601 IP S1-anjo5726.cloud.38034 > L1-anjo5726.cloud.1974: Flags [S], seq 2330597225, win 1024, options [mss 1460], length 0
01:10:23.178601 IP S1-anjo5726.cloud.38034 > L1-anjo5726.cloud.6646: Flags [S], seq 2330597225, win 1024, options [mss 1460], length 0
01:10:23.178601 IP S1-anjo5726.cloud.38034 > L1-anjo5726.cloud.32773: Flags [S], seq 2330597225, win 1024, options [mss 1460], length 0
01:10:23.178609 IP L1-anjo5726.cloud.264 > S1-anjo5726.cloud.38034: Flags [R.], seq 0, ack 2330597226, win 0, length 0
01:10:23.178622 IP L1-anjo5726.cloud.5102 > S1-anjo5726.cloud.38034: Flags [R.], seq 0, ack 2330597226, win 0, length 0
01:10:23.178626 IP L1-anjo5726.cloud.2638 > S1-anjo5726.cloud.38034: Flags [R.], seq 0, ack 2330597226, win 0, length 0
01:10:23.178630 IP L1-anjo5726.cloud.1974 > S1-anjo5726.cloud.38034: Flags [R.], seq 0, ack 2330597226, win 0, length 0
01:10:23.178634 IP L1-anjo5726.cloud.6646 > S1-anjo5726.cloud.38034: Flags [R.], seq 0, ack 2330597226, win 0, length 0
01:10:23.178638 IP L1-anjo5726.cloud.32773 > S1-anjo5726.cloud.38034: Flags [R.], seq 0, ack 2330597226, win 0, length 0
01:10:23.178646 IP S1-anjo5726.cloud.38034 > L1-anjo5726.cloud.7627: Flags [S], seq 2330597225, win 1024, options [mss 1460], length 0
01:10:23.178646 IP S1-anjo5726.cloud.38034 > L1-anjo5726.cloud.5298: Flags [S], seq 2330597225, win 1024, options [mss 1460], length 0
01:10:23.178646 IP S1-anjo5726.cloud.38034 > L1-anjo5726.cloud.541: Flags [S], seq 2330597225, win 1024, options [mss 1460], length 0
01:10:23.178646 IP S1-anjo5726.cloud.38034 > L1-anjo5726.cloud.44176: Flags [S], seq 2330597225, win 1024, options [mss 1460], length 0
01:10:23.178646 IP S1-anjo5726.cloud.38034 > L1-anjo5726.cloud.9929: Flags [S], seq 2330597225, win 1024, options [mss 1460], length 0
01:10:23.178652 IP L1-anjo5726.cloud.7627 > S1-anjo5726.cloud.38034: Flags [R.], seq 0, ack 2330597226, win 0, length 0
01:10:23.178657 IP L1-anjo5726.cloud.5298 > S1-anjo5726.cloud.38034: Flags [R.], seq 0, ack 2330597226, win 0, length 0
01:10:23.178661 IP L1-anjo5726.cloud.541 > S1-anjo5726.cloud.38034: Flags [R.], seq 0, ack 2330597226, win 0, length 0
01:10:23.178664 IP L1-anjo5726.cloud.44176 > S1-anjo5726.cloud.38034: Flags [R.], seq 0, ack 2330597226, win 0, length 0
01:10:23.178668 IP L1-anjo5726.cloud.9929 > S1-anjo5726.cloud.38034: Flags [R.], seq 0, ack 2330597226, win 0, length 0
01:10:23.178719 IP S1-anjo5726.cloud.38034 > L1-anjo5726.cloud.zope-ftp: Flags [S], seq 2330597225, win 1024, options [mss 1460], length 0
01:10:23.178720 IP S1-anjo5726.cloud.38034 > L1-anjo5726.cloud.9200: Flags [S], seq 2330597225, win 1024, options [mss 1460], length 0
01:10:23.178720 IP S1-anjo5726.cloud.38034 > L1-anjo5726.cloud.lotusnote: Flags [S], seq 2330597225, win 1024, options [mss 1460], length 0
01:10:23.178720 IP S1-anjo5726.cloud.38034 > L1-anjo5726.cloud.3221: Flags [S], seq 2330597225, win 1024, options [mss 1460], length 0
01:10:23.178720 IP S1-anjo5726.cloud.38034 > L1-anjo5726.cloud.7920: Flags [S], seq 2330597225, win 1024, options [mss 1460], length 0
01:10:23.178720 IP S1-anjo5726.cloud.38034 > L1-anjo5726.cloud.5214: Flags [S], seq 2330597225, win 1024, options [mss 1460], length 0
01:10:23.178731 IP L1-anjo5726.cloud.zope-ftp > S1-anjo5726.cloud.38034: Flags [R.], seq 0, ack 2330597226, win 0, length 0
01:10:23.178745 IP L1-anjo5726.cloud.9200 > S1-anjo5726.cloud.38034: Flags [R.], seq 0, ack 2330597226, win 0, length 0
01:10:23.178749 IP L1-anjo5726.cloud.lotusnote > S1-anjo5726.cloud.38034: Flags [R.], seq 0, ack 2330597226, win 0, length 0
01:10:23.178753 IP L1-anjo5726.cloud.3221 > S1-anjo5726.cloud.38034: Flags [R.], seq 0, ack 2330597226, win 0, length 0
01:10:23.178757 IP L1-anjo5726.cloud.7920 > S1-anjo5726.cloud.38034: Flags [R.], seq 0, ack 2330597226, win 0, length 0
01:10:23.178761 IP L1-anjo5726.cloud.5214 > S1-anjo5726.cloud.38034: Flags [R.], seq 0, ack 2330597226, win 0, length 0
01:10:23.179005 IP S1-anjo5726.cloud.38034 > L1-anjo5726.cloud.32782: Flags [S], seq 2330597225, win 1024, options [mss 1460], length 0
01:10:23.179005 IP S1-anjo5726.cloud.38034 > L1-anjo5726.cloud.3801: Flags [S], seq 2330597225, win 1024, options [mss 1460], length 0
01:10:23.179005 IP S1-anjo5726.cloud.38034 > L1-anjo5726.cloud.617: Flags [S], seq 2330597225, win 1024, options [mss 1460], length 0
01:10:23.179005 IP S1-anjo5726.cloud.38034 > L1-anjo5726.cloud.7777: Flags [S], seq 2330597225, win 1024, options [mss 1460], length 0
