01:10:22.643001 ARP, Request who-has L1-anjo5726.cloud tell S1-anjo5726.cloud, length 28
01:10:22.643526 ARP, Reply L1-anjo5726.cloud is-at 02:00:ac:10:00:10 (oui Unknown), length 28
01:10:22.644175 IP S1-anjo5726.cloud.43281 > router1.cloud.domain: 30414+ PTR? 16.0.16.172.in-addr.arpa. (42)
01:10:22.645326 IP router1.cloud.domain > S1-anjo5726.cloud.43281: 30414* 1/0/0 PTR L1-anjo5726.cloud. (73)
01:10:22.646180 IP S1-anjo5726.cloud.38034 > L1-anjo5726.cloud.rtsp: Flags [S], seq 2330597225, win 1024, options [mss 1460], length 0
01:10:22.646208 IP S1-anjo5726.cloud.38034 > L1-anjo5726.cloud.microsoft-ds: Flags [S], seq 2330597225, win 1024, options [mss 1460], length 0
01:10:22.646220 IP S1-anjo5726.cloud.38034 > L1-anjo5726.cloud.smux: Flags [S], seq 2330597225, win 1024, options [mss 1460], length 0
01:10:22.646230 IP S1-anjo5726.cloud.38034 > L1-anjo5726.cloud.ms-wbt-server: Flags [S], seq 2330597225, win 1024, options [mss 1460], length 0
01:10:22.646241 IP S1-anjo5726.cloud.38034 > L1-anjo5726.cloud.ssh: Flags [S], seq 2330597225, win 1024, options [mss 1460], length 0
01:10:22.646253 IP S1-anjo5726.cloud.38034 > L1-anjo5726.cloud.https: Flags [S], seq 2330597225, win 1024, options [mss 1460], length 0
01:10:22.646264 IP S1-anjo5726.cloud.38034 > L1-anjo5726.cloud.http: Flags [S], seq 2330597225, win 1024, options [mss 1460], length 0
01:10:22.646316 IP S1-anjo5726.cloud.38034 > L1-anjo5726.cloud.imaps: Flags [S], seq 2330597225, win 1024, options [mss 1460], length 0
01:10:22.646329 IP S1-anjo5726.cloud.38034 > L1-anjo5726.cloud.netbios-ssn: Flags [S], seq 2330597225, win 1024, options [mss 1460], length 0
01:10:22.646340 IP S1-anjo5726.cloud.38034 > L1-anjo5726.cloud.mysql: Flags [S], seq 2330597225, win 1024, options [mss 1460], length 0
01:10:22.646716 IP L1-anjo5726.cloud.rtsp > S1-anjo5726.cloud.38034: Flags [R.], seq 0, ack 2330597226, win 0, length 0
01:10:22.646718 IP L1-anjo5726.cloud.microsoft-ds > S1-anjo5726.cloud.38034: Flags [R.], seq 0, ack 2330597226, win 0, length 0
01:10:22.646719 IP L1-anjo5726.cloud.smux > S1-anjo5726.cloud.38034: Flags [R.], seq 0, ack 2330597226, win 0, length 0
01:10:22.646720 IP L1-anjo5726.cloud.ms-wbt-server > S1-anjo5726.cloud.38034: Flags [R.], seq 0, ack 2330597226, win 0, length 0
01:10:22.646721 IP L1-anjo5726.cloud.ssh > S1-anjo5726.cloud.38034: Flags [S.], seq 3089415642, ack 2330597226, win 64240, options [mss 1460], length 0
01:10:22.646722 IP L1-anjo5726.cloud.https > S1-anjo5726.cloud.38034: Flags [R.], seq 0, ack 2330597226, win 0, length 0
01:10:22.646723 IP L1-anjo5726.cloud.http > S1-anjo5726.cloud.38034: Flags [S.], seq 1735977133, ack 2330597226, win 64240, options [mss 1460], length 0
01:10:22.646724 IP L1-anjo5726.cloud.imaps > S1-anjo5726.cloud.38034: Flags [R.], seq 0, ack 2330597226, win 0, length 0
01:10:22.646746 IP S1-anjo5726.cloud.38034 > L1-anjo5726.cloud.ssh: Flags [R], seq 2330597226, win 0, length 0
01:10:22.646764 IP S1-anjo5726.cloud.38034 > L1-anjo5726.cloud.http: Flags [R], seq 2330597226, win 0, length 0
01:10:22.646777 IP L1-anjo5726.cloud.netbios-ssn > S1-anjo5726.cloud.38034: Flags [R.], seq 0, ack 2330597226, win 0, length 0
01:10:22.646778 IP L1-anjo5726.cloud.mysql > S1-anjo5726.cloud.38034: Flags [R.], seq 0, ack 2330597226, win 0, length 0
01:10:22.646906 IP S1-anjo5726.cloud.38034 > L1-anjo5726.cloud.sunrpc: Flags [S], seq 2330597225, win 1024, options [mss 1460], length 0
01:10:22.646930 IP S1-anjo5726.cloud.38034 > L1-anjo5726.cloud.ftp: Flags [S], seq 2330597225, win 1024, options [mss 1460], length 0
01:10:22.646941 IP S1-anjo5726.cloud.38034 > L1-anjo5726.cloud.pop3: Flags [S], seq 2330597225, win 1024, options [mss 1460], length 0
01:10:22.646953 IP S1-anjo5726.cloud.38034 > L1-anjo5726.cloud.auth: Flags [S], seq 2330597225, win 1024, options [mss 1460], length 0
01:10:22.646963 IP S1-anjo5726.cloud.38034 > L1-anjo5726.cloud.5900: Flags [S], seq 2330597225, win 1024, options [mss 1460], length 0
01:10:22.646973 IP S1-anjo5726.cloud.38034 > L1-anjo5726.cloud.256: Flags [S], seq 2330597225, win 1024, options [mss 1460], length 0
01:10:22.646983 IP S1-anjo5726.cloud.38034 > L1-anjo5726.cloud.submission: Flags [S], seq 2330597225, win 1024, options [mss 1460], length 0
01:10:22.646995 IP S1-anjo5726.cloud.38034 > L1-anjo5726.cloud.smtp: Flags [S], seq 2330597225, win 1024, options [mss 1460], length 0
01:10:22.647005 IP S1-anjo5726.cloud.38034 > L1-anjo5726.cloud.8888: Flags [S], seq 2330597225, win 1024, options [mss 1460], length 0
01:10:22.647015 IP S1-anjo5726.cloud.38034 > L1-anjo5726.cloud.domain: Flags [S], seq 2330597225, win 1024, options [mss 1460], length 0
01:10:22.647026 IP S1-anjo5726.cloud.38034 > L1-anjo5726.cloud.imap2: Flags [S], seq 2330597225, win 1024, options [mss 1460], length 0
01:10:22.647044 IP S1-anjo5726.cloud.38034 > L1-anjo5726.cloud.pop3s: Flags [S], seq 2330597225, win 1024, options [mss 1460], length 0
01:10:22.647057 IP S1-anjo5726.cloud.38034 > L1-anjo5726.cloud.http-alt: Flags [S], seq 2330597225, win 1024, options [mss 1460], length 0
01:10:22.647067 IP S1-anjo5726.cloud.38034 > L1-anjo5726.cloud.1723: Flags [S], seq 2330597225, win 1024, options [mss 1460], length 0
01:10:22.647077 IP S1-anjo5726.cloud.38034 > L1-anjo5726.cloud.telnet: Flags [S], seq 2330597225, win 1024, options [mss 1460], length 0
01:10:22.647088 IP S1-anjo5726.cloud.38034 > L1-anjo5726.cloud.1720: Flags [S], seq 2330597225, win 1024, options [mss 1460], length 0
01:10:22.647098 IP S1-anjo5726.cloud.38034 > L1-anjo5726.cloud.epmap: Flags [S], seq 2330597225, win 1024, options [mss 1460], length 0
01:10:22.647109 IP S1-anjo5726.cloud.38034 > L1-anjo5726.cloud.1025: Flags [S], seq 2330597225, win 1024, options [mss 1460], length 0
01:10:22.647119 IP S1-anjo5726.cloud.38034 > L1-anjo5726.cloud.5033: Flags [S], seq 2330597225, win 1024, options [mss 1460], length 0
01:10:22.647130 IP S1-anjo5726.cloud.38034 > L1-anjo5726.cloud.1081: Flags [S], seq 2330597225, win 1024, options [mss 1460], length 0
01:10:22.647303 IP L1-anjo5726.cloud.sunrpc > S1-anjo5726.cloud.38034: Flags [S.], seq 1966628504, ack 2330597226, win 64240, options [mss 1460], length 0
01:10:22.647304 IP L1-anjo5726.cloud.ftp > S1-anjo5726.cloud.38034: Flags [S.], seq 148719639, ack 2330597226, win 64240, options [mss 1460], length 0
01:10:22.647305 IP L1-anjo5726.cloud.pop3 > S1-anjo5726.cloud.38034: Flags [R.], seq 0, ack 2330597226, win 0, length 0
01:10:22.647307 IP L1-anjo5726.cloud.auth > S1-anjo5726.cloud.38034: Flags [R.], seq 0, ack 2330597226, win 0, length 0
01:10:22.647308 IP L1-anjo5726.cloud.5900 > S1-anjo5726.cloud.38034: Flags [R.], seq 0, ack 2330597226, win 0, length 0
01:10:22.647309 IP L1-anjo5726.cloud.256 > S1-anjo5726.cloud.38034: Flags [R.], seq 0, ack 2330597226, win 0, length 0
01:10:22.647310 IP L1-anjo5726.cloud.submission > S1-anjo5726.cloud.38034: Flags [R.], seq 0, ack 2330597226, win 0, length 0
01:10:22.647311 IP L1-anjo5726.cloud.smtp > S1-anjo5726.cloud.38034: Flags [S.], seq 29663354, ack 2330597226, win 64240, options [mss 1460], length 0
01:10:22.647323 IP S1-anjo5726.cloud.38034 > L1-anjo5726.cloud.sunrpc: Flags [R], seq 2330597226, win 0, length 0
01:10:22.647340 IP S1-anjo5726.cloud.38034 > L1-anjo5726.cloud.ftp: Flags [R], seq 2330597226, win 0, length 0
01:10:22.647346 IP S1-anjo5726.cloud.38034 > L1-anjo5726.cloud.smtp: Flags [R], seq 2330597226, win 0, length 0
01:10:22.647365 IP L1-anjo5726.cloud.8888 > S1-anjo5726.cloud.38034: Flags [R.], seq 0, ack 2330597226, win 0, length 0
01:10:22.647366 IP L1-anjo5726.cloud.domain > S1-anjo5726.cloud.38034: Flags [S.], seq 1715592496, ack 2330597226, win 64240, options [mss 1460], length 0
01:10:22.647367 IP L1-anjo5726.cloud.imap2 > S1-anjo5726.cloud.38034: Flags [R.], seq 0, ack 2330597226, win 0, length 0
01:10:22.647368 IP L1-anjo5726.cloud.pop3s > S1-anjo5726.cloud.38034: Flags [R.], seq 0, ack 2330597226, win 0, length 0
01:10:22.647369 IP L1-anjo5726.cloud.http-alt > S1-anjo5726.cloud.38034: Flags [R.], seq 0, ack 2330597226, win 0, length 0
01:10:22.647390 IP S1-anjo5726.cloud.38034 > L1-anjo5726.cloud.domain: Flags [R], seq 2330597226, win 0, length 0
01:10:22.647460 IP L1-anjo5726.cloud.1723 > S1-anjo5726.cloud.38034: Flags [R.], seq 0, ack 2330597226, win 0, length 0
01:10:22.647462 IP L1-anjo5726.cloud.telnet > S1-anjo5726.cloud.38034: Flags [R.], seq 0, ack 2330597226, win 0, length 0
01:10:22.647463 IP L1-anjo5726.cloud.1720 > S1-anjo5726.cloud.38034: Flags [R.], seq 0, ack 2330597226, win 0, length 0
01:10:22.647464 IP L1-anjo5726.cloud.epmap > S1-anjo5726.cloud.38034: Flags [R.], seq 0, ack 2330597226, win 0, length 0
01:10:22.647465 IP L1-anjo5726.cloud.1025 > S1-anjo5726.cloud.38034: Flags [R.], seq 0, ack 2330597226, win 0, length 0
01:10:22.647466 IP L1-anjo5726.cloud.5033 > S1-anjo5726.cloud.38034: Flags [R.], seq 0, ack 2330597226, win 0, length 0
01:10:22.647467 IP L1-anjo5726.cloud.1081 > S1-anjo5726.cloud.38034: Flags [R.], seq 0, ack 2330597226, win 0, length 0
01:10:22.647612 IP S1-anjo5726.cloud.38034 > L1-anjo5726.cloud.9666: Flags [S], seq 2330597225, win 1024, options [mss 1460], length 0
01:10:22.647634 IP S1-anjo5726.cloud.38034 > L1-anjo5726.cloud.1311: Flags [S], seq 2330597225, win 1024, options [mss 1460], length 0
01:10:22.647645 IP S1-anjo5726.cloud.38034 > L1-anjo5726.cloud.8300: Flags [S], seq 2330597225, win 1024, options [mss 1460], length 0
01:10:22.647656 IP S1-anjo5726.cloud.38034 > L1-anjo5726.cloud.16001: Flags [S], seq 2330597225, win 1024, options [mss 1460], length 0
01:10:22.647666 IP S1-anjo5726.cloud.38034 > L1-anjo5726.cloud.1009: Flags [S], seq 2330597225, win 1024, options [mss 1460], length 0
01:10:22.647677 IP S1-anjo5726.cloud.38034 > L1-anjo5726.cloud.2301: Flags [S], seq 2330597225, win 1024, options [mss 1460], length 0
01:10:22.647688 IP S1-anjo5726.cloud.38034 > L1-anjo5726.cloud.2033: Flags [S], seq 2330597225, win 1024, options [mss 1460], length 0
01:10:22.647698 IP S1-anjo5726.cloud.38034 > L1-anjo5726.cloud.snmp: Flags [S], seq 2330597225, win 1024, options [mss 1460], length 0
01:10:22.647709 IP S1-anjo5726.cloud.38034 > L1-anjo5726.cloud.8899: Flags [S], seq 2330597225, win 1024, options [mss 1460], length 0
01:10:22.647719 IP S1-anjo5726.cloud.38034 > L1-anjo5726.cloud.5030: Flags [S], seq 2330597225, win 1024, options [mss 1460], length 0
01:10:22.647729 IP S1-anjo5726.cloud.38034 > L1-anjo5726.cloud.1328: Flags [S], seq 2330597225, win 1024, options [mss 1460], length 0
01:10:22.647739 IP S1-anjo5726.cloud.38034 > L1-anjo5726.cloud.1051: Flags [S], seq 2330597225, win 1024, options [mss 1460], length 0
01:10:22.647757 IP S1-anjo5726.cloud.38034 > L1-anjo5726.cloud.kshell: Flags [S], seq 2330597225, win 1024, options [mss 1460], length 0
01:10:22.647775 IP S1-anjo5726.cloud.38034 > L1-anjo5726.cloud.49152: Flags [S], seq 2330597225, win 1024, options [mss 1460], length 0
01:10:22.647787 IP S1-anjo5726.cloud.38034 > L1-anjo5726.cloud.49159: Flags [S], seq 2330597225, win 1024, options [mss 1460], length 0
01:10:22.647798 IP S1-anjo5726.cloud.38034 > L1-anjo5726.cloud.3211: Flags [S], seq 2330597225, win 1024, options [mss 1460], length 0
01:10:22.647808 IP S1-anjo5726.cloud.38034 > L1-anjo5726.cloud.34571: Flags [S], seq 2330597225, win 1024, options [mss 1460], length 0
01:10:22.647818 IP S1-anjo5726.cloud.38034 > L1-anjo5726.cloud.903: Flags [S], seq 2330597225, win 1024, options [mss 1460], length 0
01:10:22.647829 IP S1-anjo5726.cloud.38034 > L1-anjo5726.cloud.10025: Flags [S], seq 2330597225, win 1024, options [mss 1460], length 0
01:10:22.647839 IP S1-anjo5726.cloud.38034 > L1-anjo5726.cloud.2038: Flags [S], seq 2330597225, win 1024, options [mss 1460], length 0
01:10:22.647850 IP S1-anjo5726.cloud.38034 > L1-anjo5726.cloud.1862: Flags [S], seq 2330597225, win 1024, options [mss 1460], length 0
01:10:22.647860 IP S1-anjo5726.cloud.38034 > L1-anjo5726.cloud.49160: Flags [S], seq 2330597225, win 1024, options [mss 1460], length 0
01:10:22.647871 IP S1-anjo5726.cloud.38034 > L1-anjo5726.cloud.50500: Flags [S], seq 2330597225, win 1024, options [mss 1460], length 0
01:10:22.647881 IP S1-anjo5726.cloud.38034 > L1-anjo5726.cloud.9207: Flags [S], seq 2330597225, win 1024, options [mss 1460], length 0
01:10:22.647891 IP S1-anjo5726.cloud.38034 > L1-anjo5726.cloud.7106: Flags [S], seq 2330597225, win 1024, options [mss 1460], length 0
01:10:22.647901 IP S1-anjo5726.cloud.38034 > L1-anjo5726.cloud.moira-update: Flags [S], seq 2330597225, win 1024, options [mss 1460], length 0
01:10:22.647912 IP S1-anjo5726.cloud.38034 > L1-anjo5726.cloud.714: Flags [S], seq 2330597225, win 1024, options [mss 1460], length 0
01:10:22.647923 IP S1-anjo5726.cloud.38034 > L1-anjo5726.cloud.7004: Flags [S], seq 2330597225, win 1024, options [mss 1460], length 0
01:10:22.647933 IP S1-anjo5726.cloud.38034 > L1-anjo5726.cloud.2967: Flags [S], seq 2330597225, win 1024, options [mss 1460], length 0
01:10:22.647944 IP S1-anjo5726.cloud.38034 > L1-anjo5726.cloud.8085: Flags [S], seq 2330597225, win 1024, options [mss 1460], length 0
01:10:22.647954 IP S1-anjo5726.cloud.38034 > L1-anjo5726.cloud.1041: Flags [S], seq 2330597225, win 1024, options [mss 1460], length 0
01:10:22.647964 IP S1-anjo5726.cloud.38034 > L1-anjo5726.cloud.3404: Flags [S], seq 2330597225, win 1024, options [mss 1460], length 0
01:10:22.647974 IP S1-anjo5726.cloud.38034 > L1-anjo5726.cloud.1183: Flags [S], seq 2330597225, win 1024, options [mss 1460], length 0
01:10:22.647991 IP S1-anjo5726.cloud.38034 > L1-anjo5726.cloud.45100: Flags [S], seq 2330597225, win 1024, options [mss 1460], length 0
01:10:22.648004 IP S1-anjo5726.cloud.38034 > L1-anjo5726.cloud.5730: Flags [S], seq 2330597225, win 1024, options [mss 1460], length 0
01:10:22.648015 IP S1-anjo5726.cloud.38034 > L1-anjo5726.cloud.50389: Flags [S], seq 2330597225, win 1024, options [mss 1460], length 0
01:10:22.648025 IP S1-anjo5726.cloud.38034 > L1-anjo5726.cloud.8090: Flags [S], seq 2330597225, win 1024, options [mss 1460], length 0
01:10:22.648036 IP S1-anjo5726.cloud.38034 > L1-anjo5726.cloud.1083: Flags [S], seq 2330597225, win 1024, options [mss 1460], length 0
01:10:22.648046 IP S1-anjo5726.cloud.38034 > L1-anjo5726.cloud.x11-2: Flags [S], seq 2330597225, win 1024, options [mss 1460], length 0
01:10:22.648056 IP S1-anjo5726.cloud.38034 > L1-anjo5726.cloud.3986: Flags [S], seq 2330597225, win 1024, options [mss 1460], length 0
01:10:22.648187 IP L1-anjo5726.cloud.9666 > S1-anjo5726.cloud.38034: Flags [R.], seq 0, ack 2330597226, win 0, length 0
01:10:22.648189 IP L1-anjo5726.cloud.1311 > S1-anjo5726.cloud.38034: Flags [R.], seq 0, ack 2330597226, win 0, length 0
01:10:22.648190 IP L1-anjo5726.cloud.8300 > S1-anjo5726.cloud.38034: Flags [R.], seq 0, ack 2330597226, win 0, length 0
01:10:22.648191 IP L1-anjo5726.cloud.16001 > S1-anjo5726.cloud.38034: Flags [R.], seq 0, ack 2330597226, win 0, length 0
01:10:22.648192 IP L1-anjo5726.cloud.1009 > S1-anjo5726.cloud.38034: Flags [R.], seq 0, ack 2330597226, win 0, length 0
01:10:22.648193 IP L1-anjo5726.cloud.2301 > S1-anjo5726.cloud.38034: Flags [R.], seq 0, ack 2330597226, win 0, length 0
01:10:22.648194 IP L1-anjo5726.cloud.2033 > S1-anjo5726.cloud.38034: Flags [R.], seq 0, ack 2330597226, win 0, length 0
01:10:22.648195 IP L1-anjo5726.cloud.snmp > S1-anjo5726.cloud.38034: Flags [R.], seq 0, ack 2330597226, win 0, length 0
01:10:22.648222 IP L1-anjo5726.cloud.8899 > S1-anjo5726.cloud.38034: Flags [R.], seq 0, ack 2330597226, win 0, length 0
01:10:22.648223 IP L1-anjo5726.cloud.5030 > S1-anjo5726.cloud.38034: Flags [R.], seq 0, ack 2330597226, win 0, length 0
01:10:22.648224 IP L1-anjo5726.cloud.1328 > S1-anjo5726.cloud.38034: Flags [R.], seq 0, ack 2330597226, win 0, length 0
01:10:22.648226 IP L1-anjo5726.cloud.1051 > S1-anjo5726.cloud.38034: Flags [R.], seq 0, ack 2330597226, win 0, length 0
01:10:22.648227 IP L1-anjo5726.cloud.kshell > S1-anjo5726.cloud.38034: Flags [R.], seq 0, ack 2330597226, win 0, length 0
01:10:22.648228 IP L1-anjo5726.cloud.49152 > S1-anjo5726.cloud.38034: Flags [R.], seq 0, ack 2330597226, win 0, length 0
01:10:22.648229 IP L1-anjo5726.cloud.49159 > S1-anjo5726.cloud.38034: Flags [R.], seq 0, ack 2330597226, win 0, length 0
01:10:22.648230 IP L1-anjo5726.cloud.3211 > S1-anjo5726.cloud.38034: Flags [R.], seq 0, ack 2330597226, win 0, length 0
01:10:22.648253 IP L1-anjo5726.cloud.34571 > S1-anjo5726.cloud.38034: Flags [R.], seq 0, ack 2330597226, win 0, length 0
01:10:22.648254 IP L1-anjo5726.cloud.903 > S1-anjo5726.cloud.38034: Flags [R.], seq 0, ack 2330597226, win 0, length 0
01:10:22.648256 IP L1-anjo5726.cloud.10025 > S1-anjo5726.cloud.38034: Flags [R.], seq 0, ack 2330597226, win 0, length 0
01:10:22.648256 IP L1-anjo5726.cloud.2038 > S1-anjo5726.cloud.38034: Flags [R.], seq 0, ack 2330597226, win 0, length 0
01:10:22.648257 IP L1-anjo5726.cloud.1862 > S1-anjo5726.cloud.38034: Flags [R.], seq 0, ack 2330597226, win 0, length 0
01:10:22.648258 IP L1-anjo5726.cloud.49160 > S1-anjo5726.cloud.38034: Flags [R.], seq 0, ack 2330597226, win 0, length 0
01:10:22.648259 IP L1-anjo5726.cloud.50500 > S1-anjo5726.cloud.38034: Flags [R.], seq 0, ack 2330597226, win 0, length 0
01:10:22.648260 IP L1-anjo5726.cloud.9207 > S1-anjo5726.cloud.38034: Flags [R.], seq 0, ack 2330597226, win 0, length 0
01:10:22.648285 IP L1-anjo5726.cloud.7106 > S1-anjo5726.cloud.38034: Flags [R.], seq 0, ack 2330597226, win 0, length 0
01:10:22.648286 IP L1-anjo5726.cloud.moira-update > S1-anjo5726.cloud.38034: Flags [R.], seq 0, ack 2330597226, win 0, length 0
01:10:22.648287 IP L1-anjo5726.cloud.714 > S1-anjo5726.cloud.38034: Flags [R.], seq 0, ack 2330597226, win 0, length 0
01:10:22.648288 IP L1-anjo5726.cloud.7004 > S1-anjo5726.cloud.38034: Flags [R.], seq 0, ack 2330597226, win 0, length 0
01:10:22.648289 IP L1-anjo5726.cloud.2967 > S1-anjo5726.cloud.38034: Flags [R.], seq 0, ack 2330597226, win 0, length 0
01:10:22.648290 IP L1-anjo5726.cloud.8085 > S1-anjo5726.cloud.38034: Flags [R.], seq 0, ack 2330597226, win 0, length 0
01:10:22.648291 IP L1-anjo5726.cloud.1041 > S1-anjo5726.cloud.38034: Flags [R.], seq 0, ack 2330597226, win 0, length 0
01:10:22.648292 IP L1-anjo5726.cloud.3404 > S1-anjo5726.cloud.38034: Flags [R.], seq 0, ack 2330597226, win 0, length 0
01:10:22.648315 IP L1-anjo5726.cloud.1183 > S1-anjo5726.cloud.38034: Flags [R.], seq 0, ack 2330597226, win 0, length 0
01:10:22.648316 IP L1-anjo5726.cloud.45100 > S1-anjo5726.cloud.38034: Flags [R.], seq 0, ack 2330597226, win 0, length 0
01:10:22.648318 IP L1-anjo5726.cloud.5730 > S1-anjo5726.cloud.38034: Flags [R.], seq 0, ack 2330597226, win 0, length 0
01:10:22.648319 IP L1-anjo5726.cloud.50389 > S1-anjo5726.cloud.38034: Flags [R.], seq 0, ack 2330597226, win 0, length 0
01:10:22.648320 IP L1-anjo5726.cloud.8090 > S1-anjo5726.cloud.38034: Flags [R.], seq 0, ack 2330597226, win 0, length 0
01:10:22.648321 IP L1-anjo5726.cloud.1083 > S1-anjo5726.cloud.38034: Flags [R.], seq 0, ack 2330597226, win 0, length 0
01:10:22.648321 IP L1-anjo5726.cloud.x11-2 > S1-anjo5726.cloud.38034: Flags [R.], seq 0, ack 2330597226, win 0, length 0
01:10:22.648322 IP L1-anjo5726.cloud.3986 > S1-anjo5726.cloud.38034: Flags [R.], seq 0, ack 2330597226, win 0, length 0
01:10:22.648621 IP S1-anjo5726.cloud.38034 > L1-anjo5726.cloud.8800: Flags [S], seq 2330597225, win 1024, options [mss 1460], length 0
01:10:22.648646 IP S1-anjo5726.cloud.38034 > L1-anjo5726.cloud.49157: Flags [S], seq 2330597225, win 1024, options [mss 1460], length 0
01:10:22.648657 IP S1-anjo5726.cloud.38034 > L1-anjo5726.cloud.20031: Flags [S], seq 2330597225, win 1024, options [mss 1460], length 0
01:10:22.648668 IP S1-anjo5726.cloud.38034 > L1-anjo5726.cloud.15742: Flags [S], seq 2330597225, win 1024, options [mss 1460], length 0
01:10:22.648683 IP S1-anjo5726.cloud.38034 > L1-anjo5726.cloud.5051: Flags [S], seq 2330597225, win 1024, options [mss 1460], length 0
01:10:22.648694 IP S1-anjo5726.cloud.38034 > L1-anjo5726.cloud.1494: Flags [S], seq 2330597225, win 1024, options [mss 1460], length 0
01:10:22.648704 IP S1-anjo5726.cloud.38034 > L1-anjo5726.cloud.7937: Flags [S], seq 2330597225, win 1024, options [mss 1460], length 0
01:10:22.648715 IP S1-anjo5726.cloud.38034 > L1-anjo5726.cloud.1124: Flags [S], seq 2330597225, win 1024, options [mss 1460], length 0
01:10:22.648726 IP S1-anjo5726.cloud.38034 > L1-anjo5726.cloud.1122: Flags [S], seq 2330597225, win 1024, options [mss 1460], length 0
01:10:22.648736 IP S1-anjo5726.cloud.38034 > L1-anjo5726.cloud.9593: Flags [S], seq 2330597225, win 1024, options [mss 1460], length 0
01:10:22.648746 IP S1-anjo5726.cloud.38034 > L1-anjo5726.cloud.iscsi-target: Flags [S], seq 2330597225, win 1024, options [mss 1460], length 0
01:10:22.648757 IP S1-anjo5726.cloud.38034 > L1-anjo5726.cloud.1001: Flags [S], seq 2330597225, win 1024, options [mss 1460], length 0
01:10:22.648770 IP S1-anjo5726.cloud.38034 > L1-anjo5726.cloud.2557: Flags [S], seq 2330597225, win 1024, options [mss 1460], length 0
01:10:22.648782 IP S1-anjo5726.cloud.38034 > L1-anjo5726.cloud.2717: Flags [S], seq 2330597225, win 1024, options [mss 1460], length 0
01:10:22.648800 IP S1-anjo5726.cloud.38034 > L1-anjo5726.cloud.62078: Flags [S], seq 2330597225, win 1024, options [mss 1460], length 0
01:10:22.648812 IP S1-anjo5726.cloud.38034 > L1-anjo5726.cloud.5087: Flags [S], seq 2330597225, win 1024, options [mss 1460], length 0
01:10:22.648822 IP S1-anjo5726.cloud.38034 > L1-anjo5726.cloud.8400: Flags [S], seq 2330597225, win 1024, options [mss 1460], length 0
01:10:22.648832 IP S1-anjo5726.cloud.38034 > L1-anjo5726.cloud.5902: Flags [S], seq 2330597225, win 1024, options [mss 1460], length 0
01:10:22.648842 IP S1-anjo5726.cloud.38034 > L1-anjo5726.cloud.4129: Flags [S], seq 2330597225, win 1024, options [mss 1460], length 0
01:10:22.648853 IP S1-anjo5726.cloud.38034 > L1-anjo5726.cloud.1717: Flags [S], seq 2330597225, win 1024, options [mss 1460], length 0
01:10:22.648867 IP S1-anjo5726.cloud.38034 > L1-anjo5726.cloud.648: Flags [S], seq 2330597225, win 1024, options [mss 1460], length 0
01:10:22.648878 IP S1-anjo5726.cloud.38034 > L1-anjo5726.cloud.3784: Flags [S], seq 2330597225, win 1024, options [mss 1460], length 0
01:10:22.648888 IP S1-anjo5726.cloud.38034 > L1-anjo5726.cloud.2288: Flags [S], seq 2330597225, win 1024, options [mss 1460], length 0
01:10:22.648898 IP S1-anjo5726.cloud.38034 > L1-anjo5726.cloud.3011: Flags [S], seq 2330597225, win 1024, options [mss 1460], length 0
01:10:22.648909 IP S1-anjo5726.cloud.38034 > L1-anjo5726.cloud.3370: Flags [S], seq 2330597225, win 1024, options [mss 1460], length 0
01:10:22.648919 IP S1-anjo5726.cloud.38034 > L1-anjo5726.cloud.1056: Flags [S], seq 2330597225, win 1024, options [mss 1460], length 0
01:10:22.648929 IP S1-anjo5726.cloud.38034 > L1-anjo5726.cloud.5859: Flags [S], seq 2330597225, win 1024, options [mss 1460], length 0
01:10:22.648939 IP S1-anjo5726.cloud.38034 > L1-anjo5726.cloud.1192: Flags [S], seq 2330597225, win 1024, options [mss 1460], length 0
01:10:22.648952 IP S1-anjo5726.cloud.38034 > L1-anjo5726.cloud.1900: Flags [S], seq 2330597225, win 1024, options [mss 1460], length 0
01:10:22.648963 IP S1-anjo5726.cloud.38034 > L1-anjo5726.cloud.109: Flags [S], seq 2330597225, win 1024, options [mss 1460], length 0
01:10:22.648973 IP S1-anjo5726.cloud.38034 > L1-anjo5726.cloud.3737: Flags [S], seq 2330597225, win 1024, options [mss 1460], length 0
01:10:22.648983 IP S1-anjo5726.cloud.38034 > L1-anjo5726.cloud.9099: Flags [S], seq 2330597225, win 1024, options [mss 1460], length 0
01:10:22.648993 IP S1-anjo5726.cloud.38034 > L1-anjo5726.cloud.40193: Flags [S], seq 2330597225, win 1024, options [mss 1460], length 0
01:10:22.649003 IP S1-anjo5726.cloud.38034 > L1-anjo5726.cloud.2160: Flags [S], seq 2330597225, win 1024, options [mss 1460], length 0
01:10:22.649013 IP S1-anjo5726.cloud.38034 > L1-anjo5726.cloud.10004: Flags [S], seq 2330597225, win 1024, options [mss 1460], length 0
01:10:22.649030 IP S1-anjo5726.cloud.38034 > L1-anjo5726.cloud.3261: Flags [S], seq 2330597225, win 1024, options [mss 1460], length 0
01:10:22.649051 IP S1-anjo5726.cloud.38034 > L1-anjo5726.cloud.bgp: Flags [S], seq 2330597225, win 1024, options [mss 1460], length 0
01:10:22.649064 IP S1-anjo5726.cloud.38034 > L1-anjo5726.cloud.tproxy: Flags [S], seq 2330597225, win 1024, options [mss 1460], length 0
01:10:22.649128 IP L1-anjo5726.cloud.8800 > S1-anjo5726.cloud.38034: Flags [R.], seq 0, ack 2330597226, win 0, length 0
01:10:22.649129 IP L1-anjo5726.cloud.49157 > S1-anjo5726.cloud.38034: Flags [R.], seq 0, ack 2330597226, win 0, length 0
01:10:22.649130 IP L1-anjo5726.cloud.20031 > S1-anjo5726.cloud.38034: Flags [R.], seq 0, ack 2330597226, win 0, length 0
01:10:22.649131 IP L1-anjo5726.cloud.15742 > S1-anjo5726.cloud.38034: Flags [R.], seq 0, ack 2330597226, win 0, length 0
01:10:22.649131 IP L1-anjo5726.cloud.5051 > S1-anjo5726.cloud.38034: Flags [R.], seq 0, ack 2330597226, win 0, length 0
01:10:22.649133 IP L1-anjo5726.cloud.1494 > S1-anjo5726.cloud.38034: Flags [R.], seq 0, ack 2330597226, win 0, length 0
01:10:22.649133 IP L1-anjo5726.cloud.7937 > S1-anjo5726.cloud.38034: Flags [R.], seq 0, ack 2330597226, win 0, length 0
01:10:22.649134 IP L1-anjo5726.cloud.1124 > S1-anjo5726.cloud.38034: Flags [R.], seq 0, ack 2330597226, win 0, length 0
01:10:22.649155 IP L1-anjo5726.cloud.1122 > S1-anjo5726.cloud.38034: Flags [R.], seq 0, ack 2330597226, win 0, length 0
01:10:22.649156 IP L1-anjo5726.cloud.9593 > S1-anjo5726.cloud.38034: Flags [R.], seq 0, ack 2330597226, win 0, length 0
01:10:22.649157 IP L1-anjo5726.cloud.iscsi-target > S1-anjo5726.cloud.38034: Flags [R.], seq 0, ack 2330597226, win 0, length 0
01:10:22.649158 IP L1-anjo5726.cloud.1001 > S1-anjo5726.cloud.38034: Flags [R.], seq 0, ack 2330597226, win 0, length 0
01:10:22.649159 IP L1-anjo5726.cloud.2557 > S1-anjo5726.cloud.38034: Flags [R.], seq 0, ack 2330597226, win 0, length 0
01:10:22.649160 IP L1-anjo5726.cloud.2717 > S1-anjo5726.cloud.38034: Flags [R.], seq 0, ack 2330597226, win 0, length 0
01:10:22.649161 IP L1-anjo5726.cloud.62078 > S1-anjo5726.cloud.38034: Flags [R.], seq 0, ack 2330597226, win 0, length 0
01:10:22.649162 IP L1-anjo5726.cloud.5087 > S1-anjo5726.cloud.38034: Flags [R.], seq 0, ack 2330597226, win 0, length 0
01:10:22.649179 IP L1-anjo5726.cloud.8400 > S1-anjo5726.cloud.38034: Flags [R.], seq 0, ack 2330597226, win 0, length 0
01:10:22.649180 IP L1-anjo5726.cloud.5902 > S1-anjo5726.cloud.38034: Flags [R.], seq 0, ack 2330597226, win 0, length 0
01:10:22.649181 IP L1-anjo5726.cloud.4129 > S1-anjo5726.cloud.38034: Flags [R.], seq 0, ack 2330597226, win 0, length 0
01:10:22.649182 IP L1-anjo5726.cloud.1717 > S1-anjo5726.cloud.38034: Flags [R.], seq 0, ack 2330597226, win 0, length 0
01:10:22.649183 IP L1-anjo5726.cloud.648 > S1-anjo5726.cloud.38034: Flags [R.], seq 0, ack 2330597226, win 0, length 0
01:10:22.649184 IP L1-anjo5726.cloud.3784 > S1-anjo5726.cloud.38034: Flags [R.], seq 0, ack 2330597226, win 0, length 0
01:10:22.649185 IP L1-anjo5726.cloud.2288 > S1-anjo5726.cloud.38034: Flags [R.], seq 0, ack 2330597226, win 0, length 0
01:10:22.649185 IP L1-anjo5726.cloud.3011 > S1-anjo5726.cloud.38034: Flags [R.], seq 0, ack 2330597226, win 0, length 0
01:10:22.649209 IP L1-anjo5726.cloud.3370 > S1-anjo5726.cloud.38034: Flags [R.], seq 0, ack 2330597226, win 0, length 0
01:10:22.649210 IP L1-anjo5726.cloud.1056 > S1-anjo5726.cloud.38034: Flags [R.], seq 0, ack 2330597226, win 0, length 0
01:10:22.649211 IP L1-anjo5726.cloud.5859 > S1-anjo5726.cloud.38034: Flags [R.], seq 0, ack 2330597226, win 0, length 0
01:10:22.649212 IP L1-anjo5726.cloud.1192 > S1-anjo5726.cloud.38034: Flags [R.], seq 0, ack 2330597226, win 0, length 0
01:10:22.649213 IP L1-anjo5726.cloud.1900 > S1-anjo5726.cloud.38034: Flags [R.], seq 0, ack 2330597226, win 0, length 0
01:10:22.649214 IP L1-anjo5726.cloud.109 > S1-anjo5726.cloud.38034: Flags [R.], seq 0, ack 2330597226, win 0, length 0
01:10:22.649215 IP L1-anjo5726.cloud.3737 > S1-anjo5726.cloud.38034: Flags [R.], seq 0, ack 2330597226, win 0, length 0
01:10:22.649216 IP L1-anjo5726.cloud.9099 > S1-anjo5726.cloud.38034: Flags [R.], seq 0, ack 2330597226, win 0, length 0
01:10:22.649250 IP L1-anjo5726.cloud.40193 > S1-anjo5726.cloud.38034: Flags [R.], seq 0, ack 2330597226, win 0, length 0
01:10:22.649251 IP L1-anjo5726.cloud.2160 > S1-anjo5726.cloud.38034: Flags [R.], seq 0, ack 2330597226, win 0, length 0
01:10:22.649251 IP L1-anjo5726.cloud.10004 > S1-anjo5726.cloud.38034: Flags [R.], seq 0, ack 2330597226, win 0, length 0
01:10:22.649252 IP L1-anjo5726.cloud.3261 > S1-anjo5726.cloud.38034: Flags [R.], seq 0, ack 2330597226, win 0, length 0
01:10:22.649253 IP L1-anjo5726.cloud.bgp > S1-anjo5726.cloud.38034: Flags [R.], seq 0, ack 2330597226, win 0, length 0
01:10:22.649255 IP L1-anjo5726.cloud.tproxy > S1-anjo5726.cloud.38034: Flags [R.], seq 0, ack 2330597226, win 0, length 0
01:10:22.649285 IP S1-anjo5726.cloud.38034 > L1-anjo5726.cloud.1022: Flags [S], seq 2330597225, win 1024, options [mss 1460], length 0
01:10:22.649305 IP S1-anjo5726.cloud.38034 > L1-anjo5726.cloud.20222: Flags [S], seq 2330597225, win 1024, options [mss 1460], length 0
01:10:22.649316 IP S1-anjo5726.cloud.38034 > L1-anjo5726.cloud.89: Flags [S], seq 2330597225, win 1024, options [mss 1460], length 0
01:10:22.649326 IP S1-anjo5726.cloud.38034 > L1-anjo5726.cloud.55055: Flags [S], seq 2330597225, win 1024, options [mss 1460], length 0
01:10:22.649337 IP S1-anjo5726.cloud.38034 > L1-anjo5726.cloud.8600: Flags [S], seq 2330597225, win 1024, options [mss 1460], length 0
01:10:22.649347 IP S1-anjo5726.cloud.38034 > L1-anjo5726.cloud.3390: Flags [S], seq 2330597225, win 1024, options [mss 1460], length 0
01:10:22.649362 IP S1-anjo5726.cloud.38034 > L1-anjo5726.cloud.616: Flags [S], seq 2330597225, win 1024, options [mss 1460], length 0
01:10:22.649373 IP S1-anjo5726.cloud.38034 > L1-anjo5726.cloud.1864: Flags [S], seq 2330597225, win 1024, options [mss 1460], length 0
01:10:22.649386 IP S1-anjo5726.cloud.38034 > L1-anjo5726.cloud.1037: Flags [S], seq 2330597225, win 1024, options [mss 1460], length 0
01:10:22.649396 IP S1-anjo5726.cloud.38034 > L1-anjo5726.cloud.25735: Flags [S], seq 2330597225, win 1024, options [mss 1460], length 0
01:10:22.649406 IP S1-anjo5726.cloud.38034 > L1-anjo5726.cloud.65389: Flags [S], seq 2330597225, win 1024, options [mss 1460], length 0
01:10:22.649416 IP S1-anjo5726.cloud.38034 > L1-anjo5726.cloud.51493: Flags [S], seq 2330597225, win 1024, options [mss 1460], length 0
01:10:22.649503 IP L1-anjo5726.cloud.1022 > S1-anjo5726.cloud.38034: Flags [R.], seq 0, ack 2330597226, win 0, length 0
01:10:22.649507 IP L1-anjo5726.cloud.20222 > S1-anjo5726.cloud.38034: Flags [R.], seq 0, ack 2330597226, win 0, length 0
01:10:22.649508 IP L1-anjo5726.cloud.89 > S1-anjo5726.cloud.38034: Flags [R.], seq 0, ack 2330597226, win 0, length 0
01:10:22.649508 IP L1-anjo5726.cloud.55055 > S1-anjo5726.cloud.38034: Flags [R.], seq 0, ack 2330597226, win 0, length 0
01:10:22.649509 IP L1-anjo5726.cloud.8600 > S1-anjo5726.cloud.38034: Flags [R.], seq 0, ack 2330597226, win 0, length 0
01:10:22.649527 IP L1-anjo5726.cloud.3390 > S1-anjo5726.cloud.38034: Flags [R.], seq 0, ack 2330597226, win 0, length 0
01:10:22.649528 IP L1-anjo5726.cloud.616 > S1-anjo5726.cloud.38034: Flags [R.], seq 0, ack 2330597226, win 0, length 0
01:10:22.649529 IP L1-anjo5726.cloud.1864 > S1-anjo5726.cloud.38034: Flags [R.], seq 0, ack 2330597226, win 0, length 0
01:10:22.649530 IP L1-anjo5726.cloud.1037 > S1-anjo5726.cloud.38034: Flags [R.], seq 0, ack 2330597226, win 0, length 0
01:10:22.649553 IP L1-anjo5726.cloud.25735 > S1-anjo5726.cloud.38034: Flags [R.], seq 0, ack 2330597226, win 0, length 0
01:10:22.649554 IP L1-anjo5726.cloud.65389 > S1-anjo5726.cloud.38034: Flags [R.], seq 0, ack 2330597226, win 0, length 0
01:10:22.649555 IP L1-anjo5726.cloud.51493 > S1-anjo5726.cloud.38034: Flags [R.], seq 0, ack 2330597226, win 0, length 0
01:10:22.649827 IP S1-anjo5726.cloud.38034 > L1-anjo5726.cloud.1104: Flags [S], seq 2330597225, win 1024, options [mss 1460], length 0
01:10:22.649849 IP S1-anjo5726.cloud.38034 > L1-anjo5726.cloud.9943: Flags [S], seq 2330597225, win 1024, options [mss 1460], length 0
01:10:22.649860 IP S1-anjo5726.cloud.38034 > L1-anjo5726.cloud.880: Flags [S], seq 2330597225, win 1024, options [mss 1460], length 0
01:10:22.649870 IP S1-anjo5726.cloud.38034 > L1-anjo5726.cloud.16113: Flags [S], seq 2330597225, win 1024, options [mss 1460], length 0
01:10:22.649880 IP S1-anjo5726.cloud.38034 > L1-anjo5726.cloud.32770: Flags [S], seq 2330597225, win 1024, options [mss 1460], length 0
01:10:22.649891 IP S1-anjo5726.cloud.38034 > L1-anjo5726.cloud.32774: Flags [S], seq 2330597225, win 1024, options [mss 1460], length 0
01:10:22.649908 IP S1-anjo5726.cloud.38034 > L1-anjo5726.cloud.5405: Flags [S], seq 2330597225, win 1024, options [mss 1460], length 0
01:10:22.649920 IP S1-anjo5726.cloud.38034 > L1-anjo5726.cloud.x11-6: Flags [S], seq 2330597225, win 1024, options [mss 1460], length 0
01:10:22.649933 IP S1-anjo5726.cloud.38034 > L1-anjo5726.cloud.264: Flags [S], seq 2330597225, win 1024, options [mss 1460], length 0
01:10:22.649943 IP S1-anjo5726.cloud.38034 > L1-anjo5726.cloud.5102: Flags [S], seq 2330597225, win 1024, options [mss 1460], length 0
01:10:22.649955 IP S1-anjo5726.cloud.38034 > L1-anjo5726.cloud.2638: Flags [S], seq 2330597225, win 1024, options [mss 1460], length 0
01:10:22.649966 IP S1-anjo5726.cloud.38034 > L1-anjo5726.cloud.1974: Flags [S], seq 2330597225, win 1024, options [mss 1460], length 0
01:10:22.649976 IP S1-anjo5726.cloud.38034 > L1-anjo5726.cloud.6646: Flags [S], seq 2330597225, win 1024, options [mss 1460], length 0
01:10:22.649986 IP S1-anjo5726.cloud.38034 > L1-anjo5726.cloud.32773: Flags [S], seq 2330597225, win 1024, options [mss 1460], length 0
01:10:22.649996 IP S1-anjo5726.cloud.38034 > L1-anjo5726.cloud.7627: Flags [S], seq 2330597225, win 1024, options [mss 1460], length 0
01:10:22.650006 IP S1-anjo5726.cloud.38034 > L1-anjo5726.cloud.5298: Flags [S], seq 2330597225, win 1024, options [mss 1460], length 0
01:10:22.650018 IP S1-anjo5726.cloud.38034 > L1-anjo5726.cloud.541: Flags [S], seq 2330597225, win 1024, options [mss 1460], length 0
01:10:22.650029 IP S1-anjo5726.cloud.38034 > L1-anjo5726.cloud.44176: Flags [S], seq 2330597225, win 1024, options [mss 1460], length 0
01:10:22.650047 IP S1-anjo5726.cloud.38034 > L1-anjo5726.cloud.9929: Flags [S], seq 2330597225, win 1024, options [mss 1460], length 0
01:10:22.650060 IP S1-anjo5726.cloud.38034 > L1-anjo5726.cloud.zope-ftp: Flags [S], seq 2330597225, win 1024, options [mss 1460], length 0
01:10:22.650070 IP S1-anjo5726.cloud.38034 > L1-anjo5726.cloud.9200: Flags [S], seq 2330597225, win 1024, options [mss 1460], length 0
01:10:22.650080 IP S1-anjo5726.cloud.38034 > L1-anjo5726.cloud.lotusnote: Flags [S], seq 2330597225, win 1024, options [mss 1460], length 0
01:10:22.650090 IP S1-anjo5726.cloud.38034 > L1-anjo5726.cloud.3221: Flags [S], seq 2330597225, win 1024, options [mss 1460], length 0
01:10:22.650100 IP S1-anjo5726.cloud.38034 > L1-anjo5726.cloud.7920: Flags [S], seq 2330597225, win 1024, options [mss 1460], length 0
01:10:22.650126 IP S1-anjo5726.cloud.38034 > L1-anjo5726.cloud.5214: Flags [S], seq 2330597225, win 1024, options [mss 1460], length 0
01:10:22.650177 IP L1-anjo5726.cloud.1104 > S1-anjo5726.cloud.38034: Flags [R.], seq 0, ack 2330597226, win 0, length 0
01:10:22.650178 IP L1-anjo5726.cloud.9943 > S1-anjo5726.cloud.38034: Flags [R.], seq 0, ack 2330597226, win 0, length 0
01:10:22.650179 IP L1-anjo5726.cloud.880 > S1-anjo5726.cloud.38034: Flags [R.], seq 0, ack 2330597226, win 0, length 0
01:10:22.650180 IP L1-anjo5726.cloud.16113 > S1-anjo5726.cloud.38034: Flags [R.], seq 0, ack 2330597226, win 0, length 0
01:10:22.650181 IP L1-anjo5726.cloud.32770 > S1-anjo5726.cloud.38034: Flags [R.], seq 0, ack 2330597226, win 0, length 0
01:10:22.650181 IP L1-anjo5726.cloud.32774 > S1-anjo5726.cloud.38034: Flags [R.], seq 0, ack 2330597226, win 0, length 0
01:10:22.650182 IP L1-anjo5726.cloud.5405 > S1-anjo5726.cloud.38034: Flags [R.], seq 0, ack 2330597226, win 0, length 0
01:10:22.650183 IP L1-anjo5726.cloud.x11-6 > S1-anjo5726.cloud.38034: Flags [R.], seq 0, ack 2330597226, win 0, length 0
01:10:22.650207 IP L1-anjo5726.cloud.264 > S1-anjo5726.cloud.38034: Flags [R.], seq 0, ack 2330597226, win 0, length 0
01:10:22.650208 IP L1-anjo5726.cloud.5102 > S1-anjo5726.cloud.38034: Flags [R.], seq 0, ack 2330597226, win 0, length 0
01:10:22.650209 IP L1-anjo5726.cloud.2638 > S1-anjo5726.cloud.38034: Flags [R.], seq 0, ack 2330597226, win 0, length 0
01:10:22.650210 IP L1-anjo5726.cloud.1974 > S1-anjo5726.cloud.38034: Flags [R.], seq 0, ack 2330597226, win 0, length 0
01:10:22.650210 IP L1-anjo5726.cloud.6646 > S1-anjo5726.cloud.38034: Flags [R.], seq 0, ack 2330597226, win 0, length 0
01:10:22.650211 IP L1-anjo5726.cloud.32773 > S1-anjo5726.cloud.38034: Flags [R.], seq 0, ack 2330597226, win 0, length 0
01:10:22.650212 IP L1-anjo5726.cloud.7627 > S1-anjo5726.cloud.38034: Flags [R.], seq 0, ack 2330597226, win 0, length 0
01:10:22.650212 IP L1-anjo5726.cloud.5298 > S1-anjo5726.cloud.38034: Flags [R.], seq 0, ack 2330597226, win 0, length 0
01:10:22.650244 IP L1-anjo5726.cloud.541 > S1-anjo5726.cloud.38034: Flags [R.], seq 0, ack 2330597226, win 0, length 0
01:10:22.650245 IP L1-anjo5726.cloud.44176 > S1-anjo5726.cloud.38034: Flags [R.], seq 0, ack 2330597226, win 0, length 0
01:10:22.650245 IP L1-anjo5726.cloud.9929 > S1-anjo5726.cloud.38034: Flags [R.], seq 0, ack 2330597226, win 0, length 0
01:10:22.650246 IP L1-anjo5726.cloud.zope-ftp > S1-anjo5726.cloud.38034: Flags [R.], seq 0, ack 2330597226, win 0, length 0
01:10:22.650247 IP L1-anjo5726.cloud.9200 > S1-anjo5726.cloud.38034: Flags [R.], seq 0, ack 2330597226, win 0, length 0
01:10:22.650256 IP L1-anjo5726.cloud.lotusnote > S1-anjo5726.cloud.38034: Flags [R.], seq 0, ack 2330597226, win 0, length 0
01:10:22.650256 IP L1-anjo5726.cloud.3221 > S1-anjo5726.cloud.38034: Flags [R.], seq 0, ack 2330597226, win 0, length 0
01:10:22.650257 IP L1-anjo5726.cloud.7920 > S1-anjo5726.cloud.38034: Flags [R.], seq 0, ack 2330597226, win 0, length 0
01:10:22.650258 IP L1-anjo5726.cloud.5214 > S1-anjo5726.cloud.38034: Flags [R.], seq 0, ack 2330597226, win 0, length 0
01:10:22.650374 IP S1-anjo5726.cloud.38034 > L1-anjo5726.cloud.32782: Flags [S], seq 2330597225, win 1024, options [mss 1460], length 0
01:10:22.650399 IP S1-anjo5726.cloud.38034 > L1-anjo5726.cloud.3801: Flags [S], seq 2330597225, win 1024, options [mss 1460], length 0
01:10:22.650409 IP S1-anjo5726.cloud.38034 > L1-anjo5726.cloud.617: Flags [S], seq 2330597225, win 1024, options [mss 1460], length 0
01:10:22.650419 IP S1-anjo5726.cloud.38034 > L1-anjo5726.cloud.7777: Flags [S], seq 2330597225, win 1024, options [mss 1460], length 0
01:10:22.650429 IP S1-anjo5726.cloud.38034 > L1-anjo5726.cloud.10628: Flags [S], seq 2330597225, win 1024, options [mss 1460], length 0
01:10:22.650438 IP S1-anjo5726.cloud.38034 > L1-anjo5726.cloud.zebra: Flags [S], seq 2330597225, win 1024, options [mss 1460], length 0
01:10:22.650448 IP S1-anjo5726.cloud.38034 > L1-anjo5726.cloud.kerberos-adm: Flags [S], seq 2330597225, win 1024, options [mss 1460], length 0
01:10:22.650457 IP S1-anjo5726.cloud.38034 > L1-anjo5726.cloud.exec: Flags [S], seq 2330597225, win 1024, options [mss 1460], length 0
01:10:22.650467 IP S1-anjo5726.cloud.38034 > L1-anjo5726.cloud.1658: Flags [S], seq 2330597225, win 1024, options [mss 1460], length 0
01:10:22.650485 IP S1-anjo5726.cloud.38034 > L1-anjo5726.cloud.32771: Flags [S], seq 2330597225, win 1024, options [mss 1460], length 0
01:10:22.650497 IP S1-anjo5726.cloud.38034 > L1-anjo5726.cloud.3001: Flags [S], seq 2330597225, win 1024, options [mss 1460], length 0
