01:10:38.928608 IP L1-anjo5726.cloud.ntp > ns1.telecom.lt.ntp: NTPv4, Client, length 48
01:10:38.931280 IP ns1.telecom.lt.ntp > L1-anjo5726.cloud.ntp: NTPv4, Server, length 48
01:10:39.253398 IP L1-anjo5726.cloud.38400 > router1.cloud.domain: 23682+ PTR? 1.0.59.212.in-addr.arpa. (41)
01:10:39.254563 IP router1.cloud.domain > L1-anjo5726.cloud.38400: 23682 1/0/0 PTR ns1.telecom.lt. (69)
01:10:39.254807 IP L1-anjo5726.cloud.55070 > router1.cloud.domain: 1700+ PTR? 16.0.16.172.in-addr.arpa. (42)
01:10:39.255743 IP router1.cloud.domain > L1-anjo5726.cloud.55070: 1700* 1/0/0 PTR L1-anjo5726.cloud. (73)
01:10:40.276535 IP L1-anjo5726.cloud.50357 > router1.cloud.domain: 24+ PTR? 1.0.16.172.in-addr.arpa. (41)
01:10:40.277599 IP router1.cloud.domain > L1-anjo5726.cloud.50357: 24* 1/0/0 PTR router1.cloud. (68)
01:11:11.928663 IP L1-anjo5726.cloud.ntp > 5.20.0.21.ntp: NTPv4, Client, length 48
01:11:11.930924 IP 5.20.0.21.ntp > L1-anjo5726.cloud.ntp: NTPv4, Server, length 48
01:11:12.020581 IP L1-anjo5726.cloud.56978 > router1.cloud.domain: 24349+ PTR? 21.0.20.5.in-addr.arpa. (40)
01:11:12.021720 IP router1.cloud.domain > L1-anjo5726.cloud.56978: 24349 NXDomain 0/0/0 (40)
01:11:17.106418 ARP, Request who-has L1-anjo5726.cloud tell router1.cloud, length 28
01:11:17.106453 ARP, Reply L1-anjo5726.cloud is-at 02:00:ac:10:00:10 (oui Unknown), length 28
01:11:17.172232 ARP, Request who-has router1.cloud tell L1-anjo5726.cloud, length 28
01:11:17.172887 ARP, Reply router1.cloud is-at 02:00:ac:10:00:01 (oui Unknown), length 28
01:12:15.716586 ARP, Request who-has L1-anjo5726.cloud tell S1-anjo5726.cloud, length 28
01:12:15.716613 ARP, Reply L1-anjo5726.cloud is-at 02:00:ac:10:00:10 (oui Unknown), length 28
01:12:15.720071 IP S1-anjo5726.cloud.56498 > L1-anjo5726.cloud.imaps: Flags [S], seq 4180191734, win 1024, options [mss 1460], length 0
01:12:15.720071 IP S1-anjo5726.cloud.56498 > L1-anjo5726.cloud.mysql: Flags [S], seq 4180191734, win 1024, options [mss 1460], length 0
01:12:15.720071 IP S1-anjo5726.cloud.56498 > L1-anjo5726.cloud.5900: Flags [S], seq 4180191734, win 1024, options [mss 1460], length 0
01:12:15.720071 IP S1-anjo5726.cloud.56498 > L1-anjo5726.cloud.https: Flags [S], seq 4180191734, win 1024, options [mss 1460], length 0
01:12:15.720071 IP S1-anjo5726.cloud.56498 > L1-anjo5726.cloud.pop3s: Flags [S], seq 4180191734, win 1024, options [mss 1460], length 0
01:12:15.720071 IP S1-anjo5726.cloud.56498 > L1-anjo5726.cloud.1720: Flags [S], seq 4180191734, win 1024, options [mss 1460], length 0
01:12:15.720071 IP S1-anjo5726.cloud.56498 > L1-anjo5726.cloud.domain: Flags [S], seq 4180191734, win 1024, options [mss 1460], length 0
01:12:15.720072 IP S1-anjo5726.cloud.56498 > L1-anjo5726.cloud.256: Flags [S], seq 4180191734, win 1024, options [mss 1460], length 0
01:12:15.720131 IP L1-anjo5726.cloud.imaps > S1-anjo5726.cloud.56498: Flags [R.], seq 0, ack 4180191735, win 0, length 0
01:12:15.720183 IP L1-anjo5726.cloud.mysql > S1-anjo5726.cloud.56498: Flags [R.], seq 0, ack 4180191735, win 0, length 0
01:12:15.720230 IP L1-anjo5726.cloud.5900 > S1-anjo5726.cloud.56498: Flags [R.], seq 0, ack 4180191735, win 0, length 0
01:12:15.720242 IP L1-anjo5726.cloud.https > S1-anjo5726.cloud.56498: Flags [R.], seq 0, ack 4180191735, win 0, length 0
01:12:15.720254 IP L1-anjo5726.cloud.pop3s > S1-anjo5726.cloud.56498: Flags [R.], seq 0, ack 4180191735, win 0, length 0
01:12:15.720266 IP L1-anjo5726.cloud.1720 > S1-anjo5726.cloud.56498: Flags [R.], seq 0, ack 4180191735, win 0, length 0
01:12:15.720313 IP L1-anjo5726.cloud.domain > S1-anjo5726.cloud.56498: Flags [S.], seq 535251, ack 4180191735, win 64240, options [mss 1460], length 0
01:12:15.720327 IP L1-anjo5726.cloud.256 > S1-anjo5726.cloud.56498: Flags [R.], seq 0, ack 4180191735, win 0, length 0
01:12:15.720352 IP S1-anjo5726.cloud.56498 > L1-anjo5726.cloud.telnet: Flags [S], seq 4180191734, win 1024, options [mss 1460], length 0
01:12:15.720352 IP S1-anjo5726.cloud.56498 > L1-anjo5726.cloud.ssh: Flags [S], seq 4180191734, win 1024, options [mss 1460], length 0
01:12:15.720363 IP L1-anjo5726.cloud.telnet > S1-anjo5726.cloud.56498: Flags [R.], seq 0, ack 4180191735, win 0, length 0
01:12:15.720380 IP L1-anjo5726.cloud.ssh > S1-anjo5726.cloud.56498: Flags [S.], seq 1472527161, ack 4180191735, win 64240, options [mss 1460], length 0
01:12:15.720580 IP S1-anjo5726.cloud.56498 > L1-anjo5726.cloud.domain: Flags [R], seq 4180191735, win 0, length 0
01:12:15.720580 IP S1-anjo5726.cloud.56498 > L1-anjo5726.cloud.ssh: Flags [R], seq 4180191735, win 0, length 0
01:12:15.720676 IP S1-anjo5726.cloud.56498 > L1-anjo5726.cloud.epmap: Flags [S], seq 4180191734, win 1024, options [mss 1460], length 0
01:12:15.720677 IP S1-anjo5726.cloud.56498 > L1-anjo5726.cloud.sunrpc: Flags [S], seq 4180191734, win 1024, options [mss 1460], length 0
01:12:15.720701 IP L1-anjo5726.cloud.epmap > S1-anjo5726.cloud.56498: Flags [R.], seq 0, ack 4180191735, win 0, length 0
01:12:15.720734 IP L1-anjo5726.cloud.sunrpc > S1-anjo5726.cloud.56498: Flags [S.], seq 1668831735, ack 4180191735, win 64240, options [mss 1460], length 0
01:12:15.720746 IP S1-anjo5726.cloud.56498 > L1-anjo5726.cloud.pop3: Flags [S], seq 4180191734, win 1024, options [mss 1460], length 0
01:12:15.720746 IP S1-anjo5726.cloud.56498 > L1-anjo5726.cloud.1025: Flags [S], seq 4180191734, win 1024, options [mss 1460], length 0
01:12:15.720746 IP S1-anjo5726.cloud.56498 > L1-anjo5726.cloud.microsoft-ds: Flags [S], seq 4180191734, win 1024, options [mss 1460], length 0
01:12:15.720796 IP L1-anjo5726.cloud.pop3 > S1-anjo5726.cloud.56498: Flags [R.], seq 0, ack 4180191735, win 0, length 0
01:12:15.720819 IP L1-anjo5726.cloud.1025 > S1-anjo5726.cloud.56498: Flags [R.], seq 0, ack 4180191735, win 0, length 0
01:12:15.720829 IP L1-anjo5726.cloud.microsoft-ds > S1-anjo5726.cloud.56498: Flags [R.], seq 0, ack 4180191735, win 0, length 0
01:12:15.720846 IP S1-anjo5726.cloud.56498 > L1-anjo5726.cloud.smtp: Flags [S], seq 4180191734, win 1024, options [mss 1460], length 0
01:12:15.720846 IP S1-anjo5726.cloud.56498 > L1-anjo5726.cloud.http-alt: Flags [S], seq 4180191734, win 1024, options [mss 1460], length 0
01:12:15.720846 IP S1-anjo5726.cloud.56498 > L1-anjo5726.cloud.1723: Flags [S], seq 4180191734, win 1024, options [mss 1460], length 0
01:12:15.720846 IP S1-anjo5726.cloud.56498 > L1-anjo5726.cloud.auth: Flags [S], seq 4180191734, win 1024, options [mss 1460], length 0
01:12:15.720846 IP S1-anjo5726.cloud.56498 > L1-anjo5726.cloud.netbios-ssn: Flags [S], seq 4180191734, win 1024, options [mss 1460], length 0
01:12:15.720846 IP S1-anjo5726.cloud.56498 > L1-anjo5726.cloud.8888: Flags [S], seq 4180191734, win 1024, options [mss 1460], length 0
01:12:15.720846 IP S1-anjo5726.cloud.56498 > L1-anjo5726.cloud.ftp: Flags [S], seq 4180191734, win 1024, options [mss 1460], length 0
01:12:15.720846 IP S1-anjo5726.cloud.56498 > L1-anjo5726.cloud.http: Flags [S], seq 4180191734, win 1024, options [mss 1460], length 0
01:12:15.720879 IP L1-anjo5726.cloud.smtp > S1-anjo5726.cloud.56498: Flags [S.], seq 2618979487, ack 4180191735, win 64240, options [mss 1460], length 0
01:12:15.720904 IP L1-anjo5726.cloud.http-alt > S1-anjo5726.cloud.56498: Flags [R.], seq 0, ack 4180191735, win 0, length 0
01:12:15.720920 IP L1-anjo5726.cloud.1723 > S1-anjo5726.cloud.56498: Flags [R.], seq 0, ack 4180191735, win 0, length 0
01:12:15.720929 IP L1-anjo5726.cloud.auth > S1-anjo5726.cloud.56498: Flags [R.], seq 0, ack 4180191735, win 0, length 0
01:12:15.720937 IP L1-anjo5726.cloud.netbios-ssn > S1-anjo5726.cloud.56498: Flags [R.], seq 0, ack 4180191735, win 0, length 0
01:12:15.720946 IP L1-anjo5726.cloud.8888 > S1-anjo5726.cloud.56498: Flags [R.], seq 0, ack 4180191735, win 0, length 0
01:12:15.720961 IP L1-anjo5726.cloud.ftp > S1-anjo5726.cloud.56498: Flags [S.], seq 4176517892, ack 4180191735, win 64240, options [mss 1460], length 0
01:12:15.720976 IP L1-anjo5726.cloud.http > S1-anjo5726.cloud.56498: Flags [S.], seq 8647821, ack 4180191735, win 64240, options [mss 1460], length 0
01:12:15.720993 IP S1-anjo5726.cloud.56498 > L1-anjo5726.cloud.imap2: Flags [S], seq 4180191734, win 1024, options [mss 1460], length 0
01:12:15.720993 IP S1-anjo5726.cloud.56498 > L1-anjo5726.cloud.smux: Flags [S], seq 4180191734, win 1024, options [mss 1460], length 0
01:12:15.720993 IP S1-anjo5726.cloud.56498 > L1-anjo5726.cloud.rtsp: Flags [S], seq 4180191734, win 1024, options [mss 1460], length 0
01:12:15.720993 IP S1-anjo5726.cloud.56498 > L1-anjo5726.cloud.submission: Flags [S], seq 4180191734, win 1024, options [mss 1460], length 0
01:12:15.720993 IP S1-anjo5726.cloud.56498 > L1-anjo5726.cloud.ms-wbt-server: Flags [S], seq 4180191734, win 1024, options [mss 1460], length 0
01:12:15.720993 IP S1-anjo5726.cloud.56498 > L1-anjo5726.cloud.1791: Flags [S], seq 4180191734, win 1024, options [mss 1460], length 0
01:12:15.720994 IP S1-anjo5726.cloud.56498 > L1-anjo5726.cloud.43242: Flags [S], seq 4180191734, win 1024, options [mss 1460], length 0
01:12:15.721035 IP L1-anjo5726.cloud.imap2 > S1-anjo5726.cloud.56498: Flags [R.], seq 0, ack 4180191735, win 0, length 0
01:12:15.721079 IP L1-anjo5726.cloud.smux > S1-anjo5726.cloud.56498: Flags [R.], seq 0, ack 4180191735, win 0, length 0
01:12:15.721099 IP L1-anjo5726.cloud.rtsp > S1-anjo5726.cloud.56498: Flags [R.], seq 0, ack 4180191735, win 0, length 0
01:12:15.721108 IP L1-anjo5726.cloud.submission > S1-anjo5726.cloud.56498: Flags [R.], seq 0, ack 4180191735, win 0, length 0
01:12:15.721117 IP L1-anjo5726.cloud.ms-wbt-server > S1-anjo5726.cloud.56498: Flags [R.], seq 0, ack 4180191735, win 0, length 0
01:12:15.721126 IP L1-anjo5726.cloud.1791 > S1-anjo5726.cloud.56498: Flags [R.], seq 0, ack 4180191735, win 0, length 0
01:12:15.721136 IP L1-anjo5726.cloud.43242 > S1-anjo5726.cloud.56498: Flags [R.], seq 0, ack 4180191735, win 0, length 0
01:12:15.721146 IP S1-anjo5726.cloud.56498 > L1-anjo5726.cloud.sunrpc: Flags [R], seq 4180191735, win 0, length 0
01:12:15.721146 IP S1-anjo5726.cloud.56498 > L1-anjo5726.cloud.smtp: Flags [R], seq 4180191735, win 0, length 0
01:12:15.721205 IP S1-anjo5726.cloud.56498 > L1-anjo5726.cloud.ftp: Flags [R], seq 4180191735, win 0, length 0
01:12:15.721205 IP S1-anjo5726.cloud.56498 > L1-anjo5726.cloud.http: Flags [R], seq 4180191735, win 0, length 0
01:12:15.721430 IP S1-anjo5726.cloud.56498 > L1-anjo5726.cloud.7002: Flags [S], seq 4180191734, win 1024, options [mss 1460], length 0
01:12:15.721430 IP S1-anjo5726.cloud.56498 > L1-anjo5726.cloud.1806: Flags [S], seq 4180191734, win 1024, options [mss 1460], length 0
01:12:15.721455 IP L1-anjo5726.cloud.7002 > S1-anjo5726.cloud.56498: Flags [R.], seq 0, ack 4180191735, win 0, length 0
01:12:15.721477 IP L1-anjo5726.cloud.1806 > S1-anjo5726.cloud.56498: Flags [R.], seq 0, ack 4180191735, win 0, length 0
01:12:15.721487 IP S1-anjo5726.cloud.56498 > L1-anjo5726.cloud.12080: Flags [S], seq 4180191734, win 1024, options [mss 1460], length 0
01:12:15.721487 IP S1-anjo5726.cloud.56498 > L1-anjo5726.cloud.41632: Flags [S], seq 4180191734, win 1024, options [mss 1460], length 0
01:12:15.721487 IP S1-anjo5726.cloud.56498 > L1-anjo5726.cloud.3340: Flags [S], seq 4180191734, win 1024, options [mss 1460], length 0
01:12:15.721488 IP S1-anjo5726.cloud.56498 > L1-anjo5726.cloud.6112: Flags [S], seq 4180191734, win 1024, options [mss 1460], length 0
01:12:15.721500 IP L1-anjo5726.cloud.12080 > S1-anjo5726.cloud.56498: Flags [R.], seq 0, ack 4180191735, win 0, length 0
01:12:15.721543 IP L1-anjo5726.cloud.41632 > S1-anjo5726.cloud.56498: Flags [R.], seq 0, ack 4180191735, win 0, length 0
01:12:15.721553 IP L1-anjo5726.cloud.3340 > S1-anjo5726.cloud.56498: Flags [R.], seq 0, ack 4180191735, win 0, length 0
01:12:15.721562 IP L1-anjo5726.cloud.6112 > S1-anjo5726.cloud.56498: Flags [R.], seq 0, ack 4180191735, win 0, length 0
01:12:15.721610 IP S1-anjo5726.cloud.56498 > L1-anjo5726.cloud.5421: Flags [S], seq 4180191734, win 1024, options [mss 1460], length 0
01:12:15.721610 IP S1-anjo5726.cloud.56498 > L1-anjo5726.cloud.2993: Flags [S], seq 4180191734, win 1024, options [mss 1460], length 0
01:12:15.721611 IP S1-anjo5726.cloud.56498 > L1-anjo5726.cloud.2802: Flags [S], seq 4180191734, win 1024, options [mss 1460], length 0
01:12:15.721611 IP S1-anjo5726.cloud.56498 > L1-anjo5726.cloud.2221: Flags [S], seq 4180191734, win 1024, options [mss 1460], length 0
01:12:15.721611 IP S1-anjo5726.cloud.56498 > L1-anjo5726.cloud.4038: Flags [S], seq 4180191734, win 1024, options [mss 1460], length 0
01:12:15.721627 IP L1-anjo5726.cloud.5421 > S1-anjo5726.cloud.56498: Flags [R.], seq 0, ack 4180191735, win 0, length 0
01:12:15.721652 IP L1-anjo5726.cloud.2993 > S1-anjo5726.cloud.56498: Flags [R.], seq 0, ack 4180191735, win 0, length 0
01:12:15.721662 IP L1-anjo5726.cloud.2802 > S1-anjo5726.cloud.56498: Flags [R.], seq 0, ack 4180191735, win 0, length 0
01:12:15.721671 IP L1-anjo5726.cloud.2221 > S1-anjo5726.cloud.56498: Flags [R.], seq 0, ack 4180191735, win 0, length 0
01:12:15.721680 IP L1-anjo5726.cloud.4038 > S1-anjo5726.cloud.56498: Flags [R.], seq 0, ack 4180191735, win 0, length 0
01:12:15.721698 IP S1-anjo5726.cloud.56498 > L1-anjo5726.cloud.1916: Flags [S], seq 4180191734, win 1024, options [mss 1460], length 0
01:12:15.721698 IP S1-anjo5726.cloud.56498 > L1-anjo5726.cloud.983: Flags [S], seq 4180191734, win 1024, options [mss 1460], length 0
01:12:15.721698 IP S1-anjo5726.cloud.56498 > L1-anjo5726.cloud.32814: Flags [S], seq 4180191734, win 1024, options [mss 1460], length 0
01:12:15.721698 IP S1-anjo5726.cloud.56498 > L1-anjo5726.cloud.3244: Flags [S], seq 4180191734, win 1024, options [mss 1460], length 0
01:12:15.721699 IP S1-anjo5726.cloud.56498 > L1-anjo5726.cloud.1350: Flags [S], seq 4180191734, win 1024, options [mss 1460], length 0
01:12:15.721699 IP S1-anjo5726.cloud.56498 > L1-anjo5726.cloud.2317: Flags [S], seq 4180191734, win 1024, options [mss 1460], length 0
01:12:15.721699 IP S1-anjo5726.cloud.56498 > L1-anjo5726.cloud.2996: Flags [S], seq 4180191734, win 1024, options [mss 1460], length 0
01:12:15.721699 IP S1-anjo5726.cloud.56498 > L1-anjo5726.cloud.x11-4: Flags [S], seq 4180191734, win 1024, options [mss 1460], length 0
01:12:15.721727 IP L1-anjo5726.cloud.1916 > S1-anjo5726.cloud.56498: Flags [R.], seq 0, ack 4180191735, win 0, length 0
01:12:15.721748 IP L1-anjo5726.cloud.983 > S1-anjo5726.cloud.56498: Flags [R.], seq 0, ack 4180191735, win 0, length 0
01:12:15.721758 IP L1-anjo5726.cloud.32814 > S1-anjo5726.cloud.56498: Flags [R.], seq 0, ack 4180191735, win 0, length 0
01:12:15.721766 IP L1-anjo5726.cloud.3244 > S1-anjo5726.cloud.56498: Flags [R.], seq 0, ack 4180191735, win 0, length 0
01:12:15.721775 IP L1-anjo5726.cloud.1350 > S1-anjo5726.cloud.56498: Flags [R.], seq 0, ack 4180191735, win 0, length 0
01:12:15.721784 IP L1-anjo5726.cloud.2317 > S1-anjo5726.cloud.56498: Flags [R.], seq 0, ack 4180191735, win 0, length 0
01:12:15.721792 IP L1-anjo5726.cloud.2996 > S1-anjo5726.cloud.56498: Flags [R.], seq 0, ack 4180191735, win 0, length 0
01:12:15.721801 IP L1-anjo5726.cloud.x11-4 > S1-anjo5726.cloud.56498: Flags [R.], seq 0, ack 4180191735, win 0, length 0
01:12:15.721815 IP S1-anjo5726.cloud.56498 > L1-anjo5726.cloud.8640: Flags [S], seq 4180191734, win 1024, options [mss 1460], length 0
01:12:15.721815 IP S1-anjo5726.cloud.56498 > L1-anjo5726.cloud.17070: Flags [S], seq 4180191734, win 1024, options [mss 1460], length 0
01:12:15.721815 IP S1-anjo5726.cloud.56498 > L1-anjo5726.cloud.5059: Flags [S], seq 4180191734, win 1024, options [mss 1460], length 0
01:12:15.721816 IP S1-anjo5726.cloud.56498 > L1-anjo5726.cloud.4029: Flags [S], seq 4180191734, win 1024, options [mss 1460], length 0
01:12:15.721816 IP S1-anjo5726.cloud.56498 > L1-anjo5726.cloud.33879: Flags [S], seq 4180191734, win 1024, options [mss 1460], length 0
01:12:15.721816 IP S1-anjo5726.cloud.56498 > L1-anjo5726.cloud.43654: Flags [S], seq 4180191734, win 1024, options [mss 1460], length 0
01:12:15.721816 IP S1-anjo5726.cloud.56498 > L1-anjo5726.cloud.8383: Flags [S], seq 4180191734, win 1024, options [mss 1460], length 0
01:12:15.721816 IP S1-anjo5726.cloud.56498 > L1-anjo5726.cloud.2805: Flags [S], seq 4180191734, win 1024, options [mss 1460], length 0
01:12:15.721854 IP L1-anjo5726.cloud.8640 > S1-anjo5726.cloud.56498: Flags [R.], seq 0, ack 4180191735, win 0, length 0
01:12:15.721876 IP L1-anjo5726.cloud.17070 > S1-anjo5726.cloud.56498: Flags [R.], seq 0, ack 4180191735, win 0, length 0
01:12:15.721885 IP L1-anjo5726.cloud.5059 > S1-anjo5726.cloud.56498: Flags [R.], seq 0, ack 4180191735, win 0, length 0
01:12:15.721894 IP L1-anjo5726.cloud.4029 > S1-anjo5726.cloud.56498: Flags [R.], seq 0, ack 4180191735, win 0, length 0
01:12:15.721902 IP L1-anjo5726.cloud.33879 > S1-anjo5726.cloud.56498: Flags [R.], seq 0, ack 4180191735, win 0, length 0
01:12:15.721911 IP L1-anjo5726.cloud.43654 > S1-anjo5726.cloud.56498: Flags [R.], seq 0, ack 4180191735, win 0, length 0
01:12:15.721920 IP L1-anjo5726.cloud.8383 > S1-anjo5726.cloud.56498: Flags [R.], seq 0, ack 4180191735, win 0, length 0
01:12:15.721928 IP L1-anjo5726.cloud.2805 > S1-anjo5726.cloud.56498: Flags [R.], seq 0, ack 4180191735, win 0, length 0
01:12:15.721944 IP S1-anjo5726.cloud.56498 > L1-anjo5726.cloud.17235: Flags [S], seq 4180191734, win 1024, options [mss 1460], length 0
01:12:15.721944 IP S1-anjo5726.cloud.56498 > L1-anjo5726.cloud.5408: Flags [S], seq 4180191734, win 1024, options [mss 1460], length 0
01:12:15.721944 IP S1-anjo5726.cloud.56498 > L1-anjo5726.cloud.32792: Flags [S], seq 4180191734, win 1024, options [mss 1460], length 0
01:12:15.721944 IP S1-anjo5726.cloud.56498 > L1-anjo5726.cloud.3806: Flags [S], seq 4180191734, win 1024, options [mss 1460], length 0
01:12:15.721944 IP S1-anjo5726.cloud.56498 > L1-anjo5726.cloud.27004: Flags [S], seq 4180191734, win 1024, options [mss 1460], length 0
01:12:15.721944 IP S1-anjo5726.cloud.56498 > L1-anjo5726.cloud.4051: Flags [S], seq 4180191734, win 1024, options [mss 1460], length 0
01:12:15.721944 IP S1-anjo5726.cloud.56498 > L1-anjo5726.cloud.2990: Flags [S], seq 4180191734, win 1024, options [mss 1460], length 0
01:12:15.721945 IP S1-anjo5726.cloud.56498 > L1-anjo5726.cloud.4061: Flags [S], seq 4180191734, win 1024, options [mss 1460], length 0
01:12:15.721959 IP L1-anjo5726.cloud.17235 > S1-anjo5726.cloud.56498: Flags [R.], seq 0, ack 4180191735, win 0, length 0
01:12:15.721968 IP L1-anjo5726.cloud.5408 > S1-anjo5726.cloud.56498: Flags [R.], seq 0, ack 4180191735, win 0, length 0
01:12:15.721978 IP L1-anjo5726.cloud.32792 > S1-anjo5726.cloud.56498: Flags [R.], seq 0, ack 4180191735, win 0, length 0
01:12:15.721991 IP L1-anjo5726.cloud.3806 > S1-anjo5726.cloud.56498: Flags [R.], seq 0, ack 4180191735, win 0, length 0
01:12:15.721999 IP L1-anjo5726.cloud.27004 > S1-anjo5726.cloud.56498: Flags [R.], seq 0, ack 4180191735, win 0, length 0
01:12:15.722007 IP L1-anjo5726.cloud.4051 > S1-anjo5726.cloud.56498: Flags [R.], seq 0, ack 4180191735, win 0, length 0
01:12:15.722015 IP L1-anjo5726.cloud.2990 > S1-anjo5726.cloud.56498: Flags [R.], seq 0, ack 4180191735, win 0, length 0
01:12:15.722024 IP L1-anjo5726.cloud.4061 > S1-anjo5726.cloud.56498: Flags [R.], seq 0, ack 4180191735, win 0, length 0
01:12:15.722050 IP S1-anjo5726.cloud.56498 > L1-anjo5726.cloud.4250: Flags [S], seq 4180191734, win 1024, options [mss 1460], length 0
01:12:15.722050 IP S1-anjo5726.cloud.56498 > L1-anjo5726.cloud.2412: Flags [S], seq 4180191734, win 1024, options [mss 1460], length 0
01:12:15.722050 IP S1-anjo5726.cloud.56498 > L1-anjo5726.cloud.18463: Flags [S], seq 4180191734, win 1024, options [mss 1460], length 0
01:12:15.722050 IP S1-anjo5726.cloud.56498 > L1-anjo5726.cloud.3197: Flags [S], seq 4180191734, win 1024, options [mss 1460], length 0
01:12:15.722050 IP S1-anjo5726.cloud.56498 > L1-anjo5726.cloud.5544: Flags [S], seq 4180191734, win 1024, options [mss 1460], length 0
01:12:15.722065 IP L1-anjo5726.cloud.4250 > S1-anjo5726.cloud.56498: Flags [R.], seq 0, ack 4180191735, win 0, length 0
01:12:15.722075 IP L1-anjo5726.cloud.2412 > S1-anjo5726.cloud.56498: Flags [R.], seq 0, ack 4180191735, win 0, length 0
01:12:15.722084 IP L1-anjo5726.cloud.18463 > S1-anjo5726.cloud.56498: Flags [R.], seq 0, ack 4180191735, win 0, length 0
01:12:15.722092 IP L1-anjo5726.cloud.3197 > S1-anjo5726.cloud.56498: Flags [R.], seq 0, ack 4180191735, win 0, length 0
01:12:15.722101 IP L1-anjo5726.cloud.5544 > S1-anjo5726.cloud.56498: Flags [R.], seq 0, ack 4180191735, win 0, length 0
01:12:15.722478 IP S1-anjo5726.cloud.56498 > L1-anjo5726.cloud.1170: Flags [S], seq 4180191734, win 1024, options [mss 1460], length 0
01:12:15.722478 IP S1-anjo5726.cloud.56498 > L1-anjo5726.cloud.1181: Flags [S], seq 4180191734, win 1024, options [mss 1460], length 0
01:12:15.722504 IP L1-anjo5726.cloud.1170 > S1-anjo5726.cloud.56498: Flags [R.], seq 0, ack 4180191735, win 0, length 0
01:12:15.722526 IP L1-anjo5726.cloud.1181 > S1-anjo5726.cloud.56498: Flags [R.], seq 0, ack 4180191735, win 0, length 0
01:12:15.722564 IP S1-anjo5726.cloud.56498 > L1-anjo5726.cloud.3908: Flags [S], seq 4180191734, win 1024, options [mss 1460], length 0
01:12:15.722564 IP S1-anjo5726.cloud.56498 > L1-anjo5726.cloud.5032: Flags [S], seq 4180191734, win 1024, options [mss 1460], length 0
01:12:15.722564 IP S1-anjo5726.cloud.56498 > L1-anjo5726.cloud.6316: Flags [S], seq 4180191734, win 1024, options [mss 1460], length 0
01:12:15.722579 IP L1-anjo5726.cloud.3908 > S1-anjo5726.cloud.56498: Flags [R.], seq 0, ack 4180191735, win 0, length 0
01:12:15.722603 IP L1-anjo5726.cloud.5032 > S1-anjo5726.cloud.56498: Flags [R.], seq 0, ack 4180191735, win 0, length 0
01:12:15.722613 IP L1-anjo5726.cloud.6316 > S1-anjo5726.cloud.56498: Flags [R.], seq 0, ack 4180191735, win 0, length 0
01:12:15.722629 IP S1-anjo5726.cloud.56498 > L1-anjo5726.cloud.3525: Flags [S], seq 4180191734, win 1024, options [mss 1460], length 0
01:12:15.722629 IP S1-anjo5726.cloud.56498 > L1-anjo5726.cloud.4841: Flags [S], seq 4180191734, win 1024, options [mss 1460], length 0
01:12:15.722629 IP S1-anjo5726.cloud.56498 > L1-anjo5726.cloud.1772: Flags [S], seq 4180191734, win 1024, options [mss 1460], length 0
01:12:15.722629 IP S1-anjo5726.cloud.56498 > L1-anjo5726.cloud.3281: Flags [S], seq 4180191734, win 1024, options [mss 1460], length 0
01:12:15.722629 IP S1-anjo5726.cloud.56498 > L1-anjo5726.cloud.7171: Flags [S], seq 4180191734, win 1024, options [mss 1460], length 0
01:12:15.722629 IP S1-anjo5726.cloud.56498 > L1-anjo5726.cloud.4219: Flags [S], seq 4180191734, win 1024, options [mss 1460], length 0
01:12:15.722629 IP S1-anjo5726.cloud.56498 > L1-anjo5726.cloud.10025: Flags [S], seq 4180191734, win 1024, options [mss 1460], length 0
01:12:15.722662 IP L1-anjo5726.cloud.3525 > S1-anjo5726.cloud.56498: Flags [R.], seq 0, ack 4180191735, win 0, length 0
01:12:15.722691 IP L1-anjo5726.cloud.4841 > S1-anjo5726.cloud.56498: Flags [R.], seq 0, ack 4180191735, win 0, length 0
01:12:15.722701 IP L1-anjo5726.cloud.1772 > S1-anjo5726.cloud.56498: Flags [R.], seq 0, ack 4180191735, win 0, length 0
01:12:15.722709 IP L1-anjo5726.cloud.3281 > S1-anjo5726.cloud.56498: Flags [R.], seq 0, ack 4180191735, win 0, length 0
01:12:15.722718 IP L1-anjo5726.cloud.7171 > S1-anjo5726.cloud.56498: Flags [R.], seq 0, ack 4180191735, win 0, length 0
01:12:15.722727 IP L1-anjo5726.cloud.4219 > S1-anjo5726.cloud.56498: Flags [R.], seq 0, ack 4180191735, win 0, length 0
01:12:15.722735 IP L1-anjo5726.cloud.10025 > S1-anjo5726.cloud.56498: Flags [R.], seq 0, ack 4180191735, win 0, length 0
01:12:15.722782 IP S1-anjo5726.cloud.56498 > L1-anjo5726.cloud.16789: Flags [S], seq 4180191734, win 1024, options [mss 1460], length 0
01:12:15.722782 IP S1-anjo5726.cloud.56498 > L1-anjo5726.cloud.3366: Flags [S], seq 4180191734, win 1024, options [mss 1460], length 0
01:12:15.722782 IP S1-anjo5726.cloud.56498 > L1-anjo5726.cloud.5747: Flags [S], seq 4180191734, win 1024, options [mss 1460], length 0
01:12:15.722782 IP S1-anjo5726.cloud.56498 > L1-anjo5726.cloud.4280: Flags [S], seq 4180191734, win 1024, options [mss 1460], length 0
01:12:15.722782 IP S1-anjo5726.cloud.56498 > L1-anjo5726.cloud.6031: Flags [S], seq 4180191734, win 1024, options [mss 1460], length 0
01:12:15.722782 IP S1-anjo5726.cloud.56498 > L1-anjo5726.cloud.1081: Flags [S], seq 4180191734, win 1024, options [mss 1460], length 0
01:12:15.722782 IP S1-anjo5726.cloud.56498 > L1-anjo5726.cloud.3677: Flags [S], seq 4180191734, win 1024, options [mss 1460], length 0
01:12:15.722782 IP S1-anjo5726.cloud.56498 > L1-anjo5726.cloud.4314: Flags [S], seq 4180191734, win 1024, options [mss 1460], length 0
01:12:15.722803 IP L1-anjo5726.cloud.16789 > S1-anjo5726.cloud.56498: Flags [R.], seq 0, ack 4180191735, win 0, length 0
01:12:15.722821 IP L1-anjo5726.cloud.3366 > S1-anjo5726.cloud.56498: Flags [R.], seq 0, ack 4180191735, win 0, length 0
01:12:15.722830 IP L1-anjo5726.cloud.5747 > S1-anjo5726.cloud.56498: Flags [R.], seq 0, ack 4180191735, win 0, length 0
01:12:15.722838 IP L1-anjo5726.cloud.4280 > S1-anjo5726.cloud.56498: Flags [R.], seq 0, ack 4180191735, win 0, length 0
01:12:15.722847 IP L1-anjo5726.cloud.6031 > S1-anjo5726.cloud.56498: Flags [R.], seq 0, ack 4180191735, win 0, length 0
01:12:15.722867 IP L1-anjo5726.cloud.1081 > S1-anjo5726.cloud.56498: Flags [R.], seq 0, ack 4180191735, win 0, length 0
01:12:15.722877 IP L1-anjo5726.cloud.3677 > S1-anjo5726.cloud.56498: Flags [R.], seq 0, ack 4180191735, win 0, length 0
01:12:15.722885 IP L1-anjo5726.cloud.4314 > S1-anjo5726.cloud.56498: Flags [R.], seq 0, ack 4180191735, win 0, length 0
01:12:15.722899 IP S1-anjo5726.cloud.56498 > L1-anjo5726.cloud.13192: Flags [S], seq 4180191734, win 1024, options [mss 1460], length 0
01:12:15.722899 IP S1-anjo5726.cloud.56498 > L1-anjo5726.cloud.5230: Flags [S], seq 4180191734, win 1024, options [mss 1460], length 0
01:12:15.722899 IP S1-anjo5726.cloud.56498 > L1-anjo5726.cloud.5236: Flags [S], seq 4180191734, win 1024, options [mss 1460], length 0
01:12:15.722899 IP S1-anjo5726.cloud.56498 > L1-anjo5726.cloud.2280: Flags [S], seq 4180191734, win 1024, options [mss 1460], length 0
01:12:15.722899 IP S1-anjo5726.cloud.56498 > L1-anjo5726.cloud.2515: Flags [S], seq 4180191734, win 1024, options [mss 1460], length 0
01:12:15.722899 IP S1-anjo5726.cloud.56498 > L1-anjo5726.cloud.5453: Flags [S], seq 4180191734, win 1024, options [mss 1460], length 0
01:12:15.722899 IP S1-anjo5726.cloud.56498 > L1-anjo5726.cloud.4569: Flags [S], seq 4180191734, win 1024, options [mss 1460], length 0
01:12:15.722899 IP S1-anjo5726.cloud.56498 > L1-anjo5726.cloud.4609: Flags [S], seq 4180191734, win 1024, options [mss 1460], length 0
01:12:15.722914 IP L1-anjo5726.cloud.13192 > S1-anjo5726.cloud.56498: Flags [R.], seq 0, ack 4180191735, win 0, length 0
01:12:15.722923 IP L1-anjo5726.cloud.5230 > S1-anjo5726.cloud.56498: Flags [R.], seq 0, ack 4180191735, win 0, length 0
01:12:15.722932 IP L1-anjo5726.cloud.5236 > S1-anjo5726.cloud.56498: Flags [R.], seq 0, ack 4180191735, win 0, length 0
01:12:15.722940 IP L1-anjo5726.cloud.2280 > S1-anjo5726.cloud.56498: Flags [R.], seq 0, ack 4180191735, win 0, length 0
01:12:15.722949 IP L1-anjo5726.cloud.2515 > S1-anjo5726.cloud.56498: Flags [R.], seq 0, ack 4180191735, win 0, length 0
01:12:15.722958 IP L1-anjo5726.cloud.5453 > S1-anjo5726.cloud.56498: Flags [R.], seq 0, ack 4180191735, win 0, length 0
01:12:15.722966 IP L1-anjo5726.cloud.4569 > S1-anjo5726.cloud.56498: Flags [R.], seq 0, ack 4180191735, win 0, length 0
01:12:15.722975 IP L1-anjo5726.cloud.4609 > S1-anjo5726.cloud.56498: Flags [R.], seq 0, ack 4180191735, win 0, length 0
01:12:15.723058 IP S1-anjo5726.cloud.56498 > L1-anjo5726.cloud.15645: Flags [S], seq 4180191734, win 1024, options [mss 1460], length 0
01:12:15.723058 IP S1-anjo5726.cloud.56498 > L1-anjo5726.cloud.17016: Flags [S], seq 4180191734, win 1024, options [mss 1460], length 0
01:12:15.723069 IP L1-anjo5726.cloud.15645 > S1-anjo5726.cloud.56498: Flags [R.], seq 0, ack 4180191735, win 0, length 0
01:12:15.723087 IP L1-anjo5726.cloud.17016 > S1-anjo5726.cloud.56498: Flags [R.], seq 0, ack 4180191735, win 0, length 0
01:12:15.723134 IP S1-anjo5726.cloud.56498 > L1-anjo5726.cloud.8865: Flags [S], seq 4180191734, win 1024, options [mss 1460], length 0
01:12:15.723157 IP L1-anjo5726.cloud.8865 > S1-anjo5726.cloud.56498: Flags [R.], seq 0, ack 4180191735, win 0, length 0
01:12:15.723185 IP S1-anjo5726.cloud.56498 > L1-anjo5726.cloud.5419: Flags [S], seq 4180191734, win 1024, options [mss 1460], length 0
01:12:15.723185 IP S1-anjo5726.cloud.56498 > L1-anjo5726.cloud.32006: Flags [S], seq 4180191734, win 1024, options [mss 1460], length 0
01:12:15.723185 IP S1-anjo5726.cloud.56498 > L1-anjo5726.cloud.2878: Flags [S], seq 4180191734, win 1024, options [mss 1460], length 0
01:12:15.723219 IP L1-anjo5726.cloud.5419 > S1-anjo5726.cloud.56498: Flags [R.], seq 0, ack 4180191735, win 0, length 0
01:12:15.723241 IP L1-anjo5726.cloud.32006 > S1-anjo5726.cloud.56498: Flags [R.], seq 0, ack 4180191735, win 0, length 0
01:12:15.723251 IP L1-anjo5726.cloud.2878 > S1-anjo5726.cloud.56498: Flags [R.], seq 0, ack 4180191735, win 0, length 0
01:12:15.723297 IP S1-anjo5726.cloud.56498 > L1-anjo5726.cloud.6896: Flags [S], seq 4180191734, win 1024, options [mss 1460], length 0
01:12:15.723298 IP S1-anjo5726.cloud.56498 > L1-anjo5726.cloud.564: Flags [S], seq 4180191734, win 1024, options [mss 1460], length 0
01:12:15.723298 IP S1-anjo5726.cloud.56498 > L1-anjo5726.cloud.3575: Flags [S], seq 4180191734, win 1024, options [mss 1460], length 0
01:12:15.723298 IP S1-anjo5726.cloud.56498 > L1-anjo5726.cloud.9844: Flags [S], seq 4180191734, win 1024, options [mss 1460], length 0
01:12:15.723298 IP S1-anjo5726.cloud.56498 > L1-anjo5726.cloud.7321: Flags [S], seq 4180191734, win 1024, options [mss 1460], length 0
01:12:15.723314 IP L1-anjo5726.cloud.6896 > S1-anjo5726.cloud.56498: Flags [R.], seq 0, ack 4180191735, win 0, length 0
01:12:15.723337 IP L1-anjo5726.cloud.564 > S1-anjo5726.cloud.56498: Flags [R.], seq 0, ack 4180191735, win 0, length 0
01:12:15.723347 IP L1-anjo5726.cloud.3575 > S1-anjo5726.cloud.56498: Flags [R.], seq 0, ack 4180191735, win 0, length 0
01:12:15.723355 IP L1-anjo5726.cloud.9844 > S1-anjo5726.cloud.56498: Flags [R.], seq 0, ack 4180191735, win 0, length 0
01:12:15.723363 IP L1-anjo5726.cloud.7321 > S1-anjo5726.cloud.56498: Flags [R.], seq 0, ack 4180191735, win 0, length 0
01:12:15.723378 IP S1-anjo5726.cloud.56498 > L1-anjo5726.cloud.3482: Flags [S], seq 4180191734, win 1024, options [mss 1460], length 0
01:12:15.723378 IP S1-anjo5726.cloud.56498 > L1-anjo5726.cloud.5428: Flags [S], seq 4180191734, win 1024, options [mss 1460], length 0
01:12:15.723378 IP S1-anjo5726.cloud.56498 > L1-anjo5726.cloud.2711: Flags [S], seq 4180191734, win 1024, options [mss 1460], length 0
01:12:15.723378 IP S1-anjo5726.cloud.56498 > L1-anjo5726.cloud.3881: Flags [S], seq 4180191734, win 1024, options [mss 1460], length 0
01:12:15.723378 IP S1-anjo5726.cloud.56498 > L1-anjo5726.cloud.1348: Flags [S], seq 4180191734, win 1024, options [mss 1460], length 0
01:12:15.723378 IP S1-anjo5726.cloud.56498 > L1-anjo5726.cloud.1280: Flags [S], seq 4180191734, win 1024, options [mss 1460], length 0
01:12:15.723378 IP S1-anjo5726.cloud.56498 > L1-anjo5726.cloud.987: Flags [S], seq 4180191734, win 1024, options [mss 1460], length 0
01:12:15.723379 IP S1-anjo5726.cloud.56498 > L1-anjo5726.cloud.8445: Flags [S], seq 4180191734, win 1024, options [mss 1460], length 0
01:12:15.723394 IP L1-anjo5726.cloud.3482 > S1-anjo5726.cloud.56498: Flags [R.], seq 0, ack 4180191735, win 0, length 0
01:12:15.723404 IP L1-anjo5726.cloud.5428 > S1-anjo5726.cloud.56498: Flags [R.], seq 0, ack 4180191735, win 0, length 0
01:12:15.723412 IP L1-anjo5726.cloud.2711 > S1-anjo5726.cloud.56498: Flags [R.], seq 0, ack 4180191735, win 0, length 0
01:12:15.723420 IP L1-anjo5726.cloud.3881 > S1-anjo5726.cloud.56498: Flags [R.], seq 0, ack 4180191735, win 0, length 0
01:12:15.723429 IP L1-anjo5726.cloud.1348 > S1-anjo5726.cloud.56498: Flags [R.], seq 0, ack 4180191735, win 0, length 0
01:12:15.723437 IP L1-anjo5726.cloud.1280 > S1-anjo5726.cloud.56498: Flags [R.], seq 0, ack 4180191735, win 0, length 0
01:12:15.723456 IP L1-anjo5726.cloud.987 > S1-anjo5726.cloud.56498: Flags [R.], seq 0, ack 4180191735, win 0, length 0
01:12:15.723464 IP L1-anjo5726.cloud.8445 > S1-anjo5726.cloud.56498: Flags [R.], seq 0, ack 4180191735, win 0, length 0
01:12:15.723547 IP S1-anjo5726.cloud.56498 > L1-anjo5726.cloud.3479: Flags [S], seq 4180191734, win 1024, options [mss 1460], length 0
01:12:15.723547 IP S1-anjo5726.cloud.56498 > L1-anjo5726.cloud.2945: Flags [S], seq 4180191734, win 1024, options [mss 1460], length 0
01:12:15.723547 IP S1-anjo5726.cloud.56498 > L1-anjo5726.cloud.1040: Flags [S], seq 4180191734, win 1024, options [mss 1460], length 0
01:12:15.723559 IP L1-anjo5726.cloud.3479 > S1-anjo5726.cloud.56498: Flags [R.], seq 0, ack 4180191735, win 0, length 0
01:12:15.723578 IP L1-anjo5726.cloud.2945 > S1-anjo5726.cloud.56498: Flags [R.], seq 0, ack 4180191735, win 0, length 0
01:12:15.723586 IP L1-anjo5726.cloud.1040 > S1-anjo5726.cloud.56498: Flags [R.], seq 0, ack 4180191735, win 0, length 0
01:12:15.723902 IP S1-anjo5726.cloud.56498 > L1-anjo5726.cloud.5727: Flags [S], seq 4180191734, win 1024, options [mss 1460], length 0
01:12:15.723902 IP S1-anjo5726.cloud.56498 > L1-anjo5726.cloud.819: Flags [S], seq 4180191734, win 1024, options [mss 1460], length 0
01:12:15.723928 IP L1-anjo5726.cloud.5727 > S1-anjo5726.cloud.56498: Flags [R.], seq 0, ack 4180191735, win 0, length 0
01:12:15.723959 IP L1-anjo5726.cloud.819 > S1-anjo5726.cloud.56498: Flags [R.], seq 0, ack 4180191735, win 0, length 0
01:12:15.723971 IP S1-anjo5726.cloud.56498 > L1-anjo5726.cloud.3178: Flags [S], seq 4180191734, win 1024, options [mss 1460], length 0
01:12:15.723972 IP S1-anjo5726.cloud.56498 > L1-anjo5726.cloud.1474: Flags [S], seq 4180191734, win 1024, options [mss 1460], length 0
01:12:15.723972 IP S1-anjo5726.cloud.56498 > L1-anjo5726.cloud.20118: Flags [S], seq 4180191734, win 1024, options [mss 1460], length 0
01:12:15.723972 IP S1-anjo5726.cloud.56498 > L1-anjo5726.cloud.5784: Flags [S], seq 4180191734, win 1024, options [mss 1460], length 0
01:12:15.723984 IP L1-anjo5726.cloud.3178 > S1-anjo5726.cloud.56498: Flags [R.], seq 0, ack 4180191735, win 0, length 0
01:12:15.724025 IP L1-anjo5726.cloud.1474 > S1-anjo5726.cloud.56498: Flags [R.], seq 0, ack 4180191735, win 0, length 0
01:12:15.724035 IP L1-anjo5726.cloud.20118 > S1-anjo5726.cloud.56498: Flags [R.], seq 0, ack 4180191735, win 0, length 0
01:12:15.724043 IP L1-anjo5726.cloud.5784 > S1-anjo5726.cloud.56498: Flags [R.], seq 0, ack 4180191735, win 0, length 0
01:12:15.724055 IP S1-anjo5726.cloud.56498 > L1-anjo5726.cloud.3266: Flags [S], seq 4180191734, win 1024, options [mss 1460], length 0
01:12:15.724055 IP S1-anjo5726.cloud.56498 > L1-anjo5726.cloud.1763: Flags [S], seq 4180191734, win 1024, options [mss 1460], length 0
01:12:15.724088 IP L1-anjo5726.cloud.3266 > S1-anjo5726.cloud.56498: Flags [R.], seq 0, ack 4180191735, win 0, length 0
01:12:15.724109 IP L1-anjo5726.cloud.1763 > S1-anjo5726.cloud.56498: Flags [R.], seq 0, ack 4180191735, win 0, length 0
01:12:15.724120 IP S1-anjo5726.cloud.56498 > L1-anjo5726.cloud.2881: Flags [S], seq 4180191734, win 1024, options [mss 1460], length 0
01:12:15.724120 IP S1-anjo5726.cloud.56498 > L1-anjo5726.cloud.2360: Flags [S], seq 4180191734, win 1024, options [mss 1460], length 0
01:12:15.724120 IP S1-anjo5726.cloud.56498 > L1-anjo5726.cloud.1499: Flags [S], seq 4180191734, win 1024, options [mss 1460], length 0
01:12:15.724151 IP L1-anjo5726.cloud.2881 > S1-anjo5726.cloud.56498: Flags [R.], seq 0, ack 4180191735, win 0, length 0
01:12:15.724169 IP L1-anjo5726.cloud.2360 > S1-anjo5726.cloud.56498: Flags [R.], seq 0, ack 4180191735, win 0, length 0
01:12:15.724178 IP L1-anjo5726.cloud.1499 > S1-anjo5726.cloud.56498: Flags [R.], seq 0, ack 4180191735, win 0, length 0
01:12:15.724186 IP S1-anjo5726.cloud.56498 > L1-anjo5726.cloud.50202: Flags [S], seq 4180191734, win 1024, options [mss 1460], length 0
01:12:15.724196 IP L1-anjo5726.cloud.50202 > S1-anjo5726.cloud.56498: Flags [R.], seq 0, ack 4180191735, win 0, length 0
01:12:15.724251 IP S1-anjo5726.cloud.56498 > L1-anjo5726.cloud.21201: Flags [S], seq 4180191734, win 1024, options [mss 1460], length 0
01:12:15.724251 IP S1-anjo5726.cloud.56498 > L1-anjo5726.cloud.32871: Flags [S], seq 4180191734, win 1024, options [mss 1460], length 0
01:12:15.724269 IP L1-anjo5726.cloud.21201 > S1-anjo5726.cloud.56498: Flags [R.], seq 0, ack 4180191735, win 0, length 0
01:12:15.724287 IP L1-anjo5726.cloud.32871 > S1-anjo5726.cloud.56498: Flags [R.], seq 0, ack 4180191735, win 0, length 0
01:12:15.724330 IP S1-anjo5726.cloud.56498 > L1-anjo5726.cloud.20052: Flags [S], seq 4180191734, win 1024, options [mss 1460], length 0
01:12:15.724330 IP S1-anjo5726.cloud.56498 > L1-anjo5726.cloud.3985: Flags [S], seq 4180191734, win 1024, options [mss 1460], length 0
01:12:15.724330 IP S1-anjo5726.cloud.56498 > L1-anjo5726.cloud.10550: Flags [S], seq 4180191734, win 1024, options [mss 1460], length 0
01:12:15.724355 IP L1-anjo5726.cloud.20052 > S1-anjo5726.cloud.56498: Flags [R.], seq 0, ack 4180191735, win 0, length 0
01:12:15.724375 IP L1-anjo5726.cloud.3985 > S1-anjo5726.cloud.56498: Flags [R.], seq 0, ack 4180191735, win 0, length 0
01:12:15.724388 IP L1-anjo5726.cloud.10550 > S1-anjo5726.cloud.56498: Flags [R.], seq 0, ack 4180191735, win 0, length 0
01:12:15.724399 IP S1-anjo5726.cloud.56498 > L1-anjo5726.cloud.5620: Flags [S], seq 4180191734, win 1024, options [mss 1460], length 0
01:12:15.724399 IP S1-anjo5726.cloud.56498 > L1-anjo5726.cloud.10602: Flags [S], seq 4180191734, win 1024, options [mss 1460], length 0
01:12:15.724399 IP S1-anjo5726.cloud.56498 > L1-anjo5726.cloud.1466: Flags [S], seq 4180191734, win 1024, options [mss 1460], length 0
01:12:15.724399 IP S1-anjo5726.cloud.56498 > L1-anjo5726.cloud.33175: Flags [S], seq 4180191734, win 1024, options [mss 1460], length 0
01:12:15.724411 IP L1-anjo5726.cloud.5620 > S1-anjo5726.cloud.56498: Flags [R.], seq 0, ack 4180191735, win 0, length 0
01:12:15.724420 IP L1-anjo5726.cloud.10602 > S1-anjo5726.cloud.56498: Flags [R.], seq 0, ack 4180191735, win 0, length 0
01:12:15.724429 IP L1-anjo5726.cloud.1466 > S1-anjo5726.cloud.56498: Flags [R.], seq 0, ack 4180191735, win 0, length 0
01:12:15.724438 IP L1-anjo5726.cloud.33175 > S1-anjo5726.cloud.56498: Flags [R.], seq 0, ack 4180191735, win 0, length 0
01:12:15.724508 IP S1-anjo5726.cloud.56498 > L1-anjo5726.cloud.46436: Flags [S], seq 4180191734, win 1024, options [mss 1460], length 0
01:12:15.724508 IP S1-anjo5726.cloud.56498 > L1-anjo5726.cloud.2812: Flags [S], seq 4180191734, win 1024, options [mss 1460], length 0
01:12:15.724520 IP L1-anjo5726.cloud.46436 > S1-anjo5726.cloud.56498: Flags [R.], seq 0, ack 4180191735, win 0, length 0
01:12:15.724538 IP L1-anjo5726.cloud.2812 > S1-anjo5726.cloud.56498: Flags [R.], seq 0, ack 4180191735, win 0, length 0
01:12:15.724585 IP S1-anjo5726.cloud.56498 > L1-anjo5726.cloud.4500: Flags [S], seq 4180191734, win 1024, options [mss 1460], length 0
01:12:15.724585 IP S1-anjo5726.cloud.56498 > L1-anjo5726.cloud.1115: Flags [S], seq 4180191734, win 1024, options [mss 1460], length 0
01:12:15.724585 IP S1-anjo5726.cloud.56498 > L1-anjo5726.cloud.36700: Flags [S], seq 4180191734, win 1024, options [mss 1460], length 0
01:12:15.724607 IP L1-anjo5726.cloud.4500 > S1-anjo5726.cloud.56498: Flags [R.], seq 0, ack 4180191735, win 0, length 0
01:12:15.724630 IP L1-anjo5726.cloud.1115 > S1-anjo5726.cloud.56498: Flags [R.], seq 0, ack 4180191735, win 0, length 0
01:12:15.724640 IP L1-anjo5726.cloud.36700 > S1-anjo5726.cloud.56498: Flags [R.], seq 0, ack 4180191735, win 0, length 0
