01:12:15.189380 ARP, Request who-has L1-anjo5726.cloud tell S1-anjo5726.cloud, length 28
01:12:15.189885 ARP, Reply L1-anjo5726.cloud is-at 02:00:ac:10:00:10 (oui Unknown), length 28
01:12:15.190887 IP S1-anjo5726.cloud.45676 > router1.cloud.domain: 31593+ PTR? 16.0.16.172.in-addr.arpa. (42)
01:12:15.192074 IP router1.cloud.domain > S1-anjo5726.cloud.45676: 31593* 1/0/0 PTR L1-anjo5726.cloud. (73)
01:12:15.192898 IP S1-anjo5726.cloud.56498 > L1-anjo5726.cloud.imaps: Flags [S], seq 4180191734, win 1024, options [mss 1460], length 0
01:12:15.192925 IP S1-anjo5726.cloud.56498 > L1-anjo5726.cloud.mysql: Flags [S], seq 4180191734, win 1024, options [mss 1460], length 0
01:12:15.192937 IP S1-anjo5726.cloud.56498 > L1-anjo5726.cloud.5900: Flags [S], seq 4180191734, win 1024, options [mss 1460], length 0
01:12:15.192947 IP S1-anjo5726.cloud.56498 > L1-anjo5726.cloud.https: Flags [S], seq 4180191734, win 1024, options [mss 1460], length 0
01:12:15.192959 IP S1-anjo5726.cloud.56498 > L1-anjo5726.cloud.pop3s: Flags [S], seq 4180191734, win 1024, options [mss 1460], length 0
01:12:15.192978 IP S1-anjo5726.cloud.56498 > L1-anjo5726.cloud.1720: Flags [S], seq 4180191734, win 1024, options [mss 1460], length 0
01:12:15.192995 IP S1-anjo5726.cloud.56498 > L1-anjo5726.cloud.domain: Flags [S], seq 4180191734, win 1024, options [mss 1460], length 0
01:12:15.193008 IP S1-anjo5726.cloud.56498 > L1-anjo5726.cloud.256: Flags [S], seq 4180191734, win 1024, options [mss 1460], length 0
01:12:15.193018 IP S1-anjo5726.cloud.56498 > L1-anjo5726.cloud.telnet: Flags [S], seq 4180191734, win 1024, options [mss 1460], length 0
01:12:15.193036 IP S1-anjo5726.cloud.56498 > L1-anjo5726.cloud.ssh: Flags [S], seq 4180191734, win 1024, options [mss 1460], length 0
01:12:15.193449 IP L1-anjo5726.cloud.imaps > S1-anjo5726.cloud.56498: Flags [R.], seq 0, ack 4180191735, win 0, length 0
01:12:15.193451 IP L1-anjo5726.cloud.mysql > S1-anjo5726.cloud.56498: Flags [R.], seq 0, ack 4180191735, win 0, length 0
01:12:15.193452 IP L1-anjo5726.cloud.5900 > S1-anjo5726.cloud.56498: Flags [R.], seq 0, ack 4180191735, win 0, length 0
01:12:15.193453 IP L1-anjo5726.cloud.https > S1-anjo5726.cloud.56498: Flags [R.], seq 0, ack 4180191735, win 0, length 0
01:12:15.193454 IP L1-anjo5726.cloud.pop3s > S1-anjo5726.cloud.56498: Flags [R.], seq 0, ack 4180191735, win 0, length 0
01:12:15.193455 IP L1-anjo5726.cloud.1720 > S1-anjo5726.cloud.56498: Flags [R.], seq 0, ack 4180191735, win 0, length 0
01:12:15.193506 IP L1-anjo5726.cloud.domain > S1-anjo5726.cloud.56498: Flags [S.], seq 535251, ack 4180191735, win 64240, options [mss 1460], length 0
01:12:15.193507 IP L1-anjo5726.cloud.256 > S1-anjo5726.cloud.56498: Flags [R.], seq 0, ack 4180191735, win 0, length 0
01:12:15.193508 IP L1-anjo5726.cloud.telnet > S1-anjo5726.cloud.56498: Flags [R.], seq 0, ack 4180191735, win 0, length 0
01:12:15.193509 IP L1-anjo5726.cloud.ssh > S1-anjo5726.cloud.56498: Flags [S.], seq 1472527161, ack 4180191735, win 64240, options [mss 1460], length 0
01:12:15.193529 IP S1-anjo5726.cloud.56498 > L1-anjo5726.cloud.domain: Flags [R], seq 4180191735, win 0, length 0
01:12:15.193552 IP S1-anjo5726.cloud.56498 > L1-anjo5726.cloud.ssh: Flags [R], seq 4180191735, win 0, length 0
01:12:15.193675 IP S1-anjo5726.cloud.56498 > L1-anjo5726.cloud.epmap: Flags [S], seq 4180191734, win 1024, options [mss 1460], length 0
01:12:15.193699 IP S1-anjo5726.cloud.56498 > L1-anjo5726.cloud.sunrpc: Flags [S], seq 4180191734, win 1024, options [mss 1460], length 0
01:12:15.193711 IP S1-anjo5726.cloud.56498 > L1-anjo5726.cloud.pop3: Flags [S], seq 4180191734, win 1024, options [mss 1460], length 0
01:12:15.193722 IP S1-anjo5726.cloud.56498 > L1-anjo5726.cloud.1025: Flags [S], seq 4180191734, win 1024, options [mss 1460], length 0
01:12:15.193732 IP S1-anjo5726.cloud.56498 > L1-anjo5726.cloud.microsoft-ds: Flags [S], seq 4180191734, win 1024, options [mss 1460], length 0
01:12:15.193742 IP S1-anjo5726.cloud.56498 > L1-anjo5726.cloud.smtp: Flags [S], seq 4180191734, win 1024, options [mss 1460], length 0
01:12:15.193753 IP S1-anjo5726.cloud.56498 > L1-anjo5726.cloud.http-alt: Flags [S], seq 4180191734, win 1024, options [mss 1460], length 0
01:12:15.193771 IP S1-anjo5726.cloud.56498 > L1-anjo5726.cloud.1723: Flags [S], seq 4180191734, win 1024, options [mss 1460], length 0
01:12:15.193783 IP S1-anjo5726.cloud.56498 > L1-anjo5726.cloud.auth: Flags [S], seq 4180191734, win 1024, options [mss 1460], length 0
01:12:15.193794 IP S1-anjo5726.cloud.56498 > L1-anjo5726.cloud.netbios-ssn: Flags [S], seq 4180191734, win 1024, options [mss 1460], length 0
01:12:15.193804 IP S1-anjo5726.cloud.56498 > L1-anjo5726.cloud.8888: Flags [S], seq 4180191734, win 1024, options [mss 1460], length 0
01:12:15.193815 IP S1-anjo5726.cloud.56498 > L1-anjo5726.cloud.ftp: Flags [S], seq 4180191734, win 1024, options [mss 1460], length 0
01:12:15.193825 IP S1-anjo5726.cloud.56498 > L1-anjo5726.cloud.http: Flags [S], seq 4180191734, win 1024, options [mss 1460], length 0
01:12:15.193836 IP S1-anjo5726.cloud.56498 > L1-anjo5726.cloud.imap2: Flags [S], seq 4180191734, win 1024, options [mss 1460], length 0
01:12:15.193846 IP S1-anjo5726.cloud.56498 > L1-anjo5726.cloud.smux: Flags [S], seq 4180191734, win 1024, options [mss 1460], length 0
01:12:15.193863 IP S1-anjo5726.cloud.56498 > L1-anjo5726.cloud.rtsp: Flags [S], seq 4180191734, win 1024, options [mss 1460], length 0
01:12:15.193875 IP S1-anjo5726.cloud.56498 > L1-anjo5726.cloud.submission: Flags [S], seq 4180191734, win 1024, options [mss 1460], length 0
01:12:15.193886 IP S1-anjo5726.cloud.56498 > L1-anjo5726.cloud.ms-wbt-server: Flags [S], seq 4180191734, win 1024, options [mss 1460], length 0
01:12:15.193896 IP S1-anjo5726.cloud.56498 > L1-anjo5726.cloud.1791: Flags [S], seq 4180191734, win 1024, options [mss 1460], length 0
01:12:15.193907 IP S1-anjo5726.cloud.56498 > L1-anjo5726.cloud.43242: Flags [S], seq 4180191734, win 1024, options [mss 1460], length 0
01:12:15.193991 IP L1-anjo5726.cloud.epmap > S1-anjo5726.cloud.56498: Flags [R.], seq 0, ack 4180191735, win 0, length 0
01:12:15.193992 IP L1-anjo5726.cloud.sunrpc > S1-anjo5726.cloud.56498: Flags [S.], seq 1668831735, ack 4180191735, win 64240, options [mss 1460], length 0
01:12:15.193993 IP L1-anjo5726.cloud.pop3 > S1-anjo5726.cloud.56498: Flags [R.], seq 0, ack 4180191735, win 0, length 0
01:12:15.193995 IP L1-anjo5726.cloud.1025 > S1-anjo5726.cloud.56498: Flags [R.], seq 0, ack 4180191735, win 0, length 0
01:12:15.193996 IP L1-anjo5726.cloud.microsoft-ds > S1-anjo5726.cloud.56498: Flags [R.], seq 0, ack 4180191735, win 0, length 0
01:12:15.194003 IP L1-anjo5726.cloud.smtp > S1-anjo5726.cloud.56498: Flags [S.], seq 2618979487, ack 4180191735, win 64240, options [mss 1460], length 0
01:12:15.194015 IP S1-anjo5726.cloud.56498 > L1-anjo5726.cloud.sunrpc: Flags [R], seq 4180191735, win 0, length 0
01:12:15.194027 IP S1-anjo5726.cloud.56498 > L1-anjo5726.cloud.smtp: Flags [R], seq 4180191735, win 0, length 0
01:12:15.194075 IP L1-anjo5726.cloud.http-alt > S1-anjo5726.cloud.56498: Flags [R.], seq 0, ack 4180191735, win 0, length 0
01:12:15.194076 IP L1-anjo5726.cloud.1723 > S1-anjo5726.cloud.56498: Flags [R.], seq 0, ack 4180191735, win 0, length 0
01:12:15.194078 IP L1-anjo5726.cloud.auth > S1-anjo5726.cloud.56498: Flags [R.], seq 0, ack 4180191735, win 0, length 0
01:12:15.194079 IP L1-anjo5726.cloud.netbios-ssn > S1-anjo5726.cloud.56498: Flags [R.], seq 0, ack 4180191735, win 0, length 0
01:12:15.194080 IP L1-anjo5726.cloud.8888 > S1-anjo5726.cloud.56498: Flags [R.], seq 0, ack 4180191735, win 0, length 0
01:12:15.194081 IP L1-anjo5726.cloud.ftp > S1-anjo5726.cloud.56498: Flags [S.], seq 4176517892, ack 4180191735, win 64240, options [mss 1460], length 0
01:12:15.194082 IP L1-anjo5726.cloud.http > S1-anjo5726.cloud.56498: Flags [S.], seq 8647821, ack 4180191735, win 64240, options [mss 1460], length 0
01:12:15.194092 IP S1-anjo5726.cloud.56498 > L1-anjo5726.cloud.ftp: Flags [R], seq 4180191735, win 0, length 0
01:12:15.194105 IP S1-anjo5726.cloud.56498 > L1-anjo5726.cloud.http: Flags [R], seq 4180191735, win 0, length 0
01:12:15.194165 IP L1-anjo5726.cloud.imap2 > S1-anjo5726.cloud.56498: Flags [R.], seq 0, ack 4180191735, win 0, length 0
01:12:15.194184 IP L1-anjo5726.cloud.smux > S1-anjo5726.cloud.56498: Flags [R.], seq 0, ack 4180191735, win 0, length 0
01:12:15.194204 IP L1-anjo5726.cloud.rtsp > S1-anjo5726.cloud.56498: Flags [R.], seq 0, ack 4180191735, win 0, length 0
01:12:15.194205 IP L1-anjo5726.cloud.submission > S1-anjo5726.cloud.56498: Flags [R.], seq 0, ack 4180191735, win 0, length 0
01:12:15.194225 IP L1-anjo5726.cloud.ms-wbt-server > S1-anjo5726.cloud.56498: Flags [R.], seq 0, ack 4180191735, win 0, length 0
01:12:15.194259 IP L1-anjo5726.cloud.1791 > S1-anjo5726.cloud.56498: Flags [R.], seq 0, ack 4180191735, win 0, length 0
01:12:15.194264 IP L1-anjo5726.cloud.43242 > S1-anjo5726.cloud.56498: Flags [R.], seq 0, ack 4180191735, win 0, length 0
01:12:15.194428 IP S1-anjo5726.cloud.56498 > L1-anjo5726.cloud.7002: Flags [S], seq 4180191734, win 1024, options [mss 1460], length 0
01:12:15.194452 IP S1-anjo5726.cloud.56498 > L1-anjo5726.cloud.1806: Flags [S], seq 4180191734, win 1024, options [mss 1460], length 0
01:12:15.194463 IP S1-anjo5726.cloud.56498 > L1-anjo5726.cloud.12080: Flags [S], seq 4180191734, win 1024, options [mss 1460], length 0
01:12:15.194474 IP S1-anjo5726.cloud.56498 > L1-anjo5726.cloud.41632: Flags [S], seq 4180191734, win 1024, options [mss 1460], length 0
01:12:15.194484 IP S1-anjo5726.cloud.56498 > L1-anjo5726.cloud.3340: Flags [S], seq 4180191734, win 1024, options [mss 1460], length 0
01:12:15.194496 IP S1-anjo5726.cloud.56498 > L1-anjo5726.cloud.6112: Flags [S], seq 4180191734, win 1024, options [mss 1460], length 0
01:12:15.194506 IP S1-anjo5726.cloud.56498 > L1-anjo5726.cloud.5421: Flags [S], seq 4180191734, win 1024, options [mss 1460], length 0
01:12:15.194517 IP S1-anjo5726.cloud.56498 > L1-anjo5726.cloud.2993: Flags [S], seq 4180191734, win 1024, options [mss 1460], length 0
01:12:15.194528 IP S1-anjo5726.cloud.56498 > L1-anjo5726.cloud.2802: Flags [S], seq 4180191734, win 1024, options [mss 1460], length 0
01:12:15.194538 IP S1-anjo5726.cloud.56498 > L1-anjo5726.cloud.2221: Flags [S], seq 4180191734, win 1024, options [mss 1460], length 0
01:12:15.194548 IP S1-anjo5726.cloud.56498 > L1-anjo5726.cloud.4038: Flags [S], seq 4180191734, win 1024, options [mss 1460], length 0
01:12:15.194558 IP S1-anjo5726.cloud.56498 > L1-anjo5726.cloud.1916: Flags [S], seq 4180191734, win 1024, options [mss 1460], length 0
01:12:15.194569 IP S1-anjo5726.cloud.56498 > L1-anjo5726.cloud.983: Flags [S], seq 4180191734, win 1024, options [mss 1460], length 0
01:12:15.194587 IP S1-anjo5726.cloud.56498 > L1-anjo5726.cloud.32814: Flags [S], seq 4180191734, win 1024, options [mss 1460], length 0
01:12:15.194600 IP S1-anjo5726.cloud.56498 > L1-anjo5726.cloud.3244: Flags [S], seq 4180191734, win 1024, options [mss 1460], length 0
01:12:15.194610 IP S1-anjo5726.cloud.56498 > L1-anjo5726.cloud.1350: Flags [S], seq 4180191734, win 1024, options [mss 1460], length 0
01:12:15.194621 IP S1-anjo5726.cloud.56498 > L1-anjo5726.cloud.2317: Flags [S], seq 4180191734, win 1024, options [mss 1460], length 0
01:12:15.194631 IP S1-anjo5726.cloud.56498 > L1-anjo5726.cloud.2996: Flags [S], seq 4180191734, win 1024, options [mss 1460], length 0
01:12:15.194641 IP S1-anjo5726.cloud.56498 > L1-anjo5726.cloud.x11-4: Flags [S], seq 4180191734, win 1024, options [mss 1460], length 0
01:12:15.194652 IP S1-anjo5726.cloud.56498 > L1-anjo5726.cloud.8640: Flags [S], seq 4180191734, win 1024, options [mss 1460], length 0
01:12:15.194662 IP S1-anjo5726.cloud.56498 > L1-anjo5726.cloud.17070: Flags [S], seq 4180191734, win 1024, options [mss 1460], length 0
01:12:15.194679 IP S1-anjo5726.cloud.56498 > L1-anjo5726.cloud.5059: Flags [S], seq 4180191734, win 1024, options [mss 1460], length 0
01:12:15.194691 IP S1-anjo5726.cloud.56498 > L1-anjo5726.cloud.4029: Flags [S], seq 4180191734, win 1024, options [mss 1460], length 0
01:12:15.194702 IP S1-anjo5726.cloud.56498 > L1-anjo5726.cloud.33879: Flags [S], seq 4180191734, win 1024, options [mss 1460], length 0
01:12:15.194712 IP S1-anjo5726.cloud.56498 > L1-anjo5726.cloud.43654: Flags [S], seq 4180191734, win 1024, options [mss 1460], length 0
01:12:15.194722 IP S1-anjo5726.cloud.56498 > L1-anjo5726.cloud.8383: Flags [S], seq 4180191734, win 1024, options [mss 1460], length 0
01:12:15.194733 IP S1-anjo5726.cloud.56498 > L1-anjo5726.cloud.2805: Flags [S], seq 4180191734, win 1024, options [mss 1460], length 0
01:12:15.194743 IP S1-anjo5726.cloud.56498 > L1-anjo5726.cloud.17235: Flags [S], seq 4180191734, win 1024, options [mss 1460], length 0
01:12:15.194754 IP S1-anjo5726.cloud.56498 > L1-anjo5726.cloud.5408: Flags [S], seq 4180191734, win 1024, options [mss 1460], length 0
01:12:15.194765 IP S1-anjo5726.cloud.56498 > L1-anjo5726.cloud.32792: Flags [S], seq 4180191734, win 1024, options [mss 1460], length 0
01:12:15.194775 IP S1-anjo5726.cloud.56498 > L1-anjo5726.cloud.3806: Flags [S], seq 4180191734, win 1024, options [mss 1460], length 0
01:12:15.194785 IP S1-anjo5726.cloud.56498 > L1-anjo5726.cloud.27004: Flags [S], seq 4180191734, win 1024, options [mss 1460], length 0
01:12:15.194796 IP S1-anjo5726.cloud.56498 > L1-anjo5726.cloud.4051: Flags [S], seq 4180191734, win 1024, options [mss 1460], length 0
01:12:15.194807 IP S1-anjo5726.cloud.56498 > L1-anjo5726.cloud.2990: Flags [S], seq 4180191734, win 1024, options [mss 1460], length 0
01:12:15.194817 IP S1-anjo5726.cloud.56498 > L1-anjo5726.cloud.4061: Flags [S], seq 4180191734, win 1024, options [mss 1460], length 0
01:12:15.194827 IP S1-anjo5726.cloud.56498 > L1-anjo5726.cloud.4250: Flags [S], seq 4180191734, win 1024, options [mss 1460], length 0
01:12:15.194841 IP S1-anjo5726.cloud.56498 > L1-anjo5726.cloud.2412: Flags [S], seq 4180191734, win 1024, options [mss 1460], length 0
01:12:15.194853 IP S1-anjo5726.cloud.56498 > L1-anjo5726.cloud.18463: Flags [S], seq 4180191734, win 1024, options [mss 1460], length 0
01:12:15.194864 IP S1-anjo5726.cloud.56498 > L1-anjo5726.cloud.3197: Flags [S], seq 4180191734, win 1024, options [mss 1460], length 0
01:12:15.194874 IP S1-anjo5726.cloud.56498 > L1-anjo5726.cloud.5544: Flags [S], seq 4180191734, win 1024, options [mss 1460], length 0
01:12:15.194947 IP L1-anjo5726.cloud.7002 > S1-anjo5726.cloud.56498: Flags [R.], seq 0, ack 4180191735, win 0, length 0
01:12:15.194949 IP L1-anjo5726.cloud.1806 > S1-anjo5726.cloud.56498: Flags [R.], seq 0, ack 4180191735, win 0, length 0
01:12:15.194952 IP L1-anjo5726.cloud.12080 > S1-anjo5726.cloud.56498: Flags [R.], seq 0, ack 4180191735, win 0, length 0
01:12:15.194953 IP L1-anjo5726.cloud.41632 > S1-anjo5726.cloud.56498: Flags [R.], seq 0, ack 4180191735, win 0, length 0
01:12:15.194954 IP L1-anjo5726.cloud.3340 > S1-anjo5726.cloud.56498: Flags [R.], seq 0, ack 4180191735, win 0, length 0
01:12:15.194955 IP L1-anjo5726.cloud.6112 > S1-anjo5726.cloud.56498: Flags [R.], seq 0, ack 4180191735, win 0, length 0
01:12:15.194957 IP L1-anjo5726.cloud.5421 > S1-anjo5726.cloud.56498: Flags [R.], seq 0, ack 4180191735, win 0, length 0
01:12:15.194958 IP L1-anjo5726.cloud.2993 > S1-anjo5726.cloud.56498: Flags [R.], seq 0, ack 4180191735, win 0, length 0
01:12:15.194974 IP L1-anjo5726.cloud.2802 > S1-anjo5726.cloud.56498: Flags [R.], seq 0, ack 4180191735, win 0, length 0
01:12:15.194975 IP L1-anjo5726.cloud.2221 > S1-anjo5726.cloud.56498: Flags [R.], seq 0, ack 4180191735, win 0, length 0
01:12:15.194976 IP L1-anjo5726.cloud.4038 > S1-anjo5726.cloud.56498: Flags [R.], seq 0, ack 4180191735, win 0, length 0
01:12:15.194977 IP L1-anjo5726.cloud.1916 > S1-anjo5726.cloud.56498: Flags [R.], seq 0, ack 4180191735, win 0, length 0
01:12:15.194978 IP L1-anjo5726.cloud.983 > S1-anjo5726.cloud.56498: Flags [R.], seq 0, ack 4180191735, win 0, length 0
01:12:15.194979 IP L1-anjo5726.cloud.32814 > S1-anjo5726.cloud.56498: Flags [R.], seq 0, ack 4180191735, win 0, length 0
01:12:15.194980 IP L1-anjo5726.cloud.3244 > S1-anjo5726.cloud.56498: Flags [R.], seq 0, ack 4180191735, win 0, length 0
01:12:15.194981 IP L1-anjo5726.cloud.1350 > S1-anjo5726.cloud.56498: Flags [R.], seq 0, ack 4180191735, win 0, length 0
01:12:15.194993 IP L1-anjo5726.cloud.2317 > S1-anjo5726.cloud.56498: Flags [R.], seq 0, ack 4180191735, win 0, length 0
01:12:15.194994 IP L1-anjo5726.cloud.2996 > S1-anjo5726.cloud.56498: Flags [R.], seq 0, ack 4180191735, win 0, length 0
01:12:15.194995 IP L1-anjo5726.cloud.x11-4 > S1-anjo5726.cloud.56498: Flags [R.], seq 0, ack 4180191735, win 0, length 0
01:12:15.195003 IP L1-anjo5726.cloud.8640 > S1-anjo5726.cloud.56498: Flags [R.], seq 0, ack 4180191735, win 0, length 0
01:12:15.195006 IP L1-anjo5726.cloud.17070 > S1-anjo5726.cloud.56498: Flags [R.], seq 0, ack 4180191735, win 0, length 0
01:12:15.195007 IP L1-anjo5726.cloud.5059 > S1-anjo5726.cloud.56498: Flags [R.], seq 0, ack 4180191735, win 0, length 0
01:12:15.195032 IP L1-anjo5726.cloud.4029 > S1-anjo5726.cloud.56498: Flags [R.], seq 0, ack 4180191735, win 0, length 0
01:12:15.195033 IP L1-anjo5726.cloud.33879 > S1-anjo5726.cloud.56498: Flags [R.], seq 0, ack 4180191735, win 0, length 0
01:12:15.195046 IP L1-anjo5726.cloud.43654 > S1-anjo5726.cloud.56498: Flags [R.], seq 0, ack 4180191735, win 0, length 0
01:12:15.195056 IP L1-anjo5726.cloud.8383 > S1-anjo5726.cloud.56498: Flags [R.], seq 0, ack 4180191735, win 0, length 0
01:12:15.195057 IP L1-anjo5726.cloud.2805 > S1-anjo5726.cloud.56498: Flags [R.], seq 0, ack 4180191735, win 0, length 0
01:12:15.195080 IP L1-anjo5726.cloud.17235 > S1-anjo5726.cloud.56498: Flags [R.], seq 0, ack 4180191735, win 0, length 0
01:12:15.195092 IP L1-anjo5726.cloud.5408 > S1-anjo5726.cloud.56498: Flags [R.], seq 0, ack 4180191735, win 0, length 0
01:12:15.195103 IP L1-anjo5726.cloud.32792 > S1-anjo5726.cloud.56498: Flags [R.], seq 0, ack 4180191735, win 0, length 0
01:12:15.195117 IP L1-anjo5726.cloud.3806 > S1-anjo5726.cloud.56498: Flags [R.], seq 0, ack 4180191735, win 0, length 0
01:12:15.195145 IP L1-anjo5726.cloud.27004 > S1-anjo5726.cloud.56498: Flags [R.], seq 0, ack 4180191735, win 0, length 0
01:12:15.195151 IP L1-anjo5726.cloud.4051 > S1-anjo5726.cloud.56498: Flags [R.], seq 0, ack 4180191735, win 0, length 0
01:12:15.195152 IP L1-anjo5726.cloud.2990 > S1-anjo5726.cloud.56498: Flags [R.], seq 0, ack 4180191735, win 0, length 0
01:12:15.195171 IP L1-anjo5726.cloud.4061 > S1-anjo5726.cloud.56498: Flags [R.], seq 0, ack 4180191735, win 0, length 0
01:12:15.195183 IP L1-anjo5726.cloud.4250 > S1-anjo5726.cloud.56498: Flags [R.], seq 0, ack 4180191735, win 0, length 0
01:12:15.195194 IP L1-anjo5726.cloud.2412 > S1-anjo5726.cloud.56498: Flags [R.], seq 0, ack 4180191735, win 0, length 0
01:12:15.195205 IP L1-anjo5726.cloud.18463 > S1-anjo5726.cloud.56498: Flags [R.], seq 0, ack 4180191735, win 0, length 0
01:12:15.195216 IP L1-anjo5726.cloud.3197 > S1-anjo5726.cloud.56498: Flags [R.], seq 0, ack 4180191735, win 0, length 0
01:12:15.195226 IP L1-anjo5726.cloud.5544 > S1-anjo5726.cloud.56498: Flags [R.], seq 0, ack 4180191735, win 0, length 0
01:12:15.195471 IP S1-anjo5726.cloud.56498 > L1-anjo5726.cloud.1170: Flags [S], seq 4180191734, win 1024, options [mss 1460], length 0
01:12:15.195497 IP S1-anjo5726.cloud.56498 > L1-anjo5726.cloud.1181: Flags [S], seq 4180191734, win 1024, options [mss 1460], length 0
01:12:15.195516 IP S1-anjo5726.cloud.56498 > L1-anjo5726.cloud.3908: Flags [S], seq 4180191734, win 1024, options [mss 1460], length 0
01:12:15.195529 IP S1-anjo5726.cloud.56498 > L1-anjo5726.cloud.5032: Flags [S], seq 4180191734, win 1024, options [mss 1460], length 0
01:12:15.195543 IP S1-anjo5726.cloud.56498 > L1-anjo5726.cloud.6316: Flags [S], seq 4180191734, win 1024, options [mss 1460], length 0
01:12:15.195555 IP S1-anjo5726.cloud.56498 > L1-anjo5726.cloud.3525: Flags [S], seq 4180191734, win 1024, options [mss 1460], length 0
01:12:15.195565 IP S1-anjo5726.cloud.56498 > L1-anjo5726.cloud.4841: Flags [S], seq 4180191734, win 1024, options [mss 1460], length 0
01:12:15.195576 IP S1-anjo5726.cloud.56498 > L1-anjo5726.cloud.1772: Flags [S], seq 4180191734, win 1024, options [mss 1460], length 0
01:12:15.195587 IP S1-anjo5726.cloud.56498 > L1-anjo5726.cloud.3281: Flags [S], seq 4180191734, win 1024, options [mss 1460], length 0
01:12:15.195598 IP S1-anjo5726.cloud.56498 > L1-anjo5726.cloud.7171: Flags [S], seq 4180191734, win 1024, options [mss 1460], length 0
01:12:15.195608 IP S1-anjo5726.cloud.56498 > L1-anjo5726.cloud.4219: Flags [S], seq 4180191734, win 1024, options [mss 1460], length 0
01:12:15.195618 IP S1-anjo5726.cloud.56498 > L1-anjo5726.cloud.10025: Flags [S], seq 4180191734, win 1024, options [mss 1460], length 0
01:12:15.195631 IP S1-anjo5726.cloud.56498 > L1-anjo5726.cloud.16789: Flags [S], seq 4180191734, win 1024, options [mss 1460], length 0
01:12:15.195642 IP S1-anjo5726.cloud.56498 > L1-anjo5726.cloud.3366: Flags [S], seq 4180191734, win 1024, options [mss 1460], length 0
01:12:15.195653 IP S1-anjo5726.cloud.56498 > L1-anjo5726.cloud.5747: Flags [S], seq 4180191734, win 1024, options [mss 1460], length 0
01:12:15.195663 IP S1-anjo5726.cloud.56498 > L1-anjo5726.cloud.4280: Flags [S], seq 4180191734, win 1024, options [mss 1460], length 0
01:12:15.195674 IP S1-anjo5726.cloud.56498 > L1-anjo5726.cloud.6031: Flags [S], seq 4180191734, win 1024, options [mss 1460], length 0
01:12:15.195684 IP S1-anjo5726.cloud.56498 > L1-anjo5726.cloud.1081: Flags [S], seq 4180191734, win 1024, options [mss 1460], length 0
01:12:15.195694 IP S1-anjo5726.cloud.56498 > L1-anjo5726.cloud.3677: Flags [S], seq 4180191734, win 1024, options [mss 1460], length 0
01:12:15.195704 IP S1-anjo5726.cloud.56498 > L1-anjo5726.cloud.4314: Flags [S], seq 4180191734, win 1024, options [mss 1460], length 0
01:12:15.195718 IP S1-anjo5726.cloud.56498 > L1-anjo5726.cloud.13192: Flags [S], seq 4180191734, win 1024, options [mss 1460], length 0
01:12:15.195736 IP S1-anjo5726.cloud.56498 > L1-anjo5726.cloud.5230: Flags [S], seq 4180191734, win 1024, options [mss 1460], length 0
01:12:15.195746 IP S1-anjo5726.cloud.56498 > L1-anjo5726.cloud.5236: Flags [S], seq 4180191734, win 1024, options [mss 1460], length 0
01:12:15.195756 IP S1-anjo5726.cloud.56498 > L1-anjo5726.cloud.2280: Flags [S], seq 4180191734, win 1024, options [mss 1460], length 0
01:12:15.195766 IP S1-anjo5726.cloud.56498 > L1-anjo5726.cloud.2515: Flags [S], seq 4180191734, win 1024, options [mss 1460], length 0
01:12:15.195776 IP S1-anjo5726.cloud.56498 > L1-anjo5726.cloud.5453: Flags [S], seq 4180191734, win 1024, options [mss 1460], length 0
01:12:15.195786 IP S1-anjo5726.cloud.56498 > L1-anjo5726.cloud.4569: Flags [S], seq 4180191734, win 1024, options [mss 1460], length 0
01:12:15.195796 IP S1-anjo5726.cloud.56498 > L1-anjo5726.cloud.4609: Flags [S], seq 4180191734, win 1024, options [mss 1460], length 0
01:12:15.195837 IP S1-anjo5726.cloud.56498 > L1-anjo5726.cloud.15645: Flags [S], seq 4180191734, win 1024, options [mss 1460], length 0
01:12:15.195872 IP L1-anjo5726.cloud.1170 > S1-anjo5726.cloud.56498: Flags [R.], seq 0, ack 4180191735, win 0, length 0
01:12:15.195873 IP L1-anjo5726.cloud.1181 > S1-anjo5726.cloud.56498: Flags [R.], seq 0, ack 4180191735, win 0, length 0
01:12:15.195881 IP L1-anjo5726.cloud.3908 > S1-anjo5726.cloud.56498: Flags [R.], seq 0, ack 4180191735, win 0, length 0
01:12:15.195881 IP L1-anjo5726.cloud.5032 > S1-anjo5726.cloud.56498: Flags [R.], seq 0, ack 4180191735, win 0, length 0
01:12:15.195882 IP L1-anjo5726.cloud.6316 > S1-anjo5726.cloud.56498: Flags [R.], seq 0, ack 4180191735, win 0, length 0
01:12:15.195883 IP L1-anjo5726.cloud.3525 > S1-anjo5726.cloud.56498: Flags [R.], seq 0, ack 4180191735, win 0, length 0
01:12:15.195885 IP L1-anjo5726.cloud.4841 > S1-anjo5726.cloud.56498: Flags [R.], seq 0, ack 4180191735, win 0, length 0
01:12:15.195886 IP L1-anjo5726.cloud.1772 > S1-anjo5726.cloud.56498: Flags [R.], seq 0, ack 4180191735, win 0, length 0
01:12:15.195903 IP L1-anjo5726.cloud.3281 > S1-anjo5726.cloud.56498: Flags [R.], seq 0, ack 4180191735, win 0, length 0
01:12:15.195904 IP L1-anjo5726.cloud.7171 > S1-anjo5726.cloud.56498: Flags [R.], seq 0, ack 4180191735, win 0, length 0
01:12:15.195905 IP L1-anjo5726.cloud.4219 > S1-anjo5726.cloud.56498: Flags [R.], seq 0, ack 4180191735, win 0, length 0
01:12:15.195906 IP L1-anjo5726.cloud.10025 > S1-anjo5726.cloud.56498: Flags [R.], seq 0, ack 4180191735, win 0, length 0
01:12:15.195907 IP L1-anjo5726.cloud.16789 > S1-anjo5726.cloud.56498: Flags [R.], seq 0, ack 4180191735, win 0, length 0
01:12:15.195933 IP L1-anjo5726.cloud.3366 > S1-anjo5726.cloud.56498: Flags [R.], seq 0, ack 4180191735, win 0, length 0
01:12:15.195934 IP L1-anjo5726.cloud.5747 > S1-anjo5726.cloud.56498: Flags [R.], seq 0, ack 4180191735, win 0, length 0
01:12:15.195962 IP L1-anjo5726.cloud.4280 > S1-anjo5726.cloud.56498: Flags [R.], seq 0, ack 4180191735, win 0, length 0
01:12:15.195963 IP L1-anjo5726.cloud.6031 > S1-anjo5726.cloud.56498: Flags [R.], seq 0, ack 4180191735, win 0, length 0
01:12:15.195986 IP L1-anjo5726.cloud.1081 > S1-anjo5726.cloud.56498: Flags [R.], seq 0, ack 4180191735, win 0, length 0
01:12:15.195998 IP L1-anjo5726.cloud.3677 > S1-anjo5726.cloud.56498: Flags [R.], seq 0, ack 4180191735, win 0, length 0
01:12:15.195999 IP L1-anjo5726.cloud.4314 > S1-anjo5726.cloud.56498: Flags [R.], seq 0, ack 4180191735, win 0, length 0
01:12:15.196017 IP S1-anjo5726.cloud.56498 > L1-anjo5726.cloud.17016: Flags [S], seq 4180191734, win 1024, options [mss 1460], length 0
01:12:15.196031 IP L1-anjo5726.cloud.13192 > S1-anjo5726.cloud.56498: Flags [R.], seq 0, ack 4180191735, win 0, length 0
01:12:15.196033 IP L1-anjo5726.cloud.5230 > S1-anjo5726.cloud.56498: Flags [R.], seq 0, ack 4180191735, win 0, length 0
01:12:15.196110 IP L1-anjo5726.cloud.5236 > S1-anjo5726.cloud.56498: Flags [R.], seq 0, ack 4180191735, win 0, length 0
01:12:15.196111 IP L1-anjo5726.cloud.2280 > S1-anjo5726.cloud.56498: Flags [R.], seq 0, ack 4180191735, win 0, length 0
01:12:15.196112 IP L1-anjo5726.cloud.2515 > S1-anjo5726.cloud.56498: Flags [R.], seq 0, ack 4180191735, win 0, length 0
01:12:15.196113 IP L1-anjo5726.cloud.5453 > S1-anjo5726.cloud.56498: Flags [R.], seq 0, ack 4180191735, win 0, length 0
01:12:15.196127 IP L1-anjo5726.cloud.4569 > S1-anjo5726.cloud.56498: Flags [R.], seq 0, ack 4180191735, win 0, length 0
01:12:15.196128 IP L1-anjo5726.cloud.4609 > S1-anjo5726.cloud.56498: Flags [R.], seq 0, ack 4180191735, win 0, length 0
01:12:15.196151 IP S1-anjo5726.cloud.56498 > L1-anjo5726.cloud.8865: Flags [S], seq 4180191734, win 1024, options [mss 1460], length 0
01:12:15.196171 IP S1-anjo5726.cloud.56498 > L1-anjo5726.cloud.5419: Flags [S], seq 4180191734, win 1024, options [mss 1460], length 0
01:12:15.196184 IP S1-anjo5726.cloud.56498 > L1-anjo5726.cloud.32006: Flags [S], seq 4180191734, win 1024, options [mss 1460], length 0
01:12:15.196196 IP S1-anjo5726.cloud.56498 > L1-anjo5726.cloud.2878: Flags [S], seq 4180191734, win 1024, options [mss 1460], length 0
01:12:15.196206 IP S1-anjo5726.cloud.56498 > L1-anjo5726.cloud.6896: Flags [S], seq 4180191734, win 1024, options [mss 1460], length 0
01:12:15.196217 IP S1-anjo5726.cloud.56498 > L1-anjo5726.cloud.564: Flags [S], seq 4180191734, win 1024, options [mss 1460], length 0
01:12:15.196228 IP S1-anjo5726.cloud.56498 > L1-anjo5726.cloud.3575: Flags [S], seq 4180191734, win 1024, options [mss 1460], length 0
01:12:15.196248 IP S1-anjo5726.cloud.56498 > L1-anjo5726.cloud.9844: Flags [S], seq 4180191734, win 1024, options [mss 1460], length 0
01:12:15.196259 IP S1-anjo5726.cloud.56498 > L1-anjo5726.cloud.7321: Flags [S], seq 4180191734, win 1024, options [mss 1460], length 0
01:12:15.196270 IP S1-anjo5726.cloud.56498 > L1-anjo5726.cloud.3482: Flags [S], seq 4180191734, win 1024, options [mss 1460], length 0
01:12:15.196282 IP S1-anjo5726.cloud.56498 > L1-anjo5726.cloud.5428: Flags [S], seq 4180191734, win 1024, options [mss 1460], length 0
01:12:15.196292 IP S1-anjo5726.cloud.56498 > L1-anjo5726.cloud.2711: Flags [S], seq 4180191734, win 1024, options [mss 1460], length 0
01:12:15.196302 IP S1-anjo5726.cloud.56498 > L1-anjo5726.cloud.3881: Flags [S], seq 4180191734, win 1024, options [mss 1460], length 0
01:12:15.196312 IP S1-anjo5726.cloud.56498 > L1-anjo5726.cloud.1348: Flags [S], seq 4180191734, win 1024, options [mss 1460], length 0
01:12:15.196322 IP S1-anjo5726.cloud.56498 > L1-anjo5726.cloud.1280: Flags [S], seq 4180191734, win 1024, options [mss 1460], length 0
01:12:15.196334 IP S1-anjo5726.cloud.56498 > L1-anjo5726.cloud.987: Flags [S], seq 4180191734, win 1024, options [mss 1460], length 0
01:12:15.196345 IP S1-anjo5726.cloud.56498 > L1-anjo5726.cloud.8445: Flags [S], seq 4180191734, win 1024, options [mss 1460], length 0
01:12:15.196355 IP S1-anjo5726.cloud.56498 > L1-anjo5726.cloud.3479: Flags [S], seq 4180191734, win 1024, options [mss 1460], length 0
01:12:15.196367 IP S1-anjo5726.cloud.56498 > L1-anjo5726.cloud.2945: Flags [S], seq 4180191734, win 1024, options [mss 1460], length 0
01:12:15.196378 IP S1-anjo5726.cloud.56498 > L1-anjo5726.cloud.1040: Flags [S], seq 4180191734, win 1024, options [mss 1460], length 0
01:12:15.196443 IP L1-anjo5726.cloud.15645 > S1-anjo5726.cloud.56498: Flags [R.], seq 0, ack 4180191735, win 0, length 0
01:12:15.196444 IP L1-anjo5726.cloud.17016 > S1-anjo5726.cloud.56498: Flags [R.], seq 0, ack 4180191735, win 0, length 0
01:12:15.196445 IP L1-anjo5726.cloud.8865 > S1-anjo5726.cloud.56498: Flags [R.], seq 0, ack 4180191735, win 0, length 0
01:12:15.196446 IP L1-anjo5726.cloud.5419 > S1-anjo5726.cloud.56498: Flags [R.], seq 0, ack 4180191735, win 0, length 0
01:12:15.196447 IP L1-anjo5726.cloud.32006 > S1-anjo5726.cloud.56498: Flags [R.], seq 0, ack 4180191735, win 0, length 0
01:12:15.196448 IP L1-anjo5726.cloud.2878 > S1-anjo5726.cloud.56498: Flags [R.], seq 0, ack 4180191735, win 0, length 0
01:12:15.196449 IP L1-anjo5726.cloud.6896 > S1-anjo5726.cloud.56498: Flags [R.], seq 0, ack 4180191735, win 0, length 0
01:12:15.196450 IP L1-anjo5726.cloud.564 > S1-anjo5726.cloud.56498: Flags [R.], seq 0, ack 4180191735, win 0, length 0
01:12:15.196459 IP L1-anjo5726.cloud.3575 > S1-anjo5726.cloud.56498: Flags [R.], seq 0, ack 4180191735, win 0, length 0
01:12:15.196460 IP L1-anjo5726.cloud.9844 > S1-anjo5726.cloud.56498: Flags [R.], seq 0, ack 4180191735, win 0, length 0
01:12:15.196480 IP L1-anjo5726.cloud.7321 > S1-anjo5726.cloud.56498: Flags [R.], seq 0, ack 4180191735, win 0, length 0
01:12:15.196491 IP L1-anjo5726.cloud.3482 > S1-anjo5726.cloud.56498: Flags [R.], seq 0, ack 4180191735, win 0, length 0
01:12:15.196504 IP L1-anjo5726.cloud.5428 > S1-anjo5726.cloud.56498: Flags [R.], seq 0, ack 4180191735, win 0, length 0
01:12:15.196526 IP L1-anjo5726.cloud.2711 > S1-anjo5726.cloud.56498: Flags [R.], seq 0, ack 4180191735, win 0, length 0
01:12:15.196540 IP L1-anjo5726.cloud.3881 > S1-anjo5726.cloud.56498: Flags [R.], seq 0, ack 4180191735, win 0, length 0
01:12:15.196552 IP L1-anjo5726.cloud.1348 > S1-anjo5726.cloud.56498: Flags [R.], seq 0, ack 4180191735, win 0, length 0
01:12:15.196563 IP L1-anjo5726.cloud.1280 > S1-anjo5726.cloud.56498: Flags [R.], seq 0, ack 4180191735, win 0, length 0
01:12:15.196573 IP L1-anjo5726.cloud.987 > S1-anjo5726.cloud.56498: Flags [R.], seq 0, ack 4180191735, win 0, length 0
01:12:15.196584 IP L1-anjo5726.cloud.8445 > S1-anjo5726.cloud.56498: Flags [R.], seq 0, ack 4180191735, win 0, length 0
01:12:15.196667 IP L1-anjo5726.cloud.3479 > S1-anjo5726.cloud.56498: Flags [R.], seq 0, ack 4180191735, win 0, length 0
01:12:15.196682 IP L1-anjo5726.cloud.2945 > S1-anjo5726.cloud.56498: Flags [R.], seq 0, ack 4180191735, win 0, length 0
01:12:15.196683 IP L1-anjo5726.cloud.1040 > S1-anjo5726.cloud.56498: Flags [R.], seq 0, ack 4180191735, win 0, length 0
01:12:15.196905 IP S1-anjo5726.cloud.56498 > L1-anjo5726.cloud.5727: Flags [S], seq 4180191734, win 1024, options [mss 1460], length 0
01:12:15.196929 IP S1-anjo5726.cloud.56498 > L1-anjo5726.cloud.819: Flags [S], seq 4180191734, win 1024, options [mss 1460], length 0
01:12:15.196940 IP S1-anjo5726.cloud.56498 > L1-anjo5726.cloud.3178: Flags [S], seq 4180191734, win 1024, options [mss 1460], length 0
01:12:15.196959 IP S1-anjo5726.cloud.56498 > L1-anjo5726.cloud.1474: Flags [S], seq 4180191734, win 1024, options [mss 1460], length 0
01:12:15.196970 IP S1-anjo5726.cloud.56498 > L1-anjo5726.cloud.20118: Flags [S], seq 4180191734, win 1024, options [mss 1460], length 0
01:12:15.196981 IP S1-anjo5726.cloud.56498 > L1-anjo5726.cloud.5784: Flags [S], seq 4180191734, win 1024, options [mss 1460], length 0
01:12:15.196997 IP S1-anjo5726.cloud.56498 > L1-anjo5726.cloud.3266: Flags [S], seq 4180191734, win 1024, options [mss 1460], length 0
01:12:15.197007 IP S1-anjo5726.cloud.56498 > L1-anjo5726.cloud.1763: Flags [S], seq 4180191734, win 1024, options [mss 1460], length 0
01:12:15.197054 IP L1-anjo5726.cloud.5727 > S1-anjo5726.cloud.56498: Flags [R.], seq 0, ack 4180191735, win 0, length 0
01:12:15.197055 IP L1-anjo5726.cloud.819 > S1-anjo5726.cloud.56498: Flags [R.], seq 0, ack 4180191735, win 0, length 0
01:12:15.197066 IP S1-anjo5726.cloud.56498 > L1-anjo5726.cloud.2881: Flags [S], seq 4180191734, win 1024, options [mss 1460], length 0
01:12:15.197088 IP S1-anjo5726.cloud.56498 > L1-anjo5726.cloud.2360: Flags [S], seq 4180191734, win 1024, options [mss 1460], length 0
01:12:15.197114 IP S1-anjo5726.cloud.56498 > L1-anjo5726.cloud.1499: Flags [S], seq 4180191734, win 1024, options [mss 1460], length 0
01:12:15.197153 IP L1-anjo5726.cloud.3178 > S1-anjo5726.cloud.56498: Flags [R.], seq 0, ack 4180191735, win 0, length 0
01:12:15.197154 IP L1-anjo5726.cloud.1474 > S1-anjo5726.cloud.56498: Flags [R.], seq 0, ack 4180191735, win 0, length 0
01:12:15.197156 IP L1-anjo5726.cloud.20118 > S1-anjo5726.cloud.56498: Flags [R.], seq 0, ack 4180191735, win 0, length 0
01:12:15.197157 IP L1-anjo5726.cloud.5784 > S1-anjo5726.cloud.56498: Flags [R.], seq 0, ack 4180191735, win 0, length 0
01:12:15.197167 IP S1-anjo5726.cloud.56498 > L1-anjo5726.cloud.50202: Flags [S], seq 4180191734, win 1024, options [mss 1460], length 0
01:12:15.197189 IP S1-anjo5726.cloud.56498 > L1-anjo5726.cloud.21201: Flags [S], seq 4180191734, win 1024, options [mss 1460], length 0
01:12:15.197218 IP L1-anjo5726.cloud.3266 > S1-anjo5726.cloud.56498: Flags [R.], seq 0, ack 4180191735, win 0, length 0
01:12:15.197219 IP L1-anjo5726.cloud.1763 > S1-anjo5726.cloud.56498: Flags [R.], seq 0, ack 4180191735, win 0, length 0
01:12:15.197244 IP S1-anjo5726.cloud.56498 > L1-anjo5726.cloud.32871: Flags [S], seq 4180191734, win 1024, options [mss 1460], length 0
01:12:15.197272 IP L1-anjo5726.cloud.2881 > S1-anjo5726.cloud.56498: Flags [R.], seq 0, ack 4180191735, win 0, length 0
01:12:15.197273 IP L1-anjo5726.cloud.2360 > S1-anjo5726.cloud.56498: Flags [R.], seq 0, ack 4180191735, win 0, length 0
01:12:15.197304 IP L1-anjo5726.cloud.1499 > S1-anjo5726.cloud.56498: Flags [R.], seq 0, ack 4180191735, win 0, length 0
01:12:15.197305 IP L1-anjo5726.cloud.50202 > S1-anjo5726.cloud.56498: Flags [R.], seq 0, ack 4180191735, win 0, length 0
01:12:15.197325 IP S1-anjo5726.cloud.56498 > L1-anjo5726.cloud.20052: Flags [S], seq 4180191734, win 1024, options [mss 1460], length 0
01:12:15.197345 IP S1-anjo5726.cloud.56498 > L1-anjo5726.cloud.3985: Flags [S], seq 4180191734, win 1024, options [mss 1460], length 0
01:12:15.197356 IP S1-anjo5726.cloud.56498 > L1-anjo5726.cloud.10550: Flags [S], seq 4180191734, win 1024, options [mss 1460], length 0
01:12:15.197366 IP S1-anjo5726.cloud.56498 > L1-anjo5726.cloud.5620: Flags [S], seq 4180191734, win 1024, options [mss 1460], length 0
01:12:15.197376 IP S1-anjo5726.cloud.56498 > L1-anjo5726.cloud.10602: Flags [S], seq 4180191734, win 1024, options [mss 1460], length 0
01:12:15.197386 IP S1-anjo5726.cloud.56498 > L1-anjo5726.cloud.1466: Flags [S], seq 4180191734, win 1024, options [mss 1460], length 0
01:12:15.197408 IP S1-anjo5726.cloud.56498 > L1-anjo5726.cloud.33175: Flags [S], seq 4180191734, win 1024, options [mss 1460], length 0
01:12:15.197421 IP S1-anjo5726.cloud.56498 > L1-anjo5726.cloud.46436: Flags [S], seq 4180191734, win 1024, options [mss 1460], length 0
01:12:15.197457 IP S1-anjo5726.cloud.56498 > L1-anjo5726.cloud.2812: Flags [S], seq 4180191734, win 1024, options [mss 1460], length 0
01:12:15.197473 IP L1-anjo5726.cloud.21201 > S1-anjo5726.cloud.56498: Flags [R.], seq 0, ack 4180191735, win 0, length 0
01:12:15.197474 IP L1-anjo5726.cloud.32871 > S1-anjo5726.cloud.56498: Flags [R.], seq 0, ack 4180191735, win 0, length 0
01:12:15.197475 IP L1-anjo5726.cloud.20052 > S1-anjo5726.cloud.56498: Flags [R.], seq 0, ack 4180191735, win 0, length 0
01:12:15.197504 IP L1-anjo5726.cloud.3985 > S1-anjo5726.cloud.56498: Flags [R.], seq 0, ack 4180191735, win 0, length 0
01:12:15.197510 IP L1-anjo5726.cloud.10550 > S1-anjo5726.cloud.56498: Flags [R.], seq 0, ack 4180191735, win 0, length 0
01:12:15.197511 IP L1-anjo5726.cloud.5620 > S1-anjo5726.cloud.56498: Flags [R.], seq 0, ack 4180191735, win 0, length 0
01:12:15.197520 IP L1-anjo5726.cloud.10602 > S1-anjo5726.cloud.56498: Flags [R.], seq 0, ack 4180191735, win 0, length 0
01:12:15.197520 IP L1-anjo5726.cloud.1466 > S1-anjo5726.cloud.56498: Flags [R.], seq 0, ack 4180191735, win 0, length 0
01:12:15.197539 IP L1-anjo5726.cloud.33175 > S1-anjo5726.cloud.56498: Flags [R.], seq 0, ack 4180191735, win 0, length 0
01:12:15.197548 IP S1-anjo5726.cloud.56498 > L1-anjo5726.cloud.4500: Flags [S], seq 4180191734, win 1024, options [mss 1460], length 0
01:12:15.197569 IP S1-anjo5726.cloud.56498 > L1-anjo5726.cloud.1115: Flags [S], seq 4180191734, win 1024, options [mss 1460], length 0
01:12:15.197579 IP S1-anjo5726.cloud.56498 > L1-anjo5726.cloud.36700: Flags [S], seq 4180191734, win 1024, options [mss 1460], length 0
01:12:15.197589 IP S1-anjo5726.cloud.56498 > L1-anjo5726.cloud.6700: Flags [S], seq 4180191734, win 1024, options [mss 1460], length 0
01:12:15.197599 IP S1-anjo5726.cloud.56498 > L1-anjo5726.cloud.2622: Flags [S], seq 4180191734, win 1024, options [mss 1460], length 0
01:12:15.197609 IP S1-anjo5726.cloud.56498 > L1-anjo5726.cloud.9093: Flags [S], seq 4180191734, win 1024, options [mss 1460], length 0
01:12:15.197619 IP S1-anjo5726.cloud.56498 > L1-anjo5726.cloud.4165: Flags [S], seq 4180191734, win 1024, options [mss 1460], length 0
01:12:15.197628 IP S1-anjo5726.cloud.56498 > L1-anjo5726.cloud.5162: Flags [S], seq 4180191734, win 1024, options [mss 1460], length 0
01:12:15.197638 IP S1-anjo5726.cloud.56498 > L1-anjo5726.cloud.2115: Flags [S], seq 4180191734, win 1024, options [mss 1460], length 0
01:12:15.197648 IP S1-anjo5726.cloud.56498 > L1-anjo5726.cloud.1591: Flags [S], seq 4180191734, win 1024, options [mss 1460], length 0
01:12:15.197658 IP S1-anjo5726.cloud.56498 > L1-anjo5726.cloud.2973: Flags [S], seq 4180191734, win 1024, options [mss 1460], length 0
01:12:15.197678 IP S1-anjo5726.cloud.56498 > L1-anjo5726.cloud.10011: Flags [S], seq 4180191734, win 1024, options [mss 1460], length 0
01:12:15.197690 IP S1-anjo5726.cloud.56498 > L1-anjo5726.cloud.52673: Flags [S], seq 4180191734, win 1024, options [mss 1460], length 0
01:12:15.197700 IP S1-anjo5726.cloud.56498 > L1-anjo5726.cloud.4126: Flags [S], seq 4180191734, win 1024, options [mss 1460], length 0
01:12:15.197710 IP S1-anjo5726.cloud.56498 > L1-anjo5726.cloud.9292: Flags [S], seq 4180191734, win 1024, options [mss 1460], length 0
01:12:15.197720 IP S1-anjo5726.cloud.56498 > L1-anjo5726.cloud.54514: Flags [S], seq 4180191734, win 1024, options [mss 1460], length 0
01:12:15.197729 IP S1-anjo5726.cloud.56498 > L1-anjo5726.cloud.2146: Flags [S], seq 4180191734, win 1024, options [mss 1460], length 0
