01:13:48.391321 ARP, Request who-has L1-anjo5726.cloud tell S1-anjo5726.cloud, length 28
01:13:48.391447 ARP, Reply L1-anjo5726.cloud is-at 02:00:ac:10:00:10 (oui Unknown), length 28
01:13:48.394507 IP S1-anjo5726.cloud.50770 > L1-anjo5726.cloud.http: Flags [S], seq 2360612703, win 1024, options [mss 1460], length 0
01:13:48.394507 IP S1-anjo5726.cloud.50770 > L1-anjo5726.cloud.ms-wbt-server: Flags [S], seq 2360612703, win 1024, options [mss 1460], length 0
01:13:48.394507 IP S1-anjo5726.cloud.50770 > L1-anjo5726.cloud.5900: Flags [S], seq 2360612703, win 1024, options [mss 1460], length 0
01:13:48.394507 IP S1-anjo5726.cloud.50770 > L1-anjo5726.cloud.domain: Flags [S], seq 2360612703, win 1024, options [mss 1460], length 0
01:13:48.394507 IP S1-anjo5726.cloud.50770 > L1-anjo5726.cloud.smtp: Flags [S], seq 2360612703, win 1024, options [mss 1460], length 0
01:13:48.394507 IP S1-anjo5726.cloud.50770 > L1-anjo5726.cloud.netbios-ssn: Flags [S], seq 2360612703, win 1024, options [mss 1460], length 0
01:13:48.394508 IP S1-anjo5726.cloud.50770 > L1-anjo5726.cloud.telnet: Flags [S], seq 2360612703, win 1024, options [mss 1460], length 0
01:13:48.394615 IP L1-anjo5726.cloud.http > S1-anjo5726.cloud.50770: Flags [S.], seq 3520678766, ack 2360612704, win 64240, options [mss 1460], length 0
01:13:48.394640 IP L1-anjo5726.cloud.ms-wbt-server > S1-anjo5726.cloud.50770: Flags [R.], seq 0, ack 2360612704, win 0, length 0
01:13:48.394644 IP L1-anjo5726.cloud.5900 > S1-anjo5726.cloud.50770: Flags [R.], seq 0, ack 2360612704, win 0, length 0
01:13:48.394675 IP L1-anjo5726.cloud.domain > S1-anjo5726.cloud.50770: Flags [S.], seq 3933515294, ack 2360612704, win 64240, options [mss 1460], length 0
01:13:48.394692 IP L1-anjo5726.cloud.smtp > S1-anjo5726.cloud.50770: Flags [S.], seq 1063155599, ack 2360612704, win 64240, options [mss 1460], length 0
01:13:48.394700 IP L1-anjo5726.cloud.netbios-ssn > S1-anjo5726.cloud.50770: Flags [R.], seq 0, ack 2360612704, win 0, length 0
01:13:48.394705 IP L1-anjo5726.cloud.telnet > S1-anjo5726.cloud.50770: Flags [R.], seq 0, ack 2360612704, win 0, length 0
01:13:48.394714 IP S1-anjo5726.cloud.50770 > L1-anjo5726.cloud.rtsp: Flags [S], seq 2360612703, win 1024, options [mss 1460], length 0
01:13:48.394714 IP S1-anjo5726.cloud.50770 > L1-anjo5726.cloud.mysql: Flags [S], seq 2360612703, win 1024, options [mss 1460], length 0
01:13:48.394714 IP S1-anjo5726.cloud.50770 > L1-anjo5726.cloud.auth: Flags [S], seq 2360612703, win 1024, options [mss 1460], length 0
01:13:48.394748 IP L1-anjo5726.cloud.rtsp > S1-anjo5726.cloud.50770: Flags [R.], seq 0, ack 2360612704, win 0, length 0
01:13:48.394792 IP L1-anjo5726.cloud.mysql > S1-anjo5726.cloud.50770: Flags [R.], seq 0, ack 2360612704, win 0, length 0
01:13:48.394799 IP L1-anjo5726.cloud.auth > S1-anjo5726.cloud.50770: Flags [R.], seq 0, ack 2360612704, win 0, length 0
01:13:48.395025 IP S1-anjo5726.cloud.50770 > L1-anjo5726.cloud.http: Flags [R], seq 2360612704, win 0, length 0
01:13:48.395025 IP S1-anjo5726.cloud.50770 > L1-anjo5726.cloud.domain: Flags [R], seq 2360612704, win 0, length 0
01:13:48.395025 IP S1-anjo5726.cloud.50770 > L1-anjo5726.cloud.smtp: Flags [R], seq 2360612704, win 0, length 0
01:13:48.395253 IP S1-anjo5726.cloud.50770 > L1-anjo5726.cloud.https: Flags [S], seq 2360612703, win 1024, options [mss 1460], length 0
01:13:48.395253 IP S1-anjo5726.cloud.50770 > L1-anjo5726.cloud.submission: Flags [S], seq 2360612703, win 1024, options [mss 1460], length 0
01:13:48.395253 IP S1-anjo5726.cloud.50770 > L1-anjo5726.cloud.1723: Flags [S], seq 2360612703, win 1024, options [mss 1460], length 0
01:13:48.395253 IP S1-anjo5726.cloud.50770 > L1-anjo5726.cloud.smux: Flags [S], seq 2360612703, win 1024, options [mss 1460], length 0
01:13:48.395253 IP S1-anjo5726.cloud.50770 > L1-anjo5726.cloud.ssh: Flags [S], seq 2360612703, win 1024, options [mss 1460], length 0
01:13:48.395253 IP S1-anjo5726.cloud.50770 > L1-anjo5726.cloud.sunrpc: Flags [S], seq 2360612703, win 1024, options [mss 1460], length 0
01:13:48.395254 IP S1-anjo5726.cloud.50770 > L1-anjo5726.cloud.8888: Flags [S], seq 2360612703, win 1024, options [mss 1460], length 0
01:13:48.395254 IP S1-anjo5726.cloud.50770 > L1-anjo5726.cloud.microsoft-ds: Flags [S], seq 2360612703, win 1024, options [mss 1460], length 0
01:13:48.395274 IP L1-anjo5726.cloud.https > S1-anjo5726.cloud.50770: Flags [R.], seq 0, ack 2360612704, win 0, length 0
01:13:48.395293 IP L1-anjo5726.cloud.submission > S1-anjo5726.cloud.50770: Flags [R.], seq 0, ack 2360612704, win 0, length 0
01:13:48.395297 IP L1-anjo5726.cloud.1723 > S1-anjo5726.cloud.50770: Flags [R.], seq 0, ack 2360612704, win 0, length 0
01:13:48.395301 IP L1-anjo5726.cloud.smux > S1-anjo5726.cloud.50770: Flags [R.], seq 0, ack 2360612704, win 0, length 0
01:13:48.395320 IP L1-anjo5726.cloud.ssh > S1-anjo5726.cloud.50770: Flags [S.], seq 575082087, ack 2360612704, win 64240, options [mss 1460], length 0
01:13:48.395359 IP L1-anjo5726.cloud.sunrpc > S1-anjo5726.cloud.50770: Flags [S.], seq 236041486, ack 2360612704, win 64240, options [mss 1460], length 0
01:13:48.395381 IP L1-anjo5726.cloud.8888 > S1-anjo5726.cloud.50770: Flags [R.], seq 0, ack 2360612704, win 0, length 0
01:13:48.395394 IP L1-anjo5726.cloud.microsoft-ds > S1-anjo5726.cloud.50770: Flags [R.], seq 0, ack 2360612704, win 0, length 0
01:13:48.395431 IP S1-anjo5726.cloud.50770 > L1-anjo5726.cloud.imaps: Flags [S], seq 2360612703, win 1024, options [mss 1460], length 0
01:13:48.395431 IP S1-anjo5726.cloud.50770 > L1-anjo5726.cloud.1720: Flags [S], seq 2360612703, win 1024, options [mss 1460], length 0
01:13:48.395431 IP S1-anjo5726.cloud.50770 > L1-anjo5726.cloud.1025: Flags [S], seq 2360612703, win 1024, options [mss 1460], length 0
01:13:48.395431 IP S1-anjo5726.cloud.50770 > L1-anjo5726.cloud.256: Flags [S], seq 2360612703, win 1024, options [mss 1460], length 0
01:13:48.395431 IP S1-anjo5726.cloud.50770 > L1-anjo5726.cloud.pop3s: Flags [S], seq 2360612703, win 1024, options [mss 1460], length 0
01:13:48.395431 IP S1-anjo5726.cloud.50770 > L1-anjo5726.cloud.imap2: Flags [S], seq 2360612703, win 1024, options [mss 1460], length 0
01:13:48.395431 IP S1-anjo5726.cloud.50770 > L1-anjo5726.cloud.ftp: Flags [S], seq 2360612703, win 1024, options [mss 1460], length 0
01:13:48.395431 IP S1-anjo5726.cloud.50770 > L1-anjo5726.cloud.pop3: Flags [S], seq 2360612703, win 1024, options [mss 1460], length 0
01:13:48.395441 IP L1-anjo5726.cloud.imaps > S1-anjo5726.cloud.50770: Flags [R.], seq 0, ack 2360612704, win 0, length 0
01:13:48.395453 IP L1-anjo5726.cloud.1720 > S1-anjo5726.cloud.50770: Flags [R.], seq 0, ack 2360612704, win 0, length 0
01:13:48.395457 IP L1-anjo5726.cloud.1025 > S1-anjo5726.cloud.50770: Flags [R.], seq 0, ack 2360612704, win 0, length 0
01:13:48.395461 IP L1-anjo5726.cloud.256 > S1-anjo5726.cloud.50770: Flags [R.], seq 0, ack 2360612704, win 0, length 0
01:13:48.395465 IP L1-anjo5726.cloud.pop3s > S1-anjo5726.cloud.50770: Flags [R.], seq 0, ack 2360612704, win 0, length 0
01:13:48.395469 IP L1-anjo5726.cloud.imap2 > S1-anjo5726.cloud.50770: Flags [R.], seq 0, ack 2360612704, win 0, length 0
01:13:48.395483 IP L1-anjo5726.cloud.ftp > S1-anjo5726.cloud.50770: Flags [S.], seq 3650572619, ack 2360612704, win 64240, options [mss 1460], length 0
01:13:48.395488 IP L1-anjo5726.cloud.pop3 > S1-anjo5726.cloud.50770: Flags [R.], seq 0, ack 2360612704, win 0, length 0
01:13:48.395505 IP S1-anjo5726.cloud.50770 > L1-anjo5726.cloud.epmap: Flags [S], seq 2360612703, win 1024, options [mss 1460], length 0
01:13:48.395505 IP S1-anjo5726.cloud.50770 > L1-anjo5726.cloud.http-alt: Flags [S], seq 2360612703, win 1024, options [mss 1460], length 0
01:13:48.395505 IP S1-anjo5726.cloud.50770 > L1-anjo5726.cloud.1900: Flags [S], seq 2360612703, win 1024, options [mss 1460], length 0
01:13:48.395505 IP S1-anjo5726.cloud.50770 > L1-anjo5726.cloud.2500: Flags [S], seq 2360612703, win 1024, options [mss 1460], length 0
01:13:48.395514 IP L1-anjo5726.cloud.epmap > S1-anjo5726.cloud.50770: Flags [R.], seq 0, ack 2360612704, win 0, length 0
01:13:48.395528 IP L1-anjo5726.cloud.http-alt > S1-anjo5726.cloud.50770: Flags [R.], seq 0, ack 2360612704, win 0, length 0
01:13:48.395532 IP L1-anjo5726.cloud.1900 > S1-anjo5726.cloud.50770: Flags [R.], seq 0, ack 2360612704, win 0, length 0
01:13:48.395536 IP L1-anjo5726.cloud.2500 > S1-anjo5726.cloud.50770: Flags [R.], seq 0, ack 2360612704, win 0, length 0
01:13:48.395581 IP S1-anjo5726.cloud.50770 > L1-anjo5726.cloud.ssh: Flags [R], seq 2360612704, win 0, length 0
01:13:48.395581 IP S1-anjo5726.cloud.50770 > L1-anjo5726.cloud.sunrpc: Flags [R], seq 2360612704, win 0, length 0
01:13:48.395656 IP S1-anjo5726.cloud.50770 > L1-anjo5726.cloud.ftp: Flags [R], seq 2360612704, win 0, length 0
01:13:48.395879 IP S1-anjo5726.cloud.50770 > L1-anjo5726.cloud.4321: Flags [S], seq 2360612703, win 1024, options [mss 1460], length 0
01:13:48.395879 IP S1-anjo5726.cloud.50770 > L1-anjo5726.cloud.10629: Flags [S], seq 2360612703, win 1024, options [mss 1460], length 0
01:13:48.395879 IP S1-anjo5726.cloud.50770 > L1-anjo5726.cloud.12000: Flags [S], seq 2360612703, win 1024, options [mss 1460], length 0
01:13:48.395879 IP S1-anjo5726.cloud.50770 > L1-anjo5726.cloud.9100: Flags [S], seq 2360612703, win 1024, options [mss 1460], length 0
01:13:48.395879 IP S1-anjo5726.cloud.50770 > L1-anjo5726.cloud.gnutella-svc: Flags [S], seq 2360612703, win 1024, options [mss 1460], length 0
01:13:48.395907 IP L1-anjo5726.cloud.4321 > S1-anjo5726.cloud.50770: Flags [R.], seq 0, ack 2360612704, win 0, length 0
01:13:48.395925 IP L1-anjo5726.cloud.10629 > S1-anjo5726.cloud.50770: Flags [R.], seq 0, ack 2360612704, win 0, length 0
01:13:48.395930 IP L1-anjo5726.cloud.12000 > S1-anjo5726.cloud.50770: Flags [R.], seq 0, ack 2360612704, win 0, length 0
01:13:48.395934 IP L1-anjo5726.cloud.9100 > S1-anjo5726.cloud.50770: Flags [R.], seq 0, ack 2360612704, win 0, length 0
01:13:48.395937 IP L1-anjo5726.cloud.gnutella-svc > S1-anjo5726.cloud.50770: Flags [R.], seq 0, ack 2360612704, win 0, length 0
01:13:48.395943 IP S1-anjo5726.cloud.50770 > L1-anjo5726.cloud.5859: Flags [S], seq 2360612703, win 1024, options [mss 1460], length 0
01:13:48.395943 IP S1-anjo5726.cloud.50770 > L1-anjo5726.cloud.5050: Flags [S], seq 2360612703, win 1024, options [mss 1460], length 0
01:13:48.395943 IP S1-anjo5726.cloud.50770 > L1-anjo5726.cloud.bacula-fd: Flags [S], seq 2360612703, win 1024, options [mss 1460], length 0
01:13:48.395949 IP L1-anjo5726.cloud.5859 > S1-anjo5726.cloud.50770: Flags [R.], seq 0, ack 2360612704, win 0, length 0
01:13:48.395954 IP L1-anjo5726.cloud.5050 > S1-anjo5726.cloud.50770: Flags [R.], seq 0, ack 2360612704, win 0, length 0
01:13:48.395958 IP L1-anjo5726.cloud.bacula-fd > S1-anjo5726.cloud.50770: Flags [R.], seq 0, ack 2360612704, win 0, length 0
01:13:48.396017 IP S1-anjo5726.cloud.50770 > L1-anjo5726.cloud.1100: Flags [S], seq 2360612703, win 1024, options [mss 1460], length 0
01:13:48.396017 IP S1-anjo5726.cloud.50770 > L1-anjo5726.cloud.7019: Flags [S], seq 2360612703, win 1024, options [mss 1460], length 0
01:13:48.396024 IP L1-anjo5726.cloud.1100 > S1-anjo5726.cloud.50770: Flags [R.], seq 0, ack 2360612704, win 0, length 0
01:13:48.396037 IP L1-anjo5726.cloud.7019 > S1-anjo5726.cloud.50770: Flags [R.], seq 0, ack 2360612704, win 0, length 0
01:13:48.396065 IP S1-anjo5726.cloud.50770 > L1-anjo5726.cloud.10004: Flags [S], seq 2360612703, win 1024, options [mss 1460], length 0
01:13:48.396065 IP S1-anjo5726.cloud.50770 > L1-anjo5726.cloud.1199: Flags [S], seq 2360612703, win 1024, options [mss 1460], length 0
01:13:48.396072 IP L1-anjo5726.cloud.10004 > S1-anjo5726.cloud.50770: Flags [R.], seq 0, ack 2360612704, win 0, length 0
01:13:48.396083 IP L1-anjo5726.cloud.1199 > S1-anjo5726.cloud.50770: Flags [R.], seq 0, ack 2360612704, win 0, length 0
01:13:48.396108 IP S1-anjo5726.cloud.50770 > L1-anjo5726.cloud.3003: Flags [S], seq 2360612703, win 1024, options [mss 1460], length 0
01:13:48.396113 IP L1-anjo5726.cloud.3003 > S1-anjo5726.cloud.50770: Flags [R.], seq 0, ack 2360612704, win 0, length 0
01:13:48.396155 IP S1-anjo5726.cloud.50770 > L1-anjo5726.cloud.discard: Flags [S], seq 2360612703, win 1024, options [mss 1460], length 0
01:13:48.396162 IP L1-anjo5726.cloud.discard > S1-anjo5726.cloud.50770: Flags [R.], seq 0, ack 2360612704, win 0, length 0
01:13:48.396209 IP S1-anjo5726.cloud.50770 > L1-anjo5726.cloud.2161: Flags [S], seq 2360612703, win 1024, options [mss 1460], length 0
01:13:48.396215 IP L1-anjo5726.cloud.2161 > S1-anjo5726.cloud.50770: Flags [R.], seq 0, ack 2360612704, win 0, length 0
01:13:48.396254 IP S1-anjo5726.cloud.50770 > L1-anjo5726.cloud.1138: Flags [S], seq 2360612703, win 1024, options [mss 1460], length 0
01:13:48.396260 IP L1-anjo5726.cloud.1138 > S1-anjo5726.cloud.50770: Flags [R.], seq 0, ack 2360612704, win 0, length 0
01:13:48.396285 IP S1-anjo5726.cloud.50770 > L1-anjo5726.cloud.15002: Flags [S], seq 2360612703, win 1024, options [mss 1460], length 0
01:13:48.396286 IP S1-anjo5726.cloud.50770 > L1-anjo5726.cloud.3920: Flags [S], seq 2360612703, win 1024, options [mss 1460], length 0
01:13:48.396299 IP L1-anjo5726.cloud.15002 > S1-anjo5726.cloud.50770: Flags [R.], seq 0, ack 2360612704, win 0, length 0
01:13:48.396311 IP L1-anjo5726.cloud.3920 > S1-anjo5726.cloud.50770: Flags [R.], seq 0, ack 2360612704, win 0, length 0
01:13:48.396317 IP S1-anjo5726.cloud.50770 > L1-anjo5726.cloud.2200: Flags [S], seq 2360612703, win 1024, options [mss 1460], length 0
01:13:48.396317 IP S1-anjo5726.cloud.50770 > L1-anjo5726.cloud.31038: Flags [S], seq 2360612703, win 1024, options [mss 1460], length 0
01:13:48.396338 IP L1-anjo5726.cloud.2200 > S1-anjo5726.cloud.50770: Flags [R.], seq 0, ack 2360612704, win 0, length 0
01:13:48.396348 IP L1-anjo5726.cloud.31038 > S1-anjo5726.cloud.50770: Flags [R.], seq 0, ack 2360612704, win 0, length 0
01:13:48.396367 IP S1-anjo5726.cloud.50770 > L1-anjo5726.cloud.27715: Flags [S], seq 2360612703, win 1024, options [mss 1460], length 0
01:13:48.396367 IP S1-anjo5726.cloud.50770 > L1-anjo5726.cloud.32781: Flags [S], seq 2360612703, win 1024, options [mss 1460], length 0
01:13:48.396367 IP S1-anjo5726.cloud.50770 > L1-anjo5726.cloud.1114: Flags [S], seq 2360612703, win 1024, options [mss 1460], length 0
01:13:48.396367 IP S1-anjo5726.cloud.50770 > L1-anjo5726.cloud.6502: Flags [S], seq 2360612703, win 1024, options [mss 1460], length 0
01:13:48.396367 IP S1-anjo5726.cloud.50770 > L1-anjo5726.cloud.3221: Flags [S], seq 2360612703, win 1024, options [mss 1460], length 0
01:13:48.396367 IP S1-anjo5726.cloud.50770 > L1-anjo5726.cloud.1123: Flags [S], seq 2360612703, win 1024, options [mss 1460], length 0
01:13:48.396375 IP L1-anjo5726.cloud.27715 > S1-anjo5726.cloud.50770: Flags [R.], seq 0, ack 2360612704, win 0, length 0
01:13:48.396392 IP L1-anjo5726.cloud.32781 > S1-anjo5726.cloud.50770: Flags [R.], seq 0, ack 2360612704, win 0, length 0
01:13:48.396396 IP L1-anjo5726.cloud.1114 > S1-anjo5726.cloud.50770: Flags [R.], seq 0, ack 2360612704, win 0, length 0
01:13:48.396415 IP L1-anjo5726.cloud.6502 > S1-anjo5726.cloud.50770: Flags [R.], seq 0, ack 2360612704, win 0, length 0
01:13:48.396425 IP L1-anjo5726.cloud.3221 > S1-anjo5726.cloud.50770: Flags [R.], seq 0, ack 2360612704, win 0, length 0
01:13:48.396429 IP L1-anjo5726.cloud.1123 > S1-anjo5726.cloud.50770: Flags [R.], seq 0, ack 2360612704, win 0, length 0
01:13:48.396452 IP S1-anjo5726.cloud.50770 > L1-anjo5726.cloud.1717: Flags [S], seq 2360612703, win 1024, options [mss 1460], length 0
01:13:48.396452 IP S1-anjo5726.cloud.50770 > L1-anjo5726.cloud.1839: Flags [S], seq 2360612703, win 1024, options [mss 1460], length 0
01:13:48.396452 IP S1-anjo5726.cloud.50770 > L1-anjo5726.cloud.8300: Flags [S], seq 2360612703, win 1024, options [mss 1460], length 0
01:13:48.396452 IP S1-anjo5726.cloud.50770 > L1-anjo5726.cloud.2106: Flags [S], seq 2360612703, win 1024, options [mss 1460], length 0
01:13:48.396452 IP S1-anjo5726.cloud.50770 > L1-anjo5726.cloud.10617: Flags [S], seq 2360612703, win 1024, options [mss 1460], length 0
01:13:48.396452 IP S1-anjo5726.cloud.50770 > L1-anjo5726.cloud.24444: Flags [S], seq 2360612703, win 1024, options [mss 1460], length 0
01:13:48.396452 IP S1-anjo5726.cloud.50770 > L1-anjo5726.cloud.90: Flags [S], seq 2360612703, win 1024, options [mss 1460], length 0
01:13:48.396466 IP L1-anjo5726.cloud.1717 > S1-anjo5726.cloud.50770: Flags [R.], seq 0, ack 2360612704, win 0, length 0
01:13:48.396479 IP L1-anjo5726.cloud.1839 > S1-anjo5726.cloud.50770: Flags [R.], seq 0, ack 2360612704, win 0, length 0
01:13:48.396483 IP L1-anjo5726.cloud.8300 > S1-anjo5726.cloud.50770: Flags [R.], seq 0, ack 2360612704, win 0, length 0
01:13:48.396487 IP L1-anjo5726.cloud.2106 > S1-anjo5726.cloud.50770: Flags [R.], seq 0, ack 2360612704, win 0, length 0
01:13:48.396491 IP L1-anjo5726.cloud.10617 > S1-anjo5726.cloud.50770: Flags [R.], seq 0, ack 2360612704, win 0, length 0
01:13:48.396495 IP L1-anjo5726.cloud.24444 > S1-anjo5726.cloud.50770: Flags [R.], seq 0, ack 2360612704, win 0, length 0
01:13:48.396498 IP L1-anjo5726.cloud.90 > S1-anjo5726.cloud.50770: Flags [R.], seq 0, ack 2360612704, win 0, length 0
01:13:48.396508 IP S1-anjo5726.cloud.50770 > L1-anjo5726.cloud.5959: Flags [S], seq 2360612703, win 1024, options [mss 1460], length 0
01:13:48.396508 IP S1-anjo5726.cloud.50770 > L1-anjo5726.cloud.32783: Flags [S], seq 2360612703, win 1024, options [mss 1460], length 0
01:13:48.396514 IP L1-anjo5726.cloud.5959 > S1-anjo5726.cloud.50770: Flags [R.], seq 0, ack 2360612704, win 0, length 0
01:13:48.396518 IP L1-anjo5726.cloud.32783 > S1-anjo5726.cloud.50770: Flags [R.], seq 0, ack 2360612704, win 0, length 0
01:13:48.396586 IP S1-anjo5726.cloud.50770 > L1-anjo5726.cloud.5033: Flags [S], seq 2360612703, win 1024, options [mss 1460], length 0
01:13:48.396586 IP S1-anjo5726.cloud.50770 > L1-anjo5726.cloud.5000: Flags [S], seq 2360612703, win 1024, options [mss 1460], length 0
01:13:48.396586 IP S1-anjo5726.cloud.50770 > L1-anjo5726.cloud.6788: Flags [S], seq 2360612703, win 1024, options [mss 1460], length 0
01:13:48.396586 IP S1-anjo5726.cloud.50770 > L1-anjo5726.cloud.2288: Flags [S], seq 2360612703, win 1024, options [mss 1460], length 0
01:13:48.396586 IP S1-anjo5726.cloud.50770 > L1-anjo5726.cloud.1300: Flags [S], seq 2360612703, win 1024, options [mss 1460], length 0
01:13:48.396594 IP L1-anjo5726.cloud.5033 > S1-anjo5726.cloud.50770: Flags [R.], seq 0, ack 2360612704, win 0, length 0
01:13:48.396605 IP L1-anjo5726.cloud.5000 > S1-anjo5726.cloud.50770: Flags [R.], seq 0, ack 2360612704, win 0, length 0
01:13:48.396609 IP L1-anjo5726.cloud.6788 > S1-anjo5726.cloud.50770: Flags [R.], seq 0, ack 2360612704, win 0, length 0
01:13:48.396613 IP L1-anjo5726.cloud.2288 > S1-anjo5726.cloud.50770: Flags [R.], seq 0, ack 2360612704, win 0, length 0
01:13:48.396617 IP L1-anjo5726.cloud.1300 > S1-anjo5726.cloud.50770: Flags [R.], seq 0, ack 2360612704, win 0, length 0
01:13:48.397017 IP S1-anjo5726.cloud.50770 > L1-anjo5726.cloud.1079: Flags [S], seq 2360612703, win 1024, options [mss 1460], length 0
01:13:48.397017 IP S1-anjo5726.cloud.50770 > L1-anjo5726.cloud.1198: Flags [S], seq 2360612703, win 1024, options [mss 1460], length 0
01:13:48.397017 IP S1-anjo5726.cloud.50770 > L1-anjo5726.cloud.1035: Flags [S], seq 2360612703, win 1024, options [mss 1460], length 0
01:13:48.397017 IP S1-anjo5726.cloud.50770 > L1-anjo5726.cloud.5003: Flags [S], seq 2360612703, win 1024, options [mss 1460], length 0
01:13:48.397029 IP L1-anjo5726.cloud.1079 > S1-anjo5726.cloud.50770: Flags [R.], seq 0, ack 2360612704, win 0, length 0
01:13:48.397041 IP L1-anjo5726.cloud.1198 > S1-anjo5726.cloud.50770: Flags [R.], seq 0, ack 2360612704, win 0, length 0
01:13:48.397045 IP L1-anjo5726.cloud.1035 > S1-anjo5726.cloud.50770: Flags [R.], seq 0, ack 2360612704, win 0, length 0
01:13:48.397049 IP L1-anjo5726.cloud.5003 > S1-anjo5726.cloud.50770: Flags [R.], seq 0, ack 2360612704, win 0, length 0
01:13:48.397054 IP S1-anjo5726.cloud.50770 > L1-anjo5726.cloud.616: Flags [S], seq 2360612703, win 1024, options [mss 1460], length 0
01:13:48.397054 IP S1-anjo5726.cloud.50770 > L1-anjo5726.cloud.3283: Flags [S], seq 2360612703, win 1024, options [mss 1460], length 0
01:13:48.397054 IP S1-anjo5726.cloud.50770 > L1-anjo5726.cloud.1287: Flags [S], seq 2360612703, win 1024, options [mss 1460], length 0
01:13:48.397060 IP L1-anjo5726.cloud.616 > S1-anjo5726.cloud.50770: Flags [R.], seq 0, ack 2360612704, win 0, length 0
01:13:48.397083 IP L1-anjo5726.cloud.3283 > S1-anjo5726.cloud.50770: Flags [R.], seq 0, ack 2360612704, win 0, length 0
01:13:48.397108 IP L1-anjo5726.cloud.1287 > S1-anjo5726.cloud.50770: Flags [R.], seq 0, ack 2360612704, win 0, length 0
01:13:48.397123 IP S1-anjo5726.cloud.50770 > L1-anjo5726.cloud.8400: Flags [S], seq 2360612703, win 1024, options [mss 1460], length 0
01:13:48.397123 IP S1-anjo5726.cloud.50770 > L1-anjo5726.cloud.6059: Flags [S], seq 2360612703, win 1024, options [mss 1460], length 0
01:13:48.397123 IP S1-anjo5726.cloud.50770 > L1-anjo5726.cloud.shell: Flags [S], seq 2360612703, win 1024, options [mss 1460], length 0
01:13:48.397123 IP S1-anjo5726.cloud.50770 > L1-anjo5726.cloud.60020: Flags [S], seq 2360612703, win 1024, options [mss 1460], length 0
01:13:48.397124 IP S1-anjo5726.cloud.50770 > L1-anjo5726.cloud.4848: Flags [S], seq 2360612703, win 1024, options [mss 1460], length 0
01:13:48.397147 IP L1-anjo5726.cloud.8400 > S1-anjo5726.cloud.50770: Flags [R.], seq 0, ack 2360612704, win 0, length 0
01:13:48.397156 IP L1-anjo5726.cloud.6059 > S1-anjo5726.cloud.50770: Flags [R.], seq 0, ack 2360612704, win 0, length 0
01:13:48.397160 IP L1-anjo5726.cloud.shell > S1-anjo5726.cloud.50770: Flags [R.], seq 0, ack 2360612704, win 0, length 0
01:13:48.397164 IP L1-anjo5726.cloud.60020 > S1-anjo5726.cloud.50770: Flags [R.], seq 0, ack 2360612704, win 0, length 0
01:13:48.397168 IP L1-anjo5726.cloud.4848 > S1-anjo5726.cloud.50770: Flags [R.], seq 0, ack 2360612704, win 0, length 0
01:13:48.397173 IP S1-anjo5726.cloud.50770 > L1-anjo5726.cloud.6901: Flags [S], seq 2360612703, win 1024, options [mss 1460], length 0
01:13:48.397173 IP S1-anjo5726.cloud.50770 > L1-anjo5726.cloud.41511: Flags [S], seq 2360612703, win 1024, options [mss 1460], length 0
01:13:48.397173 IP S1-anjo5726.cloud.50770 > L1-anjo5726.cloud.rmiregistry: Flags [S], seq 2360612703, win 1024, options [mss 1460], length 0
01:13:48.397178 IP L1-anjo5726.cloud.6901 > S1-anjo5726.cloud.50770: Flags [R.], seq 0, ack 2360612704, win 0, length 0
01:13:48.397182 IP L1-anjo5726.cloud.41511 > S1-anjo5726.cloud.50770: Flags [R.], seq 0, ack 2360612704, win 0, length 0
01:13:48.397187 IP L1-anjo5726.cloud.rmiregistry > S1-anjo5726.cloud.50770: Flags [R.], seq 0, ack 2360612704, win 0, length 0
01:13:48.397300 IP S1-anjo5726.cloud.50770 > L1-anjo5726.cloud.9968: Flags [S], seq 2360612703, win 1024, options [mss 1460], length 0
01:13:48.397300 IP S1-anjo5726.cloud.50770 > L1-anjo5726.cloud.1310: Flags [S], seq 2360612703, win 1024, options [mss 1460], length 0
01:13:48.397324 IP L1-anjo5726.cloud.9968 > S1-anjo5726.cloud.50770: Flags [R.], seq 0, ack 2360612704, win 0, length 0
01:13:48.397337 IP L1-anjo5726.cloud.1310 > S1-anjo5726.cloud.50770: Flags [R.], seq 0, ack 2360612704, win 0, length 0
01:13:48.397343 IP S1-anjo5726.cloud.50770 > L1-anjo5726.cloud.3: Flags [S], seq 2360612703, win 1024, options [mss 1460], length 0
01:13:48.397343 IP S1-anjo5726.cloud.50770 > L1-anjo5726.cloud.3800: Flags [S], seq 2360612703, win 1024, options [mss 1460], length 0
01:13:48.397343 IP S1-anjo5726.cloud.50770 > L1-anjo5726.cloud.1047: Flags [S], seq 2360612703, win 1024, options [mss 1460], length 0
01:13:48.397366 IP L1-anjo5726.cloud.3 > S1-anjo5726.cloud.50770: Flags [R.], seq 0, ack 2360612704, win 0, length 0
01:13:48.397377 IP L1-anjo5726.cloud.3800 > S1-anjo5726.cloud.50770: Flags [R.], seq 0, ack 2360612704, win 0, length 0
01:13:48.397381 IP L1-anjo5726.cloud.1047 > S1-anjo5726.cloud.50770: Flags [R.], seq 0, ack 2360612704, win 0, length 0
01:13:48.397389 IP S1-anjo5726.cloud.50770 > L1-anjo5726.cloud.9081: Flags [S], seq 2360612703, win 1024, options [mss 1460], length 0
01:13:48.397389 IP S1-anjo5726.cloud.50770 > L1-anjo5726.cloud.49161: Flags [S], seq 2360612703, win 1024, options [mss 1460], length 0
01:13:48.397389 IP S1-anjo5726.cloud.50770 > L1-anjo5726.cloud.6123: Flags [S], seq 2360612703, win 1024, options [mss 1460], length 0
01:13:48.397389 IP S1-anjo5726.cloud.50770 > L1-anjo5726.cloud.8500: Flags [S], seq 2360612703, win 1024, options [mss 1460], length 0
01:13:48.397411 IP L1-anjo5726.cloud.9081 > S1-anjo5726.cloud.50770: Flags [R.], seq 0, ack 2360612704, win 0, length 0
01:13:48.397426 IP L1-anjo5726.cloud.49161 > S1-anjo5726.cloud.50770: Flags [R.], seq 0, ack 2360612704, win 0, length 0
01:13:48.397431 IP L1-anjo5726.cloud.6123 > S1-anjo5726.cloud.50770: Flags [R.], seq 0, ack 2360612704, win 0, length 0
01:13:48.397435 IP L1-anjo5726.cloud.8500 > S1-anjo5726.cloud.50770: Flags [R.], seq 0, ack 2360612704, win 0, length 0
01:13:48.397440 IP S1-anjo5726.cloud.50770 > L1-anjo5726.cloud.8001: Flags [S], seq 2360612703, win 1024, options [mss 1460], length 0
01:13:48.397440 IP S1-anjo5726.cloud.50770 > L1-anjo5726.cloud.2800: Flags [S], seq 2360612703, win 1024, options [mss 1460], length 0
01:13:48.397440 IP S1-anjo5726.cloud.50770 > L1-anjo5726.cloud.7200: Flags [S], seq 2360612703, win 1024, options [mss 1460], length 0
01:13:48.397446 IP L1-anjo5726.cloud.8001 > S1-anjo5726.cloud.50770: Flags [R.], seq 0, ack 2360612704, win 0, length 0
01:13:48.397476 IP L1-anjo5726.cloud.2800 > S1-anjo5726.cloud.50770: Flags [R.], seq 0, ack 2360612704, win 0, length 0
01:13:48.397480 IP L1-anjo5726.cloud.7200 > S1-anjo5726.cloud.50770: Flags [R.], seq 0, ack 2360612704, win 0, length 0
01:13:48.397487 IP S1-anjo5726.cloud.50770 > L1-anjo5726.cloud.2701: Flags [S], seq 2360612703, win 1024, options [mss 1460], length 0
01:13:48.397487 IP S1-anjo5726.cloud.50770 > L1-anjo5726.cloud.18988: Flags [S], seq 2360612703, win 1024, options [mss 1460], length 0
01:13:48.397487 IP S1-anjo5726.cloud.50770 > L1-anjo5726.cloud.1097: Flags [S], seq 2360612703, win 1024, options [mss 1460], length 0
01:13:48.397487 IP S1-anjo5726.cloud.50770 > L1-anjo5726.cloud.1000: Flags [S], seq 2360612703, win 1024, options [mss 1460], length 0
01:13:48.397487 IP S1-anjo5726.cloud.50770 > L1-anjo5726.cloud.5030: Flags [S], seq 2360612703, win 1024, options [mss 1460], length 0
01:13:48.397509 IP L1-anjo5726.cloud.2701 > S1-anjo5726.cloud.50770: Flags [R.], seq 0, ack 2360612704, win 0, length 0
01:13:48.397521 IP L1-anjo5726.cloud.18988 > S1-anjo5726.cloud.50770: Flags [R.], seq 0, ack 2360612704, win 0, length 0
01:13:48.397526 IP L1-anjo5726.cloud.1097 > S1-anjo5726.cloud.50770: Flags [R.], seq 0, ack 2360612704, win 0, length 0
01:13:48.397530 IP L1-anjo5726.cloud.1000 > S1-anjo5726.cloud.50770: Flags [R.], seq 0, ack 2360612704, win 0, length 0
01:13:48.397533 IP L1-anjo5726.cloud.5030 > S1-anjo5726.cloud.50770: Flags [R.], seq 0, ack 2360612704, win 0, length 0
01:13:48.397539 IP S1-anjo5726.cloud.50770 > L1-anjo5726.cloud.1719: Flags [S], seq 2360612703, win 1024, options [mss 1460], length 0
01:13:48.397539 IP S1-anjo5726.cloud.50770 > L1-anjo5726.cloud.144: Flags [S], seq 2360612703, win 1024, options [mss 1460], length 0
01:13:48.397539 IP S1-anjo5726.cloud.50770 > L1-anjo5726.cloud.8000: Flags [S], seq 2360612703, win 1024, options [mss 1460], length 0
01:13:48.397539 IP S1-anjo5726.cloud.50770 > L1-anjo5726.cloud.3001: Flags [S], seq 2360612703, win 1024, options [mss 1460], length 0
01:13:48.397545 IP L1-anjo5726.cloud.1719 > S1-anjo5726.cloud.50770: Flags [R.], seq 0, ack 2360612704, win 0, length 0
01:13:48.397549 IP L1-anjo5726.cloud.144 > S1-anjo5726.cloud.50770: Flags [R.], seq 0, ack 2360612704, win 0, length 0
01:13:48.397553 IP L1-anjo5726.cloud.8000 > S1-anjo5726.cloud.50770: Flags [R.], seq 0, ack 2360612704, win 0, length 0
01:13:48.397557 IP L1-anjo5726.cloud.3001 > S1-anjo5726.cloud.50770: Flags [R.], seq 0, ack 2360612704, win 0, length 0
01:13:48.397607 IP S1-anjo5726.cloud.50770 > L1-anjo5726.cloud.49160: Flags [S], seq 2360612703, win 1024, options [mss 1460], length 0
01:13:48.397607 IP S1-anjo5726.cloud.50770 > L1-anjo5726.cloud.32780: Flags [S], seq 2360612703, win 1024, options [mss 1460], length 0
01:13:48.397607 IP S1-anjo5726.cloud.50770 > L1-anjo5726.cloud.5004: Flags [S], seq 2360612703, win 1024, options [mss 1460], length 0
01:13:48.397607 IP S1-anjo5726.cloud.50770 > L1-anjo5726.cloud.8085: Flags [S], seq 2360612703, win 1024, options [mss 1460], length 0
01:13:48.397607 IP S1-anjo5726.cloud.50770 > L1-anjo5726.cloud.1061: Flags [S], seq 2360612703, win 1024, options [mss 1460], length 0
01:13:48.397607 IP S1-anjo5726.cloud.50770 > L1-anjo5726.cloud.1782: Flags [S], seq 2360612703, win 1024, options [mss 1460], length 0
01:13:48.397607 IP S1-anjo5726.cloud.50770 > L1-anjo5726.cloud.10621: Flags [S], seq 2360612703, win 1024, options [mss 1460], length 0
01:13:48.397617 IP L1-anjo5726.cloud.49160 > S1-anjo5726.cloud.50770: Flags [R.], seq 0, ack 2360612704, win 0, length 0
01:13:48.397630 IP L1-anjo5726.cloud.32780 > S1-anjo5726.cloud.50770: Flags [R.], seq 0, ack 2360612704, win 0, length 0
01:13:48.397634 IP L1-anjo5726.cloud.5004 > S1-anjo5726.cloud.50770: Flags [R.], seq 0, ack 2360612704, win 0, length 0
01:13:48.397639 IP L1-anjo5726.cloud.8085 > S1-anjo5726.cloud.50770: Flags [R.], seq 0, ack 2360612704, win 0, length 0
01:13:48.397642 IP L1-anjo5726.cloud.1061 > S1-anjo5726.cloud.50770: Flags [R.], seq 0, ack 2360612704, win 0, length 0
01:13:48.397657 IP L1-anjo5726.cloud.1782 > S1-anjo5726.cloud.50770: Flags [R.], seq 0, ack 2360612704, win 0, length 0
01:13:48.397677 IP L1-anjo5726.cloud.10621 > S1-anjo5726.cloud.50770: Flags [R.], seq 0, ack 2360612704, win 0, length 0
01:13:48.397685 IP S1-anjo5726.cloud.50770 > L1-anjo5726.cloud.2003: Flags [S], seq 2360612703, win 1024, options [mss 1460], length 0
01:13:48.397686 IP S1-anjo5726.cloud.50770 > L1-anjo5726.cloud.1069: Flags [S], seq 2360612703, win 1024, options [mss 1460], length 0
01:13:48.397686 IP S1-anjo5726.cloud.50770 > L1-anjo5726.cloud.1272: Flags [S], seq 2360612703, win 1024, options [mss 1460], length 0
01:13:48.397686 IP S1-anjo5726.cloud.50770 > L1-anjo5726.cloud.3052: Flags [S], seq 2360612703, win 1024, options [mss 1460], length 0
01:13:48.397686 IP S1-anjo5726.cloud.50770 > L1-anjo5726.cloud.1783: Flags [S], seq 2360612703, win 1024, options [mss 1460], length 0
01:13:48.397686 IP S1-anjo5726.cloud.50770 > L1-anjo5726.cloud.340: Flags [S], seq 2360612703, win 1024, options [mss 1460], length 0
01:13:48.397686 IP S1-anjo5726.cloud.50770 > L1-anjo5726.cloud.5002: Flags [S], seq 2360612703, win 1024, options [mss 1460], length 0
01:13:48.397700 IP L1-anjo5726.cloud.2003 > S1-anjo5726.cloud.50770: Flags [R.], seq 0, ack 2360612704, win 0, length 0
01:13:48.397712 IP L1-anjo5726.cloud.1069 > S1-anjo5726.cloud.50770: Flags [R.], seq 0, ack 2360612704, win 0, length 0
01:13:48.397716 IP L1-anjo5726.cloud.1272 > S1-anjo5726.cloud.50770: Flags [R.], seq 0, ack 2360612704, win 0, length 0
01:13:48.397720 IP L1-anjo5726.cloud.3052 > S1-anjo5726.cloud.50770: Flags [R.], seq 0, ack 2360612704, win 0, length 0
01:13:48.397724 IP L1-anjo5726.cloud.1783 > S1-anjo5726.cloud.50770: Flags [R.], seq 0, ack 2360612704, win 0, length 0
01:13:48.397727 IP L1-anjo5726.cloud.340 > S1-anjo5726.cloud.50770: Flags [R.], seq 0, ack 2360612704, win 0, length 0
01:13:48.397731 IP L1-anjo5726.cloud.5002 > S1-anjo5726.cloud.50770: Flags [R.], seq 0, ack 2360612704, win 0, length 0
01:13:48.398207 IP S1-anjo5726.cloud.50770 > L1-anjo5726.cloud.7920: Flags [S], seq 2360612703, win 1024, options [mss 1460], length 0
01:13:48.398207 IP S1-anjo5726.cloud.50770 > L1-anjo5726.cloud.7402: Flags [S], seq 2360612703, win 1024, options [mss 1460], length 0
01:13:48.398207 IP S1-anjo5726.cloud.50770 > L1-anjo5726.cloud.1078: Flags [S], seq 2360612703, win 1024, options [mss 1460], length 0
01:13:48.398207 IP S1-anjo5726.cloud.50770 > L1-anjo5726.cloud.5510: Flags [S], seq 2360612703, win 1024, options [mss 1460], length 0
01:13:48.398208 IP S1-anjo5726.cloud.50770 > L1-anjo5726.cloud.5225: Flags [S], seq 2360612703, win 1024, options [mss 1460], length 0
01:13:48.398235 IP L1-anjo5726.cloud.7920 > S1-anjo5726.cloud.50770: Flags [R.], seq 0, ack 2360612704, win 0, length 0
01:13:48.398251 IP L1-anjo5726.cloud.7402 > S1-anjo5726.cloud.50770: Flags [R.], seq 0, ack 2360612704, win 0, length 0
01:13:48.398255 IP L1-anjo5726.cloud.1078 > S1-anjo5726.cloud.50770: Flags [R.], seq 0, ack 2360612704, win 0, length 0
01:13:48.398259 IP L1-anjo5726.cloud.5510 > S1-anjo5726.cloud.50770: Flags [R.], seq 0, ack 2360612704, win 0, length 0
01:13:48.398263 IP L1-anjo5726.cloud.5225 > S1-anjo5726.cloud.50770: Flags [R.], seq 0, ack 2360612704, win 0, length 0
01:13:48.398269 IP S1-anjo5726.cloud.50770 > L1-anjo5726.cloud.5200: Flags [S], seq 2360612703, win 1024, options [mss 1460], length 0
01:13:48.398269 IP S1-anjo5726.cloud.50770 > L1-anjo5726.cloud.32777: Flags [S], seq 2360612703, win 1024, options [mss 1460], length 0
01:13:48.398270 IP S1-anjo5726.cloud.50770 > L1-anjo5726.cloud.bgp: Flags [S], seq 2360612703, win 1024, options [mss 1460], length 0
01:13:48.398270 IP S1-anjo5726.cloud.50770 > L1-anjo5726.cloud.888: Flags [S], seq 2360612703, win 1024, options [mss 1460], length 0
01:13:48.398276 IP L1-anjo5726.cloud.5200 > S1-anjo5726.cloud.50770: Flags [R.], seq 0, ack 2360612704, win 0, length 0
01:13:48.398281 IP L1-anjo5726.cloud.32777 > S1-anjo5726.cloud.50770: Flags [R.], seq 0, ack 2360612704, win 0, length 0
01:13:48.398285 IP L1-anjo5726.cloud.bgp > S1-anjo5726.cloud.50770: Flags [R.], seq 0, ack 2360612704, win 0, length 0
01:13:48.398289 IP L1-anjo5726.cloud.888 > S1-anjo5726.cloud.50770: Flags [R.], seq 0, ack 2360612704, win 0, length 0
01:13:48.398337 IP S1-anjo5726.cloud.50770 > L1-anjo5726.cloud.1086: Flags [S], seq 2360612703, win 1024, options [mss 1460], length 0
01:13:48.398337 IP S1-anjo5726.cloud.50770 > L1-anjo5726.cloud.rmtcfg: Flags [S], seq 2360612703, win 1024, options [mss 1460], length 0
01:13:48.398337 IP S1-anjo5726.cloud.50770 > L1-anjo5726.cloud.7911: Flags [S], seq 2360612703, win 1024, options [mss 1460], length 0
01:13:48.398337 IP S1-anjo5726.cloud.50770 > L1-anjo5726.cloud.gsigatekeeper: Flags [S], seq 2360612703, win 1024, options [mss 1460], length 0
01:13:48.398337 IP S1-anjo5726.cloud.50770 > L1-anjo5726.cloud.6789: Flags [S], seq 2360612703, win 1024, options [mss 1460], length 0
01:13:48.398337 IP S1-anjo5726.cloud.50770 > L1-anjo5726.cloud.2008: Flags [S], seq 2360612703, win 1024, options [mss 1460], length 0
01:13:48.398337 IP S1-anjo5726.cloud.50770 > L1-anjo5726.cloud.1011: Flags [S], seq 2360612703, win 1024, options [mss 1460], length 0
01:13:48.398337 IP S1-anjo5726.cloud.50770 > L1-anjo5726.cloud.497: Flags [S], seq 2360612703, win 1024, options [mss 1460], length 0
01:13:48.398349 IP L1-anjo5726.cloud.1086 > S1-anjo5726.cloud.50770: Flags [R.], seq 0, ack 2360612704, win 0, length 0
01:13:48.398374 IP L1-anjo5726.cloud.rmtcfg > S1-anjo5726.cloud.50770: Flags [R.], seq 0, ack 2360612704, win 0, length 0
01:13:48.398379 IP L1-anjo5726.cloud.7911 > S1-anjo5726.cloud.50770: Flags [R.], seq 0, ack 2360612704, win 0, length 0
01:13:48.398384 IP L1-anjo5726.cloud.gsigatekeeper > S1-anjo5726.cloud.50770: Flags [R.], seq 0, ack 2360612704, win 0, length 0
01:13:48.398388 IP L1-anjo5726.cloud.6789 > S1-anjo5726.cloud.50770: Flags [R.], seq 0, ack 2360612704, win 0, length 0
01:13:48.398392 IP L1-anjo5726.cloud.2008 > S1-anjo5726.cloud.50770: Flags [R.], seq 0, ack 2360612704, win 0, length 0
01:13:48.398396 IP L1-anjo5726.cloud.1011 > S1-anjo5726.cloud.50770: Flags [R.], seq 0, ack 2360612704, win 0, length 0
01:13:48.398400 IP L1-anjo5726.cloud.497 > S1-anjo5726.cloud.50770: Flags [R.], seq 0, ack 2360612704, win 0, length 0
01:13:48.398404 IP S1-anjo5726.cloud.50770 > L1-anjo5726.cloud.7025: Flags [S], seq 2360612703, win 1024, options [mss 1460], length 0
01:13:48.398404 IP S1-anjo5726.cloud.50770 > L1-anjo5726.cloud.4001: Flags [S], seq 2360612703, win 1024, options [mss 1460], length 0
01:13:48.398409 IP L1-anjo5726.cloud.7025 > S1-anjo5726.cloud.50770: Flags [R.], seq 0, ack 2360612704, win 0, length 0
01:13:48.398414 IP L1-anjo5726.cloud.4001 > S1-anjo5726.cloud.50770: Flags [R.], seq 0, ack 2360612704, win 0, length 0
01:13:48.398446 IP S1-anjo5726.cloud.50770 > L1-anjo5726.cloud.30000: Flags [S], seq 2360612703, win 1024, options [mss 1460], length 0
01:13:48.398446 IP S1-anjo5726.cloud.50770 > L1-anjo5726.cloud.7625: Flags [S], seq 2360612703, win 1024, options [mss 1460], length 0
01:13:48.398446 IP S1-anjo5726.cloud.50770 > L1-anjo5726.cloud.49156: Flags [S], seq 2360612703, win 1024, options [mss 1460], length 0
01:13:48.398446 IP S1-anjo5726.cloud.50770 > L1-anjo5726.cloud.ospfd: Flags [S], seq 2360612703, win 1024, options [mss 1460], length 0
01:13:48.398446 IP S1-anjo5726.cloud.50770 > L1-anjo5726.cloud.6779: Flags [S], seq 2360612703, win 1024, options [mss 1460], length 0
01:13:48.398446 IP S1-anjo5726.cloud.50770 > L1-anjo5726.cloud.1030: Flags [S], seq 2360612703, win 1024, options [mss 1460], length 0
01:13:48.398447 IP S1-anjo5726.cloud.50770 > L1-anjo5726.cloud.64623: Flags [S], seq 2360612703, win 1024, options [mss 1460], length 0
01:13:48.398447 IP S1-anjo5726.cloud.50770 > L1-anjo5726.cloud.33: Flags [S], seq 2360612703, win 1024, options [mss 1460], length 0
01:13:48.398456 IP L1-anjo5726.cloud.30000 > S1-anjo5726.cloud.50770: Flags [R.], seq 0, ack 2360612704, win 0, length 0
01:13:48.398468 IP L1-anjo5726.cloud.7625 > S1-anjo5726.cloud.50770: Flags [R.], seq 0, ack 2360612704, win 0, length 0
01:13:48.398473 IP L1-anjo5726.cloud.49156 > S1-anjo5726.cloud.50770: Flags [R.], seq 0, ack 2360612704, win 0, length 0
01:13:48.398477 IP L1-anjo5726.cloud.ospfd > S1-anjo5726.cloud.50770: Flags [R.], seq 0, ack 2360612704, win 0, length 0
01:13:48.398480 IP L1-anjo5726.cloud.6779 > S1-anjo5726.cloud.50770: Flags [R.], seq 0, ack 2360612704, win 0, length 0
01:13:48.398484 IP L1-anjo5726.cloud.1030 > S1-anjo5726.cloud.50770: Flags [R.], seq 0, ack 2360612704, win 0, length 0
01:13:48.398488 IP L1-anjo5726.cloud.64623 > S1-anjo5726.cloud.50770: Flags [R.], seq 0, ack 2360612704, win 0, length 0
01:13:48.398491 IP L1-anjo5726.cloud.33 > S1-anjo5726.cloud.50770: Flags [R.], seq 0, ack 2360612704, win 0, length 0
01:13:48.398505 IP S1-anjo5726.cloud.50770 > L1-anjo5726.cloud.ftp-data: Flags [S], seq 2360612703, win 1024, options [mss 1460], length 0
01:13:48.398511 IP L1-anjo5726.cloud.ftp-data > S1-anjo5726.cloud.50770: Flags [R.], seq 0, ack 2360612704, win 0, length 0
01:13:48.398542 IP S1-anjo5726.cloud.50770 > L1-anjo5726.cloud.259: Flags [S], seq 2360612703, win 1024, options [mss 1460], length 0
01:13:48.398542 IP S1-anjo5726.cloud.50770 > L1-anjo5726.cloud.9071: Flags [S], seq 2360612703, win 1024, options [mss 1460], length 0
01:13:48.398542 IP S1-anjo5726.cloud.50770 > L1-anjo5726.cloud.1081: Flags [S], seq 2360612703, win 1024, options [mss 1460], length 0
01:13:48.398542 IP S1-anjo5726.cloud.50770 > L1-anjo5726.cloud.1875: Flags [S], seq 2360612703, win 1024, options [mss 1460], length 0
01:13:48.398542 IP S1-anjo5726.cloud.50770 > L1-anjo5726.cloud.49155: Flags [S], seq 2360612703, win 1024, options [mss 1460], length 0
01:13:48.398543 IP S1-anjo5726.cloud.50770 > L1-anjo5726.cloud.6580: Flags [S], seq 2360612703, win 1024, options [mss 1460], length 0
01:13:48.398543 IP S1-anjo5726.cloud.50770 > L1-anjo5726.cloud.4343: Flags [S], seq 2360612703, win 1024, options [mss 1460], length 0
