01:13:47.865387 ARP, Request who-has L1-anjo5726.cloud tell S1-anjo5726.cloud, length 28
01:13:47.866078 ARP, Reply L1-anjo5726.cloud is-at 02:00:ac:10:00:10 (oui Unknown), length 28
01:13:47.866764 IP S1-anjo5726.cloud.44812 > router1.cloud.domain: 15526+ PTR? 16.0.16.172.in-addr.arpa. (42)
01:13:47.867931 IP router1.cloud.domain > S1-anjo5726.cloud.44812: 15526* 1/0/0 PTR L1-anjo5726.cloud. (73)
01:13:47.868703 IP S1-anjo5726.cloud.50770 > L1-anjo5726.cloud.http: Flags [S], seq 2360612703, win 1024, options [mss 1460], length 0
01:13:47.868733 IP S1-anjo5726.cloud.50770 > L1-anjo5726.cloud.ms-wbt-server: Flags [S], seq 2360612703, win 1024, options [mss 1460], length 0
01:13:47.868745 IP S1-anjo5726.cloud.50770 > L1-anjo5726.cloud.5900: Flags [S], seq 2360612703, win 1024, options [mss 1460], length 0
01:13:47.868755 IP S1-anjo5726.cloud.50770 > L1-anjo5726.cloud.domain: Flags [S], seq 2360612703, win 1024, options [mss 1460], length 0
01:13:47.868766 IP S1-anjo5726.cloud.50770 > L1-anjo5726.cloud.smtp: Flags [S], seq 2360612703, win 1024, options [mss 1460], length 0
01:13:47.868776 IP S1-anjo5726.cloud.50770 > L1-anjo5726.cloud.netbios-ssn: Flags [S], seq 2360612703, win 1024, options [mss 1460], length 0
01:13:47.868788 IP S1-anjo5726.cloud.50770 > L1-anjo5726.cloud.telnet: Flags [S], seq 2360612703, win 1024, options [mss 1460], length 0
01:13:47.868801 IP S1-anjo5726.cloud.50770 > L1-anjo5726.cloud.rtsp: Flags [S], seq 2360612703, win 1024, options [mss 1460], length 0
01:13:47.868821 IP S1-anjo5726.cloud.50770 > L1-anjo5726.cloud.mysql: Flags [S], seq 2360612703, win 1024, options [mss 1460], length 0
01:13:47.868844 IP S1-anjo5726.cloud.50770 > L1-anjo5726.cloud.auth: Flags [S], seq 2360612703, win 1024, options [mss 1460], length 0
01:13:47.869192 IP L1-anjo5726.cloud.http > S1-anjo5726.cloud.50770: Flags [S.], seq 3520678766, ack 2360612704, win 64240, options [mss 1460], length 0
01:13:47.869194 IP L1-anjo5726.cloud.ms-wbt-server > S1-anjo5726.cloud.50770: Flags [R.], seq 0, ack 2360612704, win 0, length 0
01:13:47.869196 IP L1-anjo5726.cloud.5900 > S1-anjo5726.cloud.50770: Flags [R.], seq 0, ack 2360612704, win 0, length 0
01:13:47.869197 IP L1-anjo5726.cloud.domain > S1-anjo5726.cloud.50770: Flags [S.], seq 3933515294, ack 2360612704, win 64240, options [mss 1460], length 0
01:13:47.869199 IP L1-anjo5726.cloud.smtp > S1-anjo5726.cloud.50770: Flags [S.], seq 1063155599, ack 2360612704, win 64240, options [mss 1460], length 0
01:13:47.869201 IP L1-anjo5726.cloud.netbios-ssn > S1-anjo5726.cloud.50770: Flags [R.], seq 0, ack 2360612704, win 0, length 0
01:13:47.869202 IP L1-anjo5726.cloud.telnet > S1-anjo5726.cloud.50770: Flags [R.], seq 0, ack 2360612704, win 0, length 0
01:13:47.869225 IP S1-anjo5726.cloud.50770 > L1-anjo5726.cloud.http: Flags [R], seq 2360612704, win 0, length 0
01:13:47.869256 IP S1-anjo5726.cloud.50770 > L1-anjo5726.cloud.domain: Flags [R], seq 2360612704, win 0, length 0
01:13:47.869270 IP S1-anjo5726.cloud.50770 > L1-anjo5726.cloud.smtp: Flags [R], seq 2360612704, win 0, length 0
01:13:47.869303 IP L1-anjo5726.cloud.rtsp > S1-anjo5726.cloud.50770: Flags [R.], seq 0, ack 2360612704, win 0, length 0
01:13:47.869304 IP L1-anjo5726.cloud.mysql > S1-anjo5726.cloud.50770: Flags [R.], seq 0, ack 2360612704, win 0, length 0
01:13:47.869305 IP L1-anjo5726.cloud.auth > S1-anjo5726.cloud.50770: Flags [R.], seq 0, ack 2360612704, win 0, length 0
01:13:47.869424 IP S1-anjo5726.cloud.50770 > L1-anjo5726.cloud.https: Flags [S], seq 2360612703, win 1024, options [mss 1460], length 0
01:13:47.869448 IP S1-anjo5726.cloud.50770 > L1-anjo5726.cloud.submission: Flags [S], seq 2360612703, win 1024, options [mss 1460], length 0
01:13:47.869460 IP S1-anjo5726.cloud.50770 > L1-anjo5726.cloud.1723: Flags [S], seq 2360612703, win 1024, options [mss 1460], length 0
01:13:47.869471 IP S1-anjo5726.cloud.50770 > L1-anjo5726.cloud.smux: Flags [S], seq 2360612703, win 1024, options [mss 1460], length 0
01:13:47.869483 IP S1-anjo5726.cloud.50770 > L1-anjo5726.cloud.ssh: Flags [S], seq 2360612703, win 1024, options [mss 1460], length 0
01:13:47.869493 IP S1-anjo5726.cloud.50770 > L1-anjo5726.cloud.sunrpc: Flags [S], seq 2360612703, win 1024, options [mss 1460], length 0
01:13:47.869503 IP S1-anjo5726.cloud.50770 > L1-anjo5726.cloud.8888: Flags [S], seq 2360612703, win 1024, options [mss 1460], length 0
01:13:47.869513 IP S1-anjo5726.cloud.50770 > L1-anjo5726.cloud.microsoft-ds: Flags [S], seq 2360612703, win 1024, options [mss 1460], length 0
01:13:47.869523 IP S1-anjo5726.cloud.50770 > L1-anjo5726.cloud.imaps: Flags [S], seq 2360612703, win 1024, options [mss 1460], length 0
01:13:47.869534 IP S1-anjo5726.cloud.50770 > L1-anjo5726.cloud.1720: Flags [S], seq 2360612703, win 1024, options [mss 1460], length 0
01:13:47.869544 IP S1-anjo5726.cloud.50770 > L1-anjo5726.cloud.1025: Flags [S], seq 2360612703, win 1024, options [mss 1460], length 0
01:13:47.869555 IP S1-anjo5726.cloud.50770 > L1-anjo5726.cloud.256: Flags [S], seq 2360612703, win 1024, options [mss 1460], length 0
01:13:47.869566 IP S1-anjo5726.cloud.50770 > L1-anjo5726.cloud.pop3s: Flags [S], seq 2360612703, win 1024, options [mss 1460], length 0
01:13:47.869576 IP S1-anjo5726.cloud.50770 > L1-anjo5726.cloud.imap2: Flags [S], seq 2360612703, win 1024, options [mss 1460], length 0
01:13:47.869587 IP S1-anjo5726.cloud.50770 > L1-anjo5726.cloud.ftp: Flags [S], seq 2360612703, win 1024, options [mss 1460], length 0
01:13:47.869597 IP S1-anjo5726.cloud.50770 > L1-anjo5726.cloud.pop3: Flags [S], seq 2360612703, win 1024, options [mss 1460], length 0
01:13:47.869607 IP S1-anjo5726.cloud.50770 > L1-anjo5726.cloud.epmap: Flags [S], seq 2360612703, win 1024, options [mss 1460], length 0
01:13:47.869617 IP S1-anjo5726.cloud.50770 > L1-anjo5726.cloud.http-alt: Flags [S], seq 2360612703, win 1024, options [mss 1460], length 0
01:13:47.869628 IP S1-anjo5726.cloud.50770 > L1-anjo5726.cloud.1900: Flags [S], seq 2360612703, win 1024, options [mss 1460], length 0
01:13:47.869639 IP S1-anjo5726.cloud.50770 > L1-anjo5726.cloud.2500: Flags [S], seq 2360612703, win 1024, options [mss 1460], length 0
01:13:47.869806 IP L1-anjo5726.cloud.https > S1-anjo5726.cloud.50770: Flags [R.], seq 0, ack 2360612704, win 0, length 0
01:13:47.869807 IP L1-anjo5726.cloud.submission > S1-anjo5726.cloud.50770: Flags [R.], seq 0, ack 2360612704, win 0, length 0
01:13:47.869809 IP L1-anjo5726.cloud.1723 > S1-anjo5726.cloud.50770: Flags [R.], seq 0, ack 2360612704, win 0, length 0
01:13:47.869810 IP L1-anjo5726.cloud.smux > S1-anjo5726.cloud.50770: Flags [R.], seq 0, ack 2360612704, win 0, length 0
01:13:47.869810 IP L1-anjo5726.cloud.ssh > S1-anjo5726.cloud.50770: Flags [S.], seq 575082087, ack 2360612704, win 64240, options [mss 1460], length 0
01:13:47.869812 IP L1-anjo5726.cloud.sunrpc > S1-anjo5726.cloud.50770: Flags [S.], seq 236041486, ack 2360612704, win 64240, options [mss 1460], length 0
01:13:47.869826 IP L1-anjo5726.cloud.8888 > S1-anjo5726.cloud.50770: Flags [R.], seq 0, ack 2360612704, win 0, length 0
01:13:47.869828 IP L1-anjo5726.cloud.microsoft-ds > S1-anjo5726.cloud.50770: Flags [R.], seq 0, ack 2360612704, win 0, length 0
01:13:47.869842 IP S1-anjo5726.cloud.50770 > L1-anjo5726.cloud.ssh: Flags [R], seq 2360612704, win 0, length 0
01:13:47.869852 IP S1-anjo5726.cloud.50770 > L1-anjo5726.cloud.sunrpc: Flags [R], seq 2360612704, win 0, length 0
01:13:47.869950 IP L1-anjo5726.cloud.imaps > S1-anjo5726.cloud.50770: Flags [R.], seq 0, ack 2360612704, win 0, length 0
01:13:47.869951 IP L1-anjo5726.cloud.1720 > S1-anjo5726.cloud.50770: Flags [R.], seq 0, ack 2360612704, win 0, length 0
01:13:47.869952 IP L1-anjo5726.cloud.1025 > S1-anjo5726.cloud.50770: Flags [R.], seq 0, ack 2360612704, win 0, length 0
01:13:47.869953 IP L1-anjo5726.cloud.256 > S1-anjo5726.cloud.50770: Flags [R.], seq 0, ack 2360612704, win 0, length 0
01:13:47.869955 IP L1-anjo5726.cloud.pop3s > S1-anjo5726.cloud.50770: Flags [R.], seq 0, ack 2360612704, win 0, length 0
01:13:47.869956 IP L1-anjo5726.cloud.imap2 > S1-anjo5726.cloud.50770: Flags [R.], seq 0, ack 2360612704, win 0, length 0
01:13:47.869957 IP L1-anjo5726.cloud.ftp > S1-anjo5726.cloud.50770: Flags [S.], seq 3650572619, ack 2360612704, win 64240, options [mss 1460], length 0
01:13:47.869958 IP L1-anjo5726.cloud.pop3 > S1-anjo5726.cloud.50770: Flags [R.], seq 0, ack 2360612704, win 0, length 0
01:13:47.869970 IP S1-anjo5726.cloud.50770 > L1-anjo5726.cloud.ftp: Flags [R], seq 2360612704, win 0, length 0
01:13:47.869988 IP L1-anjo5726.cloud.epmap > S1-anjo5726.cloud.50770: Flags [R.], seq 0, ack 2360612704, win 0, length 0
01:13:47.869990 IP L1-anjo5726.cloud.http-alt > S1-anjo5726.cloud.50770: Flags [R.], seq 0, ack 2360612704, win 0, length 0
01:13:47.869990 IP L1-anjo5726.cloud.1900 > S1-anjo5726.cloud.50770: Flags [R.], seq 0, ack 2360612704, win 0, length 0
01:13:47.869991 IP L1-anjo5726.cloud.2500 > S1-anjo5726.cloud.50770: Flags [R.], seq 0, ack 2360612704, win 0, length 0
01:13:47.870158 IP S1-anjo5726.cloud.50770 > L1-anjo5726.cloud.4321: Flags [S], seq 2360612703, win 1024, options [mss 1460], length 0
01:13:47.870181 IP S1-anjo5726.cloud.50770 > L1-anjo5726.cloud.10629: Flags [S], seq 2360612703, win 1024, options [mss 1460], length 0
01:13:47.870192 IP S1-anjo5726.cloud.50770 > L1-anjo5726.cloud.12000: Flags [S], seq 2360612703, win 1024, options [mss 1460], length 0
01:13:47.870203 IP S1-anjo5726.cloud.50770 > L1-anjo5726.cloud.9100: Flags [S], seq 2360612703, win 1024, options [mss 1460], length 0
01:13:47.870213 IP S1-anjo5726.cloud.50770 > L1-anjo5726.cloud.gnutella-svc: Flags [S], seq 2360612703, win 1024, options [mss 1460], length 0
01:13:47.870224 IP S1-anjo5726.cloud.50770 > L1-anjo5726.cloud.5859: Flags [S], seq 2360612703, win 1024, options [mss 1460], length 0
01:13:47.870234 IP S1-anjo5726.cloud.50770 > L1-anjo5726.cloud.5050: Flags [S], seq 2360612703, win 1024, options [mss 1460], length 0
01:13:47.870245 IP S1-anjo5726.cloud.50770 > L1-anjo5726.cloud.bacula-fd: Flags [S], seq 2360612703, win 1024, options [mss 1460], length 0
01:13:47.870256 IP S1-anjo5726.cloud.50770 > L1-anjo5726.cloud.1100: Flags [S], seq 2360612703, win 1024, options [mss 1460], length 0
01:13:47.870266 IP S1-anjo5726.cloud.50770 > L1-anjo5726.cloud.7019: Flags [S], seq 2360612703, win 1024, options [mss 1460], length 0
01:13:47.870333 IP L1-anjo5726.cloud.4321 > S1-anjo5726.cloud.50770: Flags [R.], seq 0, ack 2360612704, win 0, length 0
01:13:47.870334 IP L1-anjo5726.cloud.10629 > S1-anjo5726.cloud.50770: Flags [R.], seq 0, ack 2360612704, win 0, length 0
01:13:47.870336 IP L1-anjo5726.cloud.12000 > S1-anjo5726.cloud.50770: Flags [R.], seq 0, ack 2360612704, win 0, length 0
01:13:47.870353 IP L1-anjo5726.cloud.9100 > S1-anjo5726.cloud.50770: Flags [R.], seq 0, ack 2360612704, win 0, length 0
01:13:47.870360 IP L1-anjo5726.cloud.gnutella-svc > S1-anjo5726.cloud.50770: Flags [R.], seq 0, ack 2360612704, win 0, length 0
01:13:47.870366 IP L1-anjo5726.cloud.5859 > S1-anjo5726.cloud.50770: Flags [R.], seq 0, ack 2360612704, win 0, length 0
01:13:47.870367 IP L1-anjo5726.cloud.5050 > S1-anjo5726.cloud.50770: Flags [R.], seq 0, ack 2360612704, win 0, length 0
01:13:47.870378 IP L1-anjo5726.cloud.bacula-fd > S1-anjo5726.cloud.50770: Flags [R.], seq 0, ack 2360612704, win 0, length 0
01:13:47.870384 IP S1-anjo5726.cloud.50770 > L1-anjo5726.cloud.10004: Flags [S], seq 2360612703, win 1024, options [mss 1460], length 0
01:13:47.870408 IP S1-anjo5726.cloud.50770 > L1-anjo5726.cloud.1199: Flags [S], seq 2360612703, win 1024, options [mss 1460], length 0
01:13:47.870435 IP S1-anjo5726.cloud.50770 > L1-anjo5726.cloud.3003: Flags [S], seq 2360612703, win 1024, options [mss 1460], length 0
01:13:47.870462 IP L1-anjo5726.cloud.1100 > S1-anjo5726.cloud.50770: Flags [R.], seq 0, ack 2360612704, win 0, length 0
01:13:47.870463 IP L1-anjo5726.cloud.7019 > S1-anjo5726.cloud.50770: Flags [R.], seq 0, ack 2360612704, win 0, length 0
01:13:47.870497 IP S1-anjo5726.cloud.50770 > L1-anjo5726.cloud.discard: Flags [S], seq 2360612703, win 1024, options [mss 1460], length 0
01:13:47.870510 IP L1-anjo5726.cloud.10004 > S1-anjo5726.cloud.50770: Flags [R.], seq 0, ack 2360612704, win 0, length 0
01:13:47.870512 IP L1-anjo5726.cloud.1199 > S1-anjo5726.cloud.50770: Flags [R.], seq 0, ack 2360612704, win 0, length 0
01:13:47.870544 IP L1-anjo5726.cloud.3003 > S1-anjo5726.cloud.50770: Flags [R.], seq 0, ack 2360612704, win 0, length 0
01:13:47.870551 IP S1-anjo5726.cloud.50770 > L1-anjo5726.cloud.2161: Flags [S], seq 2360612703, win 1024, options [mss 1460], length 0
01:13:47.870573 IP L1-anjo5726.cloud.discard > S1-anjo5726.cloud.50770: Flags [R.], seq 0, ack 2360612704, win 0, length 0
01:13:47.870598 IP S1-anjo5726.cloud.50770 > L1-anjo5726.cloud.1138: Flags [S], seq 2360612703, win 1024, options [mss 1460], length 0
01:13:47.870619 IP S1-anjo5726.cloud.50770 > L1-anjo5726.cloud.15002: Flags [S], seq 2360612703, win 1024, options [mss 1460], length 0
01:13:47.870630 IP S1-anjo5726.cloud.50770 > L1-anjo5726.cloud.3920: Flags [S], seq 2360612703, win 1024, options [mss 1460], length 0
01:13:47.870640 IP S1-anjo5726.cloud.50770 > L1-anjo5726.cloud.2200: Flags [S], seq 2360612703, win 1024, options [mss 1460], length 0
01:13:47.870650 IP S1-anjo5726.cloud.50770 > L1-anjo5726.cloud.31038: Flags [S], seq 2360612703, win 1024, options [mss 1460], length 0
01:13:47.870661 IP S1-anjo5726.cloud.50770 > L1-anjo5726.cloud.27715: Flags [S], seq 2360612703, win 1024, options [mss 1460], length 0
01:13:47.870672 IP S1-anjo5726.cloud.50770 > L1-anjo5726.cloud.32781: Flags [S], seq 2360612703, win 1024, options [mss 1460], length 0
01:13:47.870683 IP S1-anjo5726.cloud.50770 > L1-anjo5726.cloud.1114: Flags [S], seq 2360612703, win 1024, options [mss 1460], length 0
01:13:47.870694 IP S1-anjo5726.cloud.50770 > L1-anjo5726.cloud.6502: Flags [S], seq 2360612703, win 1024, options [mss 1460], length 0
01:13:47.870705 IP S1-anjo5726.cloud.50770 > L1-anjo5726.cloud.3221: Flags [S], seq 2360612703, win 1024, options [mss 1460], length 0
01:13:47.870716 IP S1-anjo5726.cloud.50770 > L1-anjo5726.cloud.1123: Flags [S], seq 2360612703, win 1024, options [mss 1460], length 0
01:13:47.870726 IP S1-anjo5726.cloud.50770 > L1-anjo5726.cloud.1717: Flags [S], seq 2360612703, win 1024, options [mss 1460], length 0
01:13:47.870736 IP S1-anjo5726.cloud.50770 > L1-anjo5726.cloud.1839: Flags [S], seq 2360612703, win 1024, options [mss 1460], length 0
01:13:47.870746 IP S1-anjo5726.cloud.50770 > L1-anjo5726.cloud.8300: Flags [S], seq 2360612703, win 1024, options [mss 1460], length 0
01:13:47.870757 IP S1-anjo5726.cloud.50770 > L1-anjo5726.cloud.2106: Flags [S], seq 2360612703, win 1024, options [mss 1460], length 0
01:13:47.870767 IP S1-anjo5726.cloud.50770 > L1-anjo5726.cloud.10617: Flags [S], seq 2360612703, win 1024, options [mss 1460], length 0
01:13:47.870777 IP S1-anjo5726.cloud.50770 > L1-anjo5726.cloud.24444: Flags [S], seq 2360612703, win 1024, options [mss 1460], length 0
01:13:47.870788 IP S1-anjo5726.cloud.50770 > L1-anjo5726.cloud.90: Flags [S], seq 2360612703, win 1024, options [mss 1460], length 0
01:13:47.870799 IP S1-anjo5726.cloud.50770 > L1-anjo5726.cloud.5959: Flags [S], seq 2360612703, win 1024, options [mss 1460], length 0
01:13:47.870810 IP S1-anjo5726.cloud.50770 > L1-anjo5726.cloud.32783: Flags [S], seq 2360612703, win 1024, options [mss 1460], length 0
01:13:47.870820 IP S1-anjo5726.cloud.50770 > L1-anjo5726.cloud.5033: Flags [S], seq 2360612703, win 1024, options [mss 1460], length 0
01:13:47.870830 IP S1-anjo5726.cloud.50770 > L1-anjo5726.cloud.5000: Flags [S], seq 2360612703, win 1024, options [mss 1460], length 0
01:13:47.870840 IP S1-anjo5726.cloud.50770 > L1-anjo5726.cloud.6788: Flags [S], seq 2360612703, win 1024, options [mss 1460], length 0
01:13:47.870850 IP S1-anjo5726.cloud.50770 > L1-anjo5726.cloud.2288: Flags [S], seq 2360612703, win 1024, options [mss 1460], length 0
01:13:47.870860 IP S1-anjo5726.cloud.50770 > L1-anjo5726.cloud.1300: Flags [S], seq 2360612703, win 1024, options [mss 1460], length 0
01:13:47.870928 IP L1-anjo5726.cloud.2161 > S1-anjo5726.cloud.50770: Flags [R.], seq 0, ack 2360612704, win 0, length 0
01:13:47.870929 IP L1-anjo5726.cloud.1138 > S1-anjo5726.cloud.50770: Flags [R.], seq 0, ack 2360612704, win 0, length 0
01:13:47.870929 IP L1-anjo5726.cloud.15002 > S1-anjo5726.cloud.50770: Flags [R.], seq 0, ack 2360612704, win 0, length 0
01:13:47.870930 IP L1-anjo5726.cloud.3920 > S1-anjo5726.cloud.50770: Flags [R.], seq 0, ack 2360612704, win 0, length 0
01:13:47.870932 IP L1-anjo5726.cloud.2200 > S1-anjo5726.cloud.50770: Flags [R.], seq 0, ack 2360612704, win 0, length 0
01:13:47.870933 IP L1-anjo5726.cloud.31038 > S1-anjo5726.cloud.50770: Flags [R.], seq 0, ack 2360612704, win 0, length 0
01:13:47.870933 IP L1-anjo5726.cloud.27715 > S1-anjo5726.cloud.50770: Flags [R.], seq 0, ack 2360612704, win 0, length 0
01:13:47.870934 IP L1-anjo5726.cloud.32781 > S1-anjo5726.cloud.50770: Flags [R.], seq 0, ack 2360612704, win 0, length 0
01:13:47.870950 IP L1-anjo5726.cloud.1114 > S1-anjo5726.cloud.50770: Flags [R.], seq 0, ack 2360612704, win 0, length 0
01:13:47.870951 IP L1-anjo5726.cloud.6502 > S1-anjo5726.cloud.50770: Flags [R.], seq 0, ack 2360612704, win 0, length 0
01:13:47.870952 IP L1-anjo5726.cloud.3221 > S1-anjo5726.cloud.50770: Flags [R.], seq 0, ack 2360612704, win 0, length 0
01:13:47.870953 IP L1-anjo5726.cloud.1123 > S1-anjo5726.cloud.50770: Flags [R.], seq 0, ack 2360612704, win 0, length 0
01:13:47.870954 IP L1-anjo5726.cloud.1717 > S1-anjo5726.cloud.50770: Flags [R.], seq 0, ack 2360612704, win 0, length 0
01:13:47.870955 IP L1-anjo5726.cloud.1839 > S1-anjo5726.cloud.50770: Flags [R.], seq 0, ack 2360612704, win 0, length 0
01:13:47.870956 IP L1-anjo5726.cloud.8300 > S1-anjo5726.cloud.50770: Flags [R.], seq 0, ack 2360612704, win 0, length 0
01:13:47.870957 IP L1-anjo5726.cloud.2106 > S1-anjo5726.cloud.50770: Flags [R.], seq 0, ack 2360612704, win 0, length 0
01:13:47.870993 IP L1-anjo5726.cloud.10617 > S1-anjo5726.cloud.50770: Flags [R.], seq 0, ack 2360612704, win 0, length 0
01:13:47.870994 IP L1-anjo5726.cloud.24444 > S1-anjo5726.cloud.50770: Flags [R.], seq 0, ack 2360612704, win 0, length 0
01:13:47.870995 IP L1-anjo5726.cloud.90 > S1-anjo5726.cloud.50770: Flags [R.], seq 0, ack 2360612704, win 0, length 0
01:13:47.870996 IP L1-anjo5726.cloud.5959 > S1-anjo5726.cloud.50770: Flags [R.], seq 0, ack 2360612704, win 0, length 0
01:13:47.870997 IP L1-anjo5726.cloud.32783 > S1-anjo5726.cloud.50770: Flags [R.], seq 0, ack 2360612704, win 0, length 0
01:13:47.871021 IP L1-anjo5726.cloud.5033 > S1-anjo5726.cloud.50770: Flags [R.], seq 0, ack 2360612704, win 0, length 0
01:13:47.871022 IP L1-anjo5726.cloud.5000 > S1-anjo5726.cloud.50770: Flags [R.], seq 0, ack 2360612704, win 0, length 0
01:13:47.871042 IP L1-anjo5726.cloud.6788 > S1-anjo5726.cloud.50770: Flags [R.], seq 0, ack 2360612704, win 0, length 0
01:13:47.871043 IP L1-anjo5726.cloud.2288 > S1-anjo5726.cloud.50770: Flags [R.], seq 0, ack 2360612704, win 0, length 0
01:13:47.871057 IP L1-anjo5726.cloud.1300 > S1-anjo5726.cloud.50770: Flags [R.], seq 0, ack 2360612704, win 0, length 0
01:13:47.871306 IP S1-anjo5726.cloud.50770 > L1-anjo5726.cloud.1079: Flags [S], seq 2360612703, win 1024, options [mss 1460], length 0
01:13:47.871330 IP S1-anjo5726.cloud.50770 > L1-anjo5726.cloud.1198: Flags [S], seq 2360612703, win 1024, options [mss 1460], length 0
01:13:47.871341 IP S1-anjo5726.cloud.50770 > L1-anjo5726.cloud.1035: Flags [S], seq 2360612703, win 1024, options [mss 1460], length 0
01:13:47.871351 IP S1-anjo5726.cloud.50770 > L1-anjo5726.cloud.5003: Flags [S], seq 2360612703, win 1024, options [mss 1460], length 0
01:13:47.871362 IP S1-anjo5726.cloud.50770 > L1-anjo5726.cloud.616: Flags [S], seq 2360612703, win 1024, options [mss 1460], length 0
01:13:47.871373 IP S1-anjo5726.cloud.50770 > L1-anjo5726.cloud.3283: Flags [S], seq 2360612703, win 1024, options [mss 1460], length 0
01:13:47.871383 IP S1-anjo5726.cloud.50770 > L1-anjo5726.cloud.1287: Flags [S], seq 2360612703, win 1024, options [mss 1460], length 0
01:13:47.871394 IP S1-anjo5726.cloud.50770 > L1-anjo5726.cloud.8400: Flags [S], seq 2360612703, win 1024, options [mss 1460], length 0
01:13:47.871405 IP S1-anjo5726.cloud.50770 > L1-anjo5726.cloud.6059: Flags [S], seq 2360612703, win 1024, options [mss 1460], length 0
01:13:47.871416 IP S1-anjo5726.cloud.50770 > L1-anjo5726.cloud.shell: Flags [S], seq 2360612703, win 1024, options [mss 1460], length 0
01:13:47.871427 IP S1-anjo5726.cloud.50770 > L1-anjo5726.cloud.60020: Flags [S], seq 2360612703, win 1024, options [mss 1460], length 0
01:13:47.871437 IP S1-anjo5726.cloud.50770 > L1-anjo5726.cloud.4848: Flags [S], seq 2360612703, win 1024, options [mss 1460], length 0
01:13:47.871479 IP S1-anjo5726.cloud.50770 > L1-anjo5726.cloud.6901: Flags [S], seq 2360612703, win 1024, options [mss 1460], length 0
01:13:47.871492 IP S1-anjo5726.cloud.50770 > L1-anjo5726.cloud.41511: Flags [S], seq 2360612703, win 1024, options [mss 1460], length 0
01:13:47.871503 IP S1-anjo5726.cloud.50770 > L1-anjo5726.cloud.rmiregistry: Flags [S], seq 2360612703, win 1024, options [mss 1460], length 0
01:13:47.871540 IP L1-anjo5726.cloud.1079 > S1-anjo5726.cloud.50770: Flags [R.], seq 0, ack 2360612704, win 0, length 0
01:13:47.871541 IP L1-anjo5726.cloud.1198 > S1-anjo5726.cloud.50770: Flags [R.], seq 0, ack 2360612704, win 0, length 0
01:13:47.871542 IP L1-anjo5726.cloud.1035 > S1-anjo5726.cloud.50770: Flags [R.], seq 0, ack 2360612704, win 0, length 0
01:13:47.871543 IP L1-anjo5726.cloud.5003 > S1-anjo5726.cloud.50770: Flags [R.], seq 0, ack 2360612704, win 0, length 0
01:13:47.871544 IP L1-anjo5726.cloud.616 > S1-anjo5726.cloud.50770: Flags [R.], seq 0, ack 2360612704, win 0, length 0
01:13:47.871556 IP L1-anjo5726.cloud.3283 > S1-anjo5726.cloud.50770: Flags [R.], seq 0, ack 2360612704, win 0, length 0
01:13:47.871557 IP L1-anjo5726.cloud.1287 > S1-anjo5726.cloud.50770: Flags [R.], seq 0, ack 2360612704, win 0, length 0
01:13:47.871570 IP L1-anjo5726.cloud.8400 > S1-anjo5726.cloud.50770: Flags [R.], seq 0, ack 2360612704, win 0, length 0
01:13:47.871571 IP L1-anjo5726.cloud.6059 > S1-anjo5726.cloud.50770: Flags [R.], seq 0, ack 2360612704, win 0, length 0
01:13:47.871578 IP L1-anjo5726.cloud.shell > S1-anjo5726.cloud.50770: Flags [R.], seq 0, ack 2360612704, win 0, length 0
01:13:47.871584 IP L1-anjo5726.cloud.60020 > S1-anjo5726.cloud.50770: Flags [R.], seq 0, ack 2360612704, win 0, length 0
01:13:47.871585 IP L1-anjo5726.cloud.4848 > S1-anjo5726.cloud.50770: Flags [R.], seq 0, ack 2360612704, win 0, length 0
01:13:47.871601 IP L1-anjo5726.cloud.6901 > S1-anjo5726.cloud.50770: Flags [R.], seq 0, ack 2360612704, win 0, length 0
01:13:47.871608 IP L1-anjo5726.cloud.41511 > S1-anjo5726.cloud.50770: Flags [R.], seq 0, ack 2360612704, win 0, length 0
01:13:47.871609 IP L1-anjo5726.cloud.rmiregistry > S1-anjo5726.cloud.50770: Flags [R.], seq 0, ack 2360612704, win 0, length 0
01:13:47.871627 IP S1-anjo5726.cloud.50770 > L1-anjo5726.cloud.9968: Flags [S], seq 2360612703, win 1024, options [mss 1460], length 0
01:13:47.871649 IP S1-anjo5726.cloud.50770 > L1-anjo5726.cloud.1310: Flags [S], seq 2360612703, win 1024, options [mss 1460], length 0
01:13:47.871660 IP S1-anjo5726.cloud.50770 > L1-anjo5726.cloud.3: Flags [S], seq 2360612703, win 1024, options [mss 1460], length 0
01:13:47.871671 IP S1-anjo5726.cloud.50770 > L1-anjo5726.cloud.3800: Flags [S], seq 2360612703, win 1024, options [mss 1460], length 0
01:13:47.871682 IP S1-anjo5726.cloud.50770 > L1-anjo5726.cloud.1047: Flags [S], seq 2360612703, win 1024, options [mss 1460], length 0
01:13:47.871692 IP S1-anjo5726.cloud.50770 > L1-anjo5726.cloud.9081: Flags [S], seq 2360612703, win 1024, options [mss 1460], length 0
01:13:47.871704 IP S1-anjo5726.cloud.50770 > L1-anjo5726.cloud.49161: Flags [S], seq 2360612703, win 1024, options [mss 1460], length 0
01:13:47.871714 IP S1-anjo5726.cloud.50770 > L1-anjo5726.cloud.6123: Flags [S], seq 2360612703, win 1024, options [mss 1460], length 0
01:13:47.871724 IP S1-anjo5726.cloud.50770 > L1-anjo5726.cloud.8500: Flags [S], seq 2360612703, win 1024, options [mss 1460], length 0
01:13:47.871738 IP S1-anjo5726.cloud.50770 > L1-anjo5726.cloud.8001: Flags [S], seq 2360612703, win 1024, options [mss 1460], length 0
01:13:47.871749 IP S1-anjo5726.cloud.50770 > L1-anjo5726.cloud.2800: Flags [S], seq 2360612703, win 1024, options [mss 1460], length 0
01:13:47.871758 IP S1-anjo5726.cloud.50770 > L1-anjo5726.cloud.7200: Flags [S], seq 2360612703, win 1024, options [mss 1460], length 0
01:13:47.871768 IP S1-anjo5726.cloud.50770 > L1-anjo5726.cloud.2701: Flags [S], seq 2360612703, win 1024, options [mss 1460], length 0
01:13:47.871780 IP S1-anjo5726.cloud.50770 > L1-anjo5726.cloud.18988: Flags [S], seq 2360612703, win 1024, options [mss 1460], length 0
01:13:47.871791 IP S1-anjo5726.cloud.50770 > L1-anjo5726.cloud.1097: Flags [S], seq 2360612703, win 1024, options [mss 1460], length 0
01:13:47.871801 IP S1-anjo5726.cloud.50770 > L1-anjo5726.cloud.1000: Flags [S], seq 2360612703, win 1024, options [mss 1460], length 0
01:13:47.871811 IP S1-anjo5726.cloud.50770 > L1-anjo5726.cloud.5030: Flags [S], seq 2360612703, win 1024, options [mss 1460], length 0
01:13:47.871824 IP S1-anjo5726.cloud.50770 > L1-anjo5726.cloud.1719: Flags [S], seq 2360612703, win 1024, options [mss 1460], length 0
01:13:47.871835 IP S1-anjo5726.cloud.50770 > L1-anjo5726.cloud.144: Flags [S], seq 2360612703, win 1024, options [mss 1460], length 0
01:13:47.871844 IP S1-anjo5726.cloud.50770 > L1-anjo5726.cloud.8000: Flags [S], seq 2360612703, win 1024, options [mss 1460], length 0
01:13:47.871855 IP S1-anjo5726.cloud.50770 > L1-anjo5726.cloud.3001: Flags [S], seq 2360612703, win 1024, options [mss 1460], length 0
01:13:47.871867 IP S1-anjo5726.cloud.50770 > L1-anjo5726.cloud.49160: Flags [S], seq 2360612703, win 1024, options [mss 1460], length 0
01:13:47.871878 IP S1-anjo5726.cloud.50770 > L1-anjo5726.cloud.32780: Flags [S], seq 2360612703, win 1024, options [mss 1460], length 0
01:13:47.871888 IP S1-anjo5726.cloud.50770 > L1-anjo5726.cloud.5004: Flags [S], seq 2360612703, win 1024, options [mss 1460], length 0
01:13:47.871898 IP S1-anjo5726.cloud.50770 > L1-anjo5726.cloud.8085: Flags [S], seq 2360612703, win 1024, options [mss 1460], length 0
01:13:47.871911 IP S1-anjo5726.cloud.50770 > L1-anjo5726.cloud.1061: Flags [S], seq 2360612703, win 1024, options [mss 1460], length 0
01:13:47.871922 IP S1-anjo5726.cloud.50770 > L1-anjo5726.cloud.1782: Flags [S], seq 2360612703, win 1024, options [mss 1460], length 0
01:13:47.871932 IP S1-anjo5726.cloud.50770 > L1-anjo5726.cloud.10621: Flags [S], seq 2360612703, win 1024, options [mss 1460], length 0
01:13:47.871942 IP S1-anjo5726.cloud.50770 > L1-anjo5726.cloud.2003: Flags [S], seq 2360612703, win 1024, options [mss 1460], length 0
01:13:47.871954 IP S1-anjo5726.cloud.50770 > L1-anjo5726.cloud.1069: Flags [S], seq 2360612703, win 1024, options [mss 1460], length 0
01:13:47.871965 IP S1-anjo5726.cloud.50770 > L1-anjo5726.cloud.1272: Flags [S], seq 2360612703, win 1024, options [mss 1460], length 0
01:13:47.871975 IP S1-anjo5726.cloud.50770 > L1-anjo5726.cloud.3052: Flags [S], seq 2360612703, win 1024, options [mss 1460], length 0
01:13:47.871985 IP S1-anjo5726.cloud.50770 > L1-anjo5726.cloud.1783: Flags [S], seq 2360612703, win 1024, options [mss 1460], length 0
01:13:47.871998 IP S1-anjo5726.cloud.50770 > L1-anjo5726.cloud.340: Flags [S], seq 2360612703, win 1024, options [mss 1460], length 0
01:13:47.872009 IP S1-anjo5726.cloud.50770 > L1-anjo5726.cloud.5002: Flags [S], seq 2360612703, win 1024, options [mss 1460], length 0
01:13:47.872072 IP L1-anjo5726.cloud.9968 > S1-anjo5726.cloud.50770: Flags [R.], seq 0, ack 2360612704, win 0, length 0
01:13:47.872073 IP L1-anjo5726.cloud.1310 > S1-anjo5726.cloud.50770: Flags [R.], seq 0, ack 2360612704, win 0, length 0
01:13:47.872074 IP L1-anjo5726.cloud.3 > S1-anjo5726.cloud.50770: Flags [R.], seq 0, ack 2360612704, win 0, length 0
01:13:47.872075 IP L1-anjo5726.cloud.3800 > S1-anjo5726.cloud.50770: Flags [R.], seq 0, ack 2360612704, win 0, length 0
01:13:47.872076 IP L1-anjo5726.cloud.1047 > S1-anjo5726.cloud.50770: Flags [R.], seq 0, ack 2360612704, win 0, length 0
01:13:47.872077 IP L1-anjo5726.cloud.9081 > S1-anjo5726.cloud.50770: Flags [R.], seq 0, ack 2360612704, win 0, length 0
01:13:47.872078 IP L1-anjo5726.cloud.49161 > S1-anjo5726.cloud.50770: Flags [R.], seq 0, ack 2360612704, win 0, length 0
01:13:47.872079 IP L1-anjo5726.cloud.6123 > S1-anjo5726.cloud.50770: Flags [R.], seq 0, ack 2360612704, win 0, length 0
01:13:47.872093 IP L1-anjo5726.cloud.8500 > S1-anjo5726.cloud.50770: Flags [R.], seq 0, ack 2360612704, win 0, length 0
01:13:47.872094 IP L1-anjo5726.cloud.8001 > S1-anjo5726.cloud.50770: Flags [R.], seq 0, ack 2360612704, win 0, length 0
01:13:47.872095 IP L1-anjo5726.cloud.2800 > S1-anjo5726.cloud.50770: Flags [R.], seq 0, ack 2360612704, win 0, length 0
01:13:47.872096 IP L1-anjo5726.cloud.7200 > S1-anjo5726.cloud.50770: Flags [R.], seq 0, ack 2360612704, win 0, length 0
01:13:47.872097 IP L1-anjo5726.cloud.2701 > S1-anjo5726.cloud.50770: Flags [R.], seq 0, ack 2360612704, win 0, length 0
01:13:47.872098 IP L1-anjo5726.cloud.18988 > S1-anjo5726.cloud.50770: Flags [R.], seq 0, ack 2360612704, win 0, length 0
01:13:47.872099 IP L1-anjo5726.cloud.1097 > S1-anjo5726.cloud.50770: Flags [R.], seq 0, ack 2360612704, win 0, length 0
01:13:47.872100 IP L1-anjo5726.cloud.1000 > S1-anjo5726.cloud.50770: Flags [R.], seq 0, ack 2360612704, win 0, length 0
01:13:47.872112 IP L1-anjo5726.cloud.5030 > S1-anjo5726.cloud.50770: Flags [R.], seq 0, ack 2360612704, win 0, length 0
01:13:47.872113 IP L1-anjo5726.cloud.1719 > S1-anjo5726.cloud.50770: Flags [R.], seq 0, ack 2360612704, win 0, length 0
01:13:47.872114 IP L1-anjo5726.cloud.144 > S1-anjo5726.cloud.50770: Flags [R.], seq 0, ack 2360612704, win 0, length 0
01:13:47.872114 IP L1-anjo5726.cloud.8000 > S1-anjo5726.cloud.50770: Flags [R.], seq 0, ack 2360612704, win 0, length 0
01:13:47.872115 IP L1-anjo5726.cloud.3001 > S1-anjo5726.cloud.50770: Flags [R.], seq 0, ack 2360612704, win 0, length 0
01:13:47.872116 IP L1-anjo5726.cloud.49160 > S1-anjo5726.cloud.50770: Flags [R.], seq 0, ack 2360612704, win 0, length 0
01:13:47.872117 IP L1-anjo5726.cloud.32780 > S1-anjo5726.cloud.50770: Flags [R.], seq 0, ack 2360612704, win 0, length 0
01:13:47.872118 IP L1-anjo5726.cloud.5004 > S1-anjo5726.cloud.50770: Flags [R.], seq 0, ack 2360612704, win 0, length 0
01:13:47.872130 IP L1-anjo5726.cloud.8085 > S1-anjo5726.cloud.50770: Flags [R.], seq 0, ack 2360612704, win 0, length 0
01:13:47.872131 IP L1-anjo5726.cloud.1061 > S1-anjo5726.cloud.50770: Flags [R.], seq 0, ack 2360612704, win 0, length 0
01:13:47.872131 IP L1-anjo5726.cloud.1782 > S1-anjo5726.cloud.50770: Flags [R.], seq 0, ack 2360612704, win 0, length 0
01:13:47.872132 IP L1-anjo5726.cloud.10621 > S1-anjo5726.cloud.50770: Flags [R.], seq 0, ack 2360612704, win 0, length 0
01:13:47.872133 IP L1-anjo5726.cloud.2003 > S1-anjo5726.cloud.50770: Flags [R.], seq 0, ack 2360612704, win 0, length 0
01:13:47.872134 IP L1-anjo5726.cloud.1069 > S1-anjo5726.cloud.50770: Flags [R.], seq 0, ack 2360612704, win 0, length 0
01:13:47.872135 IP L1-anjo5726.cloud.1272 > S1-anjo5726.cloud.50770: Flags [R.], seq 0, ack 2360612704, win 0, length 0
01:13:47.872136 IP L1-anjo5726.cloud.3052 > S1-anjo5726.cloud.50770: Flags [R.], seq 0, ack 2360612704, win 0, length 0
01:13:47.872160 IP L1-anjo5726.cloud.1783 > S1-anjo5726.cloud.50770: Flags [R.], seq 0, ack 2360612704, win 0, length 0
01:13:47.872161 IP L1-anjo5726.cloud.340 > S1-anjo5726.cloud.50770: Flags [R.], seq 0, ack 2360612704, win 0, length 0
01:13:47.872166 IP L1-anjo5726.cloud.5002 > S1-anjo5726.cloud.50770: Flags [R.], seq 0, ack 2360612704, win 0, length 0
01:13:47.872492 IP S1-anjo5726.cloud.50770 > L1-anjo5726.cloud.7920: Flags [S], seq 2360612703, win 1024, options [mss 1460], length 0
01:13:47.872515 IP S1-anjo5726.cloud.50770 > L1-anjo5726.cloud.7402: Flags [S], seq 2360612703, win 1024, options [mss 1460], length 0
01:13:47.872528 IP S1-anjo5726.cloud.50770 > L1-anjo5726.cloud.1078: Flags [S], seq 2360612703, win 1024, options [mss 1460], length 0
01:13:47.872543 IP S1-anjo5726.cloud.50770 > L1-anjo5726.cloud.5510: Flags [S], seq 2360612703, win 1024, options [mss 1460], length 0
01:13:47.872554 IP S1-anjo5726.cloud.50770 > L1-anjo5726.cloud.5225: Flags [S], seq 2360612703, win 1024, options [mss 1460], length 0
01:13:47.872564 IP S1-anjo5726.cloud.50770 > L1-anjo5726.cloud.5200: Flags [S], seq 2360612703, win 1024, options [mss 1460], length 0
01:13:47.872576 IP S1-anjo5726.cloud.50770 > L1-anjo5726.cloud.32777: Flags [S], seq 2360612703, win 1024, options [mss 1460], length 0
01:13:47.872587 IP S1-anjo5726.cloud.50770 > L1-anjo5726.cloud.bgp: Flags [S], seq 2360612703, win 1024, options [mss 1460], length 0
01:13:47.872597 IP S1-anjo5726.cloud.50770 > L1-anjo5726.cloud.888: Flags [S], seq 2360612703, win 1024, options [mss 1460], length 0
01:13:47.872607 IP S1-anjo5726.cloud.50770 > L1-anjo5726.cloud.1086: Flags [S], seq 2360612703, win 1024, options [mss 1460], length 0
01:13:47.872618 IP S1-anjo5726.cloud.50770 > L1-anjo5726.cloud.rmtcfg: Flags [S], seq 2360612703, win 1024, options [mss 1460], length 0
01:13:47.872633 IP S1-anjo5726.cloud.50770 > L1-anjo5726.cloud.7911: Flags [S], seq 2360612703, win 1024, options [mss 1460], length 0
01:13:47.872643 IP S1-anjo5726.cloud.50770 > L1-anjo5726.cloud.gsigatekeeper: Flags [S], seq 2360612703, win 1024, options [mss 1460], length 0
01:13:47.872653 IP S1-anjo5726.cloud.50770 > L1-anjo5726.cloud.6789: Flags [S], seq 2360612703, win 1024, options [mss 1460], length 0
01:13:47.872664 IP S1-anjo5726.cloud.50770 > L1-anjo5726.cloud.2008: Flags [S], seq 2360612703, win 1024, options [mss 1460], length 0
01:13:47.872674 IP S1-anjo5726.cloud.50770 > L1-anjo5726.cloud.1011: Flags [S], seq 2360612703, win 1024, options [mss 1460], length 0
01:13:47.872684 IP S1-anjo5726.cloud.50770 > L1-anjo5726.cloud.497: Flags [S], seq 2360612703, win 1024, options [mss 1460], length 0
01:13:47.872694 IP S1-anjo5726.cloud.50770 > L1-anjo5726.cloud.7025: Flags [S], seq 2360612703, win 1024, options [mss 1460], length 0
01:13:47.872705 IP S1-anjo5726.cloud.50770 > L1-anjo5726.cloud.4001: Flags [S], seq 2360612703, win 1024, options [mss 1460], length 0
01:13:47.872718 IP S1-anjo5726.cloud.50770 > L1-anjo5726.cloud.30000: Flags [S], seq 2360612703, win 1024, options [mss 1460], length 0
01:13:47.872728 IP S1-anjo5726.cloud.50770 > L1-anjo5726.cloud.7625: Flags [S], seq 2360612703, win 1024, options [mss 1460], length 0
01:13:47.872739 IP S1-anjo5726.cloud.50770 > L1-anjo5726.cloud.49156: Flags [S], seq 2360612703, win 1024, options [mss 1460], length 0
01:13:47.872750 IP S1-anjo5726.cloud.50770 > L1-anjo5726.cloud.ospfd: Flags [S], seq 2360612703, win 1024, options [mss 1460], length 0
01:13:47.872759 IP S1-anjo5726.cloud.50770 > L1-anjo5726.cloud.6779: Flags [S], seq 2360612703, win 1024, options [mss 1460], length 0
01:13:47.872769 IP S1-anjo5726.cloud.50770 > L1-anjo5726.cloud.1030: Flags [S], seq 2360612703, win 1024, options [mss 1460], length 0
01:13:47.872779 IP S1-anjo5726.cloud.50770 > L1-anjo5726.cloud.64623: Flags [S], seq 2360612703, win 1024, options [mss 1460], length 0
01:13:47.872790 IP S1-anjo5726.cloud.50770 > L1-anjo5726.cloud.33: Flags [S], seq 2360612703, win 1024, options [mss 1460], length 0
01:13:47.872803 IP S1-anjo5726.cloud.50770 > L1-anjo5726.cloud.ftp-data: Flags [S], seq 2360612703, win 1024, options [mss 1460], length 0
01:13:47.872814 IP S1-anjo5726.cloud.50770 > L1-anjo5726.cloud.259: Flags [S], seq 2360612703, win 1024, options [mss 1460], length 0
01:13:47.872824 IP S1-anjo5726.cloud.50770 > L1-anjo5726.cloud.9071: Flags [S], seq 2360612703, win 1024, options [mss 1460], length 0
01:13:47.872834 IP S1-anjo5726.cloud.50770 > L1-anjo5726.cloud.1081: Flags [S], seq 2360612703, win 1024, options [mss 1460], length 0
01:13:47.872844 IP S1-anjo5726.cloud.50770 > L1-anjo5726.cloud.1875: Flags [S], seq 2360612703, win 1024, options [mss 1460], length 0
01:13:47.872854 IP S1-anjo5726.cloud.50770 > L1-anjo5726.cloud.49155: Flags [S], seq 2360612703, win 1024, options [mss 1460], length 0
01:13:47.872863 IP S1-anjo5726.cloud.50770 > L1-anjo5726.cloud.6580: Flags [S], seq 2360612703, win 1024, options [mss 1460], length 0
01:13:47.872872 IP S1-anjo5726.cloud.50770 > L1-anjo5726.cloud.4343: Flags [S], seq 2360612703, win 1024, options [mss 1460], length 0
01:13:47.872884 IP S1-anjo5726.cloud.50770 > L1-anjo5726.cloud.8031: Flags [S], seq 2360612703, win 1024, options [mss 1460], length 0
01:13:47.872894 IP S1-anjo5726.cloud.50770 > L1-anjo5726.cloud.6567: Flags [S], seq 2360612703, win 1024, options [mss 1460], length 0
01:13:47.872904 IP S1-anjo5726.cloud.50770 > L1-anjo5726.cloud.5718: Flags [S], seq 2360612703, win 1024, options [mss 1460], length 0
01:13:47.872914 IP S1-anjo5726.cloud.50770 > L1-anjo5726.cloud.50636: Flags [S], seq 2360612703, win 1024, options [mss 1460], length 0
01:13:47.872924 IP S1-anjo5726.cloud.50770 > L1-anjo5726.cloud.34571: Flags [S], seq 2360612703, win 1024, options [mss 1460], length 0
01:13:47.872935 IP S1-anjo5726.cloud.50770 > L1-anjo5726.cloud.1131: Flags [S], seq 2360612703, win 1024, options [mss 1460], length 0
01:13:47.872946 IP S1-anjo5726.cloud.50770 > L1-anjo5726.cloud.1073: Flags [S], seq 2360612703, win 1024, options [mss 1460], length 0
01:13:47.872955 IP S1-anjo5726.cloud.50770 > L1-anjo5726.cloud.51103: Flags [S], seq 2360612703, win 1024, options [mss 1460], length 0
01:13:47.872967 IP S1-anjo5726.cloud.50770 > L1-anjo5726.cloud.3551: Flags [S], seq 2360612703, win 1024, options [mss 1460], length 0
01:13:47.872976 IP S1-anjo5726.cloud.50770 > L1-anjo5726.cloud.8649: Flags [S], seq 2360612703, win 1024, options [mss 1460], length 0
01:13:47.872986 IP S1-anjo5726.cloud.50770 > L1-anjo5726.cloud.6969: Flags [S], seq 2360612703, win 1024, options [mss 1460], length 0
01:13:47.872997 IP S1-anjo5726.cloud.50770 > L1-anjo5726.cloud.ripd: Flags [S], seq 2360612703, win 1024, options [mss 1460], length 0
01:13:47.873007 IP S1-anjo5726.cloud.50770 > L1-anjo5726.cloud.1801: Flags [S], seq 2360612703, win 1024, options [mss 1460], length 0
01:13:47.873016 IP S1-anjo5726.cloud.50770 > L1-anjo5726.cloud.8290: Flags [S], seq 2360612703, win 1024, options [mss 1460], length 0
01:13:47.873026 IP S1-anjo5726.cloud.50770 > L1-anjo5726.cloud.458: Flags [S], seq 2360612703, win 1024, options [mss 1460], length 0
01:13:47.873108 IP L1-anjo5726.cloud.7920 > S1-anjo5726.cloud.50770: Flags [R.], seq 0, ack 2360612704, win 0, length 0
01:13:47.873109 IP L1-anjo5726.cloud.7402 > S1-anjo5726.cloud.50770: Flags [R.], seq 0, ack 2360612704, win 0, length 0
01:13:47.873110 IP L1-anjo5726.cloud.1078 > S1-anjo5726.cloud.50770: Flags [R.], seq 0, ack 2360612704, win 0, length 0
01:13:47.873111 IP L1-anjo5726.cloud.5510 > S1-anjo5726.cloud.50770: Flags [R.], seq 0, ack 2360612704, win 0, length 0
01:13:47.873112 IP L1-anjo5726.cloud.5225 > S1-anjo5726.cloud.50770: Flags [R.], seq 0, ack 2360612704, win 0, length 0
01:13:47.873113 IP L1-anjo5726.cloud.5200 > S1-anjo5726.cloud.50770: Flags [R.], seq 0, ack 2360612704, win 0, length 0
01:13:47.873113 IP L1-anjo5726.cloud.32777 > S1-anjo5726.cloud.50770: Flags [R.], seq 0, ack 2360612704, win 0, length 0
01:13:47.873114 IP L1-anjo5726.cloud.bgp > S1-anjo5726.cloud.50770: Flags [R.], seq 0, ack 2360612704, win 0, length 0
01:13:47.873128 IP L1-anjo5726.cloud.888 > S1-anjo5726.cloud.50770: Flags [R.], seq 0, ack 2360612704, win 0, length 0
01:13:47.873129 IP L1-anjo5726.cloud.1086 > S1-anjo5726.cloud.50770: Flags [R.], seq 0, ack 2360612704, win 0, length 0
